ID,Ticker,Date,Headline,Summary
29547286,AEP,2022-11-03T13:55:41Z,Looking Into American Electric Power's Return On Capital Employed,"According to Benzinga Pro, during Q3, American Electric Power (NASDAQ:AEP) earned $683.30 million, a 31.2% increase from the preceding quarter. American Electric Power also posted a total of $5.50 billion in sales, a 19.57% increase since Q2."
29679929,AEP,2022-11-11T13:24:27Z,"Morgan Stanley Maintains Overweight on American Electric Power, Raises Price Target to $104",
29684973,AEP,2022-11-11T20:40:51Z,Expert Ratings for American Electric Power,"Within the last quarter, American Electric Power (NASDAQ:AEP) has observed the following analyst ratings:"
29832597,AEP,2022-11-28T15:40:03Z,This Congressman Just Purchased 2 Stocks Which Consistently Increase Dividends,"Congressman Dwight Evans (D-PA) has represented Pennsylvania&#39;s Third Congressional District since 2019, and has made over 70 trades in the past three years. His top two traded investments are Intel (NASDAQ: INTC) and ARK Genomic Revolution ETF (BATS: "
29626257,AEP,2022-12-06T17:25:59Z,American Electric Power's Debt Overview,"Over the past three months, shares of American Electric Power Inc. (NASDAQ:AEP) fell by 14.00%. Before we understand the importance of debt, let&#39;s look at how much debt American Electric Power has."
30092827,AEP,2022-12-15T14:27:35Z,"Morgan Stanley Maintains Overweight on American Electric Power, Raises Price Target to $110",
30107460,AEP,2022-12-16T13:04:53Z,"BMO Capital Maintains Outperform on American Electric Power, Raises Price Target to $105",
30107915,AEP,2022-12-16T13:35:46Z,"Credit Suisse Maintains Outperform on American Electric Power, Raises Price Target to $100",
30108823,AEP,2022-12-16T14:14:06Z,"Mizuho Maintains Buy on American Electric Power, Lowers Price Target to $101",
30108875,AEP,2022-12-16T14:18:06Z,Meta To Rally Over 29%? Here Are 10 Other Price Target Changes For Friday,"
"
30111598,AEP,2022-12-16T17:00:36Z,Credit Suisse Maintains Outperform Rating for American Electric Power: Here's What You Need To Know, 
30113275,AEP,2022-12-16T18:59:22Z,"American Electric Power Says AEP Energy Partners Seeks Renewable Energy Purchase Agreements Of 10, 12 Or 15 Years For New Solar Or Wind Projects",
30127487,AEP,2022-12-19T13:44:01Z,"B of A Securities Downgrades American Electric Power to Neutral, Lowers Price Target to $98",
30129118,AEP,2022-12-19T15:00:49Z,"Benzinga's Top Ratings Upgrades, Downgrades For December 19, 2022", 
30305723,AEP,2023-01-06T02:42:40Z,Jim Cramer Says He's 'Still Feeling Good' About These 5 Stocks From 'Mutilated' Nasdaq,Prominent market commentator Jim Cramer has recommended five stocks from the Nasdaq Index that he believes could be decent additions to investors’ portfolios.
30542975,AEP,2023-01-24T12:29:29Z,"Evercore ISI Group Downgrades American Electric Power to In-Line, Raises Price Target to $102",
30548918,AEP,2023-01-24T15:01:04Z,Where American Electric Power Stands With Analysts, 
30548920,AEP,2023-01-24T15:01:08Z,"Benzinga's Top Ratings Upgrades, Downgrades For January 24, 2023", 
30661886,AEP,2023-02-01T10:18:55Z,"Wells Fargo Downgrades American Electric Power to Equal-Weight, Lowers Price Target to $99",
30668875,AEP,2023-02-01T15:00:45Z,"Benzinga's Top Ratings Upgrades, Downgrades For February 1, 2023", 
30686194,AEP,2023-02-02T12:47:30Z,"Morgan Stanley Maintains Overweight on American Electric Power, Raises Price Target to $112",
30892406,AEP,2023-02-14T05:59:02Z,AEP And Liberty File New FERC 203 Application For Approval Of Kentucky Sale,
31006093,AEP,2023-02-22T13:48:07Z,"Morgan Stanley Maintains Overweight on American Electric Power, Lowers Price Target to $107",
31019129,AEP,2023-02-22T22:57:53Z,"American Electric Power To Sell Its 1,365MW Unregulated, Contracted Renewables Portfolio To IRG Acquisition Holdings; Co. Expects To Net ~$1.2B In Cash After Taxes, Fees And Adjustments At Closing",
31022472,AEP,2023-02-23T10:18:20Z,"Earnings Scheduled For February 23, 2023","Companies Reporting Before The Bell

• ChipMOS TECHNOLOGIES (NASDAQ:IMOS) is likely to report earnings for its fourth quarter."
31024418,AEP,2023-02-23T11:59:27Z,"American Electric Power Q4 Adjusted EPS $1.05 Beats $0.99 Estimate, Sales $4.90B Beat $3.51B Estimate",
31024592,AEP,2023-02-23T12:01:36Z,American Electric Power Reaffirms FY23 Adjusted EPS Of $5.19-$5.39 Vs. Consensus Of $5.29,
31028614,AEP,2023-02-23T14:19:16Z,"GDP Revised Lower, Labor Market Still Tight","Good Morning Everyone!

Wells Fargo (NYSE: WFC) just laid off hundreds of mortgage bankers, including some top producers who brought the bank more than $100 million in loans last year. 

Is Wells Fargo making a huge mistake?"
31043835,AEP,2023-02-24T10:44:23Z,"CFRA Maintains Hold on American Electric Power, Raises Price Target to $96",
31046164,AEP,2023-02-24T13:01:31Z,Expert Ratings for American Electric Power, 
31069872,AEP,2023-02-27T14:47:53Z,Looking Into American Electric Power's Return On Capital Employed, 
31134464,AEP,2023-03-01T18:31:52Z,A Look Into American Electric Power's Debt,"Shares of American Electric Power Inc. (NASDAQ:AEP) moved lower by 8.81% in the past three months. When understanding a companies price change over a time period like 3 months, it could be helpful to look at its financials."
31164224,AEP,2023-03-02T12:24:35Z,"RBC Capital Maintains Outperform on American Electric Power, Lowers Price Target to $103",
31294955,AEP,2023-03-10T13:19:45Z,"JP Morgan Maintains Overweight on American Electric Power, Lowers Price Target to $102",
31344463,AEP,2023-03-14T15:30:45Z,American Electric Power's Debt Overview, 
31347188,AEP,2023-03-14T18:06:00Z,P/E Ratio Insights for American Electric Power,"In the current market session, American Electric Power Inc. (NASDAQ:AEP) price is at $89.65, after a 0.30% increase. However, over the past month, the stock fell by 0.92%, and in the past year, by 5.70%."
31384252,AEP,2023-03-16T16:30:30Z,How Is The Market Feeling About American Electric Power?, 
31435770,AEP,2023-03-21T11:45:38Z,"Morgan Stanley Maintains Overweight on American Electric Power, Lowers Price Target to $101",
31512110,AEP,2023-03-27T15:46:37Z,FirstEnergy Picks Brian X. Tierney As Its New CEO,"
"
31561485,AEP,2023-03-29T20:30:18Z,P/E Ratio Insights for American Electric Power, 
31590615,AEP,2023-03-30T17:15:27Z,American Electric Power's Debt Overview, 
31633506,AEP,2023-04-03T13:24:19Z,"Ladenburg Thalmann Initiates Coverage On American Electric Power with Sell Rating, Announces Price Target of $82.5",
31636315,AEP,2023-04-03T15:00:39Z,"Benzinga's Top Ratings Upgrades, Downgrades For April 3, 2023", 
31639329,AEP,2023-04-03T17:01:39Z,Expert Ratings for American Electric Power, 
31656545,AEP,2023-04-04T13:17:13Z,Short Volatility Alert: American Electric Power Inc,"On Monday, shares of American Electric Power Inc (NASDAQ: AEP) experienced volatile short activity. After the activity, the stock price went up +0.62% to $90.99.

The overall sentiment for AEP has been Bearish."
31683180,AEP,2023-04-05T16:04:50Z,Nasdaq Tumbles 150 Points; Liminal BioSciences Shares Spike Higher,"U.S. stocks traded mostly lower midway through trading, with the Nasdaq Composite dropping around 150 points on Wednesday.

The Dow traded up 0.07% to 33,425.80 while the NASDAQ fell 1.27% to 11,972.78. The S&amp;P 500, also fell, dropping, 0.48% to 4,080.74."
31810339,AEP,2023-04-14T16:45:20Z,P/E Ratio Insights for American Electric Power, 
31825374,AEP,2023-04-17T11:07:25Z,"American Electric Power Reaffirms FY23 Adj EPS $5.19-$5.39, Long-Term Growth Rate of 6%-7%",
31830852,AEP,2023-04-17T13:40:56Z,"BMO Capital Maintains Outperform on American Electric Power, Raises Price Target to $102",
31848528,AEP,2023-04-18T09:29:06Z,"Citigroup Maintains Neutral on American Electric Power, Raises Price Target to $100",
31859008,AEP,2023-04-18T14:24:48Z,"Mizuho Maintains Buy on American Electric Power, Lowers Price Target to $100",
31864245,AEP,2023-04-18T17:00:30Z,Citigroup Maintains Neutral Rating for American Electric Power: Here's What You Need To Know, 
31864248,AEP,2023-04-18T17:00:33Z,What Does American Electric Power's Debt Look Like?, 
32197792,AEP,2023-05-03T20:15:26Z,P/E Ratio Insights for American Electric Power, 
32205981,AEP,2023-05-04T10:34:05Z,"Earnings Scheduled For May 4, 2023","Companies Reporting Before The Bell

• Cedar Fair (NYSE:FUN) is estimated to report quarterly loss at $1.83 per share on revenue of $104.21 million."
32208628,AEP,2023-05-04T11:06:34Z,"American Electric Power Q1 Adj. EPS $1.11, Inline, Sales $4.70B Miss $4.71B Estimate",
32208660,AEP,2023-05-04T11:08:19Z,American Electric Power Reaffirms FY23 Adj. EPS Outlook $5.19 - $5.39 Vs. $5.28 Estimate,
32210099,AEP,2023-05-04T11:47:30Z,American Electric Power: Q1 Earnings Insights, 
32211274,AEP,2023-05-04T13:24:08Z,"American Electric Power Q1 EPS In-Line With Estimates, Guidance Reiterated","
"
32233375,AEP,2023-05-05T09:37:49Z,"CFRA Maintains Hold on American Electric Power, Raises Price Target to $98",
32266515,AEP,2023-05-08T14:45:37Z,What Does American Electric Power's Debt Look Like?, 
32319525,AEP,2023-05-10T15:15:29Z,How Is The Market Feeling About American Electric Power?, 
32465068,AEP,2023-05-18T12:55:31Z,Top 4 Utilities Stocks That Could Lead To Your Biggest Gains In Q2,The most oversold stocks in the utilities sector presents an opportunity to buy into undervalued companies.
32484054,AEP,2023-05-19T12:33:02Z,"UBS Maintains Buy on American Electric Power, Lowers Price Target to $113",
32491447,AEP,2023-05-19T18:02:14Z,12 Analysts Have This to Say About American Electric Power, 
32505508,AEP,2023-05-22T11:58:50Z,"Morgan Stanley Maintains Overweight on American Electric Power, Lowers Price Target to $104",
32508523,AEP,2023-05-22T13:45:42Z,A Look Into American Electric Power's Debt, 
32660159,AEP,2023-05-31T22:01:31Z,American Electric Power Says  Successfully Remarketed Its 1.30% Junior Subordinated Debentures Due 2025,
32711339,AEP,2023-06-05T10:45:07Z,"Mizuho Maintains Buy on American Electric Power, Lowers Price Target to $94",
32714894,AEP,2023-06-05T13:01:41Z,What 11 Analyst Ratings Have To Say About American Electric Power, 
32731341,AEP,2023-06-06T09:47:00Z,UBS Downgrades American Electric Power to Neutral,
32740027,AEP,2023-06-06T15:00:50Z,"Benzinga's Top Ratings Upgrades, Downgrades For June 6, 2023", 
32773360,AEP,2023-06-08T08:40:25Z,"Goldman Sachs Initiates Coverage On American Electric Power with Buy Rating, Announces Price Target of $98",
32780819,AEP,2023-06-08T15:00:49Z,"Benzinga's Top Ratings Upgrades, Downgrades For June 8, 2023", 
32796791,AEP,2023-06-09T15:48:37Z,"Goldman Sachs On 10 Utilities Stocks: What To Buy, Sell And Is Neutral","Shares of companies in the utilities sector were under pressure in early trading on Friday.

The next phase for U.S. utilities has begun, with many companies becoming “decarbonization enablers” and their models could “drive value from several clear mega-themes,” according to Goldman Sachs."
32916647,AEP,2023-06-20T12:46:31Z,Jim Cramer Deems This 5% Yield Stock 'Too Risky For Me': He Prefers These 2 Alternatives,"On CNBC’s &#34;Mad Money Lightning Round,&#34; Jim Cramer said  Dominion Energy, Inc."
32971360,AEP,2023-06-22T16:40:39Z,"Blackstone Injects $1B More Into Invenergy, Raising Total Stake To $4B To Propel Business Initiatives", 
32983634,AEP,2023-06-23T13:11:11Z,"Morgan Stanley Maintains Overweight on American Electric Power, Lowers Price Target to $100",
32985583,AEP,2023-06-23T14:45:37Z,What Does American Electric Power's Debt Look Like?, 
32985910,AEP,2023-06-23T15:00:59Z,Where American Electric Power Stands With Analysts, 
32987014,AEP,2023-06-23T15:31:07Z,P/E Ratio Insights for American Electric Power, 
33047880,AEP,2023-06-28T17:45:29Z,How Is The Market Feeling About American Electric Power?, 
33066787,AEP,2023-06-29T20:01:19Z,Louisiana Public Service Commission Approves Southwestern Electric Power Co. Renewable Projects To Move Forward With Its Fuel-Free Power Plan To Acquire Up To 999 Megawatts Of Renewable Generation Resources,
33076493,AEP,2023-06-30T12:06:07Z,"BMO Capital Maintains Outperform on American Electric Power, Lowers Price Target to $96",
33147677,AEP,2023-07-07T13:45:39Z,American Electric Power's Debt Overview, 
33150175,AEP,2023-07-07T16:25:22Z,"Guggenheim Maintains Buy on American Electric Power, Lowers Price Target to $96",
33189796,AEP,2023-07-11T18:18:36Z,"CFRA Upgrades American Electric Power to Buy, Raises Price Target to $99",
33254441,AEP,2023-07-17T18:00:24Z,(AEP) - Analyzing American Electric Power's Short Interest, 
33322530,AEP,2023-07-21T13:14:50Z,"Morgan Stanley Maintains Overweight on American Electric Power, Raises Price Target to $101",
33327347,AEP,2023-07-21T18:00:30Z,Analyst Expectations for American Electric Power's Future, 
33395256,AEP,2023-07-26T15:01:09Z,A Preview Of American Electric Power's Earnings, 
33411974,AEP,2023-07-27T08:34:16Z,"Earnings Scheduled For July 27, 2023","Companies Reporting Before The Bell

• SES AI (NYSE:SES) is projected to report quarterly earnings at $0.11 per share on revenue of $337.60 million."
33414823,AEP,2023-07-27T10:59:29Z,"American Electric Power Q2 Adj EPS $1.13 Beats $1.12 Estimate, Sales $4.40B Miss $4.76B Estimate",
33415746,AEP,2023-07-27T11:18:20Z,"American Electric Power Reaffirmed FY23 Adj EPS Guide Of $5.19-$5.39 Vs $5.27 Est, Long-Term Growth Rate of 6%-7%",
33419314,AEP,2023-07-27T14:45:01Z,"American Electric Power Q2: Mixed Performance, 2023 EPS Outlook Reaffirmed","American Electric Power Co Inc (NASDAQ: AEP) reported Q2 2023 operating EPS of $1.13, down from $1.20, "
33524896,AEP,2023-08-02T15:30:18Z,Price Over Earnings Overview: American Electric Power, 
33634903,AEP,2023-08-08T17:32:28Z,Stocks That Hit 52-Week Lows On Tuesday," 

During Tuesday&#39;s trading, 188 companies set new 52-week lows."
33877076,AEP,2023-08-16T15:08:52Z,Invenergy Buys American Electric Power's Renewables Portfolio For $1.5B,Invenergy disclosed it has closed the buyout of American Electric Power Co.
33901574,AEP,2023-08-17T20:15:22Z,How Is The Market Feeling About American Electric Power?, 
33961261,AEP,2023-08-21T12:14:48Z,"American Electric Power Has Elected Julie Sloat Chair Of The Board, Effective October 2; Nicholas K. Akins Will Be Retiring And Stepping Down From His Position As Executive Chair Of AEP's Board On October 1",
33998988,AEP,2023-08-23T09:05:50Z,"Barclays Initiates Coverage On American Electric Power with Overweight Rating, Announces Price Target of $88",
34003459,AEP,2023-08-23T13:03:08Z,"Morgan Stanley Maintains Overweight on American Electric Power, Lowers Price Target to $95",
34006586,AEP,2023-08-23T15:00:43Z,"Benzinga's Top Ratings Upgrades, Downgrades For August 23, 2023", 
34013821,AEP,2023-08-23T21:00:47Z,Analyst Expectations for American Electric Power's Future, 
34241454,AEP,2023-09-05T17:34:18Z,Stocks That Hit 52-Week Lows On Tuesday," 

On Tuesday, 164 companies achieved new lows for the year."
34285491,AEP,2023-09-06T16:04:25Z,"RBC Capital Maintains Outperform on American Electric Power, Lowers Price Target to $89",
34318580,AEP,2023-09-07T13:15:16Z,Peering Into American Electric Power's Recent Short Interest, 
34425827,AEP,2023-09-11T12:27:19Z,"Jim Cramer Says Skip This 'Very Strange Stock,' Buy DraftKings Instead","On CNBC’s &#34;Mad Money Lightning Round,&#34; Jim Cramer said he is a buyer of  American Electric Power Company, Inc.  (NYSE: AEP). &#34;This won’t just be a smooth ride, 4.2% yield is good."
34699498,AEP,2023-09-18T17:49:49Z,"CFRA Maintains Buy on American Electric Power, Lowers Price Target to $94",
34701318,AEP,2023-09-18T20:00:26Z,Analyst Ratings for American Electric Power, 
34790548,AEP,2023-09-21T12:38:01Z,"Morgan Stanley Maintains Overweight on American Electric Power, Raises Price Target to $97",
34800677,AEP,2023-09-21T17:00:17Z,Morgan Stanley Maintains Overweight Rating for American Electric Power: Here's What You Need To Know, 
34950179,AEP,2023-09-27T14:00:20Z,(AEP) - Analyzing American Electric Power's Short Interest, 
34980368,AEP,2023-09-28T18:32:08Z,Stocks That Hit 52-Week Lows On Thursday," 

During Thursday&#39;s session, 406 companies made new 52-week lows."
35029174,AEP,2023-10-02T12:04:54Z,"AEP Appoints Charles E. Zebula Chief Financial Officer; Company Reaffirms 2023 Operating Earnings Guidance Range Of $5.19-$5.39 Per Share, Long-Term Growth Rate Of 6%-7% And FFO/Debt Target Of 14%-15%",
35029721,AEP,2023-10-02T14:02:38Z,American Electric Power Appoints Charles Zebula As Finance Chief; Reaffirms Guidance,American Electric Power Company Inc (NASDAQ: AEP) has appointed Charles E.
35034779,AEP,2023-10-02T17:00:10Z,Stocks That Hit 52-Week Lows On Monday," 

On Monday, 369 companies set new 52-week lows."
35067420,AEP,2023-10-03T18:37:58Z,Stocks That Hit 52-Week Lows On Tuesday," 

On Tuesday, 647 companies set new 52-week lows."
35094195,AEP,2023-10-04T17:15:16Z,P/E Ratio Insights for American Electric Power, 
35155536,AEP,2023-10-10T13:16:06Z,'Buy Some Here And Then You Buy Some If It Comes Lower': Jim Cramer On This Stock Up Over 50% YTD,"On CNBC’s &#34;Mad Money Lightning Round,&#34; Jim Cramer said  Veeva Systems Inc."
35223842,AEP,2023-10-12T15:39:57Z,"JP Morgan Maintains Overweight on American Electric Power, Lowers Price Target to $90",
35227866,AEP,2023-10-12T19:00:17Z,What 7 Analyst Ratings Have To Say About American Electric Power, 
35247946,AEP,2023-10-13T19:45:24Z,How Is The Market Feeling About American Electric Power?, 
35393774,AEP,2023-10-24T13:19:59Z,"Barclays Maintains Overweight on American Electric Power, Lowers Price Target to $82",
35395834,AEP,2023-10-24T14:31:28Z,A Look Into American Electric Power Inc's Price Over Earnings, 
35399373,AEP,2023-10-24T16:41:26Z,American Electric Power Increases Quarterly Dividend From $0.83 To $0.88 Per Share,
35413363,AEP,2023-10-25T12:08:54Z,"Morgan Stanley Maintains Overweight on American Electric Power, Lowers Price Target to $93",
35447130,AEP,2023-10-26T17:31:41Z,American Electric Power Unusual Options Activity For October 26, 
35538330,AEP,2023-11-01T14:01:01Z,American Electric Power's Earnings: A Preview, 
35556466,AEP,2023-11-02T08:56:34Z,"Earnings Scheduled For November 2, 2023","Companies Reporting Before The Bell

• AudioCodes (NASDAQ:AUDC) is estimated to report quarterly earnings at $0.18 per share on revenue of $61.52 million."
35558880,AEP,2023-11-02T11:02:14Z,"American Electric Power Q3 Adj EPS $1.77 Beats $1.71 Estimate, Sales $5.30B Miss $5.38B Estimate",
35559634,AEP,2023-11-02T11:23:19Z,American Electric Power Narrows FY23 Outlook Operating EPS Guidance To $5.24-$5.34 (Vs. $5.26 Consensus) From $5.19-$5.39; Reaffirms Long-Term Growth Rate Of 6% To 7% And FFO/Debt Target Of 14% To 15%,
35630643,AEP,2023-11-06T21:30:03Z,American Electric Power Company Inc Files For Mixed Shelf; Size Not Disclosed,
35654873,AEP,2023-11-07T18:45:18Z,Looking Into American Electric Power's Recent Short Interest, 
35734615,AEP,2023-11-10T21:34:05Z,"AEP Streamlining Business And Focusing On Regulated Operations To Benefit Customers, Reaffirms Long-Term Growth Rate Of 6%-7%; Sees 2023 Operating Earnings Guidance Range $5.24-$5.34/Share Vs $5.26 Est.; Sees 2024 Operating Earnings Guidance Range $5.53-$5.73/Share Vs $5.58 Est.",
35734654,AEP,2023-11-10T21:39:35Z,"AEP 5-Year, $43B Capital Plan Emphasizes Investments In Wires And Renewables To Support Needs Of Customers; Investing $9.4B In Regulated Renewables Over Next 5 Years To Support Needs Of Customers With Fuel-Free Power",
35734656,AEP,2023-11-10T21:40:12Z,"AEP 5-Year, $43B Capital Investment Plan Allocates More Than $27B To Transmission And Distribution; Co Will Invest Nearly All Capital In Its Regulated Businesses As It Simplifies And De-Risks Operations",
35734663,AEP,2023-11-10T21:41:16Z,AEP Expects To Complete Previously Announced Strategic Review Of Its Transource Energy Joint Venture This Year; Remains On Track With Previously Announced Sales Processes For Its Retail And Distributed Resources Businesses,
35734664,AEP,2023-11-10T21:41:28Z,AEP Says Remains On Track With Its Sales Processes For Its Shares Of A Renewable Energy JV & Two Non-Core Transmission JV,
35858457,AEP,2023-11-17T22:00:01Z,"American Electric Power Company On Nov 16, Co Entered Into A Distribution Agreement; Pursuant To Distribution Agreement Co May Sell, From Time To Time, Up To Sales Price Of $1.7B Of Common Stock",
35893310,AEP,2023-11-21T13:36:26Z,"Morgan Stanley Maintains Overweight on American Electric Power, Raises Price Target to $95",
35901003,AEP,2023-11-21T17:00:11Z,Analyst Ratings for American Electric Power, 
35941204,AEP,2023-11-24T15:45:13Z,Peering Into American Electric Power's Recent Short Interest, 
35984395,AEP,2023-11-28T17:08:25Z,"Mizuho Maintains Buy on American Electric Power, Lowers Price Target to $87",
36008689,AEP,2023-11-29T18:30:42Z,A Look Into American Electric Power Inc's Price Over Earnings, 
36106966,AEP,2023-12-06T14:08:27Z,Cramer's Top Auto Pick After 'Very Big Spike': 'By Far The Best Of The Group',"On CNBC’s &#34;Mad Money Lightning Round,&#34; Jim Cramer said he likes  Weyerhaeuser Company’s  (NYSE: WY) stock long term."
36214579,AEP,2023-12-13T13:15:18Z,How Is The Market Feeling About American Electric Power?, 
36323960,AEP,2023-12-20T13:40:41Z,Southwestern Electric Power Co Says American Electric Power Co Reaffirming Forecasted Financial Data Issued On Nov 10 On 2024 Operating Earnings Guidance; Reaffirming Its Projected 6%-7% Long-Term Earnings Growth Rate,
36382125,AEP,2023-12-26T11:34:13Z,AEP Agrees to $115 Million Solar Project Sale: New Mexico Renewable Development's 15-Site Portfolio to Exus North America,
36383489,AEP,2023-12-26T14:23:13Z,Electric Company AEP and PNM Unload 50% Solar Stake for $230M in Strategic Shift,"American Electric Power Co Inc (NASDAQ: AEP), along with PNM Resources Inc (NYSE: PNM), "
36403211,AEP,2023-12-27T19:48:01Z,"AEP Reaffirms Forecasted Financial Data Previously Issued Nov. 10, 2023, Relating To 2024 Operating EPS Guidance, Projected 6%-7% Long-Term Earnings Growth Rate And 14%-15% FFO/Debt Target",
36407872,AEP,2023-12-28T11:44:45Z,AEP Subsidiaries' Settlement: Customer Impact Reduction And Cost Management,American Electric Power Co Inc (NASDAQ: AEP) subsidiaries Appalachian Power and Wheeling Power filed a settlement agreement with the Public Service Commission of West Virginia (PSC) related to 
36592100,AEP,2024-01-11T13:01:21Z,"Mizuho Downgrades American Electric Power to Neutral, Announces $83 Price Target",
36640332,AEP,2024-01-16T13:30:17Z,How Is The Market Feeling About American Electric Power?, 
36673023,AEP,2024-01-18T14:30:24Z,"Jim Cramer Says Buy This Utilities Stock Down 6% Over Past 6 Months, Calls Bunge A 'Battleground'","On CNBC’s &#34;Mad Money Lightning Round,&#34; Jim Cramer said  American Electric Power Company, Inc. (NASDAQ: AEP) is a buy."
36714839,AEP,2024-01-22T13:21:06Z,"BMO Capital Maintains Outperform on American Electric Power, Lowers Price Target to $88",
36715535,AEP,2024-01-22T13:53:22Z,"Barclays Maintains Overweight on American Electric Power, Raises Price Target to $84",
36718125,AEP,2024-01-22T15:35:01Z,"Guggenheim Downgrades American Electric Power to Neutral, Announces $81 Price Target",
36719754,AEP,2024-01-22T17:00:16Z,BMO Capital Maintains Outperform Rating for American Electric Power: Here's What You Need To Know, 
36915853,AEP,2024-02-02T19:30:19Z,How Is The Market Feeling About American Electric Power?, 
37006242,AEP,2024-02-08T13:12:39Z,Ribbon's IP Optical Solutions Selected By American Electric Power For Supply Chain Reliability And Enhanced Network Capabilities,
37080432,AEP,2024-02-12T21:33:58Z,American Electric Power Enters Into An Agreement With Icahn Capital L.P.; Adds Hunter C. Gary And Henry P. Linginfelter To Board,
37142281,AEP,2024-02-14T21:41:27Z,"Carl Icahn Adds Stake In American Electric Power Company, Buys 1.205M Shares",
37323271,AEP,2024-02-26T21:47:40Z,"AEP Announces CEO Transition; Benjamin G.S. Fowke III, Appointed Interim CEO & President; Sara Martinez Tucker Named Chair of the Board; Reaffirming Its 2024 Operating Earnings Guidance Range Of $5.53-$5.73 Vs $5.60 Est.",
37323368,AEP,2024-02-26T21:50:02Z,American Electric Power Q4 EPS $1.23 Misses $1.26 Estimate,
37325193,AEP,2024-02-26T22:47:40Z,"American Electric Power Q4 2023 Adj EPS $1.23 Misses $1.26 Estimate, Sales $4.60B Miss $5.12B Estimate",
37328710,AEP,2024-02-27T10:01:31Z,"Earnings Scheduled For February 27, 2024","Companies Reporting Before The Bell

• Gaotu Techedu (NYSE:GOTU) is expected to report quarterly loss at $0.07 per share on revenue of $100.49 million."
37338228,AEP,2024-02-27T15:08:32Z,"BMO Capital Maintains Outperform on American Electric Power, Raises Price Target to $88",
37346565,AEP,2024-02-27T20:36:33Z,"CFRA Reiterates Buy on American Electric Power, Raises Price Target to $92",
37357614,AEP,2024-02-28T10:38:25Z,Sunset On Solar Venture: PNM Resources And AEP Complete Sale Of New Mexico JV Assets,"PNM Resources sells its stake in NMRD to Exus North America Holdings for $234 million amidst regulatory hurdles and a significant charge, while shares fall."
37358187,AEP,2024-02-28T11:08:02Z,"Barclays Downgrades American Electric Power to Equal-Weight, Lowers Price Target to $83",
37426365,AEP,2024-03-01T17:15:13Z,How Is The Market Feeling About American Electric Power?, 
37558935,AEP,2024-03-08T14:07:58Z,"Ladenburg Thalmann Downgrades American Electric Power to Sell, Lowers Price Target to $73",
37562840,AEP,2024-03-08T16:12:34Z,"BMO Capital Reiterates Outperform on American Electric Power, Raises Price Target to $90",
37580087,AEP,2024-03-11T10:12:12Z,"UBS Downgrades American Electric Power to Sell, Lowers Price Target to $83",
38090480,AEP,2024-04-04T13:00:37Z,(AEP) - Analyzing American Electric Power's Short Interest, 
