ID,Ticker,Date,Headline,Summary
38246849,AEP,2024-04-15T12:31:08Z,"Barclays Maintains Equal-Weight on American Electric Power, Raises Price Target to $84",
38362843,AEP,2024-04-22T17:39:18Z,"Scotiabank Maintains Sector Outperform on American Electric Power, Lowers Price Target to $86",
38514742,AEP,2024-04-30T11:02:16Z,"American Electric Power Q1 2024 Adj EPS $1.27 Beats $1.26 Estimate, Sales $5.000B Miss $5.021B Estimate",
38515368,AEP,2024-04-30T11:17:16Z,American Electric Power Reaffirms 2024 Adjusted Operating Earnings Guidance Of $5.53 -5.73 Per Share Vs. $5.59 Consensus,
38523291,AEP,2024-04-30T14:45:26Z,Looking Into American Electric Power's Recent Short Interest, 
38531253,AEP,2024-04-30T18:36:26Z,"American Electric Power Reports Q1 Revenue Miss, Plans $27B Investment To 'Enhance Resiliency'",American Electric Power closed the sale of its New Mexico solar assets in February.
38559667,AEP,2024-05-01T17:01:15Z,"BMO Capital Maintains Outperform on American Electric Power, Raises Price Target to $95",
38561058,AEP,2024-05-01T17:58:17Z,"Wells Fargo Maintains Equal-Weight on American Electric Power, Raises Price Target to $89",
38563583,AEP,2024-05-01T19:53:24Z,"Scotiabank Maintains Sector Outperform on American Electric Power, Raises Price Target to $90",
38585843,AEP,2024-05-02T14:17:57Z,"Barclays Maintains Equal-Weight on American Electric Power, Raises Price Target to $88",
38619909,AEP,2024-05-03T16:52:15Z,"RBC Capital Maintains Outperform on American Electric Power, Raises Price Target to $100",
38801461,AEP,2024-05-13T20:32:17Z,"AEP To Sell Distributed Resources Business To Basalt For ~$315M In Cash, Expected To Close In Q3 2024",
38802082,AEP,2024-05-13T20:45:11Z,AEP Reaffirms Its FY24 Operating Earnings Guidance Of $5.53-$5.73; Long-Term Growth Rate Of 6%-7% And FFO/Debt Target Of 14%-15%,
38821061,AEP,2024-05-14T15:26:18Z,"BMO Capital Maintains Outperform on American Electric Power, Raises Price Target to $99",
39044593,AEP,2024-05-28T17:47:12Z,"Morgan Stanley Maintains Overweight on American Electric Power, Raises Price Target to $98",
39210273,AEP,2024-06-06T15:40:28Z,Ladenburg Thalmann Upgrades American Electric Power to Neutral,
39275289,AEP,2024-06-11T16:30:11Z,Peering Into American Electric Power's Recent Short Interest, 
39458320,AEP,2024-06-24T14:40:58Z,"Morgan Stanley Maintains Overweight on American Electric Power, Lowers Price Target to $94",
39463207,AEP,2024-06-24T17:35:59Z,"Air Conditioner, Utilities Shares Climb As Heat Wave Heads From Midwest To The South","Extreme heat wave drives up US natural gas prices and stock prices for air conditioner manufacturers, utility companies, and some energy stocks."
39513881,AEP,2024-06-26T21:19:17Z,Centuri Holdings Says Bill Fehrman Will Be Stepping Down As President And CEO To Take The CEO Role At American Electric Power; Paul Caudill Named To Interim Role,
39513893,AEP,2024-06-26T21:21:00Z,"American Electric Power Names William Fehrman As President And CEO, Effective Aug. 1, 2024",
39885060,AEP,2024-07-22T14:05:36Z,American Electric Power Says On July 10 Court Preliminarily Approved Co's Settlement With Four Shareholders; Settlement Includes Implementation Of Certain Corporate Governance Changes,
39891680,AEP,2024-07-22T18:49:49Z,"Guggenheim Maintains Neutral on American Electric Power, Raises Price Target to $83",
40006542,AEP,2024-07-29T10:25:11Z,"Apple, Amazon, Microsoft, Meta Lead The Charge As Investors Bank On Tech Cheer For Rally's Reacceleration: Week Ahead In Earnings",The unfolding week&#39;s market trajectory depends on earnings from bellwether tech stocks and what the Fed has to say following its July meeting.
40008796,AEP,2024-07-29T12:02:45Z,"BMO Capital Maintains Outperform on American Electric Power, Raises Price Target to $104",
40033011,AEP,2024-07-30T11:00:23Z,"American Electric Power Q2 2024 Adj. EPS $1.25 Beats $1.23 Estimate, Sales $4.600B Miss $4.739B Estimate",
40033175,AEP,2024-07-30T11:06:23Z,AEP Reaffirms Its 2024 Outlook: Sees Operating EPS Of $5.53-$5.73 Vs. $5.62 Consensus; Long-Term Growth Rate Of 6%-7%,
40033855,AEP,2024-07-30T11:27:49Z,"Nasdaq, S&P Futures Rise As Microsoft, AMD Earnings Take Spotlight: Will Fed Provide 'Turbo Boost' For Market? Analyst Weighs In",Wall Street is likely to tenaciously hold onto the slender optimism ahead of a slew of earnings from notable companies and the Federal Reserve’s two-day rate-setting meeting that gets underway on Tuesday.
40038448,AEP,2024-07-30T13:28:14Z,"American Electric Power's Q2 Highlights: Mixed Results, Job Cuts, Maintains Guidance","AEP reports Q2 2024 revenue of $4.60B, missing consensus of $4.74B. Commercial load increased 12.4% Y/Y, adjusted operating earnings rose to $662M."
40046953,AEP,2024-07-30T17:42:51Z,"Tech Stocks Drop Ahead Of Key Earnings; Nvidia Falls, CrowdStrike Hits 8-Month Low: What's Driving Markets Tuesday?","Investor sentiment took a hit on Tuesday as caution prevailed ahead of significant market events, including key tech earnings reports and the Federal Open Market Committee meeting."
40069632,AEP,2024-07-31T13:53:16Z,"BMO Capital Maintains Outperform on American Electric Power, Raises Price Target to $105",
40080052,AEP,2024-07-31T19:43:10Z,"Scotiabank Maintains Sector Outperform on American Electric Power, Raises Price Target to $99",
40107100,AEP,2024-08-01T15:54:51Z,"Barclays Maintains Equal-Weight on American Electric Power, Raises Price Target to $96",
40182163,AEP,2024-08-06T10:18:03Z,"B of A Securities Downgrades American Electric Power to Underperform, Raises Price Target to $97",
40228260,AEP,2024-08-07T17:05:20Z,"JP Morgan Maintains Overweight on American Electric Power, Raises Price Target to $108",
40400221,AEP,2024-08-15T16:02:59Z,"EverCharge Partners With Public Service Company of Oklahoma, A Subsidiary Of American Electric Power, For Strategic Collaboration On Large-Scale EV Charging Solutions",
40461860,AEP,2024-08-20T12:54:27Z,"Scotiabank Maintains Sector Outperform on American Electric Power, Raises Price Target to $108",
40488455,AEP,2024-08-21T15:15:13Z,How Is The Market Feeling About American Electric Power?, 
40531414,AEP,2024-08-23T15:49:41Z,"Morgan Stanley Maintains Overweight on American Electric Power, Raises Price Target to $102",
40629020,AEP,2024-08-29T15:47:31Z,"B of A Securities Maintains Underperform on American Electric Power, Raises Price Target to $98",
40772131,AEP,2024-09-09T12:43:01Z,"BMO Capital Maintains Outperform on American Electric Power, Raises Price Target to $109",
40823561,AEP,2024-09-11T22:33:17Z,"This Under-The-Radar Defensive AI Sector Quietly Outperforms All Others, Despite Receiving 'No Love' From Investors","Utilities sector surges in 2024, outpacing tech by 9 percentage points. Defensive stocks lead amid rising volatility and demand for data centers."
40950054,AEP,2024-09-19T23:11:00Z,"Jefferies Initiates Coverage On American Electric Power with Hold Rating, Announces Price Target of $107",
40969515,AEP,2024-09-21T15:45:20Z,Amazon Going Nuclear? Hiring Plans Indicate Company May Be Eyeing Nuclear To Meet Energy Needs,Recent developments suggest that Amazon may be ramping up its interest in nuclear energy to fuel its growing needs.
41028823,AEP,2024-09-25T15:49:12Z,"Morgan Stanley Maintains Overweight on American Electric Power, Raises Price Target to $108",
41168746,AEP,2024-10-03T15:46:11Z,"BMO Capital Maintains Outperform on American Electric Power, Raises Price Target to $114",
41184826,AEP,2024-10-04T13:15:18Z,How Is The Market Feeling About American Electric Power?, 
41187801,AEP,2024-10-04T15:37:01Z,"BMO Capital Maintains Outperform on American Electric Power, Lowers Price Target to $111",
41254312,AEP,2024-10-09T15:51:24Z,"Hurricane Milton Descends On Florida: Analysts Warn Of Impact On Disney, NextEra's Florida Power & Light, Regional Banks",Analysts weigh in on Hurricane Milton&#39;s negative impact on different sectors and whether there could be buying opportunities for the long term.
41341511,AEP,2024-10-15T17:52:43Z,"Barclays Maintains Equal-Weight on American Electric Power, Raises Price Target to $100",
41360102,AEP,2024-10-16T15:31:11Z,"Wells Fargo Maintains Equal-Weight on American Electric Power, Raises Price Target to $104",
41404440,AEP,2024-10-18T15:06:48Z,"JP Morgan Maintains Overweight on American Electric Power, Raises Price Target to $112",
41468699,AEP,2024-10-22T21:22:44Z,American Electric Power Boosts Quarterly Cash Dividend From $0.88 To $0.93 Per Share,
41745325,AEP,2024-11-05T14:02:31Z,Insights Ahead: American Electric Power's Quarterly Earnings, 
41764877,AEP,2024-11-06T05:47:31Z,American Electric Power Gears Up For Q3 Print; Here Are The Recent Forecast Changes From Wall Street's Most Accurate Analysts, 
41769735,AEP,2024-11-06T11:59:22Z,"American Electric Power Q3 2024 Adj. EPS $1.85 Beats $1.80 Estimate, Sales $5.400B Miss $5.434B Estimate",
41770570,AEP,2024-11-06T12:15:02Z,American Electric Power Narrows FY24 Adj EPS Guidance from $5.53-$5.73 to $5.58-$5.68 vs $5.62 Est,
41770576,AEP,2024-11-06T12:15:26Z,American Electric Power Sees FY25 Adj EPS $5.75-$5.95 vs $5.98 Est,
41772985,AEP,2024-11-06T13:22:45Z,"American Electric Power Q3: EPS Beat, Revenue Miss, 10% Commercial Load Jump & More","American Electric Power Company reported Q3 revenue of $5.42B, missing consensus of $5.434B. Commercial load up 10%, projected to grow 20% annually. Adjusted EPS beat and outlook narrowed."
41784504,AEP,2024-11-06T19:25:53Z,"Trump's Win Sends Indices To Record Highs; Financials, Small Caps Surge, Bitcoin Tops $75,000: What's Driving Markets Wednesday?","An “everything rally” powered Wall Street on Wednesday after the 2024 election results, with Donald Trump emerging as the clear presidential winner."
41806880,AEP,2024-11-07T13:38:12Z,"Evercore ISI Group Maintains In-Line on American Electric Power, Lowers Price Target to $96",
41811169,AEP,2024-11-07T15:11:33Z,"Wells Fargo Maintains Equal-Weight on American Electric Power, Lowers Price Target to $102",
41813316,AEP,2024-11-07T15:53:10Z,"UBS Maintains Sell on American Electric Power, Raises Price Target to $95",
41818783,AEP,2024-11-07T18:17:39Z,"BMO Capital Maintains Outperform on American Electric Power, Lowers Price Target to $104",
41984836,AEP,2024-11-14T18:53:19Z,AEP Leveraging Fuel Cell Technology To Power Data Center Growth; AEP Has An Agreement In Place To Secure Up To 1 Gigawatt Of Bloom Energy Solid Oxide Fuel Cells For Data Centers And Other Large Energy Users Who Need To Quickly Power Their Operations While The Grid Is Built Out To Accommodate Demand; In The Process Of Finalizing The First Customer Project Agreements Where All Costs Will Be Covered By The Large Customers Under A Special Contract,
42011327,AEP,2024-11-15T15:25:13Z,"Why Bloom Energy Could Reach Revenues Of $1.8B Next Year, Says Bullish Analyst","Bloom Energy Corp announces 1 GW fuel cell supply deal with American Electric Power Co, sending stock soaring. Analyst upgrades rating and price target."
42015378,AEP,2024-11-15T17:58:52Z,"Friday's Top 5 Trending Stocks: What's The Scoop On Palantir, Bloom Energy, Pfizer?","Here&#39;s a look at Pfizer, Applied Materials, Bloom Energy, Palantir and FuelCell Energy. Friday&#39;s Top 5 Trending Stocks."
42017034,AEP,2024-11-15T19:20:22Z,Crude Oil Dips Over 2%; Bloom Energy Shares Spike Higher, 
42143266,AEP,2024-11-22T17:14:56Z,"Morgan Stanley Maintains Overweight on American Electric Power, Lowers Price Target to $104",
42188879,AEP,2024-11-26T13:26:31Z,"Barclays Maintains Equal-Weight on American Electric Power, Lowers Price Target to $99",
42269963,AEP,2024-12-02T15:55:56Z,"BMO Capital Maintains Outperform on American Electric Power, Raises Price Target to $108",
42460376,AEP,2024-12-12T13:45:37Z,"JP Morgan Downgrades American Electric Power to Neutral, Lowers Price Target to $102",
42463995,AEP,2024-12-12T15:24:26Z,"Scotiabank Downgrades American Electric Power to Sector Perform, Lowers Price Target to $102",
42684254,AEP,2024-12-26T13:48:51Z,Top 3 Utilities Stocks You'll Regret Missing In December, 
42844616,AEP,2025-01-07T14:02:16Z,"American Electric Power Appoints Trevor Mihalik As Executive VP & CFO, Effective Jan. 20; Mihalik To Succeed Chuck Zebula, Who Retires In March After Serving As Senior Advisor To The CEO",
42905584,AEP,2025-01-10T07:15:32Z,"Reported Earlier, KKR and PSP Investments Acquire 19.9% Stake in AEP's Transmission Companies for $2.82B",
42910243,AEP,2025-01-10T12:58:16Z,American Electric Power Sells 19.9% Stake In Two Transmission Assets For $2.82B: Details,American Electric Power has entered into a $2.82 billion deal with KKR and PSP Investments with respece to a 19.9% stake in its Ohio and Indiana &amp; Michigan Transmission Companies. 
42913644,AEP,2025-01-10T14:19:27Z,"BMO Capital Maintains Outperform on American Electric Power, Lowers Price Target to $100",
42942102,AEP,2025-01-13T12:41:10Z,"B of A Securities Upgrades American Electric Power to Buy, Raises Price Target to $104",
42945841,AEP,2025-01-13T14:20:24Z,This Caterpillar Analyst Is No Longer Bearish; Here Are Top 5 Upgrades For Monday, 
42956879,AEP,2025-01-13T18:40:36Z,"American Electric Power Is Attractive Going Forward, Analyst Double-Upgrades Stock","Bank of America Securities analyst Julien Dumoulin-Smith upgraded American Electric Power to a Buy rating and raised the price target to $104, up from $98. The upgrade follows AEP&#39;s sale of a 19.9% stake in transmission assets for $2.8 billion and the appointment of Trevor Mihalik as CFO. "
43262796,AEP,2025-01-28T12:36:00Z,Top 3 Utilities Stocks You May Want To Dump In January, 
43310997,AEP,2025-01-29T16:45:19Z,Looking Into American Electric Power's Recent Short Interest, 
43356785,AEP,2025-01-30T22:22:42Z,3 ETFs To Navigate Utility Stock Volatility As DeepSeek Challenges Power Demand Forecasts,"AI&#39;s impact on electricity demand is uncertain with the emergence of DeepSeek, causing confusion among investors and leading to a sell-off in power stocks. Less sensitive ETFs include XLU, RSPU, and GRID."
43685550,AEP,2025-02-13T08:32:25Z,"Earnings Scheduled For February 13, 2025", 
43688484,AEP,2025-02-13T11:58:18Z,"American Electric Power Q4 2024 Adj EPS $1.24 Beats $1.22 Estimate, Sales $4.70B Miss $4.88B Estimate",
43688490,AEP,2025-02-13T11:59:40Z,American Electric Power Affirms FY2025 Adj EPS Guidance Of $5.75-$5.95 vs $5.88 Estimate,
43693667,AEP,2025-02-13T14:19:42Z,"American Electric Power Misses On Revenue, Tops Profit Forecasts, Reaffirms 2025 Outlook (CORRECTED)","AEP reports Q4 revenue of $4.70B, missing consensus of $4.88B. Total energy distribution &amp; commercial load rose. FY25 adjusted EPS reaffirmed at $5.75-$5.95."
43708650,AEP,2025-02-13T19:34:50Z,"Stocks Rise Despite Hot Producer Inflation, Intel Soars, Bitcoin Drops Below $96,000: What's Driving Markets Thursday?","Wall Street climbed on Thursday, even as the Producer Price Index (PPI) sharply exceeded estimates in January, reigniting concerns over persistent inflationary pressures. "
44004516,AEP,2025-02-27T13:09:42Z,"American Electric Power, Affiliates Selected To Complete ~$1.7B Of Transmission Investments In PJM Region",
44372909,AEP,2025-03-18T10:47:19Z,"B of A Securities Maintains Buy on American Electric Power, Raises Price Target to $114",
44419224,AEP,2025-03-20T15:07:49Z,"Morgan Stanley Maintains Overweight on American Electric Power, Raises Price Target to $113",
44465259,AEP,2025-03-24T20:28:02Z,American Electric Power Reports Commencement Of Offering Of $2B Of Shares Of Its Common Stock,
44468617,AEP,2025-03-25T06:21:21Z,"Reported Earlier, AEP Prices 19.6M Share Offering At $102 Each With Forward Sale Component To Settle By 2026",
44491576,AEP,2025-03-26T12:00:32Z,"BMO Capital Maintains Outperform on American Electric Power, Raises Price Target to $111",
44525929,AEP,2025-03-27T21:05:03Z,"'Our GPUs Are Melting,' OpenAI's Altman Warns — Could US Natural Gas Power AI Revolution?","The AI boom is straining US energy infrastructure, but natural gas may help meet the growing demand. Gas-fired power plants provide reliable and flexible electricity for data centers."
44647747,AEP,2025-04-04T15:00:12Z,Ohio Rep. David Taylor Bought Over $8K Worth of Amazon.com Stock: Here's What You Should Know, 
44715854,AEP,2025-04-09T15:00:29Z,Is American Electric Power Gaining or Losing Market Support?, 
44772414,AEP,2025-04-11T19:04:33Z,American Electric Power's I&M Seeks IURC Approval to Acquire 870 MW Oregon Clean Energy Center,
44901158,AEP,2025-04-21T15:13:22Z,"BMO Capital Maintains Outperform on American Electric Power, Raises Price Target to $115",
44928781,AEP,2025-04-22T15:57:59Z,"Barclays Maintains Equal-Weight on American Electric Power, Raises Price Target to $106",
44956314,AEP,2025-04-23T16:00:26Z,A Look Into American Electric Power Inc's Price Over Earnings, 
45111682,AEP,2025-04-30T17:59:18Z,Wall Street Falls On Weak Economic Data As Oil Slumps To $58: What's Driving Markets Wednesday,"Wall Street traded lower on the final session of the month, heading for its third consecutive monthly loss as economic data began reflecting the impact of Trump tariffs."
45214800,AEP,2025-05-06T08:32:41Z,"Earnings Scheduled For May 6, 2025", 
45216920,AEP,2025-05-06T10:58:57Z,"American Electric Power Q1 Adj. EPS $1.54 Beats $1.40 Estimate, Sales $5.46B Beat $5.17B Estimate",
45217350,AEP,2025-05-06T11:12:51Z,American Electric Power Affirms FY25 Adj EPS Guidance of $5.75-$5.95 vs $5.87 Est,
45217358,AEP,2025-05-06T11:14:12Z,American Electric Power Sees FY2025 GAAP EPS $5.71-$5.91 vs $5.88 Est,
45231535,AEP,2025-05-06T17:26:40Z,"Stocks Fall On Trade Concerns, Oil And Gold Rally: What's Driving Markets Tuesday?","Wall Street edged lower by midday Tuesday as uncertainty surrounding trade policies lingered, with investors adopting a cautious approach ahead of Wednesday’s Federal Reserve meeting."
45236298,AEP,2025-05-06T20:22:40Z,American Electric Power Reaffirms 2025 Outlook With Minimal Tariff Risk On $54B Grid Investment Plan,"American Electric Power Company reports strong first-quarter revenue of $5.46B and adjusted EPS of $1.54, reaffirms FY25 outlook of $5.75-$5.95."
45253178,AEP,2025-05-07T13:37:40Z,"Wells Fargo Maintains Equal-Weight on American Electric Power, Raises Price Target to $114",
45258078,AEP,2025-05-07T15:19:13Z,"Guggenheim Maintains Buy on American Electric Power, Raises Price Target to $115",
45473816,AEP,2025-05-16T17:24:06Z,George Soros Loads Up On First Solar Calls: What Does He Know That Wall Street Doesn't?,"Soros Fund Management, in a surprise move, revealed a bold new bet on First Solar Inc., scooping up 1.6 million call options."
45563886,AEP,2025-05-22T13:03:18Z,"Morgan Stanley Maintains Overweight on American Electric Power, Lowers Price Target to $113",
45814971,AEP,2025-06-06T14:10:02Z,"UBS Maintains Sell on American Electric Power, Raises Price Target to $100",
45930788,AEP,2025-06-13T16:34:51Z,"Raymond James Initiates Coverage On American Electric Power with Outperform Rating, Announces Price Target of $115",
46571449,AEP,2025-07-23T13:27:15Z,American Electric Power Co Says Sara Martinez Tucker Resigns As Chair Of Board; William J. Fehrman Elected As Chair Of AEP Board,
46689502,AEP,2025-07-29T14:01:32Z,Insights Ahead: American Electric Power's Quarterly Earnings, 
46714212,AEP,2025-07-30T08:32:48Z,"Earnings Scheduled For July 30, 2025", 
46716629,AEP,2025-07-30T10:57:36Z,"American Electric Power Q2 Adj. EPS $1.43 Beats $1.23 Estimate, Sales $5.086B Beat $4.844B Estimate",
46716656,AEP,2025-07-30T10:58:47Z,American Electric Power Affirms FY2025 Adj EPS Guidance of $5.75-$5.95 vs $5.87 Est,
46717420,AEP,2025-07-30T11:21:00Z,American Electric Power Raises FY2025 GAAP EPS Guidance from $5.71-$5.91 to $6.57-$6.77 vs $5.86 Est,
46731635,AEP,2025-07-30T17:21:57Z,"American Electric Power Lifts Annual GAAP Outlook, To Announce $70 Billion Capital Plan","AEP reported strong Q2 results, with adjusted earnings of $1.43 per share and revenue of $5.09 billion. They also raised their full-year earnings guidance due to customer growth and regulatory outcomes."
46753284,AEP,2025-07-31T12:02:55Z,"Mizuho Maintains Neutral on American Electric Power, Raises Price Target to $116",
46754376,AEP,2025-07-31T12:33:15Z,"UBS Maintains Sell on American Electric Power, Raises Price Target to $110",
46759157,AEP,2025-07-31T14:16:12Z,"Raymond James Reiterates Outperform on American Electric Power, Raises Price Target to $122",
46769053,AEP,2025-07-31T17:55:47Z,"Scotiabank Maintains Sector Perform on American Electric Power, Raises Price Target to $114",
46791463,AEP,2025-08-01T12:51:20Z,"Barclays Maintains Equal-Weight on American Electric Power, Raises Price Target to $111",
46826416,AEP,2025-08-04T13:18:50Z,American Electric Power's Indiana Michigan Power Files Joint Contract With Google To Support I&M's Capacity Needs Through Clean Generation And Use Of Demand Response Structure,
47166066,AEP,2025-08-15T19:07:48Z,"Icahn Hedge Fund's Q2 Moves: Centuri Stake Soars, JetBlue Held, 2 Positions Exited","Carl Icahn&#39;s 13F shows concentrated equity book, with top 10 holdings making up 98.76%. Notable changes in non-house names like CTRI and IFF."
47624837,AEP,2025-09-11T15:46:26Z,"Jefferies Maintains Hold on American Electric Power, Lowers Price Target to $116",
47693349,AEP,2025-09-16T14:35:11Z,"Mizuho Maintains Neutral on American Electric Power, Lowers Price Target to $113",
47821171,AEP,2025-09-23T14:58:39Z,"Plug Power, FuelCell, Bloom Energy Surge As AI Hype Meets Hydrogen Power","Plug Power, FuelCell and Bloom Energy stocks rally as the AI boom drives massive new demand for data center power sources."
47850063,AEP,2025-09-24T18:16:55Z,Why Bloom Energy's 650% Rally Might Be More Hype Than Reality,"Bloom Energy (BE) has seen a 650% surge in stock due to AI hype, but Bank of America warns fundamentals don&#39;t justify valuation."
47873182,AEP,2025-09-25T17:24:43Z,"Morgan Stanley Maintains Overweight on American Electric Power, Lowers Price Target to $115",
47914128,AEP,2025-09-29T12:55:10Z,"Jim Cramer Recommends ONEOK, 'Can't Believe' Stock Price Is This Low","On CNBC&#39;s “Mad Money Lightning Round,” Jim Cramer recommended buying ONEOK, Inc. (NYSE: OKE) and “can&#39;t believe it&#39;s this low.&#34;"
48048742,AEP,2025-10-06T16:00:25Z,How Is The Market Feeling About American Electric Power Co Inc?, 
48072858,AEP,2025-10-07T12:49:27Z,"Evercore ISI Group Initiates Coverage On American Electric Power with Outperform Rating, Announces Price Target of $133",
48148908,AEP,2025-10-10T14:27:18Z,"UBS Maintains Sell on American Electric Power, Raises Price Target to $116",
48174221,AEP,2025-10-13T13:28:49Z,Brookfield's $5 Billion Bet Powers Bloom Energy's AI Factory Role,Bloom Energy (NYSE: BE) surges 31% after inking $5B AI infrastructure partnership with Brookfield Asset Management.
48197246,AEP,2025-10-14T13:27:14Z,"Barclays Maintains Equal-Weight on American Electric Power, Raises Price Target to $117",
48244993,AEP,2025-10-16T10:20:33Z,"AEP Transmission Secures $1.6B US Department of Energy Loan to Upgrade 5,000 Miles of Power Lines and Cut Customer Costs",
48245956,AEP,2025-10-16T11:33:14Z,"BMO Capital Maintains Outperform on American Electric Power, Raises Price Target to $127",
48259675,AEP,2025-10-16T18:07:50Z,What's Going On With American Electric Power Stock Thursday?,"AEP holds steady as it lands a $1.6B DOE-backed grid upgrade, wins a target hike, and outlines multi-state transmission rebuilds."
48262673,AEP,2025-10-16T19:45:56Z,"Jefferies Maintains Hold on American Electric Power, Raises Price Target to $128",
48360965,AEP,2025-10-22T17:06:18Z,"Morgan Stanley Maintains Overweight on American Electric Power, Raises Price Target to $123",
48362460,AEP,2025-10-22T18:04:29Z,American Electric Power Increases Its Quarterly Cash Dividend From $0.93 To $0.95,
48462296,AEP,2025-10-28T13:56:59Z,"Wells Fargo Initiates Coverage On American Electric Power with Overweight Rating, Announces Price Target of $132",
48462719,AEP,2025-10-28T14:02:16Z,Insights into American Electric Power's Upcoming Earnings, 
48488212,AEP,2025-10-29T10:58:55Z,"American Electric Power Q3 Adj. EPS $1.80 Misses $1.81 Estimate, Sales $6.010B Beat $5.754B Estimate",
48488221,AEP,2025-10-29T10:59:49Z,American Electric Power Affirms FY2025 Adj EPS Guidance of $5.75-$5.95 vs $5.90 Est,
48488543,AEP,2025-10-29T11:08:24Z,"American Electric Power Plans $67B Grid Buildout As Peak Demand Hits 65 GW By 2030, Including $30B Transmission And $20B+ Generation Investments",
48488789,AEP,2025-10-29T11:11:56Z,"Earnings Scheduled For October 29, 2025", 
48489016,AEP,2025-10-29T11:28:57Z,CORRECTION: American Electric Power Raises FY2025 Adj EPS Guidance from $5.75-$5.95 to $5.85-$5.95 vs $5.90 Est,
48489019,AEP,2025-10-29T11:29:32Z,American Electric Power Raises FY2025 GAAP EPS Guidance from $6.57-$6.77 to $6.58-$6.78 vs $6.28 Est,
48490725,AEP,2025-10-29T12:41:45Z,American Electric Power Lifts Outlook As It Rolls Out Ambitious $72 Billion Investment Blueprint,"American Electric Power (NASDAQ: AEP) reports higher earnings and revenue, announces plans for future growth and raises dividend."
48503314,AEP,2025-10-29T16:47:38Z,"S&P 500 Tops 6,900 Ahead Fed Rate Move, Gold Reclaims $4,000: What's Moving Markets Wednesday?","A powerful surge in AI-related stocks — led by a 9% advance in NVIDIA Corp. (NASDAQ:NVDA) over the past two sessions — propelled the S&amp;P 500 above the 6,900 mark and lifted the Nasdaq 100 to 26,100 points, both breaking new records, as investors brace for the Federal Reserve&#39;s"
48522430,AEP,2025-10-30T11:01:15Z,"BMO Capital Downgrades American Electric Power to Market Perform, Maintains Price Target to $126",
48523689,AEP,2025-10-30T11:44:22Z,This American Electric Power Analyst Is No Longer Bullish; Here Are Top 4 Downgrades For Thursday, 
48523959,AEP,2025-10-30T11:55:38Z,"Mizuho Maintains Neutral on American Electric Power, Raises Price Target to $123",
