ID,Ticker,Date,Headline,Summary
48532787,AEP,2025-10-30T15:25:08Z,"Wells Fargo Maintains Overweight on American Electric Power, Raises Price Target to $139",
48534761,AEP,2025-10-30T16:09:04Z,"Evercore ISI Group Maintains Outperform on American Electric Power, Raises Price Target to $137",
48538574,AEP,2025-10-30T17:55:50Z,"Morgan Stanley Maintains Overweight on American Electric Power, Raises Price Target to $130",
48540544,AEP,2025-10-30T18:53:58Z,"Scotiabank Maintains Sector Perform on American Electric Power, Raises Price Target to $121",
48574315,AEP,2025-10-31T20:22:17Z,"Citigroup Maintains Neutral on American Electric Power, Raises Price Target to $132",
48613531,AEP,2025-11-04T09:01:32Z,"Amazon, Google Deals Boosted Cipher Mining's Credibility, Says CEO, But Admits 'Bias' Linked To Bitcoin Mining Background",Cipher Mining Inc. (NASDAQ:CIFR) CEO Tyler Page shed light Monday on the substantial benefits the company has reaped from its big-ticket deals with Amazon.com Inc. (NASDAQ:AMZN) and Fluidstack&lt;
48651040,AEP,2025-11-05T13:15:29Z,"American Electric Power Signs Agreements With Quanta Service To Execute Announced $72B Capital Plan To Enhance Supply Chain Resilience, Expand Development Capabilities",
48660828,AEP,2025-11-05T16:55:46Z,American Electric Power Files For Mixed Shelf Offering Of Up To $10B,
48750053,AEP,2025-11-10T13:29:14Z,Top 2 Utilities Stocks That May Crash This Quarter, 
48897407,AEP,2025-11-17T14:00:47Z,"Jefferies Upgrades American Electric Power to Buy, Raises Price Target to $137",
49014553,AEP,2025-11-21T20:00:24Z,Price Over Earnings Overview: American Electric Power, 
49072451,AEP,2025-11-25T21:23:43Z,American Electric Power Files For Common Stock Offering Of Up To $3.5B,
49240622,AEP,2025-12-05T20:08:54Z,AEP Prices $1B In Additional Fixed-To-Fixed Reset Junior Subordinated Debentures Due 2056,
49268851,AEP,2025-12-08T21:00:30Z,P/E Ratio Insights for American Electric Power, 
49302319,AEP,2025-12-10T13:00:30Z,How Is The Market Feeling About American Electric Power Co Inc?, 
49371987,AEP,2025-12-12T19:20:41Z,"JP Morgan Maintains Neutral on American Electric Power, Raises Price Target to $125",
49458969,AEP,2025-12-17T18:20:09Z,"UBS Maintains Sell on American Electric Power, Lowers Price Target to $107",
49783197,AEP,2026-01-08T14:19:03Z,"Reported Earlier: On January 4, AEP Subsidiary Signs $2.65B Deal For Solid Oxide Fuel Cells And 20-Year Offtake Agreement Near Cheyenne, Wyoming",
49846130,AEP,2026-01-12T15:04:40Z,"B of A Securities Downgrades American Electric Power to Neutral, Lowers Price Target to $122",
50010086,AEP,2026-01-20T16:11:08Z,"Wells Fargo Maintains Overweight on American Electric Power, Raises Price Target to $140",
50014050,AEP,2026-01-20T17:44:57Z,"Live On CNBC, Josh Brown Hosts Segment Titled ""Josh's Best Stocks Spotlight: Utilities""",
50014678,AEP,2026-01-20T18:00:15Z,P/E Ratio Insights for American Electric Power, 
50035126,AEP,2026-01-21T14:16:52Z,How America's Data Center Boom Is Rewriting The Power Stock Playbook,"Goldman Sachs says the US data center boom is tightening power markets, boosting utilities, grid stocks, renewables and reshaping energy investment plays."
50077860,AEP,2026-01-22T18:06:25Z,"Barclays Maintains Equal-Weight on American Electric Power, Raises Price Target to $121",
50171405,AEP,2026-01-27T20:00:32Z,How Is The Market Feeling About American Electric Power Co Inc?, 
50251044,AEP,2026-01-29T21:33:34Z,Bloom Energy's Wild Ride Is Stress-Testing Clean Energy ETFs,"Clean energy ETFs slid sharply as Bloom Energy&#39;s volatile rally cooled, highlighting how single-stock momentum can distort thematic ETF returns."
50540288,AEP,2026-02-11T14:01:33Z,Examining the Future: American Electric Power's Earnings Outlook, 
50566673,AEP,2026-02-12T06:49:59Z,"Cisco, US Foods And 3 Stocks To Watch Heading Into Thursday","US stock futures up, AEP, CSCO, USFD, MCD and AMAT in focus for earnings. MCD beats estimates, CSCO raises guidance, AEP and USFD to report."
50566780,AEP,2026-02-12T07:08:39Z,"Dow Ends Three-Session Win Streak Following Jobs Report: Investor Sentiment Declines, Fear & Greed Index Remains In 'Neutral' Zone","U.S. stocks close lower, with Dow Jones snapping 3-session win streak. Robinhood tumbles 9%, T-Mobile gains 5%, Micron up 10%."
50569050,AEP,2026-02-12T11:11:33Z,"Earnings Scheduled For February 12, 2026", 
50570629,AEP,2026-02-12T11:58:44Z,"American Electric Power Q4 Adj. EPS $1.19 Beats $1.15 Estimate, Sales $5.314B Beat $4.887B Estimate",
50570714,AEP,2026-02-12T12:00:11Z,Earnings Summary: American Electric Power Q4, 
50571839,AEP,2026-02-12T12:19:10Z,American Electric Power Sees FY2026 Adj EPS $6.15-$6.45 vs $6.32 Est,
50581312,AEP,2026-02-12T15:44:26Z,"AEP Q4: Bets Big on Transmission Growth, Utility Sees Massive Data Center Demand",American Electric Power (AEP) beats Q4 earnings expectations with adjusted EPS of $1.19 and revenue of $5.31 billion.
50586585,AEP,2026-02-12T17:34:05Z,S&P 500 Falls Over 1%; American Electric Power Shares Gain After Upbeat Earnings, 
50602892,AEP,2026-02-13T08:05:28Z,"Nasdaq Dips 2% Amid Tech Selloff: Investor Sentiment Declines, Greed Index Moves To 'Fear' Zone","U.S. stocks closed lower on Thursday as Cisco, AppLovin, and American Electric Power reported mixed earnings."
50606324,AEP,2026-02-13T12:29:12Z,"Wolfe Research Upgrades American Electric Power to Outperform, Announces $142 Price Target",
50607970,AEP,2026-02-13T13:30:53Z,"Mizuho Maintains Neutral on American Electric Power, Raises Price Target to $130",
50612327,AEP,2026-02-13T15:06:09Z,"Wells Fargo Maintains Overweight on American Electric Power, Raises Price Target to $141",
50641368,AEP,2026-02-17T07:46:26Z,"Reported Monday, FirstEnergy Transmission And Transource Energy Joint Venture Secure PJM Approval For Major Ohio Grid Expansion Supporting Rising Electricity Demand And Economic Growth",
50651043,AEP,2026-02-17T14:25:38Z,"BMO Capital Maintains Market Perform on American Electric Power, Raises Price Target to $136",
50760883,AEP,2026-02-20T19:14:22Z,"TD Cowen Maintains Buy on American Electric Power, Raises Price Target to $141",
50948190,AEP,2026-02-27T21:40:46Z,"UBS Upgrades American Electric Power to Neutral, Raises Price Target to $132",
51031243,AEP,2026-03-04T12:51:28Z,"Ladenburg Thalmann Upgrades American Electric Power to Buy, Announces $148 Price Target",
51065520,AEP,2026-03-05T13:54:59Z,"Evercore ISI Group Maintains Outperform on American Electric Power, Raises Price Target to $153",
51065735,AEP,2026-03-05T14:00:22Z,Analyst Expectations For American Electric Power's Future, 
51223685,AEP,2026-03-12T18:25:34Z,"JP Morgan Maintains Neutral on American Electric Power, Raises Price Target to $139",
51380243,AEP,2026-03-20T14:31:36Z,Energy Department Announces Partnership to Ensure Affordable Energy and Power America's AI Future,
