ID,Ticker,Date,Headline,Summary
29445749,CMCSA,2022-10-27T18:30:13Z,Comcast Said To Weigh Sale Of German Unit Sky Deutschland,
29446833,CMCSA,2022-10-27T20:24:22Z,Comcast Unusual Options Activity For October 27," Someone with a lot of money to spend has taken a bearish stance on Comcast (NASDAQ:CMCSA).
And retail traders should know.
We noticed this today when the big position showed up on publicly available options history that we track here at Benzinga."
29453166,CMCSA,2022-10-28T12:13:16Z,"TikTok Is Bullish On Gaming Despite China Crackdown, To Launch Standalone Gaming Channel","ByteDance Ltd&#39;s TikTok made a big push into gaming, adding a dedicated tab within the short-form video platform, the Financial Times reported."
29457263,CMCSA,2022-10-28T12:34:34Z,"Truist Securities Maintains Hold on Comcast, Lowers Price Target to $34",
29493664,CMCSA,2022-11-01T10:11:38Z,Charter Offers Freebies To Win More Customers,"
	Charter Communications, Inc (NASDAQ: CHTR) offered a free wireless phone line to some new and existing customers as the fight between cable companies, and their telecom rivals gained momentum.
"
29516753,CMCSA,2022-11-02T09:33:57Z,"Netflix Studio Negotiations Continue as Ad-back Tier is Launching Globally, Disney, NBCUniversal, Sony and Warner Bros. Among Studios With Which Netflix is in Talks",
29523617,CMCSA,2022-11-02T14:01:44Z,Comcast And Charter Announce Xumo As The Brand Name For Their Streaming Platform Joint Venture,
29531752,CMCSA,2022-11-02T20:11:58Z,Comcast Unusual Options Activity," Someone with a lot of money to spend has taken a bearish stance on Comcast (NASDAQ:CMCSA).
And retail traders should know.
We noticed this today when the big position showed up on publicly available options history that we track here at Benzinga."
29549454,CMCSA,2022-11-03T15:01:22Z,"Fox Corporation Partners With FreeWheel, A Comcast Company, To Power Its OneFOX Inventory Across The Company's Leading Entertainment, Sports, Streaming And News Portfolio",
29570980,CMCSA,2022-11-04T14:17:46Z,'WWE Renews Deal With Hulu Until 2023; More Negotiations To Come' - TheStreamable,
29586159,CMCSA,2022-11-07T07:41:13Z,Starlink To Cap Monthly Data Usage At 1TB Starting Next Month — What It Means For You,"Starlink, the satellite internet division of SpaceX, will introduce daytime data caps for residential users starting December."
29616997,CMCSA,2022-11-08T15:44:52Z,Here's How Much $100 Invested In Comcast 15 Years Ago Would Be Worth Today,"Comcast (NASDAQ:CMCSA) has outperformed the market over the past 15 years by 1.59% on an annualized basis producing an average annual return of 8.12%. Currently, Comcast has a market capitalization of $136.62 billion."
29632401,CMCSA,2022-11-09T13:35:46Z,"Netflix Eyes Sports Leagues, Streaming Rights Bids To Expanding Streaming, Boost Revenue","Netflix, Inc (NASDAQ: NFLX) weighed offering live sports on its platform as long as it can do so without breaking the bank."
29664482,CMCSA,2022-11-10T19:29:33Z,From The LBC To The Big Screen: Can A Snoop Dogg Biopic Drop The Box Office Like It's Hot?,One of the most well-known rappers of the 1990s is teaming up with a media company to bring a biopic to life and let everyone know “Who Am I” after all.
29744963,CMCSA,2022-11-16T12:03:01Z,"Wall Street's Most Accurate Analysts Reshuffled Their Best Media Picks, Here They Are","Wall Street analysts make new stock picks on a daily basis. Unfortunately for investors, not all analysts have particularly impressive track records at predicting market movements. Even when it comes to one single stock, analyst ratings and price targets can vary widely, leaving investors confused about which analyst&#39;s opinion to trust."
29777390,CMCSA,2022-11-18T15:32:31Z,"Long-Running Australian Soap Opera That Launched Margot Robbie, Russell Crowe Getting Saved By This Streaming Company",One of the longest-running Australian soap operas was canceled earlier this year. The show is now being rescued by a leading streaming company.
29808837,CMCSA,2022-11-21T18:26:08Z,"How To Watch US World Cup Games, Betting Odds And How The England Vs. US Game Could Set Records","The 2022 World Cup kicked off with its first of 64 matches on Sunday, Nov. 20. For the first time since 2014, fans of the U.S. Men’s National Team (Team USA) will be able to watch their team in World Cup competition.

Here are the details on how to watch, betting odds and the highly anticipated Team USA vs. England matchup."
29825689,CMCSA,2022-11-22T16:17:33Z,Peering Into Comcast's Recent Short Interest,"Comcast&#39;s (NASDAQ:CMCSA) short percent of float has fallen 5.49% since its last report. The company recently reported that it has 73.60 million shares sold short, which is 1.72% of all regular shares that are available for trading."
29828492,CMCSA,2022-11-22T19:47:19Z,New Disney CEO Bob Iger Is Cutting The Fat - And Fast. Is ESPN Next? 1 Analyst Weighs In,Media giant The Walt Disney Company (NYSE: DIS) is making a major change in a move that it hopes could help its stock price rebound and also keep fans happy after years of major concerns. The move could also see the company make major changes to its structure and business segments.
29831566,CMCSA,2022-11-22T21:33:01Z,"If You Invested $100 In This Stock 15 Years Ago, You Would Have $400 Today", 
29830807,CMCSA,2022-11-22T22:23:36Z,Here's How Much $100 Bet On Saudi Arabia To Beat Argentina Paid Out And The Impact On World Cup Odds,"The 2022 World Cup kicked off Sunday, Nov. 20 with the first of 64 games to determine which of the 32 teams that qualified will lift the World Cup Trophy as the best team in the world. With 64 games to be played, there will likely be several upsets, including a big one that happened Tuesday."
29848007,CMCSA,2022-11-24T13:26:42Z,Your Favorite NFT Project Could Have A Macy's Thanksgiving Day Balloon Next Year: The Details And How You Can Vote,One of the greatest Thanksgiving Day traditions will become more connected to the world of non-fungible tokens for a second straight year. Here are the details.
29848065,CMCSA,2022-11-24T14:23:19Z,Here's Why The Detroit Lions And Dallas Cowboys Always Have Thanksgiving Day NFL Games,"Many families have Thanksgiving Day traditions throughout the U.S, which could include watching National Football League games. A total of six NFL teams are now featured annually on the holiday, with two of them playing every year."
29873865,CMCSA,2022-11-28T17:42:13Z,"Fox Scores Big With Record-Breaking USA Vs. England, Michigan Vs. Ohio State Viewership","Two of the most talked about sporting events in America happened after Thanksgiving Day and they were both aired by the same media company.

Here’s a look at the record-setting performances for sports over the long holiday weekend."
29880530,CMCSA,2022-11-29T00:12:58Z,Fortune Fails The Brave: Super Bowl Cryptocurrency-Related Companies Continue Curse,"The defending Super Bowl champion Los Angeles Rams are having a tough 2022 NFL season, but the team isn&#39;t the only one that might be suffering from a Super Bowl hangover."
29891684,CMCSA,2022-11-29T16:42:55Z,AMC Networks CEO Abruptly Steps Down Amid Mass Layoff Announcement,"AMC Networks (NASDAQ: AMCX) Chief Executive Officer Christina Spade has stepped down after only three months in the role.

The announcement comes as a staff memo from the chairman of the entertainment company indicates that AMC Networks is preparing for significant layoffs."
29895511,CMCSA,2022-11-29T20:10:29Z,Comcast Unusual Options Activity,"A whale with a lot of money to spend has taken a noticeably bearish stance on Comcast.

Looking at options history for Comcast (NASDAQ:CMCSA) we detected 13 strange trades."
29897871,CMCSA,2022-11-29T23:02:19Z,"Team USA Advances To Round Of 16, Hurts Sportsbooks: How To Watch Next Match And Updated Betting Odds","The 2022 World Cup kicked off Sunday, Nov. 20 with the first of 64 matches. For the first time since 2014, fans of the U.S. Men’s National Team (Team USA) can watch their team in the competition."
29911890,CMCSA,2022-11-30T20:33:41Z,"An Unlikely Parlay Hits With Team USA Win In World Cup: How A $911.79 Bet Pays Out $175,000",Many Americans cheered on Team USA in their final group stage win over Iran in the 2022 World Cup. The team was heavily bet on across U.S. sportsbooks and one bettor hit a huge parlay. Here’s the bet.
29928672,CMCSA,2022-12-01T17:48:53Z,'Bob Iger's Disney Return: 5 Far-Fetched (or Are They?) Megadeal Scenarios' -The Hollywood Reporter,
29953786,CMCSA,2022-12-05T10:17:50Z,"Wells Fargo Upgrades Comcast to Equal-Weight, Raises Price Target to $38",
29954968,CMCSA,2022-12-05T12:03:28Z,What 12 Analyst Ratings Have To Say About Comcast, 
29956112,CMCSA,2022-12-05T13:03:01Z,Yum! Brands To Rally Around 20%? Here Are 10 Other Price Target Changes For Monday,"
"
29958204,CMCSA,2022-12-05T14:31:21Z,NBC Universal CEO At UBS Global TMT Conference Says Peacock Streaming Service Has Over 18M Global Paid Subscribers,
29959013,CMCSA,2022-12-05T15:01:01Z,"Benzinga's Top Ratings Upgrades, Downgrades For December 5, 2022", 
29958458,CMCSA,2022-12-05T16:13:00Z,Why This Longtime Comcast Bear Just Upgraded The Stock Down 30% This Year,"Shares of Comcast Corporation (NASDAQ: CMCSA) have lost close to 30% year to date. The adverse impact on Cable seems to have played out, according to Wells Fargo."
30023949,CMCSA,2022-12-09T16:03:10Z,"If You Invested $1000 In This Stock 15 Years Ago, You Would Have $3,900 Today", 
30044741,CMCSA,2022-12-12T16:49:52Z,Golden Globe Award Nominees: See The List And Which Companies Could Win Big In January 2023,"After a scandal rocked the Hollywood Foregin Press Association, canceling the annual Golden Globes ceremony in 2022, the show returns on Jan. 10, 2023 with awards covering the best in movies and television.

Here is a look at the nominees for the 80th annual Golden Globes and which companies are among the most nominated and have the most to gain from the ceremony."
30046072,CMCSA,2022-12-12T18:24:49Z,Dave Chappelle's Surprise Introduction Of Elon Musk On Stage Ends In Boos And Awkwardness: Here's What Happened (Video),"A comedy tour featuring Dave Chappelle and Chris Rock is generating strong demand, with the two comedians having their own viral moments in 2022 thanks to streaming giant Netflix Inc (NASDAQ: NFLX) and an infamous slap at the Academy Awards."
30050684,CMCSA,2022-12-12T23:32:35Z,"The Fastest-Growing Brands In 2022: How Crocs, Apple, Zelle And More Stack Up Across Boomers, Gen Z, Gen X, Millennials","A new poll highlighted the fastest-growing brands based on awareness. The poll results were sorted by age demographic, which could help show which brands are bound to be popular in the future.

Here’s a look at the results."
30053777,CMCSA,2022-12-13T12:27:30Z,Stop Arguing With Comcast: This ChatGPT Bot Can Negotiate Your Internet Bill With No Human Assistance At All,DoNotPay&#39;s chatGPT has apparently negotiated with a Comcast Corporation (NASDAQ: CMCSA) agent without any human assistance. 
30032547,CMCSA,2022-12-13T22:35:39Z,"A Career Politician Who Regularly Trades The SPY, Picked Up These 3 High Yielding ETFs Instead",Representative Robert Wittman (R-VA) is the vice-ranking member of the House Armed Services Committee and also serves on the Committee on Natural Resources.
30072863,CMCSA,2022-12-14T12:09:54Z,Charter Earmarks $5.5B On Internet Speed Upgrade: Report,"
	Leading U.S. cable TV provider Charter Communications, Inc (NASDAQ: CHTR) looks to spend $5.5 billion on its network to introduce higher-speed broadband connections.
"
30095220,CMCSA,2022-12-15T16:03:40Z,"JetBlue, Peacock Announce Partnership",
30113928,CMCSA,2022-12-17T15:58:39Z,"2022 World Cup Finals: How To Watch France Vs. Argentina, Betting Odds, Picks And Top Storylines","The 2022 World Cup is nearing its end, with the 32 competing teams narrowed down to two that will compete to lift the trophy. Here’s a look at the two finalists, how they got to the big game, betting odds and additional storylines ahead of the game."
30134591,CMCSA,2022-12-19T21:46:08Z,"'Seems Like A Scam And In Many Ways It Is,' Saturday Night Live Trolls Donald Trump NFT Collection","In the past, the weekly late-night show “Saturday Night Live” has covered the cryptocurrency market as items have trended."
30147291,CMCSA,2022-12-20T16:33:35Z,Drake Bet $1 Million On Argentina To Beat France In World Cup: Here's How He Still Lost His Wager,"Soccer is one of the most wagered-on sports in the world. Unlike many traditional North American sports that result in one team winning the game, soccer matches have a greater chance of ending in a tie. Rapper Drake found this out the hard way."
30148567,CMCSA,2022-12-20T16:51:22Z,"'TV Ratings: World Cup Final Sets Records For Fox, Telemundo' - The Hollywood Reporter",
30148363,CMCSA,2022-12-20T17:02:17Z,"Disney Stock Could Have 43% Upside If Bob Iger Makes This Move In 2023, Analyst Says",A Walt Disney Company (NYSE: DIS) analyst is calling for a spinoff many have suggested for the media giant over the years.
30164433,CMCSA,2022-12-21T19:32:52Z,"Pandora's Box Office: Here's How Much Avatar Sequel Made, How It Stacks Up To The Original","One of the most anticipated movies of 2022 opened this past weekend and turned in the fifth-biggest opening weekend of the year.

Here’s a look at how the performance of “Avatar: The Way of Water” stacked up in 2022, so far, and against its previous movie released in theaters in 2009."
30174861,CMCSA,2022-12-22T15:24:49Z,YouTube Beats Apple To NFL Sunday Ticket Deal: Here's How Much They're Paying And Why It's Important,The National Football League is turning to a streaming company for the NFL Sunday Ticket rights. Here’s the latest on the rights to premium National Football League content.
30177455,CMCSA,2022-12-22T18:00:54Z,10 Communication Services Stocks Whale Activity In Today's Session,"This whale alert can help traders discover the next big trading opportunities.
Whales are entities with large sums of money and we track their transactions here at Benzinga on our options activity scanner."
30205025,CMCSA,2022-12-27T17:00:42Z,Here's How Much $100 Invested In Comcast 15 Years Ago Would Be Worth Today, 
30216015,CMCSA,2022-12-28T17:30:00Z,Comcast Unusual Options Activity For December 28,"Someone with a lot of money to spend has taken a bullish stance on Comcast (NASDAQ:CMCSA).

And retail traders should know.

We noticed this today when the big position showed up on publicly available options history that we track here at Benzinga."
30223846,CMCSA,2022-12-29T12:05:02Z,US Court Indicts Google And YouTube Content Providers For Violating Children Privacy,"
	A U.S. appeals court revived a suit charging Alphabet Inc&#39;s (NASDAQ: GOOG) (NASDAQ: GOOGL) Google and other companies of violating the privacy of children below 13 years.
"
30224896,CMCSA,2022-12-29T12:59:45Z,"Elon Musk Tells Employees Tesla Will Be 'Most Valuable Company On Earth, Sam Bankman-Fried Set To Enter Plea On Fraud Case, Twitter 'Should Feel Faster': Today's Top Stories",Reuters
30291220,CMCSA,2023-01-05T12:20:56Z,"Truist Securities Upgrades Comcast to Buy, Announces $50 Price Target",
30290333,CMCSA,2023-01-05T13:42:42Z,"Roku Launches Premium Smart TV, Seeks To Boost Ad Revenue By Tapping Streaming Audience","
"
30284319,CMCSA,2023-01-05T14:10:43Z,2022 Box Office Performance: Year Of The Sequel — Top 10 Movies And Which Stocks To Watch,"Movie theaters continue to suffer due to the COVID-19 pandemic and the surge of content from on-demand streaming platforms.

Here’s a recap of what happened in 2022 and the highest grossing movies both domestically and worldwide."
30295134,CMCSA,2023-01-05T15:01:20Z,"Benzinga's Top Ratings Upgrades, Downgrades For January 5, 2023", 
30299658,CMCSA,2023-01-05T19:00:20Z,The Latest Analyst Ratings for Comcast, 
30310146,CMCSA,2023-01-06T14:01:20Z,Comcast Promotes Jason S. Armstrong To Chief Financial Officer,
30352739,CMCSA,2023-01-10T14:14:32Z,Looking Into Comcast's Recent Short Interest,"Comcast&#39;s (NASDAQ:CMCSA) short percent of float has risen 4.82% since its last report. The company recently reported that it has 74.37 million shares sold short, which is 1.74% of all regular shares that are available for trading."
30378456,CMCSA,2023-01-11T21:48:17Z,"Zelenskyy Says 'No Third World War,' Angela Bassett Makes Marvel Movie History, Which Streamers Won Big: Here's What Unfolded At The Golden Globes","The 80th annual Golden Globes honored the top movies and television shows of the last year with an in-person and televised event. The ceremony featured wins from several of the top streaming companies, saw Marvel do something for the first time in its movie history, and included a virtual speech from Ukraine President Volodymyr Zelenskyy."
30395825,CMCSA,2023-01-12T17:49:26Z,"'Ongoing layoffs at NBCUniversal are hitting NBC News today. Leadership says it's a ""small"" number, but won't specify percentage of staff.' -Puck Reporter",
30412335,CMCSA,2023-01-13T16:05:13Z,'Report: Comcast Expresses Interest In Buying WWE' - Cultaholic,
30417882,CMCSA,2023-01-14T14:51:18Z,"NFL Playoffs And Super Bowl LVII Betting Odds, TV Schedule, NFL Picks And Stocks To Watch",The 2022 NFL season is nearing an end with the start of the NFL Playoffs. Fourteen teams will compete to make it to Super Bowl LVII and lift the Lombardi Trophy. Here’s a look at the betting odds and the companies airing the games.
30453246,CMCSA,2023-01-17T23:53:57Z,Jaguars 27-Point Comeback Costs Sports Bettor $1.4 Million: Here's How And Why No 'Sure Thing' Bet Is Safe,"Have you heard the phrase &#34;a sure thing&#34; in sports? The phrase often refers to a sports match that has a winner declared by the public before the game starts, often a matchup between David vs. Goliath in college sports."
30468077,CMCSA,2023-01-18T19:28:34Z,"Analyst Boosts Disney, Comcast's Theme Park Estimates On Better Than Feared Expectations","
"
30491506,CMCSA,2023-01-20T13:34:40Z,"DraftKings, FanDuel And These Streaming Apps Climb Apple's App Store Rankings As NFL Playoffs Kick Off","Sports betting apps saw the biggest boost from the start of the NFL playoffs over the weekend, but one streaming app also had a significant increase in usage. "
30515925,CMCSA,2023-01-22T21:30:43Z,"Tesla, Microsoft, IBM, Intel, TI Among Companies Reporting This Week: Can Netflix's Optimism Spill Over To Rest Of Tech Space?","Netflix, Inc. (NASDAQ: NFLX) shares jumped nearly 8.5% on Friday before settling at their highest level since April 19, 2022, when shares plunged after the company reported its first loss in net paid subscriber adds in a decade."
30567516,CMCSA,2023-01-25T14:01:48Z,Comcast Earnings Preview, 
30580644,CMCSA,2023-01-26T09:15:51Z,"Earnings Scheduled For January 26, 2023","Companies Reporting Before The Bell

• Nokia (NYSE:NOK) is estimated to report quarterly earnings at $0.14 per share on revenue of $7.20 billion."
30581533,CMCSA,2023-01-26T11:33:28Z,"Nasdaq, S&P Futures Take Off As Tesla's Solid Earnings Report Perk Up Sentiment: Advance Q4 GDP Data, Housing Data On Investors' Radar","Trading in the U.S. index futures suggests a cautious start by Wall Street stocks, as traders look ahead to more earnings and the advance fourth-quarter GDP report."
30582267,CMCSA,2023-01-26T12:00:55Z,"Comcast Q4 EPS $0.82 Beats $0.77 Estimate, Sales $30.55B Beat $30.31B Estimate",
30582534,CMCSA,2023-01-26T12:09:32Z,Comcast Raises Dividend By $0.08 To $1.16 On An Annualized Basis,
30583118,CMCSA,2023-01-26T13:40:54Z,Comcast Q4 Earnings Highlights: Flattish Growth From Cable Communications; FIFA Gives Boost To NBCUniversal Revenue; Dividend Hike,"
"
30590572,CMCSA,2023-01-26T18:21:32Z,2022 World Cup Helps Subscribers Flock To Peacock: Does Comcast Have A Hit Revenue Driver?,Media and cable giant Comcast Corporation (NASDAQ: CMCSA) reported fourth quarter and full fiscal year financial results before market open Thursday.
30599779,CMCSA,2023-01-27T11:36:38Z,Nasdaq Futures Weighed Down By Tech Earnings Even As US Stocks Look To End Week On High Note,Traders have returned back to their cautious ways following the week’s strong run-up amid hopes of a soft landing and earnings optimism. The index futures are pointing to a modestly lower opening on Friday.
30600393,CMCSA,2023-01-27T12:07:15Z,"Rosenblatt Maintains Neutral on Comcast, Raises Price Target to $38",
30601334,CMCSA,2023-01-27T13:02:06Z,"Wells Fargo Maintains Equal-Weight on Comcast, Raises Price Target to $42",
30601414,CMCSA,2023-01-27T13:09:13Z,"JP Morgan Maintains Neutral on Comcast, Raises Price Target to $43",
30601704,CMCSA,2023-01-27T13:26:39Z,"Cowen & Co. Maintains Outperform on Comcast, Lowers Price Target to $46",
30602532,CMCSA,2023-01-27T14:10:45Z,"Pivotal Research Maintains Buy on Comcast, Raises Price Target to $47",
30608705,CMCSA,2023-01-27T20:02:09Z,Here's How Much $100 Invested In Comcast 15 Years Ago Would Be Worth Today, 
30609462,CMCSA,2023-01-27T21:01:18Z,Where Comcast Stands With Analysts, 
30617204,CMCSA,2023-01-30T12:00:24Z,Sorare Inks 4-Year Deal With English Premier League: What Sports And NFT Fans Should Know,Global sports entertainment company Sorare announced a new partnership with the English Premier League. The four-year deal grows on recent partnerships by Sorare and will give the chance to consumers to purchase digital player cards and compete in fantasy football (soccer) challenges.
30628628,CMCSA,2023-01-30T21:34:37Z,WWE May Have Chosen The Perfect Time To Explore A Sale: 'Royal Rumble' Numbers Released,"While the boardroom at World Wrestling Entertainment, Inc. (NYSE: WWE) is undergoing a seismic shift, with its founder Vince McMahon recently returning, and his daughter, Stephanie McMahon stepping down as co-CEO, the business itself is in a great place as the company"
30647121,CMCSA,2023-01-31T16:32:00Z,"'Peacock Drops Free Tier For New Sign-Ups, Only Offering Paid Plans to New Customers' - TheStreamable",
30647959,CMCSA,2023-01-31T17:49:44Z,"Harmonic Likely To See Upside After Securing Comcast Deal And Emerges As Front-Runner For Charter Win, Analysts Say","
"
30686019,CMCSA,2023-02-02T12:40:03Z,"Barclays Maintains Equal-Weight on Comcast, Raises Price Target to $36",
30727591,CMCSA,2023-02-06T13:19:36Z,"Comcast Signs Agreements With State of Indiana, Joint $50M Investment Will Bring Fiber Network To 10,000+ Rural Hoosiers Across 19 Counties",
30735827,CMCSA,2023-02-06T18:37:10Z,"Disney Analyst Expects Blockbusters Wakanda Forever, Avtar To Dominate Upcoming Quarterly Results","
"
30774497,CMCSA,2023-02-07T22:30:54Z,The Most Anticipated Game Of 2023: Everything You Need To Know About Hogwarts Legacy,"If you&#39;re a fan of the Harry Potter saga and a gaming enthusiast, you&#39;ve probably heard about Hogwarts Legacy, the upcoming action role-playing game developed by Avalanche Software and published by Warner Bros."
30818982,CMCSA,2023-02-08T18:36:26Z,From 'Guardians Of The Galaxy' To 'The Flash' To 'Cocaine Bear': These Are The Movie Trailers For Super Bowl LVII,"Super Bowl LVII kicks off on Sunday, Feb. 12 and will feature the NFL championship matchup between the Kansas City Chiefs and Philadelphia Eagles.

The game will also showcase Super Bowl commercials and movie trailers that could be heavily discussed during the game and in the days after. Here’s a look at the movie trailers you will likely see."
30834834,CMCSA,2023-02-09T14:47:50Z,This Favorable Sign Appears On Comcast's Chart, 
30874314,CMCSA,2023-02-13T12:32:19Z,"Comcast Xfinity Subscribers, Peacock Streaming Will No Longer Be Free From This Date", 
30882387,CMCSA,2023-02-13T17:36:24Z,10 Communication Services Stocks With Whale Alerts In Today's Session,"This whale alert can help traders discover the next big trading opportunities.

Whales are entities with large sums of money and we track their transactions here at Benzinga on our options activity scanner."
30883140,CMCSA,2023-02-13T19:17:49Z,Super Bowl Commercials 2023: The Complete List Of Super Bowl LVII Ads And The Companies Behind Them,"Super Bowl LVII aired Sunday Feb. 12, 2023 and featured dozens of commercials advertising products and showcasing new movies and television shows. The commercials also featured many celebrity cameos and several reunions. Here’s a look at the complete list."
30890636,CMCSA,2023-02-13T22:38:23Z,NBC Sports Hopes To Make An Aggressive Bid To Bring Back The NBA; Apple And Amazon Have Already Expressed Interest In NBA Rights,
30920191,CMCSA,2023-02-15T10:54:16Z,"Google Fiber Rolls Out 5Gbps Plan In These US Cities — Stream, Game, Work All At Once For Just $125/Month", 
30947498,CMCSA,2023-02-16T18:26:46Z,"Paramount Adds 9.9M Streaming Subscribers In Q4: How It Stacks Up To Netflix, Disney+ And Other Rivals","The streaming market continues to be ultra-competitive, with streaming pure-play companies, media giants and others launching and growing their own platforms. Companies are looking for an edge with the release or original shows and movies, live sports and other exclusives."
30951644,CMCSA,2023-02-16T21:25:16Z,U.S. FCC Investigates Broadband Providers Over Coverage Claims,
30964754,CMCSA,2023-02-17T19:02:37Z,$100 Invested In Comcast 15 Years Ago Would Be Worth This Much Today, 
31010385,CMCSA,2023-02-22T18:22:42Z,"Comcast Capitalizes On ChatGPT Fueled BuzzFeed Rally, Slashes Exposure In Digital Media Company","
"
31089837,CMCSA,2023-02-28T13:28:55Z,"B of A Securities Reiterates Neutral on Comcast, Maintains $44 Price Target",
31133433,CMCSA,2023-03-01T18:31:33Z,10 Communication Services Stocks Whale Activity In Today's Session,"This whale alert can help traders discover the next big trading opportunities.

Whales are entities with large sums of money and we track their transactions here at Benzinga on our options activity scanner."
