ID,Ticker,Date,Headline,Summary
31969069,CNI,2023-04-24T20:09:41Z,CN Q1 EPS C$1.82,
31969113,CNI,2023-04-24T20:10:34Z,CN Now Expects 2023 Mid Single-Digit Adj. EPS Growth Over 2022,
31969165,CNI,2023-04-24T20:12:12Z,"Canadian National Railway Q1 Adj. EPS $1.35 Beats $1.26 Estimate, Sales $3.19B Beat $3.11B Estimate",
31982542,CNI,2023-04-25T09:43:46Z,"Barclays Maintains Equal-Weight on Canadian National Railway, Raises Price Target to $130",
31983471,CNI,2023-04-25T10:33:12Z,"Credit Suisse Maintains Neutral on Canadian National Railway, Raises Price Target to $133",
31983853,CNI,2023-04-25T10:50:35Z,"Wells Fargo Maintains Equal-Weight on Canadian National Railway, Raises Price Target to $125",
31983963,CNI,2023-04-25T10:54:30Z,"Susquehanna Maintains Neutral on Canadian National Railway, Raises Price Target to $116",
31984532,CNI,2023-04-25T11:12:45Z,Canadian National Railway Gets Price Target Hikes By Analysts After Q1 Results,Canadian National Railway Company  (NYSE: CNI) reported strong Q1 financial results.
31987546,CNI,2023-04-25T12:58:55Z,"Stephens & Co. Maintains Equal-Weight on Canadian National Railway, Raises Price Target to $124",
31987853,CNI,2023-04-25T13:01:35Z,What 7 Analyst Ratings Have To Say About Canadian National Railway, 
32012858,CNI,2023-04-26T14:43:37Z,"Argus Research Maintains Buy on Canadian National Railway, Lowers Price Target to $140",
32085668,CNI,2023-04-28T15:00:35Z,Here's How Much You Would Have Made Owning Canadian National Railway Stock In The Last 20 Years, 
32118648,CNI,2023-05-01T13:03:49Z,Unifor Ratifies CN Collective Agreements,
32186014,CNI,2023-05-03T12:51:29Z,Canadian National Railway Outlines 3-year Financial Perspective; Sees FY23 EPS Growth In Mid-Single Digits; FY24-FY26 Sees Targeting To Deliver 10%-15% EPS Growth By Growing Volumes More Than The Economy,
32213296,CNI,2023-05-04T13:11:00Z,"RBC Capital Reiterates Outperform on Canadian National Railway, Maintains C$184 Price Target",
32219335,CNI,2023-05-04T16:30:13Z,Morgan Stanley Upgrades Canadian National Railway to Overweight,
32429301,CNI,2023-05-16T17:34:37Z,Bill And Melinda Gates Foundation Sells 20% Stake In Berkshire Hathaway, 
32503298,CNI,2023-05-22T09:14:10Z,"Citigroup Downgrades Canadian National Railway to Neutral, Lowers Price Target to $125",
32510529,CNI,2023-05-22T15:00:43Z,"Benzinga's Top Ratings Upgrades, Downgrades For May 22, 2023", 
32510550,CNI,2023-05-22T15:01:20Z,Where Canadian National Railway Stands With Analysts, 
32557748,CNI,2023-05-24T17:00:42Z,Here's How Much $100 Invested In Canadian National Railway 15 Years Ago Would Be Worth Today, 
32602753,CNI,2023-05-26T19:46:07Z,Teamsters Canada Rail Conference Ratifies CN Collective Agreement,
32780536,CNI,2023-06-08T14:48:40Z,Golden Cross Appears Before Canadian National Railway Investors, 
32784570,CNI,2023-06-08T18:00:39Z,"If You Invested $100 In This Stock 15 Years Ago, You Would Have $500 Today", 
33012944,CNI,2023-06-26T19:30:43Z,Here's How Much $1000 Invested In Canadian National Railway 20 Years Ago Would Be Worth Today, 
33119942,CNI,2023-07-05T18:16:50Z,"CPKC's Growth Prospects Among Best In North American Rails, But High Valuation Premium Calls For Caution: Analyst",Credit Suisse analyst Ariel Rosa reiterated a 
33179626,CNI,2023-07-11T10:56:10Z,"Citigroup Maintains Neutral on Canadian National Railway, Lowers Price Target to $122",
33190150,CNI,2023-07-11T19:00:20Z,9 Analysts Have This to Say About Canadian National Railway, 
33198693,CNI,2023-07-12T13:29:58Z,"Citigroup Maintains Neutral on Canadian National Railway, Lowers Price Target to $122",
33223671,CNI,2023-07-13T21:00:23Z,Here's How Much You Would Have Made Owning Canadian National Railway Stock In The Last 20 Years, 
33350773,CNI,2023-07-24T17:01:37Z,Earnings Outlook For Canadian National Railway, 
33361937,CNI,2023-07-25T09:00:38Z,"Earnings Scheduled For July 25, 2023","Companies Reporting Before The Bell

• Unilever (NYSE:UL) is expected to report earnings for its first quarter.

• Lilium (NASDAQ:LILM) is estimated to report earnings for its first quarter."
33377973,CNI,2023-07-25T20:10:17Z,"Canadian National Railway Q2 EPS $1.31 Misses $1.37 Estimate, Sales $3.02B Miss $3.17B Estimate",
33378446,CNI,2023-07-25T20:20:50Z,CN Now Sees Flat To Slightly Negative YoY Adj. EPS Growth,
33390175,CNI,2023-07-26T12:08:53Z,"BMO Capital Maintains Outperform on Canadian National Railway, Lowers Price Target to C$175",
33394427,CNI,2023-07-26T14:28:32Z,"Stephens & Co. Maintains Equal-Weight on Canadian National Railway, Lowers Price Target to $122",
33394868,CNI,2023-07-26T14:49:10Z,"Susquehanna Maintains Neutral on Canadian National Railway, Lowers Price Target to $120",
33395231,CNI,2023-07-26T15:00:34Z,$100 Invested In This Stock 15 Years Ago Would Be Worth $400 Today, 
33420222,CNI,2023-07-27T13:19:28Z,"Credit Suisse Maintains Neutral on Canadian National Railway, Lowers Price Target to $131",
33427360,CNI,2023-07-27T18:00:47Z,The Latest Analyst Ratings for Canadian National Railway, 
33496359,CNI,2023-08-01T14:22:52Z,Argus Research Downgrades Canadian National Railway to Hold,
33497286,CNI,2023-08-01T15:00:35Z,"Benzinga's Top Ratings Upgrades, Downgrades For August 1, 2023", 
33896549,CNI,2023-08-17T15:00:42Z,Here's How Much $100 Invested In Canadian National Railway 20 Years Ago Would Be Worth Today, 
34182304,CNI,2023-09-01T19:30:27Z,Here's How Much You Would Have Made Owning Canadian National Railway Stock In The Last 20 Years, 
34698561,CNI,2023-09-18T17:00:41Z,"If You Invested $100 In This Stock 15 Years Ago, You Would Have $500 Today", 
34796129,CNI,2023-09-21T15:14:33Z,"Evercore ISI Group Maintains In-Line on Canadian National Railway, Lowers Price Target to $116",
34799529,CNI,2023-09-21T16:31:54Z,"CIBC Maintains Outperformer on Canadian National Railway, Lowers Price Target to $173",
34804399,CNI,2023-09-21T19:00:21Z,Analyst Expectations for Canadian National Railway's Future, 
34956023,CNI,2023-09-27T17:20:42Z,"Scotiabank Maintains Sector Perform on Canadian National Railway, Lowers Price Target to $170",
34971547,CNI,2023-09-28T11:35:00Z,"Bowman Consulting Group Won A Multi-Year, On-Call Engineering Services Contract From The Canadian National Railway Company",
35000246,CNI,2023-09-29T13:07:48Z,Bowman Consulting Buys Excellence Engineering - What's On the Cards?,"Bowman Consulting Group Ltd (NASDAQ: BWMN) penned a deal to acquire Tulsa, Oklahoma-based Excellence Engineering, LLC"
35061819,CNI,2023-10-03T13:00:10Z,"Stifel Maintains Hold on Canadian National Railway, Lowers Price Target to $122",
35068553,CNI,2023-10-03T16:30:27Z,"If You Invested $1000 In This Stock 15 Years Ago, You Would Have $5,100 Today", 
35070312,CNI,2023-10-03T18:08:18Z,"Susquehanna Maintains Neutral on Canadian National Railway, Lowers Price Target to $112",
35110148,CNI,2023-10-05T14:25:10Z,"B of A Securities Downgrades Canadian National Railway to Neutral, Lowers Price Target to $115",
35110999,CNI,2023-10-05T15:00:45Z,"Benzinga's Top Ratings Upgrades, Downgrades For October 5, 2023", 
35114319,CNI,2023-10-05T17:52:56Z,"National Bank Financial Inc Maintains Sector Perform on Canadian National Railway, Lowers Price Target to $168",
35202732,CNI,2023-10-11T19:28:08Z,"JP Morgan Maintains Neutral on Canadian National Railway, Lowers Price Target to $159",
35203546,CNI,2023-10-11T20:00:54Z,The Latest Analyst Ratings for Canadian National Railway, 
35307013,CNI,2023-10-18T12:20:13Z,CN Announces COO Succession And Evolution Of Operating Structure; Patrick Whitehead As Executive Vice-President And Chief Network Operating Officer And The Appointment Of Derek Taylor As Executive Vice-President And Chief Field Operating Officer,
35359364,CNI,2023-10-20T21:31:11Z,Here's How Much You Would Have Made Owning Canadian National Railway Stock In The Last 20 Years, 
35379126,CNI,2023-10-23T17:01:42Z,Canadian National Railway's Earnings Outlook, 
35383076,CNI,2023-10-23T20:25:12Z,CN Announces 5-Year Transportation Agreement With AltaGas,
35388060,CNI,2023-10-24T09:13:04Z,"Earnings Scheduled For October 24, 2023","Companies Reporting Before The Bell

• Barclays (NYSE:BCS) is estimated to report earnings for its third quarter."
35403552,CNI,2023-10-24T20:10:47Z,"Canadian National Railway Q3 Adj EPS $1.26 Beats $1.25 Estimate, Sales $2.97B Beat $2.96B Estimate",
35416722,CNI,2023-10-25T14:11:26Z,"Barclays Maintains Equal-Weight on Canadian National Railway, Raises Price Target to $113",
35419506,CNI,2023-10-25T15:44:42Z,"Susquehanna Maintains Neutral on Canadian National Railway, Raises Price Target to $115",
35419924,CNI,2023-10-25T16:00:25Z,"RBC Capital Maintains Sector Perform on Canadian National Railway, Lowers Price Target to C$158",
35444163,CNI,2023-10-26T15:32:54Z,"Citigroup Maintains Neutral on Canadian National Railway, Raises Price Target to $117",
35506164,CNI,2023-10-31T06:21:21Z,CN Announces $600M Debt Offering Comprising $300M 5.850% Notes Due 2033 And $300M 6.125% Notes Due 2053,
35619763,CNI,2023-11-06T14:00:25Z,"If You Invested $100 In This Stock 20 Years Ago, You Would Have $1,100 Today", 
35880103,CNI,2023-11-20T19:00:25Z,Here's How Much $100 Invested In Canadian National Railway 20 Years Ago Would Be Worth Today, 
35955195,CNI,2023-11-27T11:28:00Z,"Deutsche Bank Downgrades Canadian National Railway to Hold, Lowers Price Target to $121",
35956529,CNI,2023-11-27T13:00:32Z,Analyst Ratings for Canadian National Railway, 
36123955,CNI,2023-12-06T22:07:33Z,CN Signs And Closes Agreement To Acquire Iowa Northern Railway; Terms Were Not Disclosed,
36179826,CNI,2023-12-11T16:30:20Z,"$1000 Invested In This Stock 20 Years Ago Would Be Worth $12,000 Today", 
36389746,CNI,2023-12-26T19:30:44Z,Here's How Much $100 Invested In Canadian National Railway 20 Years Ago Would Be Worth Today, 
36471881,CNI,2024-01-03T15:30:19Z,"$1000 Invested In This Stock 15 Years Ago Would Be Worth $6,400 Today", 
36657561,CNI,2024-01-17T12:33:13Z,CN And Unifor Affiliated CNTL Drivers Reach Tentative Agreement,
36711792,CNI,2024-01-22T10:00:35Z,"Tesla, Netflix, Intel Take Center Stage In Pivotal Q4 Earnings Week As S&P 500 Eyes Breaking New Highs","According to Factset, the fourth-quarter earnings season has had a weak start, with the percentage of S&amp;P 500 companies reporting positive earnings surprises below average."
36718702,CNI,2024-01-22T16:01:36Z,Earnings Outlook For Canadian National Railway, 
36732086,CNI,2024-01-23T10:03:56Z,"Earnings Scheduled For January 23, 2024","Companies Reporting Before The Bell

• Webster Finl (NYSE:WBS) is estimated to report quarterly earnings at $1.46 per share on revenue of $603.11 million."
36734767,CNI,2024-01-23T12:32:03Z,"US Stocks Prepare For Nervy Start Ahead of Netflix, TI Earnings: Analyst Says Cash Waiting On Sidelines Could Flood Street If This Happens",The mood turned circumspect on Tuesday as traders digested a deluge of earnings reports and anticipated market-moving economic data for the week.
36746588,CNI,2024-01-23T21:06:57Z,"Canadian National Railway Q4 2023 Adj EPS $2.02 Beats $1.99 Estimate, Sales $4.47M Miss $4.37B Estimate",
36746654,CNI,2024-01-23T21:09:42Z,CN Raises Dividend From $0.79 To $0.845/Share,
36746660,CNI,2024-01-23T21:10:01Z,CN Announces 32M Share Buyback Program,
36747336,CNI,2024-01-23T21:25:06Z,Canadian National Railway: Q4 Earnings Insights, 
36760434,CNI,2024-01-24T15:16:00Z,"Wells Fargo Maintains Equal-Weight on Canadian National Railway, Raises Price Target to $125",
36761713,CNI,2024-01-24T16:00:26Z,"RBC Capital Maintains Sector Perform on Canadian National Railway, Raises Price Target to C$164",
37213583,CNI,2024-02-20T14:32:19Z,"Bill Ackman Gains Over $600M On Handful Of Stock Bets, Enters Top-Earning Hedge Fund Managers",Bill Ackman of Pershing Square earned $610 million and ranked No. 7 on Bloomberg&#39;s list of highest-paid hedge fund founders in 2023.
37877813,CNI,2024-03-21T17:56:23Z,"B of A Securities Maintains Neutral on Canadian National Railway, Raises Price Target to $140",
37985393,CNI,2024-03-28T14:43:52Z,"Susquehanna Maintains Neutral on Canadian National Railway, Lowers Price Target to $140",
38086802,CNI,2024-04-04T10:57:43Z,"National Bank Financial Inc Maintains Sector Perform on Canadian National Railway, Raises Price Target to $190",
38092096,CNI,2024-04-04T13:58:08Z,"Barclays Maintains Equal-Weight on Canadian National Railway, Raises Price Target to $130",
38107095,CNI,2024-04-05T11:03:30Z,Canadian National Railway Company Says It Continues To Advance Decarbonization Efforts With EMD Mainline Hybrid Locomotive From Progress Rail,
38148882,CNI,2024-04-08T18:52:09Z,"Jefferies Initiates Coverage On Canadian National Railway with Hold Rating, Announces Price Target of $130",
38183016,CNI,2024-04-10T13:27:37Z,Benchmark Reiterates Hold on Canadian National Railway,
38219727,CNI,2024-04-12T12:58:34Z,"Stifel Maintains Hold on Canadian National Railway, Raises Price Target to $134",
38349204,CNI,2024-04-21T21:45:15Z,"Can Magnificent 7 Help Script Market Turnaround? Earnings Pick Up Pace With Microsoft, Meta, Alphabet And Tesla Expected This Week",Corporate profit growth rose in Q3 2023 and is expected to continue in Q1.
38374783,CNI,2024-04-23T10:55:31Z,Wall Street Set To Open Higher As Tesla Kicks Off 'Magnificent 7' Earnings: Why This Analyst Thinks Market Weakness Is A 'Healthy Pullback',"The mood on Wall Street turned tentative on Tuesday as investors awaited earnings reports from the “Magnificent 7,” companies that fueled much of the market’s upside since 2023. Index futures rose slightly in early trading. Asian markets closed mostly higher, while European markets started on a firmer footing. Commodities pulled back, and bond yields held steady."
38372470,CNI,2024-04-23T10:56:59Z,"Earnings Scheduled For April 23, 2024","Companies Reporting Before The Bell

• RTX (NYSE:RTX) is expected to report quarterly earnings at $1.23 per share on revenue of $18.41 billion."
38386546,CNI,2024-04-23T17:33:38Z,"Stocks Rally On Weaker PMI Data, Tech Earnings Optimism, Dollar Falls: What's Driving Markets Tuesday?","Stocks surged as weak economic data raised hopes for Fed rate cut. S&amp;P 500 up 1.2%, Nasdaq 100 up 1.5%, Dow Jones up 0.6%. Spotify shares jump 17% on earnings."
38392236,CNI,2024-04-23T21:21:30Z,"Canadian National Railway Q1 EPS $1.28 Beats $1.25 Estimate, Sales $3.15B Beat $3.10B Estimate",
38392377,CNI,2024-04-23T21:28:32Z,Canadian National Railway Reaffirms Its 2024 Outlook And Expects To Deliver Adjusted EPS Growth Of Approximately 10%; Reiterates Its Longer-Term Financial Perspective,
38401963,CNI,2024-04-24T12:11:30Z,"Susquehanna Maintains Neutral on Canadian National Railway, Raises Price Target to $142",
38405939,CNI,2024-04-24T14:14:55Z,Benchmark Reiterates Hold on Canadian National Railway,
38409959,CNI,2024-04-24T16:07:36Z,"Stephens & Co. Reiterates Equal-Weight on Canadian National Railway, Maintains $140 Price Target",
38481553,CNI,2024-04-29T05:51:21Z,"Will Earnings Cheer Continue To Buoy Markets? Apple, Amazon, Pfizer, Coinbase Lead Flurry Of Q1 Reports This Week","With the earnings season now halfway through, the percentage of S&amp;P 500 companies reporting positive earnings surprises and the magnitude of earnings surprises were above their 10-year averages."
38541676,CNI,2024-05-01T06:56:09Z,"Reported Earlier, CN Launches C$1.25B Debt Offering To Fuel Corporate Initiatives",
39229217,CNI,2024-06-07T14:51:38Z,"Wells Fargo Initiates Coverage On Canadian National Railway with Equal-Weight Rating, Announces Price Target of $130",
39478385,CNI,2024-06-25T12:52:46Z,"Susquehanna Maintains Neutral on Canadian National Railway, Lowers Price Target to $135",
39533606,CNI,2024-06-27T18:17:32Z,"Watching Canadian National Railway Company; Train Derails In Matteson, Illinois; 'Long-Term' Evacuations Underway As Leak Under Investigation; Spokesman Says The Train Involved Is From The Company",
39534152,CNI,2024-06-27T18:47:23Z,Canadian National Says Substance From One Car Not Hazardous,
39535045,CNI,2024-06-27T19:40:06Z,Evacuation Orders Lifted Following Illinois Train Derailment,
39535181,CNI,2024-06-27T19:45:58Z,"Canadian National Railway Train Derails, Evacuations Underway: What's Going On?","Canadian National Railway Company shares are trading lower Thursday following reports of a train derailment in Matteson, Illinois. Here&#39;s what to know: "
39671288,CNI,2024-07-08T16:51:53Z,"Bernstein Downgrades Canadian National Railway to Market Perform, Lowers Price Target to $130.67",
39798557,CNI,2024-07-16T15:38:06Z,"Barclays Maintains Equal-Weight on Canadian National Railway, Lowers Price Target to $128",
39816135,CNI,2024-07-17T13:37:51Z,"Stifel Maintains Hold on Canadian National Railway, Raises Price Target to $137",
39891189,CNI,2024-07-22T18:14:11Z,Canadian National Railway Fined $8M For Environmental Offenses Related To 2015 Train Derailments,
39917507,CNI,2024-07-23T20:10:52Z,Canadian National Railway Q2 Adj. EPS C$1.84 Up From C$1.76 YoY; Revenue C$4.329B Up From C$4.057B YoY,
39917711,CNI,2024-07-23T20:15:51Z,Canadian National Railway Sees FY24 Adj. EPS Growth In Mid-To-High Single-Digit Range; To Invest ~C$3.5B In Capital Program,
39933073,CNI,2024-07-24T13:49:18Z,"Susquehanna Maintains Neutral on Canadian National Railway, Lowers Price Target to $130",
39934459,CNI,2024-07-24T14:32:52Z,"Stifel Maintains Hold on Canadian National Railway, Lowers Price Target to $133",
39936061,CNI,2024-07-24T15:24:55Z,Benchmark Reiterates Hold on Canadian National Railway,
39936951,CNI,2024-07-24T16:01:29Z,"Wells Fargo Maintains Equal-Weight on Canadian National Railway, Lowers Price Target to $125",
39937259,CNI,2024-07-24T16:11:50Z,"Barclays Maintains Equal-Weight on Canadian National Railway, Lowers Price Target to $120",
39937263,CNI,2024-07-24T16:12:42Z,"RBC Capital Maintains Sector Perform on Canadian National Railway, Lowers Price Target to C$169",
39941387,CNI,2024-07-24T19:32:51Z,"Stephens & Co. Maintains Equal-Weight on Canadian National Railway, Lowers Price Target to $122",
39966903,CNI,2024-07-25T17:58:32Z,"Canadian National Railway Suspends Freight Service Through Jasper, Alberta Due To Raging Wildfires",
40347662,CNI,2024-08-13T17:50:11Z,'Canadian National Starts Phased Shutdown Of Rail Network In Canada; The Rail Operator Said It Started An Embargo Of Certain Hazardous Goods' - WSJ,
40419589,CNI,2024-08-16T15:12:58Z,Norfolk Southern Closes Intermodal Facility Ingates to CN Canadian Destinations Amid Potential Work Stoppages; CN Issues Embargo on All Intermodal Shipments Effective Aug 16,
40422263,CNI,2024-08-16T17:24:01Z,Union Pacific Says Actively Monitoring Canadian Railway Labor Negotiations And Is In Close Contact With Canadian Interchange Partners; Adhering To Embargos By Canadian Pacific Kansas City And Canadian National For Certain Traffic,
40434197,CNI,2024-08-19T06:40:55Z,"Reported Sunday, CN Announces Lockout Notice To Teamsters, Network Shutdown Looms As Negotiations Fail To Progress",
40442537,CNI,2024-08-19T14:58:42Z,Canada Labor Minister Urges Railway Companies And Union To Reach Agreements And Avoid A Full Work Stoppage,
40485533,CNI,2024-08-21T13:25:30Z,"Home Depot Spokesperson On Potential Canada Rail Strike Says, Has Implemented Several Short-Term Actions To Mitigate Impact On Customers, Associates",
40500063,CNI,2024-08-22T06:28:01Z,Canadian National Railway Locks Out Teamsters Canada Rail Conference Members Amid Failed Negotiations,
40511369,CNI,2024-08-22T15:43:49Z,"Canada PM Trudeau Says Will Have More To Say Soon On Rail Stoppage Having Impact Across The Country; Says We Are Not Taking This Lightly, Need Quick Solution",
40511586,CNI,2024-08-22T15:49:20Z,Rio Tinto Says It Expects Canada Rail Stoppage To Impact Incoming Raw Materials At Sites Across Canada And Ship Products To Customers In North America; It Has Contingency Plans To Minimize Impact From Canada Rail Stoppage,
40515606,CNI,2024-08-22T19:20:21Z,"2 Railway Strikes, 3 US Sectors In Trouble: $277B In Goods At Stake As Canadian Unions Call For New Contracts","Railway strike could impact sectors relying on goods from CNR and CP. Auto, timber, and grain companies in jeopardy?"
40517642,CNI,2024-08-22T20:54:34Z,"The Wall Street Journal Reported Canada Orders Final Binding Arbitration in Rail Stoppage to Bring End to Labor Disruption; Freight Rail Operations to Resume 'Forthwith,' Canada Labor Minister Says",
40522217,CNI,2024-08-23T07:13:05Z,"Reported Earlier, CN Ends Lockout And Launches Recovery Plan To Expedite Economic Revival",
40526926,CNI,2024-08-23T12:48:14Z,"Teamsters Union Says CP Workers Not Returning To Work As Railway Has Not Ended The Lockout, Want Assurances On Contract; Teamsters Union Says CN Workers Will Go Back To Work Friday After Railway Ended Lockout On Thursday",
40530810,CNI,2024-08-23T15:20:34Z,"President Of Canadian Teamsters Union Says Even If Industrial Relations Board Issues A Back-to-work Order For Rail Employees, Our People Will Still Be On Strike",
40533448,CNI,2024-08-23T17:31:50Z,"CN Receives 72-Hour Strike Notice From Teamsters Canada Rail Conference, Strike Set For August 26; CN Criticizes Teamsters For Disrupting Economy Despite Recent Lockout End And Good Faith Negotiations",
40546171,CNI,2024-08-26T06:15:22Z,"Reported Sunday, CN Complies With CIRB Order For Binding Arbitration, Averting Strike And Ensuring Continuity In Rail Operations",
40805530,CNI,2024-09-10T22:03:47Z,CN Says Its Operations Have Recovered Following Several Months Of Labor Uncertainty; Adjusts Its 2024 Guidance And Long-Term Financial Outlook,
40812241,CNI,2024-09-11T12:10:07Z,"B of A Securities Maintains Buy on Canadian National Railway, Lowers Price Target to $129",
40891998,CNI,2024-09-17T07:25:45Z,"Reported Earlier, CN Announces $750M 4.375% Notes Due 2034 Debt Offering, Proceeds Target General Corporate Use",
41028208,CNI,2024-09-25T15:25:24Z,"Evercore ISI Group Maintains In-Line on Canadian National Railway, Lowers Price Target to $119",
41029229,CNI,2024-09-25T16:06:17Z,"Barclays Maintains Equal-Weight on Canadian National Railway, Raises Price Target to $121",
41030070,CNI,2024-09-25T16:40:40Z,Biden Administration Urges Freight Railroads To Guarantee Paid Sick Leave For All Employees,
41072226,CNI,2024-09-27T17:17:41Z,"Unifor Files Notice Of Dispute With CN Early In Negotiations, Representing 3,300 Employees Across Three Collective Agreements Expiring December 31, 2024; CNI Is ""Disappointed"" That Unifor Is Filing Notice So Early In Process; Committed To Reaching Negotiated Agreements With Union",
41182240,CNI,2024-10-04T11:11:14Z,"B of A Securities Downgrades Canadian National Railway to Neutral, Lowers Price Target to $122",
41189834,CNI,2024-10-04T17:23:15Z,"Canadian National Railways Faces Rising Earnings Pressure And Network Challenges, Analyst Downgrades Stock","BofA Securities downgraded Canadian National Railway to Neutral, citing rising earnings pressure and network challenges due to labor issues and declining volumes."
41211695,CNI,2024-10-07T16:24:16Z,"Wells Fargo Upgrades Canadian National Railway to Overweight, Maintains Price Target to $125",
41226351,CNI,2024-10-08T12:11:35Z,CN And Duos Technologies Sign 5-Year Strategic Agreement That Will Enable Duos To Offer Machine Vision/AI Wayside Detection Safety Data Through A Subscription Service,
41251017,CNI,2024-10-09T13:39:33Z,"Citigroup Initiates Coverage On Canadian National Railway with Neutral Rating, Announces Price Target of $125",
41256515,CNI,2024-10-09T17:16:21Z,"Goldman Sachs Maintains Sell on Canadian National Railway, Lowers Price Target to $124",
41256663,CNI,2024-10-09T17:30:02Z,"Bernstein Maintains Market Perform on Canadian National Railway, Lowers Price Target to $126.29",
41273718,CNI,2024-10-10T14:27:54Z,"RBC Capital Upgrades Canadian National Railway to Outperform, Raises Price Target to C$179",
41431761,CNI,2024-10-21T15:02:00Z,A Preview Of Canadian National Railway's Earnings, 
41465907,CNI,2024-10-22T20:06:34Z,"Canadian National Railway Q3 2024 Adj. EPS CAD$1.72 Beats CAD$1.70 Estimate, Sales CAD$4.110B Miss CAD$4.115B Estimate",
41465982,CNI,2024-10-22T20:07:47Z,"CN Continues To Expect To Deliver Adj Diluted EPS Growth In The Low Single-Digit Range And Continues To Expect To Invest ~CAD$3.5B In Its Capital Program, Net Of Amounts Reimbursed By Customers; Continues To Expect Adjusted Return On Invested Capital To Be In The 13%-15% Range; Over The 2024-2026 Period, CN Continues To Target Compounded Annual Adj. Diluted EPS Growth In The High Single-Digit Range",
41485228,CNI,2024-10-23T11:58:09Z,"Susquehanna Maintains Neutral on Canadian National Railway, Lowers Price Target to $125",
41492083,CNI,2024-10-23T15:06:24Z,"Evercore ISI Group Maintains In-Line on Canadian National Railway, Lowers Price Target to $116",
41494718,CNI,2024-10-23T16:11:57Z,"Stifel Maintains Hold on Canadian National Railway, Raises Price Target to $132",
41496693,CNI,2024-10-23T17:18:46Z,"Stephens & Co. Reiterates Equal-Weight on Canadian National Railway, Maintains $116 Price Target",
41497128,CNI,2024-10-23T17:35:18Z,"RBC Capital Reiterates Outperform on Canadian National Railway, Maintains C$179 Price Target",
41519860,CNI,2024-10-24T14:22:59Z,Benchmark Reiterates Hold on Canadian National Railway,
41899709,CNI,2024-11-12T13:21:35Z,"Citigroup Upgrades Canadian National Railway to Buy, Raises Price Target to $130",
42140757,CNI,2024-11-22T15:36:02Z,"RBC Capital Reiterates Outperform on Canadian National Railway, Maintains C$179 Price Target",
42646659,CNI,2024-12-23T13:46:34Z,"CN Announces That Its New 4-Year Tentative Collective Agreements With Unifor Were Formally Ratified By Employees On Sunday, December 22, 2024",
42851078,CNI,2025-01-07T15:41:54Z,"Wells Fargo Maintains Overweight on Canadian National Railway, Lowers Price Target to $125",
42876612,CNI,2025-01-08T14:57:49Z,"Susquehanna Maintains Neutral on Canadian National Railway, Lowers Price Target to $115",
