ID,Ticker,Date,Headline,Summary
42879216,CNI,2025-01-08T16:03:14Z,"B of A Securities Maintains Neutral on Canadian National Railway, Lowers Price Target to $112",
42917142,CNI,2025-01-10T15:33:34Z,"Jefferies Upgrades Canadian National Railway to Buy, Announces $120 Price Target",
42920162,CNI,2025-01-10T16:56:32Z,"RBC Capital Reiterates Outperform on Canadian National Railway, Maintains $174 Price Target",
42949217,CNI,2025-01-13T15:20:19Z,"Wells Fargo Maintains Overweight on Canadian National Railway, Lowers Price Target to $123",
42984843,CNI,2025-01-14T18:27:45Z,Canadian National Railway Company Announced That The U.S. Surface Transportation Board Has Approved It's Acquisition Of Iowa Northern Railway Company; Terms Not Disclosed,
43025048,CNI,2025-01-16T12:23:09Z,"Stifel Upgrades Canadian National Railway to Buy, Lowers Price Target to $120",
43028659,CNI,2025-01-16T14:14:52Z,This Netflix Analyst Turns Bullish; Here Are Top 5 Upgrades For Thursday, 
43036259,CNI,2025-01-16T17:26:49Z,"Canadian National Railway's Valuation Is An Opportunity, Analyst Shifts To Bullish Outlook","Stifel analyst upgrades Canadian National Railway to Buy with price target reduction due to lackluster year and disruptions, sees room for upside."
43058711,CNI,2025-01-17T15:28:20Z,"Barclays Maintains Equal-Weight on Canadian National Railway, Lowers Price Target to $112",
43261744,CNI,2025-01-28T12:01:56Z,CN Enters New Tentative Four-year Collective Agreement With International Brotherhood Of Electric Workers,
43328694,CNI,2025-01-30T08:32:20Z,"Earnings Scheduled For January 30, 2025", 
43352753,CNI,2025-01-30T21:10:09Z,"Canadian National Railway Q4 2024 Adj. EPS $1.82 Misses $1.95 Estimate, Sales $4.358B Miss $4.416B Estimate",
43352875,CNI,2025-01-30T21:11:42Z,Canadian National Railway Sees FY25 Adjusted EPS Growth 10%-15%.,
43353455,CNI,2025-01-30T21:21:08Z,Canadian National Railway Earnings Analysis: Q4 Recap, 
43353699,CNI,2025-01-30T21:25:31Z,Insights into Canadian National Railway Q4 Earnings, 
43353921,CNI,2025-01-30T21:27:46Z,"CN Announces New Normal Course Issuer Bid, The Bid Permits CN To Purchase, For Cancellation, Over A 12-Month Period Up To 20M Common Shares, Representing 3.18% Of The 628,224,299 Common Shares Issued And Outstanding Of The Company On January 23, 2025",
43353964,CNI,2025-01-30T21:28:13Z,"CN Announces 5% Dividend Increase, Q1 Dividend Set At C$0.8875/Share",
43354242,CNI,2025-01-30T21:30:53Z,Earnings Summary: Canadian National Railway Q4, 
43354556,CNI,2025-01-30T21:35:21Z,Earnings Breakdown: Canadian National Railway Q4, 
43355052,CNI,2025-01-30T21:41:03Z,Canadian National Railway Earnings Review: Q4 Summary, 
43355283,CNI,2025-01-30T21:45:48Z,Canadian National Railway Earnings Report: Q4 Overview, 
43396879,CNI,2025-01-31T16:27:55Z,"Stifel Maintains Buy on Canadian National Railway, Raises Price Target to $125",
43399573,CNI,2025-01-31T17:41:08Z,"RBC Capital Maintains Outperform on Canadian National Railway, Lowers Price Target to $171",
43429205,CNI,2025-02-03T11:11:04Z,Loop Capital Downgrades Canadian National Railway to Sell,
43447167,CNI,2025-02-03T20:07:33Z,Trump's Takeover Of Panama Canal? Stocks To Watch As Diplomacy Affects President's Plan,"Trump&#39;s statements about potential changes to Panama Canal have raised concerns for companies involved in shipping, logistics and transportation."
44478786,CNI,2025-03-25T18:01:55Z,"CIBC Maintains Neutral on Canadian National Railway, Lowers Price Target to C$157",
44516315,CNI,2025-03-27T14:36:14Z,"Susquehanna Maintains Neutral on Canadian National Railway, Lowers Price Target to $113",
44607054,CNI,2025-04-02T13:35:24Z,"Barclays Maintains Equal-Weight on Canadian National Railway, Lowers Price Target to $104",
44701150,CNI,2025-04-08T20:39:17Z,"Citigroup Maintains Buy on Canadian National Railway, Lowers Price Target to $114",
44713435,CNI,2025-04-09T14:04:09Z,"Jefferies Maintains Buy on Canadian National Railway, Lowers Price Target to $110",
44788754,CNI,2025-04-14T13:29:12Z,"Stifel Maintains Buy on Canadian National Railway, Lowers Price Target to $115",
44816653,CNI,2025-04-15T14:57:10Z,Canada Eases Retaliatory Tariffs On US Goods As Trade Tensions Thaw Under Softer Trump Stance: Stocks React,"Canada announced 6-month tariff relief on US goods critical to its economy, signaling de-escalation in trade standoff with more conciliatory tone."
45127274,CNI,2025-05-01T08:32:37Z,"Earnings Scheduled For May 1, 2025", 
45151389,CNI,2025-05-01T20:29:25Z,"Canadian National Railway Q1 EPS $1.29 Misses $1.79 Estimate, Sales $3.07B Miss $4.38B Estimate",
45152231,CNI,2025-05-01T20:43:18Z,Canadian National Railway Lowers FY2025 Adj EPS Guidance from $5.58-$5.84 to $5.44-$5.69 vs $7.88 Est,
45165102,CNI,2025-05-02T13:08:11Z,"Evercore ISI Group Maintains Outperform on Canadian National Railway, Lowers Price Target to $114",
45166039,CNI,2025-05-02T13:37:20Z,"Barclays Maintains Equal-Weight on Canadian National Railway, Lowers Price Target to $101",
45173312,CNI,2025-05-02T16:44:41Z,"Stephens & Co. Maintains Equal-Weight on Canadian National Railway, Raises Price Target to $109",
45174206,CNI,2025-05-02T17:25:14Z,"RBC Capital Maintains Outperform on Canadian National Railway, Lowers Price Target to $163",
45177082,CNI,2025-05-02T19:27:00Z,Canadian National Railway's Shauneen Bruder Was Unanimously Re-Elected By The Board Of Directors As Board Chair,
45439024,CNI,2025-05-15T14:02:54Z,"CN To Invest About C$3.4B In 2025 Capital Projects, Net Of Customer Reimbursements",
45470660,CNI,2025-05-16T14:55:10Z,"B of A Securities Maintains Neutral on Canadian National Railway, Raises Price Target to $115",
45543498,CNI,2025-05-21T14:03:59Z,CN Plans To Invest About C$600M In Ontario To Support Track Maintenance And Strategic Infrastructure Initiatives In The Province,
45544920,CNI,2025-05-21T14:33:08Z,CN Plans To Invest C$510M In Alberta To Support Long-Term Sustainable Growth In Alberta And Across CN's Network,
45566135,CNI,2025-05-22T14:04:26Z,Canadian National Railway Company Plans To Invest CAD$615M  in British Columbia To Build Capacity And Power Sustainable Growth,
45567311,CNI,2025-05-22T14:31:43Z,CN Plans To Invest About C$165M In Manitoba To Support Track Maintenance And Strategic Infrastructure Initiatives In The Province,
45607633,CNI,2025-05-26T15:09:04Z,CN Plans To Invest About C$475M To Support Track Maintenance And Strategic Infrastructure Initiatives In Quebec,
45607903,CNI,2025-05-26T15:36:17Z,"CN To Invest C$290M In Saskatchewan Infrastructure, Strengthening Grain & Fertilizer Transport",
45793826,CNI,2025-06-05T14:04:53Z,"Canadian National Railway Company To Invest ~ CAD$80 Million In New Brunswick And Nova Scotia, As Part Of Its 2025 Capital Investment Program",
45794188,CNI,2025-06-05T14:14:57Z,"RBC Capital Reiterates Outperform on Canadian National Railway, Maintains $163 Price Target",
45807995,CNI,2025-06-06T06:30:33Z,"Reported Earlier, CN To Issue C$500M In 3.500% Notes Due 2030 And C$500M In 4.200% Notes Due 2035, Closing Expected June 10, 2025",
45820825,CNI,2025-06-06T17:55:29Z,"Scotiabank Maintains Sector Outperform on Canadian National Railway, Raises Price Target to C$165",
45884399,CNI,2025-06-11T14:02:29Z,Canadian National Railway To Invest $170M In Illinois To Support Track Maintenance And Strategic Infrastructure Initiatives In The State,
45885573,CNI,2025-06-11T14:32:18Z,CN Plans To Invest ~$75M In Mississippi Support Track Maintenance And Strategic Infrastructure Initiatives In The State,
45905551,CNI,2025-06-12T14:01:56Z,CN Plans To Invest ~$20M In Indiana In 2025 To Support Track Maintenance And Strategic Infrastructure Initiatives In The State,
45906610,CNI,2025-06-12T14:31:54Z,CN To Invest $30M In Tennessee Infrastructure As Part Of 2025 Capital Plan,
45950118,CNI,2025-06-16T14:02:14Z,CN To Invest $60M In Minnesota As Part Of 2025 Capital Investment Program,
45951353,CNI,2025-06-16T14:32:17Z,Canadian National Railway To Invest ~$85M In Michigan As Part Of 2025 Capital Investment Program,
46080671,CNI,2025-06-24T18:02:02Z,"Susquehanna Maintains Positive on Canadian National Railway, Raises Price Target to $122",
46175301,CNI,2025-06-30T17:02:00Z,"CN Plans To Invest ~$38M In Iowa, As Part Of 2025 Capital Investment Program",
46176226,CNI,2025-06-30T17:31:43Z,CN Plans To Invest ~$50M In Louisiana To Support Track Maintenance And Strategic Infrastructure Initiatives In The State,
46225363,CNI,2025-07-02T15:47:40Z,CN To Invest ~$110M In Wisconsin Rail Infrastructure As Part Of 2025 Capital Program,
46328822,CNI,2025-07-09T18:28:53Z,"Citigroup Maintains Buy on Canadian National Railway, Lowers Price Target to $123",
46348656,CNI,2025-07-10T16:15:50Z,"Barclays Maintains Equal-Weight on Canadian National Railway, Raises Price Target to $106",
46519944,CNI,2025-07-21T14:02:41Z,Canadian National Railway's Earnings: A Preview, 
46537915,CNI,2025-07-22T08:32:18Z,"Earnings Scheduled For July 22, 2025", 
46558617,CNI,2025-07-22T20:07:26Z,"Canadian National Railway Q2 EPS $1.35 Misses $1.92 Estimate, Sales $3.086B Miss $4.336B Estimate",
46558724,CNI,2025-07-22T20:09:56Z,Canadian National Railway  expects adjusted diluted EPS growth in the mid to high single-digit range in 2025,
46567323,CNI,2025-07-23T10:45:03Z,"JP Morgan Downgrades Canadian National Railway to Neutral, Lowers Price Target to C$154",
46567396,CNI,2025-07-23T10:51:25Z,"Barclays Maintains Equal-Weight on Canadian National Railway, Lowers Price Target to C$135",
46569947,CNI,2025-07-23T12:35:44Z,"Texas Instruments, SAP, Enphase Energy And Other Big Stocks Moving Lower In Wednesday's Pre-Market Session", 
46570117,CNI,2025-07-23T12:44:43Z,"Barclays Maintains Equal-Weight on Canadian National Railway, Lowers Price Target to $99",
46571511,CNI,2025-07-23T13:30:27Z,"Susquehanna Maintains Positive on Canadian National Railway, Lowers Price Target to $120",
46571514,CNI,2025-07-23T13:30:37Z,"RBC Capital Maintains Outperform on Canadian National Railway, Lowers Price Target to $157",
46572108,CNI,2025-07-23T13:44:38Z,"Wells Fargo Maintains Overweight on Canadian National Railway, Lowers Price Target to $117",
46574365,CNI,2025-07-23T14:24:12Z,"Scotiabank Maintains Sector Outperform on Canadian National Railway, Lowers Price Target to C$153",
47582949,CNI,2025-09-09T20:23:09Z,"CN And CSX Announces Signing Of MOU To Develop A New Intermodal Service Into Nashville, Tennessee.",
47640092,CNI,2025-09-12T11:58:33Z,"Jim Cramer Recommends Buying This Industrial Stock, Calling It 'Way Too Cheap'","&#34;Mad Money&#34; star Jim Cramer discusses MP Materials, Resideo Technologies and Canadian National Railway on Friday, Sept. 12."
47812360,CNI,2025-09-23T09:14:41Z,Jim Cramer Spotlights These Undervalued S&P 500 Stocks With Growth Potential Amid Skyrocketing Market,"In a recent episode of &#34;Mad Money,&#34; Jim Cramer identified several stocks in the S&amp;P 500 that he believes are undervalued, offering growth potential despite the market&#39;s record highs."
47867936,CNI,2025-09-25T14:45:49Z,"Susquehanna Maintains Positive on Canadian National Railway, Lowers Price Target to $115",
47916877,CNI,2025-09-29T14:07:09Z,"B of A Securities Maintains Neutral on Canadian National Railway, Lowers Price Target to $102",
47926636,CNI,2025-09-29T19:00:58Z,Forecasting The Future: 8 Analyst Projections For Canadian National Railway,"Providing a diverse range of perspectives from bullish to bearish, 8 analysts have published ratings on Canadian National Railway (NYSE: CNI) in the last three months."
47934322,CNI,2025-09-30T06:37:24Z,"Reported Earlier, CN Unveils 2025-2026 Winter Plan With $3B Capital Program, Predictive Tech And Expanded Workforce For Reliable Service",
47991002,CNI,2025-10-02T12:04:41Z,"Barclays Maintains Equal-Weight on Canadian National Railway, Lowers Price Target to $97",
48043144,CNI,2025-10-06T14:03:45Z,"Wells Fargo Maintains Overweight on Canadian National Railway, Lowers Price Target to $110",
48125277,CNI,2025-10-09T14:02:28Z,CN And Congebec Collaborate To Expand Cold Storage Facility At CN's Calgary Logistics Park In Alberta,
48180400,CNI,2025-10-13T16:04:51Z,"Citigroup Maintains Buy on Canadian National Railway, Lowers Price Target to $119",
48307498,CNI,2025-10-20T15:33:59Z,"CN Appoints Patrick Whitehea As Chief Operating Officer, Effective Immediately, Succeeding Derek Taylor",
48528907,CNI,2025-10-30T14:02:13Z,Exploring Canadian National Railway's Earnings Expectations, 
48554351,CNI,2025-10-31T11:11:48Z,"Earnings Scheduled For October 31, 2025", 
48554661,CNI,2025-10-31T11:35:34Z,"Canadian National Railway Q3 Adj. EPS $1.33 Beats $1.28 Estimate, Sales $3.025B Beat $3.000B Estimate",
48588357,CNI,2025-11-03T13:30:05Z,"Susquehanna Maintains Positive on Canadian National Railway, Raises Price Target to $116",
48589717,CNI,2025-11-03T14:12:27Z,"Evercore ISI Group Maintains In-Line on Canadian National Railway, Raises Price Target to $103",
48590806,CNI,2025-11-03T14:39:55Z,"RBC Capital Maintains Outperform on Canadian National Railway, Raises Price Target to $158",
48602357,CNI,2025-11-03T19:30:32Z,"Citigroup Maintains Buy on Canadian National Railway, Raises Price Target to $120",
48712496,CNI,2025-11-07T08:09:45Z,"Reported Earlier, CN Announces $700M Public Debt Offering Including $300M 4.200% Notes Due 2031 And $400M 4.750% Notes Due 2035",
48890792,CNI,2025-11-17T04:10:44Z,Elon Musk Thinks Microsoft Co-Founder Bill Gates Should Close Out 'Crazy' Tesla Short Position,"Elon Musk urges Bill Gates to abandon his short position against Tesla&#39;s stock, as Gates&#39;s foundation sells majority of investments."
49523248,CNI,2025-12-19T22:03:56Z,Canadian National Railway Issues Statement On UP-NS STB Filing,
49797989,CNI,2026-01-08T20:06:12Z,"Citigroup Maintains Buy on Canadian National Railway, Lowers Price Target to $119",
49844077,CNI,2026-01-12T14:20:12Z,"Canadian National Files Motion With Surface Transportation Board To Compel Additional Information To Proposed Merger Between Union Pacific, Norfolk Southern",
49944249,CNI,2026-01-15T17:28:18Z,"Barclays Maintains Equal-Weight on Canadian National Railway, Raises Price Target to $101",
49953423,CNI,2026-01-15T22:00:59Z,Canadian National Railway Stock: A Deep Dive Into Analyst Perspectives (7 Ratings), 
49995540,CNI,2026-01-20T09:33:44Z,"Reported Friday, CN Responds To STB Decision Rejecting UP–NS Merger Application As Incomplete, Citing Need For Full And Transparent Record",
50124400,CNI,2026-01-26T13:20:49Z,"Tesla, Microsoft, Meta, SanDisk And More: Stocks With Earnings This Week","Earnings season is in full-swing with reports this week from several Mag Seven names, big tech companies, defense primes, telecoms and more. "
50228272,CNI,2026-01-29T14:01:25Z,A Look at Canadian National Railway's Upcoming Earnings Report, 
50258618,CNI,2026-01-30T11:11:10Z,"Earnings Scheduled For January 30, 2026", 
50261484,CNI,2026-01-30T12:33:38Z,CN Raises Dividend From CA$0.8875 To CA$0.9150/Share,
50261895,CNI,2026-01-30T12:46:43Z,"Canadian National Railway Q4 Adj. EPS $1.49 Beats $1.43 Estimate, Sales $3.202B Beat $3.190B Estimate",
50261918,CNI,2026-01-30T12:48:09Z,Canadian National Railway: Q4 Earnings Insights, 
50262064,CNI,2026-01-30T12:56:08Z,Canadian National Railway Earnings Review: Q4 Summary, 
50262282,CNI,2026-01-30T13:02:12Z,Earnings Summary: Canadian National Railway Q4, 
50262560,CNI,2026-01-30T13:08:22Z,Canadian National Railway Earnings Report: Q4 Overview, 
50262753,CNI,2026-01-30T13:14:17Z,Insights into Canadian National Railway Q4 Earnings, 
50263065,CNI,2026-01-30T13:22:15Z,Earnings Breakdown: Canadian National Railway Q4, 
50263190,CNI,2026-01-30T13:28:24Z,Canadian National Railway Q4 Earnings Assessment, 
50263464,CNI,2026-01-30T13:36:08Z,Canadian National Railway Q4 Earnings Report: What Investors Need to Know, 
50296993,CNI,2026-02-02T13:19:58Z,"Evercore ISI Group Maintains In-Line on Canadian National Railway, Lowers Price Target to $103",
50300969,CNI,2026-02-02T14:55:26Z,"Stephens & Co. Maintains Equal-Weight on Canadian National Railway, Lowers Price Target to $100",
50302321,CNI,2026-02-02T15:20:14Z,"Scotiabank Maintains Sector Outperform on Canadian National Railway, Lowers Price Target to C$155",
50306229,CNI,2026-02-02T16:45:45Z,"RBC Capital Maintains Outperform on Canadian National Railway, Lowers Price Target to $151",
50311596,CNI,2026-02-02T19:00:52Z,Demystifying Canadian National Railway: Insights From 7 Analyst Reviews, 
51506377,CNI,2026-03-27T13:09:09Z,"Barclays Maintains Equal-Weight on Canadian National Railway, Raises Price Target to $98",
