ID,Ticker,Date,Headline,Summary
22802249,CNI,2021-09-03T17:57:49Z,KCS Punts Merger Vote Until Late September,"Kansas City Southern shareholders are holding off on voting on merger proposals from CN and, apparently, Canadian Pacific until late September."
22779560,CNI,2021-09-06T13:30:18Z,"5 Largest US M&A Deals In Q2: Railways, Health Care, REITS And More","Global merger and acquisition activity topped $1 trillion in the second quarter of 2021, with the U.S alone topping $500 billion. This was the third quarter in a row that this happened globally and in the U.S."
22913838,CNI,2021-09-13T15:48:18Z,"CN Acknowledges TCI Announcement Of Shareholder Meeting Requisition; Co Says Has Not Yet Received The Formal Requisition From TCI; Says Once CN Is In Receipt Of Requisition, It Will Review It And Comment Further In Due Course",
22949833,CNI,2021-09-15T12:49:00Z,Kansas City Southern Terminates Canadian National Railway Merger Agreement And Is Entering Into Merger Agreement With Canadian Pacific Railway,
22954529,CNI,2021-09-15T15:21:17Z,"KCS Agrees To Merge With CP, Nixes Plans With CN",The love triangle appears to have ended: Kansas City Southern has terminated plans to merge with Canadian railway CN and has agreed to merge with rival suitor Canadia
22958853,CNI,2021-09-15T19:17:41Z,Why Canadian National Railway's Stock Is Trading Higher Today,Canadian National Railway (NYSE:CNI) shares are trading higher after Kansas City Southern announced it will terminate the merger proposal between the two companies.
22985068,CNI,2021-09-17T11:11:37Z,"Canadian National Outlines Details Of Its Strategic Plan, Including Resuming Buybacks, Increasing Shareholder Returns, Cutting Capex",
22986169,CNI,2021-09-17T12:26:11Z,Canadian National Railway Co Executive Says Expects Headcount Reduction Of 650,
23008188,CNI,2021-09-20T11:19:13Z,"BMO Capital Downgrades Canadian National Railway to Market Perform, Raises Price Target to $155",
23008432,CNI,2021-09-20T11:33:49Z,"Stephens & Co. Maintains Equal-Weight on Canadian National Railway, Raises Price Target to $120",
23009282,CNI,2021-09-20T12:12:44Z,"Cowen & Co. Maintains Market Perform on Canadian National Railway, Raises Price Target to $119",
23012036,CNI,2021-09-20T14:04:31Z,"Benzinga's Top Ratings Upgrades, Downgrades For September 20, 2021", 
23015775,CNI,2021-09-20T16:13:30Z,Expert Ratings For Canadian National Railway," Within the last quarter, Canadian National Railway (NYSE:CNI) has observed the following analyst ratings: "
23017879,CNI,2021-09-20T18:57:51Z,Canadian National Railway Shares Slide On Multiple Analyst Ratings,"
"
23032334,CNI,2021-09-21T14:30:27Z,Hopeful Golden Cross Forms On Canadian National Railway's Chart,"If history is any guide, there may be good fortune ahead for shares of Canadian National Railway(NYSE:CNI)). A so-called &#34;golden cross&#34; has formed on its chart and, not surprisingly, this could be bullish for the stock."
23038019,CNI,2021-09-21T17:55:12Z,Indiana Rail Road Kicks Off 3-Year Intermodal Expansion Project,Short line Indiana Rail Road (INRD) is planning a multiyear expansion of intermodal facilities for customers that want service to and from the Indianapolis market and Canadian and U.S. West Coast ports.
23192146,CNI,2021-10-01T12:14:05Z,Canadian National Railway Responds To 'numerous misleading claims and inconsistencies in recent disclosures by CIFF Capital and TCI',
23198830,CNI,2021-10-01T17:03:40Z,Railcar America Shares Spike Higher Following Comment House Democractic Caucus Chair Sees Vote On Infrastructure Legislation Friday; Other Rail Stocks Quiet,
23224256,CNI,2021-10-04T18:56:24Z,"CN, Canadian Pacific Foresee Lower Grain Volumes, Colder-Than-Normal Winter","Colder weather and lower grain volumes are just some of the issues that Canadian railways CN and Canadian Pacific anticipate as winter approaches, according to the winter operational plans that both submitted to the Canadian government."
23260018,CNI,2021-10-06T14:38:24Z,"CN, Shareholder Publicly Scuffle Over Railway's Leadership and Direction","Over the next six months, freight rail observers may bear witness to a public relations battle between Canadian railway CN and activist London-based investor TCI Fund Management over CN&#39;s leadership and direction."
23281884,CNI,2021-10-07T14:40:58Z,Southern Illinois Inland Port Project Seeks to Become Logistics Hub Player,"An inland port in southern Illinois could someday become a logistics hub supporting key Midwestern markets, say officials affiliated with the Alexandria Cairo Port District, who are pushing to develop the port."
23418823,CNI,2021-10-18T13:09:18Z,CN Shareholder TCI Issues Vision Plan For Co.,
23420558,CNI,2021-10-18T14:24:44Z,Earnings Outlook For Canadian National Railway," CNI is set to give its latest quarterly earnings report on Tuesday, 2021-10-19. Here&#39;s what investors need to know before the announcement.
Analysts estimate that Canadian National Railway will likely report an Earnings Per Share (EPS) of $1.16 "
23422433,CNI,2021-10-18T15:17:37Z,"Sparks From CN, CP Trains Did Not Cause Lytton Fire",The Transportation Safety Board of Canada has determined that sparks coming from the trains of CN and Canadian Pacific didn&#39;t start the fire in Lytto
23433556,CNI,2021-10-19T08:06:16Z,"Earnings Scheduled For October 19, 2021"," 

Companies Reporting Before The Bell

• Signature Bank (NASDAQ:SBNY) is likely to report quarterly earnings at $3.72 per share on revenue of $513.37 million."
23447907,CNI,2021-10-19T18:41:57Z,"CN Leadership Has to Go, Activist Investor Insists",Activist investor TCI Fund Management is courting shareholders of Canadian railway CN with a plan that TCI says would refocus the railway to achieve operational excellence while touting the environmental benefits of using railroads over truc
23450095,CNI,2021-10-19T20:11:15Z,"CN Q3 EPS C$2.37, Up From C$1.52 YoY; Sales C$3.591B, Up 5% YoY",
23450105,CNI,2021-10-19T20:11:46Z,CN Says Still Targeting 2021 Free Cash Flow C$3B-C$3.3B,
23450171,CNI,2021-10-19T20:12:30Z,Canadian National Railway Reaffirms Guidance,
23450174,CNI,2021-10-19T20:12:42Z,CN Announces CEO Jean-Jacques Ruest's Planned Retirement,
23458817,CNI,2021-10-20T11:35:01Z,"Stephens & Co. Maintains Equal-Weight on Canadian National Railway, Raises Price Target to $126",
23459249,CNI,2021-10-20T11:59:22Z,"BMO Capital Maintains Market Perform on Canadian National Railway, Raises Price Target to $160",
23460004,CNI,2021-10-20T12:15:44Z,"Wells Fargo Maintains Equal-Weight on Canadian National Railway, Raises Price Target to $125",
23467670,CNI,2021-10-20T16:48:08Z,CN CEO: Railway 'Not On the Clock' for Choosing Successor,"Canadian railway CN will not give a specific time frame for when it will elect a new CEO, and the board of directors will open the search to candidates beyond one recently recommended by activist investor TCI Fund Management, according to ou"
23467538,CNI,2021-10-20T16:58:42Z,Where Canadian National Railway Stands With Analysts, Analysts have provided the following ratings for Canadian National Railway (NYSE:CNI) within the last quarter: 
23469772,CNI,2021-10-20T18:15:49Z,"Wells Fargo, Stephens See 4% Downside In Canadian National Railway","
"
23474016,CNI,2021-10-20T20:43:17Z,"Elliott Mgmt. In Talks With Canadian National Board, Has 'Large Position' In Co.",
23479778,CNI,2021-10-21T09:16:41Z,RBC Capital Downgrades Canadian National Railway to Sector Perform,
23486597,CNI,2021-10-21T15:00:14Z,"Benzinga's Top Ratings Upgrades, Downgrades For October 21, 2021","Upgrades
"
23490428,CNI,2021-10-21T16:51:03Z,Expert Ratings For Canadian National Railway," Within the last quarter, Canadian National Railway (NYSE:CNI) has observed the following analyst ratings: "
24117288,CNI,2021-11-16T11:45:41Z,"Atlantic Equities Initiates Coverage On Canadian National Railway with Neutral Rating, Announces Price Target of C$177",
24205142,CNI,2021-11-19T21:41:38Z,Canadian National Railway Expects Repairs On Flooded B.C. Lines To Continue At Least Into Next Week,
24647775,CNI,2021-12-16T15:23:35Z,Vertical Research Downgrades Canadian National Railway to Hold,
24718226,CNI,2021-12-21T14:02:11Z,CN And Watco Announce Surface Transportation Board Approval Of The Sale Of Rail Lines In Wisconsin And Michigan,
24871231,CNI,2022-01-04T23:27:36Z,"9 Of The Largest M&A Deals From 2021: WarnerMedia+Discovery, Kansas City Southern+Canadian National And More",Last year will go down with many records set in the investment world.
24972385,CNI,2022-01-10T14:49:09Z,"Wells Fargo Maintains Equal-Weight on Canadian National Railway, Raises Price Target to $130",
24979557,CNI,2022-01-10T19:02:00Z,Expert Ratings For Canadian National Railway,"Over the past 3 months, 4 analysts have published their opinion on Canadian National Railway (NYSE:CNI) stock. These analysts are typically employed by large Wall Street banks and tasked with understanding a company&#39;s business to predict how a stock will trade over the upcoming year."
24980414,CNI,2022-01-10T20:25:57Z,Wells Fargo Bumps Up Price Targets For Several Transportation Companies,Wells Fargo analyst Allison Poliniak-Cusic raised price targets for several transportation companies.
25053461,CNI,2022-01-14T12:31:47Z,"Deutsche Bank Upgrades Canadian National Railway to Buy, Raises Price Target to $137",
25056423,CNI,2022-01-14T15:03:39Z,"Benzinga's Top Ratings Upgrades, Downgrades For January 14, 2022","Upgrades
"
25058207,CNI,2022-01-14T16:30:01Z,Deutsche Bank Turns Bullish On Canadian National Railway,"
"
25126253,CNI,2022-01-20T12:13:10Z,Former SpaceX Engineers' Electric Railroad Startup Raises $49.5M In Series A Funding,"Parallel Systems, an electric railroad startup, said on Wednesday it has raised $49.55 million in Series A funding to build autonomous battery-electric rail vehicles to move freight.

What Happened: The Culver City, California-based startup was founded in 2020 by three former SpaceX engineers."
25201420,CNI,2022-01-25T09:03:51Z,"Earnings Scheduled For January 25, 2022"," 

Companies Reporting Before The Bell

• Telefonaktiebolaget L M (NASDAQ:ERIC) is projected to report quarterly earnings at $0.24 per share on revenue of $7.73 billion."
25221424,CNI,2022-01-25T21:06:16Z,"CN Q4 Adj. EPS C$1.71, Sales C$3.753B, Up 3% YoY",
25221439,CNI,2022-01-25T21:06:41Z,CN Sees FY2 Adj. EPS Growth Of 22%,
25221567,CNI,2022-01-25T21:12:20Z,CN Announces 19% Dividend Increase To C$0.7325/Share,
25221895,CNI,2022-01-25T21:22:35Z,Canadian National To Name New CEO,
25221974,CNI,2022-01-25T21:23:30Z,Canadian National Close To Settlement With TCI; TCI Expected To Get Two Board Seats,
25222219,CNI,2022-01-25T21:29:26Z,Canadian National PR Confirms Appointment Of Tracy Robinson As President And CEO,
25222696,CNI,2022-01-25T21:41:12Z,Recap: Canadian National Railway Q4 Earnings,"Canadian National Railway (NYSE:CNI) reported its Q4 earnings results on Tuesday, January 25, 2022 at 04:05 PM.

Here&#39;s what investors need to know about the announcement."
25257711,CNI,2022-01-27T13:48:24Z,"Deutsche Bank Maintains Buy on Canadian National Railway, Raises Price Target to $142",
25686087,CNI,2022-02-17T13:27:40Z,"Argus Research Upgrades Canadian National Railway to Buy, Announces $145 Price Target",
25689555,CNI,2022-02-17T15:02:20Z,"Benzinga's Top Ratings Upgrades, Downgrades For February 17, 2022","Upgrades
"
25694319,CNI,2022-02-17T17:06:23Z,Analyst Ratings For Canadian National Railway,"Within the last quarter, Canadian National Railway (NYSE:CNI) has observed the following analyst ratings: "
26805615,CNI,2022-04-26T08:34:47Z,"Earnings Scheduled For April 26, 2022"," 

Companies Reporting Before The Bell

• First American Financial (NYSE:FAF) is estimated to report quarterly loss at $0.09 per share on revenue of $46.41 million."
26826130,CNI,2022-04-26T20:16:01Z,"CN Q1 EPS C$1.32, Up 7% YoY; Sales C$3.708B, Up 5% YoY",
26826175,CNI,2022-04-26T20:16:47Z,CN Cuts FY22 Adj. EPS Growth Target From 20% To 15-20%,
26827653,CNI,2022-04-26T21:03:52Z,Recap: Canadian National Railway Q1 Earnings,"Canadian National Railway (NYSE:CNI) reported its Q1 earnings results on Tuesday, April 26, 2022 at 05:05 PM.

Here&#39;s what investors need to know about the announcement."
26834570,CNI,2022-04-27T11:37:05Z,"Wells Fargo Maintains Equal-Weight on Canadian National Railway, Lowers Price Target to $130",
26837827,CNI,2022-04-27T13:13:55Z,"Stephens & Co. Maintains Equal-Weight on Canadian National Railway, Lowers Price Target to $136",
27270986,CNI,2022-05-18T10:13:11Z,"BMO Capital Upgrades Canadian National Railway to Outperform, Announces C$170 Price Target",
27287261,CNI,2022-05-18T19:07:39Z,BMO Capital Upgrades This Canadian Transportation Company To Outperform - Read Why,"
"
27298170,CNI,2022-05-19T12:13:40Z,"Citigroup Maintains Buy on Canadian National Railway, Lowers Price Target to $132",
27414600,CNI,2022-05-26T11:58:28Z,Evercore ISI Group Upgrades Canadian National Railway to Outperform,
27418554,CNI,2022-05-26T14:27:57Z,"Benzinga's Top Ratings Upgrades, Downgrades For May 26, 2022","Upgrades
"
27442656,CNI,2022-05-27T15:41:28Z,Will Chart Analysts Notice Bad Omen on Canadian National Railway's Chart,"If history is any guide, there may be trouble ahead for shares of Canadian National Railway (NYSE:CNI).  A so-called &#34;death cross&#34; has formed on its chart and, not surprisingly, this could be bearish for the stock."
27654862,CNI,2022-06-10T18:55:02Z,"$100 Invested In This Stock 20 Years Ago Would Be Worth $1,300 Today","Canadian National Railway (NYSE:CNI) has outperformed the market over the past 20 years by 7.02% on an annualized basis producing an average annual return of 13.82%. Currently, Canadian National Railway has a market capitalization of $76.38 billion. "
27816199,CNI,2022-06-22T17:04:45Z,Canadian National Railway Reveals Investments In Ontario & Alberta,"
"
27868333,CNI,2022-06-27T20:38:22Z,Here's How Much $1000 Invested In Canadian National Railway 15 Years Ago Would Be Worth Today,"Canadian National Railway (NYSE:CNI) has outperformed the market over the past 15 years by 4.0% on an annualized basis producing an average annual return of 10.45%. Currently, Canadian National Railway has a market capitalization of $78.92 billion. "
27875801,CNI,2022-06-28T09:53:42Z,"Credit Suisse Initiates Coverage On Canadian National Railway with Neutral Rating, Announces Price Target of $122",
27882906,CNI,2022-06-28T14:25:33Z,"Benzinga's Top Ratings Upgrades, Downgrades For June 28, 2022","Upgrades
"
27889018,CNI,2022-06-28T20:34:40Z,Expert Ratings for Canadian National Railway,"Over the past 3 months, 4 analysts have published their opinion on Canadian National Railway (NYSE:CNI) stock. These analysts are typically employed by large Wall Street banks and tasked with understanding a company&#39;s business to predict how a stock will trade over the upcoming year."
28034727,CNI,2022-07-12T14:10:10Z,"Evercore ISI Group Maintains Outperform on Canadian National Railway, Lowers Price Target to $122",
28039644,CNI,2022-07-12T18:48:13Z,Here's How Much $100 Invested In Canadian National Railway 15 Years Ago Would Be Worth Today,"Canadian National Railway (NYSE:CNI) has outperformed the market over the past 15 years by 3.15% on an annualized basis producing an average annual return of 9.41%. Currently, Canadian National Railway has a market capitalization of $76.73 billion. "
28047905,CNI,2022-07-13T12:17:05Z,"Barclays Maintains Equal-Weight on Canadian National Railway, Lowers Price Target to $115",
28080044,CNI,2022-07-15T12:09:43Z,"Wells Fargo Maintains Equal-Weight on Canadian National Railway, Lowers Price Target to $115",
28080932,CNI,2022-07-15T13:05:18Z,"Stifel Maintains Hold on Canadian National Railway, Lowers Price Target to $113",
28080886,CNI,2022-07-15T14:06:04Z,Expert Ratings for Canadian National Railway,Canadian National Railway (NYSE:CNI) has observed the following analyst ratings within the last quarter: 
28171570,CNI,2022-07-22T15:49:44Z,Bill & Melinda Gates Foundation Trust Receives Gift Of 44.5M Shares Of Canadian National Railway Company,
28177813,CNI,2022-07-23T12:58:03Z,This Is How Much Bill Gates Just Gifted To The Bill & Melinda Gates Foundation,"According to a recent report, Microsoft Corporation (NASDAQ: MSFT) co-founder Bill Gates has donated more than $955 million worth of Deere &amp; Company"
28199120,CNI,2022-07-26T10:12:45Z,"Earnings Scheduled For July 26, 2022"," 

Companies Reporting Before The Bell

• General Motors (NYSE:GM) is likely to report quarterly earnings at $1.30 per share on revenue of $34.59 billion."
28213953,CNI,2022-07-26T20:10:37Z,"CN Q2 Sales C$4.344B, Up 21% YoY",
28216092,CNI,2022-07-26T22:06:39Z,"Canadian National Railway Shares Soar On Q2 Performance, Clocks 21% Revenue Growth","
"
28225010,CNI,2022-07-27T13:32:45Z,"Credit Suisse Maintains Neutral on Canadian National Railway, Raises Price Target to $134",
28226017,CNI,2022-07-27T16:22:39Z,CN Upbeat On 2nd Half Of 2022 Despite Macro Uncertainties,"Despite looming economic uncertainties in the second half of 2022, Canadian railway CN expects volume gains in grain and brisk intermodal activity to support the railway in the back half of the year, according to executives on CN&#39;s second-quarter 2022 earnings call."
28581777,CNI,2022-08-22T11:09:24Z,"Evercore ISI Group Downgrades Canadian National Railway to In-Line, Announces $129 Price Target",
28585296,CNI,2022-08-22T14:03:38Z,"Benzinga's Top Ratings Upgrades, Downgrades For August 22, 2022","Upgrades

"
28585342,CNI,2022-08-22T14:12:43Z,Expert Ratings for Canadian National Railway,Analysts have provided the following ratings for Canadian National Railway (NYSE:CNI) within the last quarter:
28827104,CNI,2022-09-12T11:51:16Z,"B of A Securities Upgrades Canadian National Railway to Buy, Raises Price Target to $135",
28830455,CNI,2022-09-12T14:50:24Z,"Benzinga's Top Ratings Upgrades, Downgrades For September 12, 2022","Upgrades
"
28834156,CNI,2022-09-12T17:05:37Z,What 8 Analyst Ratings Have To Say About Canadian National Railway,"Within the last quarter, Canadian National Railway (NYSE:CNI) has observed the following analyst ratings: "
28878569,CNI,2022-09-15T11:58:18Z,"US Railway Companies, Unions Reach Tentative Agreement Averting Catastrophic Strike","Today morning, the rail companies and union negotiators came to a tentative agreement that balances the needs of workers, businesses, and the economy, after 20 hours of talks."
28879880,CNI,2022-09-15T12:21:30Z,"Top Financial Media Stories Thursday, September 15: US Railway Companies, Unions Reach Tentative Agreement, Tesla To Wind Down Stores In China's Flashy Malls, Netflix Could Face Legal Action Over South Korean Crime Drama And More..","US Railway Companies, Unions Reach Tentative Agreement Averting Catastrophic Strike"
28933697,CNI,2022-09-20T14:55:27Z,This Favorable Sign Appears On Canadian National Railway's Chart,"If history is any guide, there may be good fortune ahead for shares of Canadian National Railway (NYSE:CNI).  A so-called &#34;golden cross&#34; has formed on its chart and, not surprisingly, this could be bullish for the stock."
29050343,CNI,2022-09-28T12:40:19Z,"Susquehanna Maintains Neutral on Canadian National Railway, Lowers Price Target to $109",
29092722,CNI,2022-09-30T11:42:43Z,"Barclays Maintains Equal-Weight on Canadian National Railway, Lowers Price Target to $110",
29093037,CNI,2022-09-30T12:31:31Z,What 9 Analyst Ratings Have To Say About Canadian National Railway, Canadian National Railway (NYSE:CNI) has observed the following analyst ratings within the last quarter: 
29101279,CNI,2022-09-30T20:16:26Z,Check Out These 3 Blue Chip Dividend Stocks Bill Gates Uses To Mitigate Recession Risk,"Bill Gates the co-founder of Microsoft has been actively involved in investing for change to lessen the impact of climate change. Gates is doing this by investing in companies such as Quantumscape (NYSE: QS), whose objective is to develop solid state batteries for electric vehicles."
29200852,CNI,2022-10-10T12:45:46Z,"Wells Fargo Maintains Equal-Weight on Canadian National Railway, Lowers Price Target to $115",
29223457,CNI,2022-10-11T17:16:56Z,"CN And IBEW Arbitration Concludes With New Three-Year Collective Agreement;  The Agreement Includes A 3 Percent Wage Increase For Each Of 2022, 2023 And 2024",
29287002,CNI,2022-10-17T12:44:54Z,"Stifel Maintains Hold on Canadian National Railway, Lowers Price Target to $118",
29293176,CNI,2022-10-17T17:12:30Z,What 7 Analyst Ratings Have To Say About Canadian National Railway, Analysts have provided the following ratings for Canadian National Railway (NYSE:CNI) within the last quarter: 
29391042,CNI,2022-10-25T08:39:48Z,"Earnings Scheduled For October 25, 2022","Companies Reporting Before The Bell

• UBS Gr (NYSE:UBS) is expected to report earnings for its third quarter.

• SAP (NYSE:SAP) is expected to report earnings for its third quarter."
29405926,CNI,2022-10-25T20:02:46Z,Canadian National Railway Reports Q3 2022 Diluted EPS C$2.13,
29405929,CNI,2022-10-25T20:02:58Z,Canadian National Railway Raises Guidance,
29405958,CNI,2022-10-25T20:03:57Z,Canadian National Railway Raises Guidance Sees FY22 Adj. EPS Growth Of 15%-20%,
29413481,CNI,2022-10-26T11:42:12Z,"Credit Suisse Maintains Neutral on Canadian National Railway, Raises Price Target to $127",
29414243,CNI,2022-10-26T12:13:32Z,"Wells Fargo Maintains Equal-Weight on Canadian National Railway, Raises Price Target to $120",
29415002,CNI,2022-10-26T12:35:41Z,"Barclays Maintains Equal-Weight on Canadian National Railway, Raises Price Target to $118",
29734500,CNI,2022-11-15T20:10:52Z,"Bill Gates Trims Berkshire Stake, Adds 2 New Positions - One Is A 'Garbage' Stock",Bill Gates has been known for buying up farmland as well as investing in disruptive companies to better combat climate change such as solid-state battery producer QuantumScape (NYSE: 
29888925,CNI,2022-11-29T14:44:14Z,"B of A Securities Maintains Buy on Canadian National Railway, Raises Price Target to $140",
29891025,CNI,2022-11-29T16:04:53Z,Expert Ratings for Canadian National Railway, 
29895418,CNI,2022-12-01T22:47:01Z,A Philanthropic Activist Investor Maintains Stakes In 2 Canadian Railroad Stocks Paying Dividends,British billionaire Chris Hohn is an activist investor who founded The Children&#39;s Investment (TCI) Fund Management in 2003. The fund manages The Children&#39;s Investment Master Fund.
30351049,CNI,2023-01-10T13:07:53Z,Goldman Sachs Downgrades Canadian National Railway to Sell,
30354796,CNI,2023-01-10T15:01:12Z,"Benzinga's Top Ratings Upgrades, Downgrades For January 10, 2023", 
30370326,CNI,2023-01-11T13:34:28Z,"Barclays Maintains Equal-Weight on Canadian National Railway, Raises Price Target to $127",
30374332,CNI,2023-01-11T16:01:03Z,Analyst Ratings for Canadian National Railway, 
30515925,CNI,2023-01-22T21:30:43Z,"Tesla, Microsoft, IBM, Intel, TI Among Companies Reporting This Week: Can Netflix's Optimism Spill Over To Rest Of Tech Space?","Netflix, Inc. (NASDAQ: NFLX) shares jumped nearly 8.5% on Friday before settling at their highest level since April 19, 2022, when shares plunged after the company reported its first loss in net paid subscriber adds in a decade."
30524871,CNI,2023-01-23T15:01:47Z,Preview: Canadian National Railway's Earnings, 
30539637,CNI,2023-01-24T09:53:57Z,"Earnings Scheduled For January 24, 2023","Companies Reporting Before The Bell

• GATX (NYSE:GATX) is expected to report quarterly earnings at $1.44 per share on revenue of $327.63 million."
30557636,CNI,2023-01-24T21:06:18Z,"CN Q4 Revenue C$4.542B, Up 21% YoY",
30557835,CNI,2023-01-24T21:11:31Z,CN  Raises 2023 Dividend By 8%,
30565221,CNI,2023-01-25T12:28:34Z,"BMO Capital Maintains Outperform on Canadian National Railway, Lowers Price Target to C$180",
30565497,CNI,2023-01-25T12:40:03Z,"Credit Suisse Maintains Neutral on Canadian National Railway, Lowers Price Target to $128",
30565754,CNI,2023-01-25T12:54:15Z,"Wells Fargo Maintains Equal-Weight on Canadian National Railway, Lowers Price Target to $115",
31190453,CNI,2023-03-03T12:32:33Z,Norfolk Southern Joins Federal Close-Call Reporting System Amid Pressure Since Ohio Train Derailment,"
"
31429765,CNI,2023-03-20T22:01:46Z,"CN, Unifor Reach Tentative Agreements Covering ~3K CN Employees; Terms Not Disclosed",
31476517,CNI,2023-03-23T14:49:23Z,A Bearish Sign Appears On Canadian National Railway's Chart, 
31772510,CNI,2023-04-12T16:00:21Z,"Barclays Maintains Equal-Weight on Canadian National Railway, Lowers Price Target to $126",
31836371,CNI,2023-04-17T16:52:43Z,"National Bank Financial Inc Maintains Sector Perform on Canadian National Railway, Raises Price Target to $178",
31935557,CNI,2023-04-21T14:01:38Z,Earnings Preview For Canadian National Railway, 
31950131,CNI,2023-04-23T23:49:29Z,"CN Announced Earlier On Sunday, It Reached Tentative Agreement With Teamsters Canada Rail Conference",
31951330,CNI,2023-04-24T10:38:27Z,"Earnings Scheduled For April 24, 2023","Companies Reporting Before The Bell

• Dynex Cap (NYSE:DX) is estimated to report quarterly earnings at $0.17 per share on revenue of $6.99 million."
31958770,CNI,2023-04-24T14:54:23Z,Hedge Funds Are Ultra-Bearish On US Treasuries,Let&#39;s get after it with the vigor and passion of French protesters who took over the Paris Stock Exchange last week.
31952301,CNI,2023-04-24T16:28:00Z,"US Stocks Limp As Tech Earnings, Key Economic Data Loom: Analyst Sees Equity Market Struggling In 'Weeks, Months Ahead'","In the first trading session of the new week, all three main US stock indices traded lower as investors were cautious ahead of a busy week of tech earnings and economic data."
31968842,CNI,2023-04-24T20:05:06Z,"CN, Union Pacific Railroad, GMXT Announce Creation Of Falcon Premium Intermodal Service, A Mexico-US-Canada Service With Rail Connection In Chicago",
31969057,CNI,2023-04-24T20:09:17Z,"CN Q1 Revenue C$4.313B, Up 16% YoY",
