ID,Ticker,Date,Headline,Summary
30963428,DE,2023-02-17T17:25:04Z,Crude Oil Down 4%; AMC Networks Shares Spike Higher,"U.S. stocks traded mostly lower midway through trading, with the Nasdaq Composite dropping around 100 points on Friday.

The Dow traded up 0.03% to 33,708.20 while the NASDAQ fell 0.79% to 11,762.38. The S&amp;P 500 also fell, dropping, 0.51% to 4,069.49."
30963847,DE,2023-02-17T17:58:57Z,"Top 15 Trending Stocks On WallStreetBets As Of Friday, Feb. 17, 2023 (Via Swaggy Stocks)",
30981612,DE,2023-02-21T10:29:51Z,"S&P 500 Settles Lower, Market Volatility Falls Slightly","The S&amp;P 500 closed lower on Friday as investors monitored recent inflation reports.

US producer prices rose 0.7% month-over-month in January, while consumer prices in the US rose 0.5% month-over-month in January, the most in three months.

Goldman Sachs and Bank of America now expect three more rate increases this year, up from their prior forecast of two rate hikes."
30982757,DE,2023-02-21T11:50:53Z,"Bernstein Maintains Market Perform on Deere, Raises Price Target to $398",
30982875,DE,2023-02-21T11:57:42Z,"Baird Maintains Outperform on Deere, Raises Price Target to $512",
30983311,DE,2023-02-21T12:08:01Z,"Wells Fargo Maintains Overweight on Deere, Raises Price Target to $510",
30984094,DE,2023-02-21T12:47:49Z,Deere Gets Price Target Bumps By Analysts After Upbeat Q1 Results,Deere &amp; Company (NYSE: DE) reported better-than-expected Q1 results.
30984740,DE,2023-02-21T13:08:41Z,"DA Davidson Maintains Buy on Deere, Maintains $520 Price Target",
30984887,DE,2023-02-21T13:13:58Z,DraftKings To Rally Around 38%? Here Are 10 Other Analyst Forecasts For Tuesday,"
	Wells Fargo boosted the price target for  Deere &amp; Company  (NYSE: DE) from $485 to $510. Wells Fargo analyst Seth Weber maintained an Overweight rating on the stock. Deere shares fell 0.5% to $431.08 in pre-market trading.
"
30985107,DE,2023-02-21T13:20:42Z,"Argus Research Maintains Buy on Deere, Raises Price Target to $485",
30985768,DE,2023-02-21T13:45:32Z,"Morgan Stanley Maintains Overweight on Deere, Raises Price Target to $537",
30988644,DE,2023-02-21T14:47:54Z,Big Retailers Report,"Good Morning Everyone!

Customers are setting banks on fire in Lebanon because they can’t get their money out.

Inflation is at +170%.

This is what a currency collapse looks like:"
31042898,DE,2023-02-24T13:17:14Z,"Alibaba, Deere, Cheniere Energy, And This Fund On CNBC's 'Final Trades'","On CNBC’s &#34;Halftime Report Final Trades,&#34;  Liz Young of BNY Mellon Investment Management named  Invesco DB US Dollar Index Bullish Fund (NYSE: UUP), saying that strength in the U.S"
31075481,DE,2023-02-27T19:31:41Z,"$1000 Invested In This Stock 5 Years Ago Would Be Worth $2,700 Today", 
31089621,DE,2023-02-28T13:18:04Z,John Deere Expands Options by Introducing New E-Drive And E-Power Machines At CONEXPO-CON/AGG 2023,
31196650,DE,2023-03-03T17:35:20Z,The Tesla Of The Industrial Sector With A Pulse On China Semiconductors,
31207832,DE,2023-03-04T23:16:59Z,"Barron's Top Weekend Stock Picks: Apple, First Solar, Deere And Why Tesla's Stock Becoming Boring Isn't Bad","Benzinga reviews this weekend&#39;s top stories covered by Barron&#39;s, here are the articles investors need to read."
31280063,DE,2023-03-09T15:58:57Z,Watching Deere & Company; Hearing Investor Business Daily Picks Stock,
31297380,DE,2023-03-10T15:16:20Z,Deere Unusual Options Activity For March 10, 
31384815,DE,2023-03-16T17:00:43Z,$1000 Invested In Deere 5 Years Ago Would Be Worth This Much Today, 
31399456,DE,2023-03-17T15:16:06Z,Deere Unusual Options Activity, 
31401244,DE,2023-03-17T17:00:53Z,"CNBC Halftime Report Final Trades: AutoZone, General Motors, Deere, Freeport-McMoRan",
31426241,DE,2023-03-20T18:30:43Z,Looking At Deere's Recent Unusual Options Activity, 
31444302,DE,2023-03-21T17:35:23Z,10 Industrials Stocks With Whale Alerts In Today's Session, 
31532275,DE,2023-03-28T15:21:00Z,One Of The Best Traders In Congress Sells Shares Of Distressed Regional Bank On Day Of Stock Crash,"Several banks have collapsed in 2023, including Silvergate Capital (NYSE: SI), Signature Bank (OTC: SBNY) and Silicon Valley Bank, a unit of SVB Financial (NASDAQ: "
31589671,DE,2023-03-30T16:46:22Z,Check Out What Whales Are Doing With Deere, 
31612506,DE,2023-03-31T16:22:09Z,"Live On CNBC Steve Weiss Buys Deere, Getting Back Into The Co.",
31679796,DE,2023-04-05T14:02:18Z,This Is What Whales Are Betting On Deere, 
31729243,DE,2023-04-10T15:46:13Z,This Is What Whales Are Betting On Deere, 
31795004,DE,2023-04-13T18:31:24Z,This Is What Whales Are Betting On Deere, 
31839599,DE,2023-04-17T18:45:58Z,Check Out What Whales Are Doing With Deere, 
31868292,DE,2023-04-18T19:30:41Z,$100 Invested In This Stock 5 Years Ago Would Be Worth $300 Today, 
32052277,DE,2023-04-27T16:31:19Z,Deere Unusual Options Activity For April 27, 
32091950,DE,2023-04-29T21:19:12Z,Here Are The Best Sector ETFs And Major Sector-Moving Stocks In April,"As April draws to a close, it&#39;s the right time to look back at how the 11 S&amp;P 500 sector ETFs fared over the month. The market as a whole was only slightly positive for the month, with the SPDR S&amp;P 500 Trust ETF (ARCA: SPY) gaining 1.3%, although there were some "
32121552,DE,2023-05-01T14:18:53Z,"Reported Earlier, 'Deere Seeks Satellite Network To Connect Far-Flung Farms; Farmers Require Wi-Fi To Use Tractor Maker's Data Services, Automated Equipment' - WSJ",
32192247,DE,2023-05-03T16:18:07Z,Deere Unusual Options Activity For May 03, 
32272587,DE,2023-05-08T20:00:46Z,$1000 Invested In Deere 5 Years Ago Would Be Worth This Much Today, 
32296927,DE,2023-05-09T17:01:10Z,Deere Unusual Options Activity For May 09, 
32318603,DE,2023-05-10T14:48:30Z,Ominous Death Cross Forms On Deere's Chart, 
32365827,DE,2023-05-12T14:34:02Z,"Deutsche Bank Maintains Hold on Deere, Lowers Price Target to $440",
32372207,DE,2023-05-12T20:00:48Z,The Latest Analyst Ratings for Deere, 
32388940,DE,2023-05-15T11:19:53Z,"Bernstein Maintains Market Perform on Deere, Lowers Price Target to $367",
32396890,DE,2023-05-15T15:02:56Z,'John Deere Debuts New 4075R Compact Utility Tractor And My2024 Upgrades For 3R- And 4-Series Models',
32432462,DE,2023-05-16T20:01:27Z,Deere Unusual Options Activity, 
32452385,DE,2023-05-17T18:30:34Z,Peering Into Deere's Recent Short Interest, 
32467007,DE,2023-05-18T14:00:35Z,Preview: Deere's Earnings, 
32480680,DE,2023-05-19T06:34:52Z,Investor Sentiment Improves Further After Nasdaq Jumps 1.5%,"The CNN Money Fear and Greed index showed further improvement in overall sentiment among U.S. investors on Thursday.

The Nasdaq Composite surged to record its highest closing level since Aug. 2022 on Thursday amid debt ceiling negotiations that remained in focus for Wall Street traders.."
32481389,DE,2023-05-19T09:17:52Z,"Deere, Foot Locker And 3 Stocks To Watch Heading Into Friday","With U.S. stock futures trading slightly higher this morning on Friday, some of the stocks that may grab investor focus today are as follows:
"
32481731,DE,2023-05-19T10:06:05Z,"Deere Q2 EPS $9.65 Beats $8.59 Estimate, Sales $17.39B Beat $14.83B Estimate",
32481162,DE,2023-05-19T10:09:37Z,"Earnings Scheduled For May 19, 2023","Companies Reporting Before The Bell

• CI&amp;T (NYSE:CINT) is estimated to report quarterly earnings at $0.07 per share on revenue of $119.60 million."
32481913,DE,2023-05-19T10:17:23Z,Deere FY23 Production & Precision Ag Revenue Outlook Growth Up ~20%,
32482119,DE,2023-05-19T10:44:28Z,"US Stocks Plunge as Debt-Ceiling Talks Stall, Investors Trim June Hike's Bets: Analyst Calls AI a ""Baby Bubble""","After a positive start to the session, the stock market turned to the red when House Speaker Kevin McCarthy&#39;s representatives allegedly stormed out of a private meeting with White House officials, calling the other side &#34;unreasonable&#34; and putting talks over the "
32483675,DE,2023-05-19T12:12:01Z,Deere & Co shares are trading higher after the company reported better-than-expected Q2 financial results and issued guidance.,
32483235,DE,2023-05-19T12:35:35Z,Deere Stock Pops On Upbeat Q2 And FY23 Guidance Boost,"Deere &amp; Company (NYSE: DE) reported second-quarter FY23 net sales and revenue growth of 30% year-on-year to $17.39 billion, beating the consensus of $14.83 bill"
32485551,DE,2023-05-19T13:46:08Z,"DeSantis Vs. Disney, Alibaba Spinoffs Cloud Business, Apple Bans Internal ChatGPT Use: Today's Top Stories",Bloomberg
32485891,DE,2023-05-19T13:58:20Z,US Stocks Open Higher; Deere Posts Upbeat Q2 Results,"U.S. stocks traded higher this morning, with the Dow Jones gaining over 50 points on Friday.

Following the market opening Friday, the Dow traded up 0.17% to 33,594.20 while the NASDAQ rose 0.28% to 12,724.56. The S&amp;P 500, also rose, gaining, 0.34% to 4,212.26."
32486336,DE,2023-05-19T14:18:15Z,Deere Exec Says Q2 Saw The Lowest Level Of Production Cost Inflation Since Q1 2021,
32503315,DE,2023-05-22T09:17:51Z,"B of A Securities Maintains Neutral on Deere, Lowers Price Target to $416",
32503491,DE,2023-05-22T09:48:17Z,S&P 500 Records Best Weekly Performance Since March; Market Volatility Increases,"The S&amp;P 500 settled lower on Friday after House Speaker Kevin McCarthy&#39;s representatives stormed out of a private meeting with White House officials.

US stocks, however, recorded weekly gains, with the S&amp;P 500 notching its biggest weekly percentage gains since March."
32504120,DE,2023-05-22T10:39:08Z,"Wells Fargo Maintains Overweight on Deere, Lowers Price Target to $490",
32504956,DE,2023-05-22T11:26:13Z,"Baird Maintains Outperform on Deere, Lowers Price Target to $445",
32504980,DE,2023-05-22T11:28:35Z,"Stifel Maintains Buy on Deere, Lowers Price Target to $493",
32505838,DE,2023-05-22T12:06:30Z,"Morgan Stanley Maintains Overweight on Deere, Lowers Price Target to $517",
32505890,DE,2023-05-22T12:09:39Z,Deere Gets Price Target Cuts By Analysts After Q2 Results,Deere &amp; Company (NYSE: DE) reported better-than-expected second-quarter financial results.
32506737,DE,2023-05-22T12:43:38Z,"Oppenheimer Maintains Outperform on Deere, Lowers Price Target to $436",
32506896,DE,2023-05-22T12:48:10Z,"DA Davidson Maintains Buy on Deere, Lowers Price Target to $492",
32508860,DE,2023-05-22T14:01:12Z,"Deutsche Bank Maintains Hold on Deere, Lowers Price Target to $392",
32512044,DE,2023-05-22T16:01:19Z,Deere Unusual Options Activity For May 22, 
32513459,DE,2023-05-22T17:00:21Z,Wells Fargo Maintains Overweight Rating for Deere: Here's What You Need To Know, 
32540841,DE,2023-05-23T20:31:24Z,Deere Unusual Options Activity For May 23, 
32546186,DE,2023-05-24T09:32:26Z,"Citigroup Maintains Buy on Deere, Lowers Price Target to $460",
32548696,DE,2023-05-24T11:54:34Z,Amazon.com To Rally Over 39%? Here Are 10 Other Analyst Forecasts For Wednesday,"
	Piper Sandler cut the price target for  Intuit Inc.  (NASDAQ: INTU) from $510 to $497. Piper Sandler analyst Arvind Ramnani maintained an Overweight rating. Intuit shares fell 5.3% to $426.10 in pre-market trading.
"
32559979,DE,2023-05-24T18:30:34Z,Here's How Much You Would Have Made Owning Deere Stock In The Last 5 Years, 
32624601,DE,2023-05-30T13:29:03Z,Deere &amp; Co.'s Futuristic Tractors Are Going All-Electric While Integrating AI And Space Technology, 
32647354,DE,2023-05-31T13:17:12Z,"AMD, Micron And 2 Other Stocks Insiders Are Selling","The S&amp;P 500 closed almost flat on Tuesday. Investors, meanwhile, focused on some notable insider trades."
32658883,DE,2023-05-31T20:46:47Z,Deere Unusual Options Activity, 
32694773,DE,2023-06-02T16:46:12Z,Check Out What Whales Are Doing With Deere, 
32695028,DE,2023-06-02T17:00:29Z,"CNBC Halftime Report Final Trades: Deere & Company, CVS Health, Quanta Services",
32695947,DE,2023-06-02T17:35:32Z,10 Industrials Stocks Whale Activity In Today's Session, 
32712815,DE,2023-06-05T11:58:28Z,"BMO Capital Maintains Market Perform on Deere, Lowers Price Target to $425",
32710617,DE,2023-06-05T12:33:12Z,"Deere, CVS Health, Quanta Services And This ETF On CNBC's 'Final Trades'","On CNBC’s &#34;Halftime Report Final Trades,&#34;  Stephen Weiss of Short Hills Capital Partners named  Deere &amp; Company  (NYSE: DE) "
32759343,DE,2023-06-07T14:16:17Z,Check Out What Whales Are Doing With Deere, 
32784575,DE,2023-06-08T18:00:51Z,Here's How Much $1000 Invested In Deere 5 Years Ago Would Be Worth Today, 
32820492,DE,2023-06-12T17:00:03Z,"CNBC Halftime Report Final Trades: AbbVie, Deere & Company, Broadcom",
32829494,DE,2023-06-13T12:48:45Z,"AbbVie, Deere And A Major Chipmaker Set To Win In AI: CNBC's 'Final Trades'","On CNBC’s &#34;Halftime Report Final Trades,&#34;  Bryn Talkington  of Requisite Capital Management said  AbbVie Inc."
32841878,DE,2023-06-13T17:35:32Z,10 Industrials Stocks With Whale Alerts In Today's Session, 
32948541,DE,2023-06-21T14:31:29Z,Looking At Deere's Recent Unusual Options Activity, 
33011646,DE,2023-06-26T18:00:44Z,Here's How Much You Would Have Made Owning Deere Stock In The Last 5 Years, 
33024554,DE,2023-06-27T13:33:16Z,Unmasking Q2 2023's Stars & Strugglers: Industry ETFs And Top Stock Standouts, 
33038649,DE,2023-06-28T10:44:58Z,"Canaccord Genuity Initiates Coverage On Deere with Buy Rating, Announces Price Target of $530",
33039986,DE,2023-06-28T12:00:39Z,What 13 Analyst Ratings Have To Say About Deere, 
33044484,DE,2023-06-28T14:50:38Z,Looking At Deere's Recent Unusual Options Activity, 
33044718,DE,2023-06-28T15:03:02Z,"Benzinga's Top Ratings Upgrades, Downgrades For June 28, 2023", 
33078230,DE,2023-06-30T13:33:10Z,Deere & Co Files For Mixed Shelf; Size Not Disclosed,
33099994,DE,2023-07-03T17:33:18Z,Check Out What Whales Are Doing With Deere, 
33120258,DE,2023-07-05T17:39:09Z,10 Industrials Stocks Whale Activity In Today's Session, 
33189399,DE,2023-07-11T17:34:32Z,Deere Unusual Options Activity, 
33206472,DE,2023-07-12T20:18:39Z,"Top Investment Bank Unveils 3 ETFs, 10 Stocks To Buy In The AI Boom", 
33215570,DE,2023-07-13T13:15:35Z,Looking Into Deere's Recent Short Interest, 
33235117,DE,2023-07-14T18:47:17Z,Deere Unusual Options Activity, 
33251591,DE,2023-07-17T15:00:40Z,Here's How Much $100 Invested In Deere 5 Years Ago Would Be Worth Today, 
33270875,DE,2023-07-18T16:28:39Z,"Citigroup Maintains Buy on Deere, Raises Price Target to $475",
33272968,DE,2023-07-18T19:01:00Z,Deere Unusual Options Activity, 
33325238,DE,2023-07-21T15:30:19Z,A Look Into Deere's Debt, 
33354192,DE,2023-07-24T20:30:49Z,Deere Unusual Options Activity For July 24, 
33354641,DE,2023-07-24T20:45:18Z,Russia Is Seizing European Company Assets — What US Businesses Are Still At Risk?, 
33371717,DE,2023-07-25T15:04:15Z,"DA Davidson Maintains Buy on Deere, Raises Price Target to $510",
33374513,DE,2023-07-25T17:00:47Z,15 Analysts Have This to Say About Deere, 
33429553,DE,2023-07-27T20:00:23Z,Here's How Much You Would Have Made Owning Deere Stock In The Last 5 Years, 
33449735,DE,2023-07-28T20:00:59Z,Check Out What Whales Are Doing With Deere, 
33467012,DE,2023-07-31T12:59:28Z,"AbbVie, Pioneer Natural Resources And This Manufacturer Are CNBC's 'Final Trades'","On CNBC’s &#34;Halftime Report Final Trades,&#34;  Bryn Talkington  of Requisite Capital Management said  AbbVie Inc."
33471902,DE,2023-07-31T14:59:22Z,"Rising Stars, Falling Trends: July's Industry ETF Winners And Losers", 
33501158,DE,2023-08-01T17:30:59Z,Deere Unusual Options Activity, 
33526711,DE,2023-08-02T16:43:13Z,"EXCLUSIVE: Tech Giants Set The Stage But AI Revolution Will Span From Pharma To Farming, Ivan Feinseth Says", 
33579464,DE,2023-08-04T17:35:34Z,10 Industrials Stocks Whale Activity In Today's Session, 
33605974,DE,2023-08-07T17:15:48Z,Check Out What Whales Are Doing With Deere, 
33672519,DE,2023-08-09T16:17:36Z,"Deutsche Bank Maintains Hold on Deere, Raises Price Target to $398",
33677040,DE,2023-08-09T19:30:22Z,"If You Invested $100 In This Stock 15 Years Ago, You Would Have $700 Today", 
33842943,DE,2023-08-14T19:46:06Z,Check Out What Whales Are Doing With Deere, 
33895583,DE,2023-08-17T14:00:31Z,Deere's Earnings: A Preview, 
33909454,DE,2023-08-18T06:49:59Z,"Applied Materials, Ross Stores, And 3 Stocks To Watch Heading Into Friday","With U.S. stock futures trading mixed this morning on Friday, some of the stocks that may grab investor focus today are as follows:
"
33911024,DE,2023-08-18T10:06:01Z,"Deere Q3 EPS $10.20 Beats $8.20 Estimate, Sales $15.80B Beat $14.25B Estimate",
33911162,DE,2023-08-18T10:08:52Z,Deere Boosts FY23 Net Income Attributable Outlook From $9.25B-$9.50B To $9.75B-$10.00B,
33912965,DE,2023-08-18T12:30:58Z,Deere Excels Q3 Earnings Estimates; Lifts Annual Profit Outlook,"Deere &amp; Co (NYSE: DE) reported Q3 FY23 net sales and revenue growth of 12% Y/Y to $15.80 billion, beating the "
33916001,DE,2023-08-18T14:17:10Z,"Deere & Co Exec Says Demand For Earthmoving & Compact Construction Equipment Remains Robust, Driven Primarily By Early Stages Of Infrastructure Spending & Rental Re-Fleeting",
33914724,DE,2023-08-18T14:20:51Z,"SpaceX On Par With Intel, Disney; US Weight Loss Drugs Pricier; Moderna, Pfizer's Shot Effective Against New Variant: Today's Top Stories",Benzinga
33916093,DE,2023-08-18T14:22:27Z,"Deere & Co Exec Says Co ""Trimmed"" Equipment Production In Brazil On The Back Half Of 2023",
33916322,DE,2023-08-18T14:31:45Z,"Deere & Co Exec Says Grain Prices Have Definitely Seen A Large Amount Of Volatility This Year, But Equipment Demand Has Remained Strong, Particularly For Large AG",
33917242,DE,2023-08-18T15:08:42Z,US Stocks Sink; Deere Shares Fall Despite Earnings Beat,"U.S. stocks traded down this morning with the Nasdaq Composite falling more than 101 points on Friday.

The Dow traded down 0.23% to 34,396.96 while the NASDAQ fell 0.91% to 13,196.22. The S&amp;P 500 also fell, dropping 0.45% to 4,350.51."
33912034,DE,2023-08-18T18:02:55Z,US Stocks Brace for Toughest Week Since March Amid China Concerns: What's Driving Markets Friday?,"The major U.S. stock indices continued to weaken as of 1:30 p.m. ET trading in New York. They are poised to conclude the third consecutive week of losses, also marking the worst weekly performance since March."
33956923,DE,2023-08-21T07:57:42Z,Fear & Greed Index Remains In 'Neutral' Zone After US Stocks Record Weekly Loss,"The CNN Money Fear and Greed index remained in the &#34;Neutral&#34; zone after U.S. stocks closed mixed on Friday.

U.S. stocks recorded losses last week, with the Dow falling 2.2%. The S&amp;P 500 declined 2.1%, recording losses for the straight week."
33959813,DE,2023-08-21T11:03:22Z,"JP Morgan Maintains Neutral on Deere, Lowers Price Target to $380",
33960444,DE,2023-08-21T11:37:51Z,"Credit Suisse Maintains Outperform on Deere, Lowers Price Target to $551",
33960670,DE,2023-08-21T11:55:44Z,"UBS Maintains Neutral on Deere, Raises Price Target to $408",
33961447,DE,2023-08-21T12:25:17Z,These Analysts Revise Their Forecasts On Deere After Q3 Results,Deere &amp; Co  (NYSE: DE) reported better-than-expected earnings for its third quarter.
33961629,DE,2023-08-21T12:32:14Z,"Oppenheimer Maintains Outperform on Deere, Lowers Price Target to $458",
33962357,DE,2023-08-21T13:01:55Z,NVIDIA To Rally Over 80%? Here Are 10 Other Analyst Forecasts For Monday,"
	Credit Suisse lowered the price target for  The Walt Disney Company (NYSE: DIS) from $126 to $122. Credit Suisse analyst Douglas Mitchelson maintained an Outperforn rating. Disney shares gained 0.4% to $86.27 in pre-market trading.
"
33963250,DE,2023-08-21T13:36:14Z,"Stifel Maintains Buy on Deere, Lowers Price Target to $460",
33966217,DE,2023-08-21T15:35:13Z,"Deutsche Bank Maintains Hold on Deere, Raises Price Target to $407",
33966822,DE,2023-08-21T16:01:05Z,Looking At Deere's Recent Unusual Options Activity, 
34097342,DE,2023-08-29T16:46:27Z,Deere Unusual Options Activity For August 29, 
34120321,DE,2023-08-30T16:31:38Z,Deere & Company Raises Quarterly Dividend From $1.25 To $1.35 Per Share,
34150253,DE,2023-08-31T16:00:22Z,"If You Invested $100 In This Stock 5 Years Ago, You Would Have $300 Today", 
34287832,DE,2023-09-06T17:16:54Z,Check Out What Whales Are Doing With Deere, 
34369162,DE,2023-09-08T18:45:50Z,This Is What Whales Are Betting On Deere, 
34545340,DE,2023-09-13T17:30:46Z,Deere Unusual Options Activity For September 13, 
34572818,DE,2023-09-14T10:21:35Z,"Stephanie Link On CNBC Mentioned Halliburton, Deere, TJX As Her Top Picks",
34607143,DE,2023-09-15T09:50:11Z,"HSBC Initiates Coverage On Deere with Buy Rating, Announces Price Target of $486",
34618735,DE,2023-09-15T15:00:44Z,"Benzinga's Top Ratings Upgrades, Downgrades For September 15, 2023", 
34630501,DE,2023-09-15T20:30:23Z,Here's How Much $100 Invested In Deere 5 Years Ago Would Be Worth Today, 
34696535,DE,2023-09-18T15:45:58Z,Looking At Deere's Recent Unusual Options Activity, 
34719284,DE,2023-09-19T09:45:18Z,"Evercore ISI Group Downgrades Deere to In-Line, Lowers Price Target to $424",
34724358,DE,2023-09-19T12:01:22Z,12 Analysts Have This to Say About Deere, 
34733445,DE,2023-09-19T15:00:28Z,"Benzinga's Top Ratings Upgrades, Downgrades For September 19, 2023", 
34741246,DE,2023-09-19T20:30:27Z,Peering Into Deere's Recent Short Interest, 
34818282,DE,2023-09-22T09:30:19Z,"Canaccord Genuity Downgrades Deere to Hold, Lowers Price Target to $400",
34821389,DE,2023-09-22T12:14:04Z,Micron Technology To Rally Around 21%? Here Are 10 Other Analyst Forecasts For Friday,"
	Loop Capital increased the price target for  Splunk Inc.  (NASDAQ: SPLK) from $135 to $157. Loop Capital analyst Yun Kim downgraded the stock from Buy to Hold. Splunk shares fell 0.1% to $144.25 in pre-market trading.
"
34825538,DE,2023-09-22T15:00:39Z,"Benzinga's Top Ratings Upgrades, Downgrades For September 22, 2023", 
34879678,DE,2023-09-25T20:02:01Z,Looking At Deere's Recent Unusual Options Activity, 
34920699,DE,2023-09-26T17:35:31Z,8 Industrials Stocks With Whale Alerts In Today's Session, 
35005690,DE,2023-09-29T15:30:20Z,"If You Invested $1000 In This Stock 5 Years Ago, You Would Have $2,500 Today", 
35038836,DE,2023-10-02T18:45:58Z,This Is What Whales Are Betting On Deere, 
35111997,DE,2023-10-05T15:45:24Z,How Is The Market Feeling About Deere?, 
35113214,DE,2023-10-05T16:40:40Z,"Live On CNBC, Jim Lebenthal Announces Bought More Deere & Co And Bought More Oracle",
35150695,DE,2023-10-09T19:57:32Z,Israel's Agricultural Frontlines: How Agri-Giants' Ties Could Be Affected By War,"Tensions in the Middle East have escalated rapidly. Since Hamas&#39;s first attack on Israel three days ago, nine U.S. citizens have been killed, as reported by the Washington Post, citing a State Department spokesman."
35169627,DE,2023-10-10T19:00:54Z,This Is What Whales Are Betting On Deere, 
35235481,DE,2023-10-13T08:02:06Z,Analysts See AGCO And Trimble's $2.4B Partnership As 'Positive Catalyst' For Farm Equipment Giant's Stock, 
35311227,DE,2023-10-18T15:05:19Z,Unlocking Value and Investor Rewards: Toro Thrives with Strong Performance and Growing Profits,"On October 18, 2023, Toro (NYSE:TTC) will distribute a dividend payout of $0.34 per share, equating to an annualized dividend yield of 1.67%. Shareholders who owned the stock before the ex-dividend date on October 03, 2023 will receive this payout."
35354903,DE,2023-10-20T17:00:27Z,"$1000 Invested In This Stock 5 Years Ago Would Be Worth $2,600 Today", 
35396257,DE,2023-10-24T14:45:30Z,Peering Into Deere's Recent Short Interest, 
35470772,DE,2023-10-27T18:01:53Z,Check Out What Whales Are Doing With Deere, 
35523624,DE,2023-10-31T19:30:56Z,Check Out What Whales Are Doing With Deere, 
35592511,DE,2023-11-03T14:30:17Z,Here's How Much $1000 Invested In Deere 5 Years Ago Would Be Worth Today, 
35651480,DE,2023-11-07T17:02:32Z,Check Out What Whales Are Doing With Deere, 
35674916,DE,2023-11-08T15:05:23Z,Achieving Growth and Investor Rewards: Deere Flourishes with Strong Performance and Rising Profits,"As the day concludes, Deere (NYSE:DE) is preparing to distribute a dividend payout of $1.35 per share, resulting in an annualized dividend yield of 1.34%. This payout is exclusive to investors who held the stock before the ex-dividend date on September 28, 2023."
35726912,DE,2023-11-10T15:15:22Z,How Is The Market Feeling About Deere?, 
35756205,DE,2023-11-13T17:01:02Z,Looking At Deere's Recent Unusual Options Activity, 
35757916,DE,2023-11-13T18:01:03Z,"CNBC Halftime Report Final Trades: Deere & Company, Uber Technologies, Cadence Design Systems",
35769788,DE,2023-11-14T13:19:17Z,"Uber, Deere, Cadence Design And More On CNBC's 'Final Trades'","On CNBC’s &#34;Halftime Report Final Trades,&#34;  Stephen Weiss of Short Hills Capital Partners named  Deere &amp; Company (NYSE: DE), which is expected to report quarterly earnings "
35848036,DE,2023-11-17T14:00:15Z,"$1000 Invested In This Stock 5 Years Ago Would Be Worth $2,700 Today", 
35857855,DE,2023-11-17T21:35:46Z,US Stock Market Posts Another Week Of Gains As Inflation Softens: This Week In The Markets,"Stock markets have notched their third successive week of gains, buoyed by inflation data falling short of forecasts. The Fed futures market anticipates four rate cuts in 2024."
35894785,DE,2023-11-21T14:00:14Z,Earnings Outlook For Deere, 
35901946,DE,2023-11-21T17:35:23Z,10 Industrials Stocks Whale Activity In Today's Session, 
35902940,DE,2023-11-21T18:23:22Z,"Deere & Co. Earnings Preview: Solid Results Expected, But Don't Expect Share Price Pop",Deere &amp; Co. reports Q4 earnings on Nov. 22 with a share price that has fallen 15% in the past 4 months. Could this be an opportunity to buy?
35911318,DE,2023-11-22T07:03:08Z,Deere Gears Up For Q4 Print; These Most Accurate Analysts Revise Forecasts Ahead Of Earnings Call,"Deere &amp; Company (NYSE: DE) is projected to release financial results for its fourth quarter 2023, before the opening bell on Nov. 22, 2023."
