ID,Ticker,Date,Headline,Summary
40414749,DE,2024-08-16T11:51:24Z,Alibaba To Rally Around 11%? Here Are 10 Top Analyst Forecasts For Friday, 
40416310,DE,2024-08-16T13:00:16Z,"Citigroup Maintains Neutral on Deere, Raises Price Target to $395",
40416800,DE,2024-08-16T13:13:53Z,These Analysts Boost Their Forecasts On Deere Following Upbeat Earnings, 
40420763,DE,2024-08-16T16:09:34Z,"Truist Securities Reiterates Buy on Deere, Raises Price Target to $443",
40424085,DE,2024-08-16T19:16:43Z,Market Whales and Their Recent Bets on Deere Options, 
40441372,DE,2024-08-19T14:03:01Z,"Evercore ISI Group Maintains In-Line on Deere, Raises Price Target to $378",
40445354,DE,2024-08-19T17:00:19Z,"If You Invested $100 In This Stock 5 Years Ago, You Would Have $200 Today", 
40472362,DE,2024-08-20T20:01:41Z,Decoding Deere's Options Activity: What's the Big Picture?, 
40531688,DE,2024-08-23T16:01:13Z,A Closer Look at Deere's Options Market Dynamics, 
40558621,DE,2024-08-26T16:55:41Z,"Morgan Stanley Maintains Overweight on Deere, Lowers Price Target to $425",
40558737,DE,2024-08-26T17:00:25Z,The Analyst Landscape: 13 Takes On Deere, 
40583951,DE,2024-08-27T17:35:23Z,10 Industrials Stocks Whale Activity In Today's Session, 
40606975,DE,2024-08-28T16:30:58Z,Looking At Deere's Recent Unusual Options Activity, 
40797937,DE,2024-09-10T15:31:27Z,John Deere Hits A Bump: Stock Slips Amid $9.93M Bribery Settlement,"Deere &amp; Co. (NYSE:DE) to pay $9.93 million to settle SEC bribery probe, dragging stock down. Analysts optimistic about long-term growth."
40837828,DE,2024-09-12T16:00:35Z,Here's How Much You Would Have Made Owning Deere Stock In The Last 5 Years, 
40858749,DE,2024-09-13T17:08:40Z,Smart Money Is Betting Big In Deere Options, 
40922042,DE,2024-09-18T15:04:11Z,Behind the Scenes of Deere's Latest Options Trends, 
40923390,DE,2024-09-18T15:58:37Z,20 S&P 500 Stocks That Move The Most When The Fed Starts Cutting Interest Rates,"Investors are anticipating the first cut to the federal funds rate in over four years at the September FOMC meeting. The market is divided on the magnitude of the cut, which could trigger significant reactions. Goldman Sachs data reveals the top S&amp;P 500 stocks to watch during Fed easing cycles."
40962454,DE,2024-09-20T16:48:13Z,Deere's Options: A Look at What the Big Money is Thinking, 
40993998,DE,2024-09-24T01:47:57Z,Mark Cuban Says Trump's Lack Of Understanding Business Is 'Insane' — Slams 200% Tariff Threat On John Deere: 'Good Way To Destroy A Legendary American Company',"Ahead of the 2024 presidential election, former President Donald Trump has made headlines with his latest trade policy proposal, promising hefty tariffs on vehicles produced by alleged Chinese factories in Mexico."
41022098,DE,2024-09-25T11:52:14Z,"Experts Slam Trump's 200% Tariff Threat To John Deere: 'You'll Find No Serious, Respected Trade Economists Thinking That This Is A Good Idea'","Ahead of the 2024 presidential election, former President Donald Trump has made headlines with his latest trade policy proposal, promising hefty tariff on John Deere "
41033980,DE,2024-09-25T19:54:46Z,Trump's Tariff Threat Could Hit John Deere Stock: Pro-Trump Congress Member Faces Potential Losses,Donald Trump&#39;s tariff threat on John Deere could hurt DE shares and members of Congress who own the stock.
41046503,DE,2024-09-26T13:04:07Z,John Deere Recalls Compact Utility Tractors Due To Crash Hazard,
41048013,DE,2024-09-26T14:00:15Z,Here's How Much $1000 Invested In Deere 5 Years Ago Would Be Worth Today, 
41051661,DE,2024-09-26T16:19:22Z,"Mark Cuban Compares Donald Trump, Small Businesses To Hammers And Nails: 'Do You Want To Be Underneath A Hammer?'",Mark Cuban doesn&#39;t think Donald Trump&#39;s plan to put large tariffs on American companies will fight off Chinese competition.
41055153,DE,2024-09-26T19:31:06Z,Smart Money Is Betting Big In Deere Options, 
41126775,DE,2024-10-01T18:31:25Z,This Is What Whales Are Betting On Deere, 
41212582,DE,2024-10-07T17:00:14Z,"If You Invested $100 In This Stock 5 Years Ago, You Would Have $200 Today", 
41236003,DE,2024-10-08T17:35:23Z,10 Industrials Stocks Whale Activity In Today's Session, 
41254171,DE,2024-10-09T15:41:24Z,"Truist Securities Maintains Buy on Deere, Raises Price Target to $496",
41256147,DE,2024-10-09T17:02:34Z,"CNBC Halftime Report Final Trades: Copart, Amgen, Deere & Company, iShares U.S. Healthcare ETF",
41261119,DE,2024-10-09T21:00:25Z,What 10 Analyst Ratings Have To Say About Deere, 
41261639,DE,2024-10-09T21:23:23Z,"Citigroup Maintains Neutral on Deere, Raises Price Target to $420",
41270890,DE,2024-10-10T12:49:12Z,"Deere, Amgen, Copart And More: CNBC's 'Final Trades'","On CNBC&#39;s &#34;Halftime Report Final Trades,&#34; Jim Lebenthal of Cerity Partners named Deere &amp; Company as his final trade."
41291453,DE,2024-10-11T13:33:15Z,"JP Morgan Maintains Neutral on Deere, Raises Price Target to $420",
41292585,DE,2024-10-11T14:32:41Z,Deere's Options Frenzy: What You Need to Know, 
41348822,DE,2024-10-16T01:41:48Z,Mark Cuban Says He Knows What Trump Wants To Achieve With Tariffs But The Ex-President Has No Idea What It Takes To Do It — 'That's How Crazy His Approach Is', 
41388430,DE,2024-10-17T17:54:02Z,"FTC Probes Deere In Antitrust, Consumer Protection Inquiry",
41454874,DE,2024-10-22T14:01:40Z,"John Deere, Trimble Partner To Deliver Advanced Technology Solutions To More Construction Customers Worldwide; Enables Machines Equipped With John Deere SmartGrade Greater Access To Trimble Technology Ecosystem",
41496093,DE,2024-10-23T17:00:51Z,What the Options Market Tells Us About Deere, 
41613462,DE,2024-10-29T21:30:18Z,Here's How Much $100 Invested In Deere 5 Years Ago Would Be Worth Today, 
41814963,DE,2024-11-07T16:31:13Z,Here's How Much You Would Have Made Owning Deere Stock In The Last 5 Years, 
41825048,DE,2024-11-07T21:25:15Z,Alcohol Stocks To Get A Boost From 2024 Election? Busy Liquor Stores Say Voters 'Drowning Their Sorrows Or Celebrating',"American voters may have bought more alcohol than normal on Election Day in 2024, at least in the state of New York."
41856784,DE,2024-11-08T20:43:22Z,Elon Musk's Wealth Tops $300 Billion As Tesla's Market Cap Soars Above $1 Trillion,"Elon Musk&#39;s net worth reached $305 billion after Tesla&#39;s stock surged following Trump&#39;s election. He is now the richest person, surpassing Bezos."
41912769,DE,2024-11-12T17:35:23Z,10 Industrials Stocks Whale Activity In Today's Session, 
42067622,DE,2024-11-19T16:11:49Z,Nebraska Files Antitrust Lawsuit Against Heavy-Duty Truck Manufacturers Over Plans To Restrict Diesel Truck Output In Favor Of EVs,
42088808,DE,2024-11-20T14:00:58Z,What to Expect from Deere's Earnings, 
42103337,DE,2024-11-21T05:16:34Z,Deere Gears Up For Q4 Print; Here Are The Recent Forecast Changes From Wall Street's Most Accurate Analysts, 
42103475,DE,2024-11-21T05:36:58Z,"Nvidia, Deere And 3 Stocks To Watch Heading Into Thursday", 
42103559,DE,2024-11-21T05:58:33Z,"Dow Gains Over 100 Points, Nvidia Posts Upbeat Earnings After Closing Bell: Fear & Greed Index Remains In 'Neutral' Zone", 
42105503,DE,2024-11-21T08:32:10Z,"Earnings Scheduled For November 21, 2024", 
42107184,DE,2024-11-21T11:07:15Z,"Deere Q4 2024 GAAP EPS $4.55 Beats $3.90 Estimate, Sales $11.143B Beat $9.335B Estimate",
42107863,DE,2024-11-21T11:50:07Z,"US Futures Head Lower As Nvidia Earnings Fail To Impress Investors: Expert Says Market Weakness Is 'Perfectly Normal,' But Late November Rally Is Still Possible",U.S.
42108331,DE,2024-11-21T12:02:24Z,Deere & Company Projects Fiscal 2025 Net Income Between $5B-$5.5B,
42110605,DE,2024-11-21T13:25:16Z,"Deere Q4 Earnings: Beats Expectations, Steep Sales Drop, Margins Squeeze & More","Deere &amp; Co reported a decline in net sales and revenue for Q4 2024, but beat expectations and announced a fiscal 2025 net income projection of $5.0-$5.5 billion."
42115302,DE,2024-11-21T15:22:52Z,"Deere CFO Says Expect Farm Fundamentals To Remain Depressed Globally In 2025; Executive Says Production Costs For Fy Came In Favorable, Primarily Due To YoY Improvements In Material And Freight Costs Across All Business Segments",
42115708,DE,2024-11-21T15:31:59Z,This Is What Whales Are Betting On Deere, 
42119233,DE,2024-11-21T17:32:22Z,Crude Oil Gains 1%; Deere Posts Better-Than-Expected Earnings, 
42121049,DE,2024-11-21T18:57:14Z,"Small Caps Rally, Alphabet Plummets, Bitcoin Flirts With $100,000: What's Driving Markets Thursday?",Wall Street witnessed a positive momentum on Thursday as investor risk appetite remained resilient despite escalating geopolitical tensions in Europe.
42137942,DE,2024-11-22T14:03:12Z,Jim Cramer Says This Stock Is A Bitcoin Play And He Prefers To Own Bitcoin,"On CNBC&#39;s “Mad Money Lightning Round,” Jim Cramer said MicroStrategy Incorporated (NASDAQ:MSTR) is a Bitcoin play and he prefers to actually own Bitcoi"
42138023,DE,2024-11-22T14:06:13Z,"Barclays Maintains Overweight on Deere, Raises Price Target to $475",
42138815,DE,2024-11-22T14:27:34Z,"Oppenheimer Maintains Outperform on Deere, Raises Price Target to $477",
42139188,DE,2024-11-22T14:45:49Z,"JP Morgan Maintains Neutral on Deere, Raises Price Target to $450",
42141497,DE,2024-11-22T16:00:21Z,Peeling Back The Layers: Exploring Deere Through Analyst Insights, 
42142656,DE,2024-11-22T16:45:47Z,"Deere Posts Q4 Beat: 2025 Outlook Isn't Rosy But Company Has 'Relative Strength,' Analysts Say",Deere &amp; Co (DE) shares rise on upbeat Q4 results and 2025 guidance. Analysts maintain Buy and Outperform ratings with target prices up to $504.
42144169,DE,2024-11-22T17:50:37Z,"Truist Securities Maintains Buy on Deere, Raises Price Target to $538",
42147259,DE,2024-11-22T20:54:58Z,Behind the Scenes of Deere's Latest Options Trends, 
42149539,DE,2024-11-22T22:28:56Z,"UBS Maintains Neutral on Deere, Raises Price Target to $462",
42164791,DE,2024-11-25T14:20:58Z,"Morgan Stanley Maintains Overweight on Deere, Raises Price Target to $450",
42170451,DE,2024-11-25T17:35:20Z,9 Industrials Stocks With Whale Alerts In Today's Session, 
42195270,DE,2024-11-26T17:01:29Z,Deere Unusual Options Activity For November 26, 
42196223,DE,2024-11-26T17:35:22Z,10 Industrials Stocks With Whale Alerts In Today's Session, 
42235321,DE,2024-11-28T17:35:16Z,8 Industrials Stocks Whale Activity In Today's Session, 
42300129,DE,2024-12-03T19:30:48Z,The Deere & Company Increases Quarterly Dividend From $1.47 To $1.62 Per Share,
42360225,DE,2024-12-06T11:24:11Z,"Jefferies Downgrades Deere to Hold, Maintains Price Target to $510",
42362072,DE,2024-12-06T13:07:17Z,This Deere Analyst Is No Longer Bullish; Here Are Top 5 Downgrades For Friday, 
42369312,DE,2024-12-06T17:35:35Z,9 Industrials Stocks Whale Activity In Today's Session, 
42398003,DE,2024-12-09T19:19:10Z,"Citigroup Maintains Neutral on Deere, Raises Price Target to $470",
42399139,DE,2024-12-09T20:30:47Z,"If You Invested $1000 In This Stock 5 Years Ago, You Would Have This Much Today", 
42441187,DE,2024-12-11T16:00:13Z,Here's How Much $100 Invested In Deere 5 Years Ago Would Be Worth Today, 
42593562,DE,2024-12-19T15:11:21Z,"Truist Securities Maintains Buy on Deere, Raises Price Target to $550",
42597652,DE,2024-12-19T16:46:56Z,Market Whales and Their Recent Bets on Deere Options, 
42598905,DE,2024-12-19T17:35:20Z,7 Industrials Stocks With Whale Alerts In Today's Session, 
42600915,DE,2024-12-19T19:00:25Z,A Glimpse Into The Expert Outlook On Deere Through 12 Analysts, 
42635878,DE,2024-12-21T21:00:00Z,"Deal Dispatch: Honeywell, Textron And Soho House Are Making M&A Moves","In addition to the latest deal coverage, we include a snippet from our exclusive chat with Tony Roma&#39;s CEO Mina Haque."
42690771,DE,2024-12-26T17:45:28Z,Deere's Options: A Look at What the Big Money is Thinking, 
42710619,DE,2024-12-27T20:44:49Z,"Deal Dispatch: Party City Wraps Up, Big Lots Goes Bust, The Container Store Continues", 
42757209,DE,2025-01-01T21:30:11Z,$100 Invested In Deere 5 Years Ago Would Be Worth This Much Today, 
42787400,DE,2025-01-03T15:03:18Z,"Molson Coors, Diageo, Boston Beer Plunge As Surgeon General Warns 'Alcohol Consumption Increases' Cancer Risk","Surgeon General warns of cancer risks from alcohol, urges updates to labels and limits. Stocks of major alcohol companies plunge in response."
42792440,DE,2025-01-03T17:45:32Z,What the Options Market Tells Us About Deere, 
42835400,DE,2025-01-07T01:47:42Z,"McDonald's Ditches DEI Initiatives Amid Pressure From Conservative Activists, Cites 'Shifting Legal Landscape'","McDonald&#39;s Corp. (NYSE: MCD) is rolling back several diversity initiatives at its corporate level, including retiring its 35% diversity leadership goal and removing supplier diversity, equity, and inclusion requirements, the company announced in an employee letter on Monday, Jan. 6."
42921543,DE,2025-01-10T17:35:23Z,10 Industrials Stocks Whale Activity In Today's Session, 
42991114,DE,2025-01-14T22:15:57Z,"Reported Earlier, John Deere Plans To Offer Centralized Platform For Self-Repair",
43001254,DE,2025-01-15T13:34:34Z,"JP Morgan Maintains Neutral on Deere, Raises Price Target to $470",
43003674,DE,2025-01-15T14:38:19Z,Netflix To Rally Around 21%? Here Are 10 Top Analyst Forecasts For Wednesday, 
43011112,DE,2025-01-15T17:35:25Z,8 Industrials Stocks With Whale Alerts In Today's Session, 
43014866,DE,2025-01-15T21:00:25Z,Deere Stock: A Deep Dive Into Analyst Perspectives (11 Ratings), 
43121368,DE,2025-01-22T09:47:50Z,Cathie Wood's Ark Invest Buys Into Defense And Energy Stocks Amid Trump's Inaugural Policies,"Cathie Wood-led Ark Invest made significant trades involving ACCD, DE, NTLA, PATH, CCJ, OKLO, ILMN, ESLT, and ABSI."
43150890,DE,2025-01-23T03:05:19Z,Cathie Wood's Wednesday Moves: Ark Invest Dumps Robinhood Stock,"On Wednesday January 22, 2025, Cathie Wood-led Ark Invest sold $927,107 worth of Robinhood shares."
43169697,DE,2025-01-23T17:36:22Z,10 Industrials Stocks Whale Activity In Today's Session, 
43198506,DE,2025-01-24T17:36:36Z,10 Industrials Stocks With Whale Alerts In Today's Session, 
43219118,DE,2025-01-26T18:45:17Z,Morgan Stanley Reveals Top 20 AI-Driven Stocks as Adoption Hits Critical Mass,"Katy Huberty, the Global Head of Research at Morgan Stanley, has spotlighted 20 stocks from companies that are likely to see significant benefits from the adoption of Artificial Intelligence (AI)."
43267903,DE,2025-01-28T14:20:54Z,"Oppenheimer Maintains Outperform on Deere, Raises Price Target to $507",
43278206,DE,2025-01-28T16:59:38Z,CNH Industrial Analyst Sees 2025 As Pivotal Year For Recovery,The earnings of CNH Industrial are expected to rebound in 2025 due to improved market conditions and company-specific catalysts. Analyst upgraded rating and set target price at $16.
43506937,DE,2025-02-05T19:45:28Z,Deere's Options Frenzy: What You Need to Know, 
43547142,DE,2025-02-06T22:00:30Z,Here's How Much $100 Invested In Deere 5 Years Ago Would Be Worth Today, 
43588517,DE,2025-02-10T12:03:50Z,"JP Morgan Maintains Neutral on Deere, Raises Price Target to $500",
43590252,DE,2025-02-10T13:00:22Z,Forecasting The Future: 13 Analyst Projections For Deere, 
43684905,DE,2025-02-13T07:38:45Z,"Deere, GE HealthCare And 3 Stocks To Watch Heading Into Thursday", 
43684932,DE,2025-02-13T07:44:22Z,"Dow Dips More Than 200 Points Following Inflation Report, Megacap Tech Stocks Edge Lower: Greed Index In 'Fear' Zone", 
43685550,DE,2025-02-13T08:32:25Z,"Earnings Scheduled For February 13, 2025", 
43686908,DE,2025-02-13T10:52:18Z,US Stocks Set For A Mixed Start Following Higher Inflation Print: Expert Says Earnings Remain Strong Despite Uncertainty,"U.S. stock futures were mixed on Thursday after a hotter-than-expected January inflation print, which was released on Wednesday."
43687224,DE,2025-02-13T11:04:10Z,"Deere Q1 2025 GAAP EPS $3.19 Beats $3.14 Estimate, Sales $8.51B Beat $7.70B Estimate",
43687282,DE,2025-02-13T11:08:00Z,Deere Sees FY Net Income Of $5.0B-$5.5B. Outlook Does Not Reflect The Impacts Of Potential Import Tariffs By U.S.,
43692928,DE,2025-02-13T13:47:58Z,"Deere Q1 Earnings: Sales Drop, Margins Shrink, Inventory Streamlining  And More","
Deere &amp; Co (NYSE: DE) reported a 30% decline in net sales and revenue for Q1 2025, beating expectations. EPS was $3.19, down from $6.23 YoY. The company expects a sales decline across segments and reaffirms fiscal 2025 net income to be between $5.0 billion and $5.5 billion. DE shares traded lower by 4.97% at $452.87 premarket."
43698670,DE,2025-02-13T15:36:53Z,"Deere CFO Says In Terms Of Components Or Component Sourcing, About 10% Of Co's U.S. Manufacturing Cost Of Goods Sold Come From Mexico",
43698793,DE,2025-02-13T15:38:27Z,"Deere CFO Says In Terms Of Components Or Component Sourcing, Less Than 2% Of Co's U.S. Manufacturing Cost Of Goods Sold Come From From China & About 1% From Canada",
43698806,DE,2025-02-13T15:39:07Z,Deere CFO Says Exposure To Recently Enacted China Tariffs Is Expected To Have An Immaterial Amount On Co's Business,
43704167,DE,2025-02-13T17:35:23Z,10 Industrials Stocks Whale Activity In Today's Session, 
43707266,DE,2025-02-13T19:00:24Z,Dow Jumps Over 100 Points; Deere Posts Upbeat Earnings, 
43708650,DE,2025-02-13T19:34:50Z,"Stocks Rise Despite Hot Producer Inflation, Intel Soars, Bitcoin Drops Below $96,000: What's Driving Markets Thursday?","Wall Street climbed on Thursday, even as the Producer Price Index (PPI) sharply exceeded estimates in January, reigniting concerns over persistent inflationary pressures. "
43718627,DE,2025-02-14T01:47:13Z,"Cathie Wood Offloads $17 Million Worth Of Surging Robinhood Shares, Buys Up Deere & Co Stock Despite Decline In Net Sales","On Thursday, February 13, 2025 Cathie Wood-led Ark Invest sold $17.01 million worth of Robinhood shares even as the stock ended the day higher by almost 14%. Ark purchased Deere &amp; Co. stock worth about the same amount."
43726246,DE,2025-02-14T12:24:03Z,TRADEPULSE POWER INFLOW ALERT: DEERE & COMPANY (DE) MOVES UP OVER 3% AFTER ALERT FROM TRADEPULSE, 
43735512,DE,2025-02-14T16:05:36Z,"Truist Securities Reiterates Buy on Deere, Lowers Price Target to $546",
43736691,DE,2025-02-14T16:33:39Z,"Citigroup Maintains Neutral on Deere, Raises Price Target to $480",
43790968,DE,2025-02-18T17:35:23Z,10 Industrials Stocks Whale Activity In Today's Session, 
43816722,DE,2025-02-19T16:02:20Z,"Evercore ISI Group Maintains In-Line on Deere, Raises Price Target to $455",
43819732,DE,2025-02-19T17:35:22Z,10 Industrials Stocks Whale Activity In Today's Session, 
43825898,DE,2025-02-19T19:00:33Z,Looking At Deere's Recent Unusual Options Activity, 
43858561,DE,2025-02-20T17:45:54Z,Alpha Buying: Insider Activity Dwindles Despite Notable Buys from Top Execs, 
43888385,DE,2025-02-21T17:44:22Z,"Live On CNBC, Jim Lebenthal Announces Sold Deere & Company",
43896332,DE,2025-02-21T21:45:13Z,$100 Invested In Deere 5 Years Ago Would Be Worth This Much Today, 
44074378,DE,2025-03-03T12:37:35Z,"Baird Downgrades Deere to Neutral, Maintains Price Target to $501",
44076843,DE,2025-03-03T14:01:29Z,What Analysts Are Saying About Deere Stock, 
44124634,DE,2025-03-04T20:45:38Z,Check Out What Whales Are Doing With Deere, 
44258781,DE,2025-03-11T18:15:44Z,Deere's Options Frenzy: What You Need to Know, 
44317652,DE,2025-03-13T21:00:13Z,"If You Invested $1000 In This Stock 10 Years Ago, You Would Have This Much Today", 
44417535,DE,2025-03-20T14:01:26Z,This Is What Whales Are Betting On Deere, 
44422326,DE,2025-03-20T17:35:24Z,10 Industrials Stocks Whale Activity In Today's Session, 
44465341,DE,2025-03-24T20:30:38Z,Deere Unusual Options Activity For March 24, 
44538991,DE,2025-03-28T15:15:51Z,Behind the Scenes of Deere's Latest Options Trends, 
44542436,DE,2025-03-28T17:35:16Z,10 Industrials Stocks With Whale Alerts In Today's Session, 
44546189,DE,2025-03-28T20:27:59Z,Benzinga's 'Stock Whisper' Index: 5 Stocks Investors Secretly Monitor But Don't Talk About Yet,The Benzinga Stock Whisper Index highlights five stocks seeing increased interest from readers during the week and a look at the potential reasons why.
44589681,DE,2025-04-01T16:00:32Z,Here's How Much You Would Have Made Owning Deere Stock In The Last 10 Years, 
44647678,DE,2025-04-04T14:56:29Z,"Nasdaq 100 Enters Bear Market, Dow In Correction Territory, Traders Await Fed Chair Powell's Remarks"," Dip-buying absent in early NY trading, Wall Street deep in red as trade war fears escalate despite strong jobs report. Investors on edge for hints from Fed Chair Powell. "
44672359,DE,2025-04-07T18:35:14Z,"UBS Maintains Neutral on Deere, Lowers Price Target to $440",
44700824,DE,2025-04-08T20:24:59Z,"Citigroup Maintains Neutral on Deere, Lowers Price Target to $450",
44843808,DE,2025-04-16T15:39:21Z,"Morgan Stanley Maintains Overweight on Deere, Raises Price Target to $500",
44845744,DE,2025-04-16T16:45:14Z,"If You Invested $100 In This Stock 10 Years Ago, You Would Have This Much Today", 
44925361,DE,2025-04-22T14:26:29Z,"Oppenheimer Maintains Outperform on Deere, Raises Price Target to $513",
44926746,DE,2025-04-22T15:03:01Z,Deere's Options: A Look at What the Big Money is Thinking, 
44934303,DE,2025-04-22T19:01:19Z,A Glimpse Into The Expert Outlook On Deere Through 10 Analysts, 
44950836,DE,2025-04-23T13:57:40Z,"Top 10 Trending Stocks On WallStreetBets As Of April 23, 2025 (Via Swaggy Stocks)",
44951004,DE,2025-04-23T14:00:19Z,$100 Invested In This Stock 10 Years Ago Would Be Worth This Much Today, 
45165725,DE,2025-05-02T13:24:00Z,"Top 10 Trending Stocks On WallStreetBets As Of May 2, 2025 (Via Swaggy Stocks)",
45380141,DE,2025-05-13T14:45:20Z,Here's How Much $1000 Invested In Deere 5 Years Ago Would Be Worth Today, 
45404774,DE,2025-05-14T12:39:26Z,How To Earn $500 A Month From Deere Stock Ahead Of Q2 Earnings,"With the recent buzz around Deere, some investors may be eyeing potential gains from the company&#39;s dividends."
45416534,DE,2025-05-14T17:35:20Z,9 Industrials Stocks With Whale Alerts In Today's Session, 
45428677,DE,2025-05-15T06:29:15Z,Deere Gears Up For Q2 Print; Here Are The Recent Forecast Changes From Wall Street's Most Accurate Analysts, 
45429731,DE,2025-05-15T08:03:24Z,"S&P 500 Gains For Third Session As Tech Stocks Soar: Investor Sentiment Improves Further, Fear Index Remains In 'Greed' Zone", 
45429744,DE,2025-05-15T08:04:07Z,"Walmart, Cisco And 3 Stocks To Watch Heading Into Thursday", 
45430079,DE,2025-05-15T08:32:23Z,"Earnings Scheduled For May 15, 2025", 
45430835,DE,2025-05-15T09:42:14Z,"US Stocks Likely To Open Lower After S&P 500's Three-Day Winning Streak: '...Many Uncertainties Remain,' Says Expert",U.S. stock futures were lower on Thursday after a mixed close on Wednesday. Futures of benchmark indices were trading lower in premarket.
45431565,DE,2025-05-15T10:22:26Z,"Deere Q2 EPS $6.64 Beats $5.59 Estimate, Sales $12.76B Beat $10.79B Estimate",
45431586,DE,2025-05-15T10:25:18Z,Deere & Co Expects FY25 Net Income Of $4.75B-$5.50B,
45439918,DE,2025-05-15T14:16:12Z,"Watching Deere & Co.; During Conf Call, CEO Reportedly Says Prepared To Invest $20B In U.S. Over Next Decade; Exec Says Global Uncertainty Continues To Weigh On Customer Sentiment; Economic Uncertainty, High Interest Rates Pressuring Order Activity For Construction Equipment",
45440503,DE,2025-05-15T14:27:16Z,"Deere Posts Upbeat Earnings, Joins Foot Locker, Boot Barn, Cisco And Other Big Stocks Moving Higher On Thursday", 
45441004,DE,2025-05-15T14:34:24Z,"Watching Deere & Co.; During Conf Call, Exec Reportedly Says Saw About $100M Of Tariff Headwinds In Q2; Expect Pre-Tax Tariff Impact Of Little Over $500M In 2025; Don't See Much Opportunity For Price Mitigation To Impact Fiscal 2025; Actions We Took Over Past 18 Months Helped Right Size New Inventory Levels",
45441833,DE,2025-05-15T14:53:45Z,Deere Shares Rise After Q2 Beat Despite Steep Sales Declines Across Segments,"Deere &amp; Co. (NYSE: DE) reported Q2 2025 results with net sales and revenue beating estimates. Despite market challenges, the company remains confident in its future and plans to invest in core markets."
45448350,DE,2025-05-15T18:19:31Z,Green Light For Deere: Analyst Sees Growth Ahead Despite Tariff Concerns,"Deere &amp; Co (DE) shares rise on Q2 beat, despite 16% sales decline. FY25 net income expected to be $4.75-$5.50B. Goldman Sachs maintains Buy rating and $583 price forecast. Investors can gain exposure through VEGI and KROP ETFs. DE shares up 4.95% at $522.15."
45466936,DE,2025-05-16T13:14:22Z,"JP Morgan Maintains Neutral on Deere, Raises Price Target to $540",
45468235,DE,2025-05-16T13:54:36Z,"Barclays Maintains Overweight on Deere, Raises Price Target to $530",
45468413,DE,2025-05-16T14:00:44Z,What Analysts Are Saying About Deere Stock, 
45469689,DE,2025-05-16T14:28:49Z,"Baird Maintains Neutral on Deere, Raises Price Target to $514",
45470595,DE,2025-05-16T14:51:00Z,"B of A Securities Maintains Neutral on Deere, Raises Price Target to $556",
45472073,DE,2025-05-16T15:44:33Z,"DA Davidson Maintains Buy on Deere, Maintains $542 Price Target",
45472823,DE,2025-05-16T16:26:24Z,"Raymond James Maintains Outperform on Deere, Raises Price Target to $560",
45474029,DE,2025-05-16T17:31:15Z,"Oppenheimer Maintains Outperform on Deere, Raises Price Target to $555",
45474200,DE,2025-05-16T17:39:09Z,"Truist Securities Maintains Buy on Deere, Raises Price Target to $619",
45474232,DE,2025-05-16T17:44:04Z,Deere Analysts Increase Their Forecasts After Better-Than-Expected Results, 
45474594,DE,2025-05-16T18:06:12Z,"Deere's Resilience Shines Through Tariffs, Analysts Raise Price Forecasts"," Deere &amp; Company (NYSE: DE) saw an increase in price forecast after reporting second quarter results, with strong net sales and revenue despite tariffs."
45491914,DE,2025-05-19T12:39:17Z,"Evercore ISI Group Maintains In-Line on Deere, Raises Price Target to $493",
45498973,DE,2025-05-19T16:06:36Z,"Citigroup Maintains Neutral on Deere, Raises Price Target to $550",
