ID,Ticker,Date,Headline,Summary
18990016,EPD,2021-01-02T21:23:47Z,"Barron's First Picks And Pans Of 2021: Disney, Home Depot, Intel, Nike, Nordstrom And More","
	This weekend&#39;s Barron&#39;s cover story offers 12 alternatives to bonds for income investors.
	Other featured articles examine values stocks worth a look, parallels between internet and transportations stocks, and how to play a consumer discretionary rebound.
"
19028420,EPD,2021-01-06T06:44:42Z,"Tesla, SPACs 'May Struggle,' Natural Gas To Shine In 2021: Bill Gross",Bond king Bill Gross released his market outlook for 2021 — betting on a change in thought to the market’s high-flying stocks.
19057640,EPD,2021-01-07T13:46:41Z,Enterprise Products Partners Raises Quarterly Dividend From $0.4450 To $0.45/Share,
19088880,EPD,2021-01-09T18:47:13Z,"Benzinga's First Bulls And Bears Of 2021: Ford, Mastercard, PepsiCo, 3M, Tesla And More","
	Benzinga has examined the prospects for many investor favorite stocks over the past week. 
	The week&#39;s bullish calls included automakers and a recovering retailer.
	Beverage giants and a satellite radio leader were among the bearish calls.


"
19265480,EPD,2021-01-21T21:49:59Z,Magellan And Enterprise To Develop Joint Houston Crude Oil Futures Contract,
19459871,EPD,2021-02-03T09:00:23Z,"Earnings Scheduled For February 3, 2021"," 

Companies Reporting Before The Bell

• Bank Bradesco (NYSE:BBD) is likely to report quarterly earnings at $0.11 per share on revenue of $4.81 billion."
19461315,EPD,2021-02-03T11:13:27Z,Enterprise Prods Partners Q4 EPS $0.15 May Not Compare To $0.50 Estimate,
19779581,EPD,2021-02-22T18:00:38Z,"CNBC 'Fast Money: Halftime Report' Final Trades: Moderna, Salesforce, Enterprise Products",
19779666,EPD,2021-02-22T18:08:07Z,"'Halftime Report' Final Trades: Salesforce, Moderna And More","On CNBC&#39;s &#34;Fast Money Halftime Report,&#34; the investment committee gave their final trades.

Boston Privates’ Shannon Saccocia likes Salesforce.Com, Inc. (NYSE: CRM)."
20044996,EPD,2021-03-06T18:14:15Z,"The Past Week's Most Notable Insider Buys: Editas, Exxon Mobil, Wayfare And More","
	Insider buying can be an encouraging signal for potential investors, especially when markets face uncertainty.
	A pair of chief executives and an executive board chair were among the insiders making purchases this week.
	A media company, an e-commerce play and a real estate investment trust saw notable insider purchasing of shares.
"
20047583,EPD,2021-03-07T22:27:16Z,"Cramer Gives His Opinion On United Microelectronics, Palantir And More","On CNBC&#39;s &#34;Mad Money Lightning Round,&#34; Jim Cramer said United Microelectronics Corp (NYSE: UMC) is in exactly the sweet spot."
20170116,EPD,2021-03-15T14:25:07Z,Stocks That Hit 52-Week Highs On Monday," 

 

On Monday morning, 415 companies achieved new highs for the year."
20277663,EPD,2021-03-22T13:05:56Z,"Morgan Stanley Maintains Overweight on Enterprise Prods Partners, Raises Price Target to $33",
20500686,EPD,2021-04-06T13:34:56Z,"TD Securities Initiates Coverage On Enterprise Prods Partners with Buy Rating, Announces Price Target of $28",
20501538,EPD,2021-04-06T14:55:37Z,"Benzinga's Top Ratings Upgrades, Downgrades For April 6, 2021", 
20889413,EPD,2021-04-30T14:44:33Z,A Preview Of Enterprise Prods Partners's Earnings,"Enterprise Prods Partners (NYSE:EPD) announces its next round of earnings this Monday, May 03. Here is Benzinga&#39;s everything-that-matters guide for this Monday&#39;s Q1 earnings announcement. "
20909065,EPD,2021-05-03T08:13:04Z,"Earnings Scheduled For May 3, 2021"," 

Companies Reporting Before The Bell

• Scienjoy Holding (NASDAQ:SJ) is estimated to report quarterly earnings at $0.58 per share on revenue of $540.11 million."
20910053,EPD,2021-05-03T10:10:47Z,A Peek Into The Markets: US Stock Futures Gain Ahead Of Manufacturing Data,Pre-open movers
20910221,EPD,2021-05-03T10:14:34Z,"Enterprise Prods Partners Q1 EPS $0.61 Beats $0.48 Estimate, Sales $9.15B Beat $7.18B Estimate",
20936355,EPD,2021-05-04T12:42:39Z,A Look Into Enterprise Prods Partners Debt," 

Shares of Enterprise Prods Partners (NYSE:EPD) increased by 9.36% in the past three months. Before we understand the importance of debt, let us look at how much debt Enterprise Prods Partners has."
21027487,EPD,2021-05-10T14:08:34Z,"Cramer Advises Viewers On American Airlines, Luminar Technologies And More","On CNBC&#39;s &#34;Mad Money Lightning Round,&#34; Jim Cramer said he likes Calix Inc (NYSE: CALX), but he recommended Comcast Corporation (NASDAQ: "
21076571,EPD,2021-05-12T12:44:29Z,"Cramer Gives His Opinion On Broadcom, Chipotle And More",Jim Cramer said on CNBC&#39;s &#34;Mad Money Lightning Round&#34; that Broadcom Inc (NASDAQ: AVGO) got a lot of people spooked because it makes parts for Apple Inc (NASDAQ: 
21105918,EPD,2021-05-13T13:40:33Z,"Wells Fargo Maintains Overweight on Enterprise Prods Partners, Raises Price Target to $28",
21128446,EPD,2021-05-14T14:35:03Z,Stocks That Hit 52-Week Highs On Friday," 

During Friday&#39;s morning session, 127 stocks hit new 52-week highs."
21247313,EPD,2021-05-23T14:24:50Z,"Notable Insider Buys Of The Past Week: AT&T, GoodRx, Opendoor Technologies And More","
	Insider buying can be an encouraging signal for potential investors, especially when markets are near all-time highs.
	A couple of chief executive officers and a president were among the insiders buying shares this past week.
	A leading telecom that just announced a major deal was among companies that saw notable insider buying.
"
21452485,EPD,2021-06-07T14:14:31Z,Stocks That Hit 52-Week Highs On Monday," 

 

Before 10 a.m. ET Monday, 296 stocks made new 52-week highs."
21512692,EPD,2021-06-10T14:18:21Z,Stocks That Hit 52-Week Highs On Thursday," 

Before 10 a.m. ET on Thursday, 258 companies set new 52-week highs."
21524001,EPD,2021-06-11T11:01:47Z,"Cramer Shares His Thoughts On IBM, Trade Desk And More","On CNBC&#39;s &#34;Mad Money Lightning Round,&#34; Jim Cramer said ZIM Integrated Shipping Services Ltd (NYSE: ZIM) is too hot for him."
21532819,EPD,2021-06-11T17:18:18Z,Stocks That Hit 52-Week Highs On Friday," 

 

During Friday&#39;s morning session, 235 stocks hit new 52-week highs."
21550671,EPD,2021-06-14T14:38:45Z,Stocks That Hit 52-Week Highs On Monday," 

During Monday&#39;s morning session, 255 companies made new 52-week highs."
21700662,EPD,2021-06-24T11:15:05Z,"Wells Fargo Maintains Overweight on Enterprise Prods Partners, Raises Price Target to $30",
22079334,EPD,2021-07-21T11:47:43Z,"Raymond James Maintains Strong Buy on Enterprise Prods Partners, Raises Price Target to $28",
22189676,EPD,2021-07-28T08:27:29Z,"Earnings Scheduled For July 28, 2021"," 

Companies Reporting Before The Bell

• Barclays (NYSE:BCS) is likely to report quarterly earnings at $0.55 per share on revenue of $7.90 billion."
22191424,EPD,2021-07-28T10:23:39Z,"Enterprise Prods Partners Q2 EPS $0.50, Inline, Sales $9.45B Beat $7.56B Estimate",
22229356,EPD,2021-07-29T17:09:33Z,Understanding Enterprise Prods Partners's Unusual Options Activity, Enterprise Prods Partners (NYSE:EPD) shares experienced unusual options activity on Thursday. The stock price moved down to $22.98 following the option alert. 
22253411,EPD,2021-07-30T17:10:35Z,Analyzing Enterprise Prods Partners's Unusual Options Activity, Enterprise Prods Partners (NYSE:EPD) shares experienced unusual options activity on Friday. The stock price moved down to $22.7 following the option alert. 
22620558,EPD,2021-08-23T16:39:26Z,19 High Dividend Stocks With 5%+ Yields,"Investing for income is a difficult task right now. The Federal Reserve has kept interest rates at zero since the coronavirus pandemic, leading to lower yields across fixed income. Stocks aren’t much better, as record-high share prices has reduced the average dividend yield of the S&amp;P 500 Index to just 1.3%."
22676434,EPD,2021-08-26T14:00:23Z,"Morgan Stanley Maintains Overweight on Enterprise Prods Partners, Lowers Price Target to $30",
22707267,EPD,2021-08-28T17:06:30Z,"The Past Week's Notable Insider Buys: Callon Petroleum, Cricut, Krispy Kreme And More","
	Insider buying can be an encouraging signal for potential investors, especially when markets are near all-time highs.
	
	Some insiders were making return trips to the buy window last week.
	
	Beneficial owners were stepping up to the buy window.
	



"
22970495,EPD,2021-09-16T13:15:47Z,3 Stocks Insiders Are Buying,"When insiders purchase shares, it indicates their confidence in the company&#39;s prospects or that they view the stock as a bargain. Either way, this signals an opportunity to go long on the stock. Insider purchases should not be taken as the only indicator for making an investment or trading decision. At best, it can lend conviction to a buying decision."
23052233,EPD,2021-09-22T15:58:40Z,A Bearish Sign Appears On Enterprise Prods Partners Chart,"If history is any guide, there may be trouble ahead for shares of Enterprise Prods Partners(NYSE:EPD). A so-called &#34;death cross&#34; has formed on its chart and, not surprisingly, this could be bearish for the stock."
23236113,EPD,2021-10-05T11:34:52Z,"Mizuho Maintains Buy on Enterprise Prods Partners, Raises Price Target to $29",
23307040,EPD,2021-10-09T13:58:59Z,"15 Under 40, 14 Over 90: A Look At The Youngest And Oldest Members Of The Forbes 400 List",The annual Forbes 400 list highlights the people in the United States who have a net worth of $2.9 billion or more. The 40th annual list showed a range of ages 29 to 95 in 2021. Here is a look at the oldest and youngest people on the list and what makes their fortunes.
23436008,EPD,2021-10-19T11:06:33Z,"Wolfe Research Downgrades Enterprise Prods Partners to Peer Perform, Announces $24 Price Target",
23441632,EPD,2021-10-19T14:02:22Z,"Benzinga's Top Ratings Upgrades, Downgrades For October 19, 2021"," Upgrades
"
23455922,EPD,2021-10-20T10:45:08Z,"28 Stocks To Benefit From Inflation, According To Jim Cramer","On CNBC’s “Mad Money,” Jim Cramer advised against falling into the trap of “thinking that the whole market will get wrecked by persistent inflation.”"
23813691,EPD,2021-11-02T08:17:21Z,"Earnings Scheduled For November 2, 2021"," 

Companies Reporting Before The Bell

• Thomson Reuters (NYSE:TRI) is expected to report quarterly earnings at $0.48 per share on revenue of $1.86 billion."
23815729,EPD,2021-11-02T10:22:37Z,"Enterprise Prods Partners Q3 EPS $0.52, Inline, Sales $10.83B Beat $8.69B Estimate",
24642618,EPD,2021-12-16T13:24:00Z,"Wells Fargo Maintains Overweight on Enterprise Prods Partners, Lowers Price Target to $27",
24712256,EPD,2021-12-21T13:31:39Z,Why Jim Cramer Likes MGM Growth Properties,"On CNBC’s &#34;Mad Money Lightning Round,&#34; Jim Cramer said  Enterprise Products Partners L.P. (NYSE: EPD) is a &#34;very good company.&#34; He noted that the stock is moving lower, in part, due to those owning these master limited partnerships selling the stock."
24926723,EPD,2022-01-06T13:15:40Z,Enterprise Products Partners Raises Qtr. Distribution From $0.45 To $0.465/Unit,
24923097,EPD,2022-01-06T14:40:32Z,Why Jim Cramer Likes Illumina And Enterprise Products Partners,"On CNBC’s &#34;Mad Money Lightning Round,&#34; Jim Cramer said  Illumina, Inc. (NASDAQ: ILMN) has got &#34;unbelievable technology&#34; and he also loves the company’s diagnostic business. He recommended buying the stock."
24944402,EPD,2022-01-07T11:04:37Z,"Morgan Stanley Downgrades Enterprise Prods Partners to Equal-Weight, Announces $27 Price Target",
24948535,EPD,2022-01-07T15:38:11Z,"Benzinga's Top Ratings Upgrades, Downgrades For January 7, 2022", 
24966222,EPD,2022-01-10T12:05:32Z,Enterprise Announces Acquisition Of Navitas Midstream For $3.25B In Cash,
24990686,EPD,2022-01-11T11:53:15Z,"Mizuho Maintains Buy on Enterprise Prods Partners, Raises Price Target to $30",
25001432,EPD,2022-01-11T17:09:05Z,Expert Ratings For Enterprise Prods Partners,Enterprise Prods Partners (NYSE:EPD) has observed the following analyst ratings within the last quarter: 
25005002,EPD,2022-01-11T20:27:37Z,Oil And Gas Stocks Expected To Remain Strong: 5 Top Midstream Energy Stock Picks For 2022,"Oil and gas stocks had a great year in 2021, and analysts expect the favorable energy market environment to continue in 2022. On Tuesday, Bank of America analyst Chase Mulvehill chose his five top stock picks for 2022 in the midstream oil and gas and MLP group."
25309141,EPD,2022-01-31T15:34:21Z,Enterprise Prods Partners's Earnings Outlook,"Enterprise Prods Partners (NYSE:EPD) is set to give its latest quarterly earnings report on Tuesday, 2022-02-01. Here&#39;s what investors need to know before the announcement.
Analysts estimate that Enterprise Prods Partners will likely report an Earnings Per Share (EPS) of $0.54. "
25330461,EPD,2022-02-01T11:09:50Z,"Enterprise Prods Partners Q4 EPS $0.47 Misses $0.54 Estimate, Sales $11.37B Beat $10.00B Estimate",
25389398,EPD,2022-02-03T11:49:56Z,Insiders Buying Charter Communications And 3 More Stocks,"Meta Platforms, Inc. (NASDAQ: FB) reported weaker-than-expected earnings for its fourth quarter and issued a weak forecast, which sent the Nasdaq futures sharply lower this morning."
25779225,EPD,2022-02-23T14:53:42Z,A Bullish Sign Appears On Enterprise Prods Partners's Chart,"If history is any guide, there may be good fortune ahead for shares of Enterprise Prods Partners (NYSE:EPD).  A so-called &#34;golden cross&#34; has formed on its chart and, not surprisingly, this could be bullish for the stock."
26124627,EPD,2022-03-14T15:01:22Z,Harold Hamm Purchases $20 Million Worth Of Continental Resources,A challenging macro environment continued to roil markets last week with the S&amp;P 500 dropping 2.4% and the Nasdaq dropping 3.6%.
26214481,EPD,2022-03-21T12:34:07Z,"What Cramer Thinks About Hims & Hers Health, Gilead Sciences And More","On CNBC’s &#34;Mad Money Lightning Round,&#34; Jim Cramer said he likes  Healthcare Realty Trust Incorporated  (NYSE: HR) as the company’s merger with  Healthcare Trust of America, Inc."
26233399,EPD,2022-03-22T12:42:08Z,Why Jim Cramer Likes Truist Financial,"On CNBC’s &#34;Mad Money Lightning Round,&#34; Jim Cramer said PPG Industries, Inc. (NYSE: PPG) shares are down too much as the company has been hurt by raw costs, but that’s going to end finally."
26287932,EPD,2022-03-24T19:34:07Z,Enterprise Prods Partners Option Alert: Jan 20 $25 Calls Sweep (9) near the Ask: 314 @ $1.58 vs 17162 OI; Earnings 5/2 Before Open [est] Ref=$24.975 15:33:28; Enterprise Prods Partners Option Alert: Jan 20 $25 Calls Sweep (3) near the Ask: 212 @ $1.577 vs 17162 OI; Earnings,
26444519,EPD,2022-04-04T10:11:58Z,Evercore ISI Group Downgrades Enterprise Prods Partners to In-Line,
26450700,EPD,2022-04-04T14:04:42Z,"Benzinga's Top Ratings Upgrades, Downgrades For April 4, 2022","Upgrades
"
26661563,EPD,2022-04-18T11:26:18Z,"Raymond James Maintains Strong Buy on Enterprise Prods Partners, Raises Price Target to $30",
26707502,EPD,2022-04-20T12:00:47Z,"Enterprise Prods Partners Earnings Conference Call Is Coming Up, Here's What You Need To Know"," 

Enterprise Prods Partners (NYSE:EPD) will host a conference call at 10:00 AM ET on May 2, 2022, to discuss Q1 2022 earnings results."
26800643,EPD,2022-04-25T20:30:44Z,Enterprise And Oxy Low Carbon Ventures Sign Letter Of Intent For Gulf Coast CO2 Transportation And Sequestration Project,
26809320,EPD,2022-04-26T12:01:42Z,"Morgan Stanley Maintains Equal-Weight on Enterprise Prods Partners, Raises Price Target to $31",
26831866,EPD,2022-04-27T12:31:34Z,"Jim Cramer Shares His Thoughts On Fluor, Tilray Brands And More","On CNBC’s &#34;Mad Money Lightning Round,&#34; Jim Cramer said stocks, including  Tilray Brands, Inc.  (NASDAQ: TLRY) are impossible to own until the Fed legalizes cannabis."
26867790,EPD,2022-04-28T13:27:05Z,"Wells Fargo Maintains Overweight on Enterprise Prods Partners, Raises Price Target to $30",
26923268,EPD,2022-05-02T09:16:16Z,"Earnings Scheduled For May 2, 2022"," 

Companies Reporting Before The Bell

• New Gold (AMEX:NGD) is estimated to report quarterly earnings at $0.03 per share on revenue of $212.42 million."
26923767,EPD,2022-05-02T10:00:53Z,Enterprise Prods Partners Q1 EPS $0.59 Beats $0.53 Estimate,
26924305,EPD,2022-05-02T10:28:37Z,A Peek Into The Markets: US Stock Futures Higher Following Friday's Sell-Off,Pre-open movers
26924574,EPD,2022-05-02T11:11:57Z,What Is Leading To Lower Natural Gas Production Despite Higher Demand?,"Although many countries are looking for new suppliers to help break their dependence on Russian gas after the Ukraine-Russia conflict, U.S. natural gas production growth is decreasing."
26923881,EPD,2022-05-02T12:02:25Z,Enterprise Prods Partners: Q1 Earnings Insights," 

Enterprise Prods Partners (NYSE:EPD) reported its Q1 earnings results on Monday, May 2, 2022 at 06:00 AM.

Here&#39;s what investors need to know about the announcement."
26933332,EPD,2022-05-02T14:08:30Z,"Truist Securities Assumes Enterprise Prods Partners at Buy, Announces Price Target of $27",
26942200,EPD,2022-05-02T18:28:31Z,What 4 Analyst Ratings Have To Say About Enterprise Prods Partners,Enterprise Prods Partners (NYSE:EPD) has observed the following analyst ratings within the last quarter: 
26953498,EPD,2022-05-03T08:26:04Z,EU Looks To Africa As It Seeks To Reduce Reliance On Russia For Gas,"As Russia continues to invade several areas in Ukraine, the European Union is looking toward Africa to reduce its reliance on Russia for gas. "
26953967,EPD,2022-05-03T09:27:32Z,"Raymond James Maintains Strong Buy on Enterprise Prods Partners, Raises Price Target to $31",
26958796,EPD,2022-05-03T12:27:37Z,"Mizuho Maintains Buy on Enterprise Prods Partners, Raises Price Target to $32",
26968483,EPD,2022-05-03T16:03:44Z,Mizuho Maintains Buy Rating for Enterprise Prods Partners: Here's What You Need To Know,"Mizuho has decided to maintain its Buy rating of Enterprise Prods Partners (NYSE:EPD) and raise its price target from $30.00 to $32.00.
Shares of Enterprise Prods Partners are trading up 2.28% over the last 24 hours, at $26.20 per share."
26968747,EPD,2022-05-03T17:59:18Z,"7 Best Energy Stocks To Buy With Over 6% Dividend Yields: Ecopetrol, Energy Transfer LP And More",One of the only sectors of the market that is skyrocketing amid broad market weakness in 2022 is the energy sector.
27040381,EPD,2022-05-06T12:50:25Z,"Cramer Gives His Opinion On CoreCivic, SGHC And More","On CNBC’s &#34;Mad Money Lightning Round,&#34; Jim Cramer said  Western Midstream Partners LP (NYSE: WES) has a great yield"
27057832,EPD,2022-05-09T17:11:29Z,15 Best Dividend Stocks Across These 3 Key Sectors,"The Fed’s recent interest rate hike of 0.5% is the most significant in over 20 years.

Chairman Jerome Powell expects several additional rate hikes through the end of 2022 and into 2023 amid the highest inflation the United States has seen since December 1981."
27162251,EPD,2022-05-12T12:56:12Z,"Credit Suisse Maintains Outperform on Enterprise Prods Partners, Raises Price Target to $30",
27168254,EPD,2022-05-16T18:13:11Z,6 High-Yield Dividend Stocks To Buy And Hold In A Volatile Market,"During periods of stock market weakness, investors can still generate yield from high-quality dividend stocks. The Federal Reserve has already raised interest rates by 0.75% so far in 2022, but there are plenty of high-yield dividend stocks paying 6% or more at current prices."
27284546,EPD,2022-05-18T17:00:38Z,"CNBC Halftime Report Final Trades: Progressive Corporation, BHP Group, Doximity, Enterprise",
27284843,EPD,2022-05-18T17:38:30Z,14 Stocks Moved By Traders on 'Fast Money: Halftime Report',CNBC’s &#34;Fast Money: Halftime Report&#34; delivers market-moving news to investors.
27294396,EPD,2022-05-19T11:35:40Z,"CNBC's Final Trades: Enterprise Products Partners, BHP Group, Progressive And This Stock That Should Be Sold Now","On CNBC’s “Halftime Report Final Trades,” Jenny Harrington of Gilman Hill Asset Management said she spent the last two days at a midstream energy conference and “never felt better” about Enterprise Products Partners L.P. (NYSE: "
27642481,EPD,2022-06-10T12:35:57Z,"Cramer Shares Takes On Berkshire Hathaway, Six Flags Entertainment And More","On CNBC&#39;s &#34;Mad Money Lightning Round,&#34; Jim Cramer said he loves Enterprise Products Partners LP (NYSE: EPD). &#34;Continue to buy that one,&#34; he added."
27986617,EPD,2022-07-07T13:20:28Z,Enterprise Raises Quarterly Dividend From $0.465 To $0.475/Unit,
27998237,EPD,2022-07-08T11:41:10Z,"UBS Maintains Buy on Enterprise Prods Partners, Raises Price Target to $33",
28004938,EPD,2022-07-08T21:02:19Z,Analyst Ratings for Enterprise Prods Partners,Analysts have provided the following ratings for Enterprise Prods Partners (NYSE:EPD) within the last quarter: 
28049972,EPD,2022-07-13T15:32:04Z,ConocoPhillips (COP) Wins Approval To Develop Tommeliten Field,ConocoPhillips (NYSE: COP) received approval from the U.K. and Norway authorities for the development and operation of the Tommeliten A field in the North Sea.
28067675,EPD,2022-07-14T15:28:11Z,Here's Why Enterprise (EPD) Could Be An Attractive Bet,"Enterprise Products Partners LP (NYSE: EPD) has witnessed upward earnings estimate revisions for 2022 and 2023 in the past 60 days. So far this year, the stock, carrying a Zacks Rank #2 (Buy), has gained 12.2%, outpacing the 9.2% rise of the composite stocks belonging to the industry."
28230323,EPD,2022-07-27T17:34:15Z,Wednesday's CNBC Fast Money Halftime Report Mentions,CNBC’s &#34;Fast Money: Halftime Report&#34; delivers market-moving news to investors.
28231030,EPD,2022-07-27T17:44:11Z,"Nervous About Interest Rate Hikes? These 3 Under-the-Radar, Tax-Advantaged Securities Offer Yield Up to 14%+","For 14 years, the federal funds rate has hovered around zero. The Federal Reserve or “Fed” maintained these low rates to stimulate the economy during two steep market downturns: the 2008 Great Recession and the 2020 COVID-19 pandemic sell-off."
28243104,EPD,2022-07-28T12:05:27Z,"CNBC's Final Trades: Nvidia, Consumer Discretionary And These 3 Energy Plays","On CNBC’s “Halftime Report Final Trades,” Degas Wright of Decatur Capital Management said Enterprise Products Partners L.P."
28295222,EPD,2022-08-01T17:49:20Z,Target And Chevron Get CNBC Fast Money Mentions With Joe Terranova Rebalancing His ETF,CNBC’s &#34;Fast Money: Halftime Report&#34; delivers market-moving news to investors.
28325448,EPD,2022-08-03T08:30:17Z,"Earnings Scheduled For August 3, 2022"," 

Companies Reporting Before The Bell

• Fresh Del Monte Produce (NYSE:FDP) is likely to report quarterly earnings at $0.79 per share on revenue of $1.15 billion."
28326031,EPD,2022-08-03T10:01:01Z,Enterprise Prods Partners Q2 EPS $0.64 Beats $0.61 Estimate,
28326363,EPD,2022-08-03T11:32:30Z,Recap: Enterprise Products Partners Q2 Earnings," 

Enterprise Prods Partners (NYSE:EPD) reported its Q2 earnings results on Wednesday, August 3, 2022 at 06:00 AM.

Here&#39;s what investors need to know about the announcement."
28348499,EPD,2022-08-04T09:41:11Z,"Raymond James Maintains Strong Buy on Enterprise Prods Partners, Raises Price Target to $32",
28411166,EPD,2022-08-09T12:03:45Z,This Stock Is 'One Of The Greatest Performers Since The Show Began': Jim Cramer,"On CNBC’s &#34;Mad Money Lightning Round,&#34; Jim Cramer said  Enterprise Products Partners L.P. (NYSE: EPD) is a &#34;terrific stock.&#34; He recommended buying shares of the company."
28539642,EPD,2022-08-17T21:46:07Z,Invest Like Carolina Panthers Owner David Tepper With These 5 Big Dividend Stocks His Hedge Fund Owns,"David Tepper, the owner of the Carolina Panthers and founder of Appaloosa Management, has become a self-made billionaire through the hedge fund he manages and the gains from his stock portfolio."
28555852,EPD,2022-08-18T17:00:04Z,"CNBC Halftime Report Final Trades: Exxon Mobile, Devon Energy, Enterprise Products",
28562408,EPD,2022-08-19T12:01:01Z,CNBC's Final Trades: 4 Energy Plays With The Biggest Upside,"On CNBC’s “Halftime Report Final Trades,” Jim Lebenthal of Cerity Partners said that Exxon Mobil Corp (NYSE: XOM) is a recent addition to his portfolio."
29325693,EPD,2022-10-19T14:25:55Z,"Tudor Pickering Downgrades Enterprise Prods Partners to Hold, Announces $29 Price Target",
29329734,EPD,2022-10-19T18:20:59Z,"Enterprise Prods Partners Q3 2022 Earnings Conference Call On November 1, 2022 At 10:00 AM ET","Enterprise Prods Partners (NYSE:EPD) will host a conference call at 10:00 AM ET on November 1, 2022, to discuss Q3 2022 earnings results."
29442748,EPD,2022-10-27T16:13:42Z,Short Volatility Alert: Enterprise Products Partners L.P.,"On Wednesday, shares of Enterprise Products Partners L.P. (NYSE: EPD) experienced volatile short activity. After the activity, the stock price went up +0.52% to $25.23.

The overall sentiment for EPD has been Bullish."
29460239,EPD,2022-10-28T15:56:31Z,A Bearish Sign Appears On Enterprise Prods Partners's Chart," If history is any guide, there may be trouble ahead for shares of Enterprise Prods Partners (NYSE:EPD).  A so-called &#34;death cross&#34; has formed on its chart and, not surprisingly, this could be bearish for the stock."
29494135,EPD,2022-11-01T08:36:29Z,"Earnings Scheduled For November 1, 2022","Companies Reporting Before The Bell

• BP (NYSE:BP) is estimated to report quarterly earnings at $2.07 per share on revenue of $64.76 billion."
29494882,EPD,2022-11-01T10:06:25Z,"Enterprise Prods Partners Q3 EPS $0.62, Inline",
