ID,Ticker,Date,Headline,Summary
45822220,EPD,2025-06-06T19:15:17Z,High-Yield Stocks Flex Muscle As Growth Outlook Fades: 4 Dividend Plays To Watch In June,"Global economic uncertainty and trade tensions have sparked a shift towards high-dividend stocks, with companies like Realty Income and Enterprise Products Partners standing out for their consistent income and strong balance sheets."
46173344,EPD,2025-06-30T16:00:25Z,Is Enterprise Prods Partners Gaining or Losing Market Support?, 
46219826,EPD,2025-07-02T13:41:10Z,"Barclays Maintains Overweight on Enterprise Prods Partners, Lowers Price Target to $35",
46220997,EPD,2025-07-02T14:00:25Z,Demystifying Enterprise Prods Partners: Insights From 4 Analyst Reviews, 
46233459,EPD,2025-07-02T20:17:01Z,Enterprise Products Partners Receives Letter From BIS  Indicating Intention To Rescind License Requirements For Ethane Export To China,
46374148,EPD,2025-07-11T17:46:09Z,"Mizuho Maintains Outperform on Enterprise Prods Partners, Lowers Price Target to $38",
46464841,EPD,2025-07-17T12:26:59Z,Wall Street's Most Accurate Analysts Give Their Take On 3 Energy Delivering High-Dividend Yields, 
46631483,EPD,2025-07-25T14:01:06Z,A Peek at Enterprise Prods Partners's Future Earnings, 
46652789,EPD,2025-07-28T06:24:50Z,"Nucor, Waste Management And 3 Stocks To Watch Heading Into Monday", 
46653030,EPD,2025-07-28T06:42:58Z,Enterprise Products Partners Gears Up For Q2 Print; Here Are The Recent Forecast Changes From Wall Street's Most Accurate Analysts, 
46653283,EPD,2025-07-28T07:36:40Z,"S&P 500 Notches 5th Consecutive Record Close Following Strong Earnings: Investor Sentiment Edges Lower, But Fear Index Remains In 'Greed' Zone", 
46653701,EPD,2025-07-28T08:32:17Z,"Earnings Scheduled For July 28, 2025", 
46654577,EPD,2025-07-28T10:04:13Z,"US Stocks Likely To Open Higher As US-EU Ink Trade Deal: Tesla, Palantir, UnitedHealth In Focus",U.S. stock futures rose on Monday after ending higher on Friday. Futures of major benchmark indices were higher.
46655421,EPD,2025-07-28T11:02:19Z,"Enterprise Prods Partners Q2 EPS $0.66 Beats $0.64 Estimate, Sales $11.36B Miss $14.19B Estimate",
46660460,EPD,2025-07-28T14:03:41Z,US Stocks Mixed; Enterprise Products Partners Posts Upbeat Earnings, 
46663944,EPD,2025-07-28T15:14:31Z,"Enterprise Products Partners Posts Strong Cash Flow, Reaffirms Capex Plan",Enterprise beats earnings expectations but misses on revenue in Q2 2025. Set multiple operating records despite market challenges.
46667345,EPD,2025-07-28T16:52:04Z,"Oil, Energy Stocks Rise, Dollar Rallies On US-EU Trade Deal: What's Moving Markets Monday?","Wall Street opened the week slightly higher, led by gains in energy stocks, while the U.S. dollar posted its strongest performance in over two months, as markets reacted to the U.S.-EU trade deal struck over the weekend."
46669296,EPD,2025-07-28T18:01:16Z,'Enterprise Sees Resilience in Permian Despite Weak Oil Prices'- Bloomberg,
46686518,EPD,2025-07-29T13:07:26Z,"Stifel Maintains Buy on Enterprise Prods Partners, Lowers Price Target to $35",
46689439,EPD,2025-07-29T14:00:46Z,Deep Dive Into Enterprise Prods Partners Stock: Analyst Perspectives (6 Ratings), 
46929357,EPD,2025-08-06T21:10:56Z,Enterprise Products Partners Announces It Will Acquire A Natural Gas Gathering Affiliate Of Occidental For $580M In Cash,
47095717,EPD,2025-08-13T15:24:58Z,Reuters Cites Sources Saying Crude Oil Flows On Enterprise's Seaway Pipeline Fall Due To Flooding,
47333369,EPD,2025-08-26T14:21:20Z,"Morgan Stanley Maintains Equal-Weight on Enterprise Prods Partners, Lowers Price Target to $33",
47341299,EPD,2025-08-26T18:00:28Z,Demystifying Enterprise Prods Partners: Insights From 5 Analyst Reviews, 
47766268,EPD,2025-09-19T15:48:46Z,"Scotiabank Maintains Sector Perform on Enterprise Prods Partners, Lowers Price Target to $35",
47770191,EPD,2025-09-19T18:01:09Z,Enterprise Prods Partners Stock: A Deep Dive Into Analyst Perspectives (5 Ratings), 
48155118,EPD,2025-10-10T17:00:51Z,How Do Investors Really Feel About Enterprise Products Partners LP?, 
48334765,EPD,2025-10-21T17:00:50Z,P/E Ratio Insights for Enterprise Prods Partners, 
48498309,EPD,2025-10-29T15:02:20Z,Earnings Outlook For Enterprise Prods Partners, 
48520680,EPD,2025-10-30T10:00:44Z,"Enterprise Prods Partners Q3 EPS $0.61 Misses $0.68 Estimate, Sales $12.023B Beat $11.927B Estimate",
48522846,EPD,2025-10-30T11:12:06Z,"Earnings Scheduled For October 30, 2025", 
48535722,EPD,2025-10-30T16:36:49Z,Enterprise Products Partners Profit Slips As Lower Prices Hit Margins,"Enterprise Products Partners posted mixed third-quarter results with earnings below expectations, but revenue slightly ahead."
48538040,EPD,2025-10-30T17:40:46Z,"Meta Tumbles 10%, Google Marks Historic Rally: What's Moving Markets Thursday?","Wall Street saw a cautious tone on Thursday as major tech-heavy indexes edged lower, weighed down by mixed earnings from the mega-caps and the lingering impact of hawkish remarks from Fed Chair Jerome Powell th"
48561302,EPD,2025-10-31T14:26:28Z,"Stifel Maintains Buy on Enterprise Prods Partners, Raises Price Target to $38",
48626905,EPD,2025-11-04T16:26:06Z,"Scotiabank Maintains Sector Perform on Enterprise Prods Partners, Lowers Price Target to $34",
48971585,EPD,2025-11-20T12:09:17Z,Enterprise Announces Bahia NGL Pipeline Expansion And ExxonMobil's 40% Stake Acquisition,
48977978,EPD,2025-11-20T15:24:57Z,ExxonMobil Acquires 40% Stake In Enterprise's Bahia NGL Pipeline,"ExxonMobil acquires 40% stake in Enterprise&#39;s 550-mile Bahia NGL pipeline, expanding capacity to 1 million BPD and connecting Midland and Delaware basins to Mont Belvieu."
49113482,EPD,2025-11-28T14:00:38Z,Is the Market Bullish or Bearish on Enterprise Products Partners LP?, 
49134479,EPD,2025-12-01T13:56:08Z,"JP Morgan Downgrades Enterprise Prods Partners to Neutral, Announces $35 Price Target",
49166984,EPD,2025-12-02T17:37:31Z,"Morgan Stanley Maintains Equal-Weight on Enterprise Prods Partners, Raises Price Target to $34",
49389409,EPD,2025-12-15T12:44:50Z,Cramer Says T-Mobile Is Being 'Hurt By The Death Star That's Elon Musk',"Jim Cramer recommends Enterprise Products Partners, maintains Lumentum and DuPont, but worries about T-Mobile due to Elon Musk&#39;s influence."
49432342,EPD,2025-12-16T19:32:35Z,"Citigroup Maintains Buy on Enterprise Prods Partners, Raises Price Target to $36",
49487641,EPD,2025-12-18T17:51:58Z,"Morgan Stanley Downgrades Enterprise Prods Partners to Underweight, Maintains Price Target to $34",
49701171,EPD,2026-01-05T17:38:14Z,"Raymond James Downgrades Enterprise Prods Partners to Outperform, Maintains Price Target to $36",
49737127,EPD,2026-01-06T20:00:38Z,Price Over Earnings Overview: Enterprise Prods Partners, 
49793603,EPD,2026-01-08T18:01:17Z,"CNBC Halftime Report Final Trades: Morgan Stanley, Amazon, Leidos Holdings, Enterprise Products Partners",
49813656,EPD,2026-01-09T15:01:15Z,"Amazon, Morgan Stanley, Leidos And An Energy Stock On CNBC's 'Final Trades'",Morgan Stanley on CNBC&#39;s Halftime Report Final Trades named as a potential investment with strong tailwinds in wealth management business.
49846523,EPD,2026-01-12T15:11:22Z,"Jefferies Initiates Coverage On Enterprise Prods Partners with Hold Rating, Announces Price Target of $33",
49901011,EPD,2026-01-14T12:28:19Z,"Wolfe Research Downgrades Enterprise Prods Partners to Underperform, Announces $31 Price Target",
49903569,EPD,2026-01-14T13:50:40Z,This Arthur J. Gallagher Analyst Is No Longer Bullish; Here Are Top 5 Downgrades For Wednesday, 
49919533,EPD,2026-01-14T20:00:29Z,Analyst Expectations For Enterprise Prods Partners's Future, 
50119956,EPD,2026-01-26T08:42:50Z,"Winter Storm Fern To Impact Energy, Utility Stocks—Antero Resources, Energy Transfer, Exelon In Focus","Winter Storm Fern is anticipated to have a significant impact on energy and power production, leading to potential stock fluctuations."
50297258,EPD,2026-02-02T13:29:35Z,"Palantir, AMD, Amazon and More Stocks with Earnings This Week","Here&#39;s a look at this week&#39;s earnings calendar, featuring over 100 S&amp;P 500 members."
50298385,EPD,2026-02-02T14:01:06Z,Enterprise Prods Partners's Earnings: A Preview, 
50323991,EPD,2026-02-03T11:01:45Z,"Enterprise Prods Partners Q4 EPS $0.75 Beats $0.70 Estimate, Sales $13.793B Beat $12.364B Estimate",
50324010,EPD,2026-02-03T11:02:13Z,Insights into Enterprise Prods Partners Q4 Earnings, 
50324508,EPD,2026-02-03T11:08:13Z,Enterprise Prods Partners Q4 Earnings Report: What Investors Need to Know, 
50324654,EPD,2026-02-03T11:11:18Z,"Earnings Scheduled For February 3, 2026", 
50324877,EPD,2026-02-03T11:18:29Z,Enterprise Prods Partners Q4 Earnings Assessment, 
50324988,EPD,2026-02-03T11:24:25Z,Enterprise Prods Partners Q4 Earnings Summary & Key Takeaways, 
50325409,EPD,2026-02-03T11:36:12Z,Enterprise Prods Partners Earnings Report: Q4 Overview, 
50325632,EPD,2026-02-03T11:42:13Z,Enterprise Prods Partners: Q4 Earnings Insights, 
50325878,EPD,2026-02-03T11:50:14Z,Earnings Summary: Enterprise Prods Partners Q4, 
50326171,EPD,2026-02-03T11:58:18Z,Earnings Breakdown: Enterprise Prods Partners Q4, 
50337769,EPD,2026-02-03T15:30:11Z,Why Is Enterprise Products Partners Stock Gaining Tuesday?,"Enterprise Products Partners L.P. (NYSE: EPD) reported strong financial results for Q4 and 2025, surpassing analyst expectations."
50373897,EPD,2026-02-04T14:19:07Z,"Barclays Maintains Overweight on Enterprise Prods Partners, Raises Price Target to $38",
50387241,EPD,2026-02-04T18:19:14Z,"Citigroup Maintains Buy on Enterprise Prods Partners, Raises Price Target to $39",
50390900,EPD,2026-02-04T20:01:02Z,9 Analysts Have This To Say About Enterprise Prods Partners, 
50409933,EPD,2026-02-05T13:52:56Z,"Wells Fargo Maintains Equal-Weight on Enterprise Prods Partners, Raises Price Target to $38",
50426058,EPD,2026-02-05T18:56:26Z,"Scotiabank Maintains Sector Perform on Enterprise Prods Partners, Raises Price Target to $37",
50639946,EPD,2026-02-16T21:49:33Z,5 Best Income Stocks in This Market, 
50773277,EPD,2026-02-23T09:55:30Z,"5,000 Flights Canceled, Roads Closed: Northeast Blizzard Puts Airlines, Delivery Firms And Energy Stocks In Spotlight","In response to a powerful winter storm, major Northeast cities, including New York City, have declared states of emergency and imposed travel bans, triggering widespread flight cancellations and delays across the region."
50898761,EPD,2026-02-26T17:10:58Z,Alpha Buying: When Insider Conviction Meets High Yield, 
51032132,EPD,2026-03-04T13:12:15Z,"Stifel Maintains Buy on Enterprise Prods Partners, Raises Price Target to $41",
51071096,EPD,2026-03-05T15:51:23Z,"Barclays Maintains Overweight on Enterprise Prods Partners, Raises Price Target to $39",
51168826,EPD,2026-03-10T18:10:12Z,"JP Morgan Maintains Neutral on Enterprise Prods Partners, Raises Price Target to $39",
51170552,EPD,2026-03-10T19:00:35Z,Breaking Down Enterprise Prods Partners: 12 Analysts Share Their Views, 
51242184,EPD,2026-03-13T14:30:09Z,"Wells Fargo Maintains Equal-Weight on Enterprise Prods Partners, Raises Price Target to $40",
51295703,EPD,2026-03-17T13:20:28Z,"Scotiabank Maintains Sector Perform on Enterprise Prods Partners, Raises Price Target to $39",
51329381,EPD,2026-03-18T15:39:12Z,"Morgan Stanley Maintains Underweight on Enterprise Prods Partners, Raises Price Target to $38",
51435325,EPD,2026-03-24T15:14:54Z,"Truist Securities Initiates Coverage On Enterprise Prods Partners with Hold Rating, Announces Price Target of $36",
51454133,EPD,2026-03-25T12:38:48Z,"Wells Fargo Upgrades Enterprise Prods Partners to Overweight, Raises Price Target to $42",
51464101,EPD,2026-03-25T17:19:28Z,3 High-Yield Dividend Stocks Paying Over 5% - And How to Boost Their Income,Learn about dividend stocks and three top picks for 2026. Dividends provide income and stability in volatile markets and can boost overall returns.
51468044,EPD,2026-03-25T19:43:47Z,This General Motors Analyst Turns Bullish; Here Are Top 5 Upgrades For Wednesday,"Top Wall Street analysts changed outlook on top names. See all rating changes, including upgrades, downgrades, and initiations on analyst ratings page."
