ID,Ticker,Date,Headline,Summary
,FUBO,2021-06-29T16:35:47Z,10 Information Technology Stocks Showing Unusual Options Activity In Today's Session,This unusual options alert can help traders track potentially big trading opportunities. Traders often look for circumstances when the market estimation of an option diverges away from its normal worth. Unusual trading activity could push option prices to hyperbolic or underperforming levels. 
,FUBO,2021-07-02T16:05:23Z,Understanding FuboTV's Unusual Options Activity," Shares of FuboTV (NYSE:FUBO) saw some unusual options activity on Friday. Following the unusual option alert, the stock price moved down to $29.42. "
,FUBO,2021-07-06T12:36:25Z,FuboTV Finance Chief Announces Departure Plans,"
"
,FUBO,2021-07-06T18:04:37Z,Understanding FuboTV's Unusual Options Activity, FuboTV (NYSE:FUBO) shares experienced unusual options activity on Tuesday. The stock price moved down to $29.05 following the option alert. 
,FUBO,2021-07-08T17:16:08Z,Understanding FuboTV's Unusual Options Activity," Shares of FuboTV (NYSE:FUBO) saw some unusual options activity on Thursday. Following the unusual option alert, the stock price moved up to $28.36. "
,FUBO,2021-07-09T17:06:20Z,Unusual Options Activity Insight: FuboTV, FuboTV (NYSE:FUBO) shares experienced unusual options activity on Friday. The stock price moved up to $28.94 following the option alert. 
,FUBO,2021-07-14T17:19:26Z,Understanding FuboTV's Unusual Options Activity," On Wednesday, shares of FuboTV (NYSE:FUBO) saw unusual options activity. After the option alert, the stock price moved down to $26.19. "
,FUBO,2021-07-15T20:09:53Z,fuboTV's Fubo Gaming And The Cordish Companies Announce Completion Of Market ACcess Agreement For Mobile Fubo Sportsbook In PA,
,FUBO,2021-07-15T20:33:54Z,12 Information Technology Stocks Moving In Thursday's After-Market Session," Gainers

"
,FUBO,2021-07-15T20:39:03Z,Why FuboTV Shares Are Trading Higher Today,"FuboTV Inc (NYSE: FUBO) shares are trading higher by 6.6% at $27.40 in Thursday&#39;s after-hours session after its Fubo Gaming subsidiary and The Cordish Companies, announced the completion of a market access agreement for the forthcoming mobile Fubo Sportsbook in Pennsylvania."
,FUBO,2021-07-16T11:54:40Z,FuboTV Shares Surge After Securing Market Access Agreement For Fubo Sportsbook In Pennsylvania,"
"
,FUBO,2021-07-16T14:07:42Z,Why FuboTV Shares Are Trading Higher Today,FuboTV Inc. (NYSE: FUBO) shares are trading higher after the company&#39;s Fubo Gaming subsidiary and The Cordish Companies announced the completion of a market access agreement for the forthcoming mobile Fubo Sportsbook in Pennsylvania.
,FUBO,2021-07-16T14:19:30Z,Roth Capital Maintains Buy Rating On FuboTV With $42 Price Target,
,FUBO,2021-07-16T14:26:04Z,UPDATE: Roth Capital On FuboTV: Firm Highlights Co. Receiving Market Rights For Anticipated Mobile Sportsbook In Pennsylvania With The Cordish Companies Partnership; Sees Roll Out In Current Four States In 4Q21 Though Still Subject To Regulatory Approval,
,FUBO,2021-07-16T15:34:26Z,Unusual Options Activity Insight: FuboTV," On Friday, shares of FuboTV (NYSE:FUBO) saw unusual options activity. After the option alert, the stock price moved up to $26.08. "
,FUBO,2021-07-19T16:42:59Z,10 Information Technology Stocks With Unusual Options Alerts In Today's Session, This unusual options alert can help traders track potentially big trading opportunities. Traders often look for circumstances when the market estimation of an option diverges away from its normal worth. Unusual trading activity could push option prices to hyperbolic or underperforming levels. 
,FUBO,2021-07-19T17:18:31Z,Unusual Options Activity Insight: FuboTV," On Monday, shares of FuboTV (NYSE:FUBO) saw unusual options activity. After the option alert, the stock price moved down to $25.7. "
,FUBO,2021-07-19T22:14:46Z,Rock Trading Founder Began His Trading Career When Disney Stock Was At $13. Here's What He Thinks About The Market Now.,The founder of The Rock Trading (@The_RockTrading on Twitter) appeared on Benzinga&#39;s YouTube show &#34;Mind Money Method&#34; for an exclusive interview Monday.
,FUBO,2021-07-23T16:32:28Z,FuboTV Option Alert: Aug 20 $35 Calls Sweep (45) near the Ask: 1017 @ $0.659 vs 13003 OI; Earnings 8/10 After Close Ref=$25.9,
,FUBO,2021-07-26T16:40:40Z,Understanding FuboTV's Unusual Options Activity," Shares of FuboTV (NYSE:FUBO) saw some unusual options activity on Monday. Following the unusual option alert, the stock price moved down to $26.37. "
,FUBO,2021-07-27T16:16:27Z,Analyzing FuboTV's Unusual Options Activity," Shares of FuboTV (NYSE:FUBO) saw some unusual options activity on Tuesday. Following the unusual option alert, the stock price moved down to $25.06. "
,FUBO,2021-07-28T16:33:57Z,Analyzing FuboTV's Unusual Options Activity," Shares of FuboTV (NYSE:FUBO) saw some unusual options activity on Wednesday. Following the unusual option alert, the stock price moved up to $27.14. "
,FUBO,2021-07-29T17:12:42Z,Analyzing FuboTV's Unusual Options Activity," Shares of FuboTV (NYSE:FUBO) saw some unusual options activity on Thursday. Following the unusual option alert, the stock price moved down to $27.52. "
,FUBO,2021-07-30T16:49:27Z,Analyzing FuboTV's Unusual Options Activity, FuboTV (NYSE:FUBO) shares experienced unusual options activity on Friday. The stock price moved down to $26.26 following the option alert. 
,FUBO,2021-08-04T10:09:03Z,FuboTV Inc Files For Mixed Shelf Of Up To $750M,
,FUBO,2021-08-04T15:12:07Z,Unusual Options Activity Insight: FuboTV,FuboTV (NYSE:FUBO) shares experienced unusual options activity on Wednesday. The stock price moved down to $25.11 following the option alert. 
,FUBO,2021-08-05T14:31:51Z,Understanding FuboTV's Unusual Options Activity," On Thursday, shares of FuboTV (NYSE:FUBO) saw unusual options activity. After the option alert, the stock price moved down to $25.18. "
,FUBO,2021-08-09T14:30:28Z,FuboTV Option Alert: Feb 18 $40 Calls Sweep (8) near the Ask: 200 @ $3.5 vs 107 OI; Earnings 8/10 After Close Ref=$28.03,
,FUBO,2021-08-09T14:34:46Z,Analyzing FuboTV's Unusual Options Activity, FuboTV (NYSE:FUBO) shares experienced unusual options activity on Monday. The stock price moved up to $27.03 following the option alert. 
,FUBO,2021-08-09T16:36:24Z,10 Information Technology Stocks With Unusual Options Alerts In Today's Session, This unusual options alert can help traders discover the next big trading opportunities. Traders will search for circumstances when the market estimation of an option diverges heavily from its normal worth. Unusual trading activity could push option prices to exaggerated or underestimated levels. 
,FUBO,2021-08-10T08:05:07Z,"Earnings Scheduled For August 10, 2021"," 

Companies Reporting Before The Bell

• Nautilus Biotechnology (NASDAQ:NAUT) is expected to report earnings for its second quarter."
,FUBO,2021-08-10T12:26:09Z,"Benzinga Pro's Top 5 Stocks To Watch For Tuesday, Aug. 10, 2021: AMC, ZEV, FUBO, FSR, ARCT",
,FUBO,2021-08-10T14:08:29Z,This Week's Earnings Repertoire,"With over 87% of S&amp;P 500 companies already having beaten revenue and profit expectations, we&#39;re in for another round of Q2 corporate earnings, along with key jobs and inflation data."
,FUBO,2021-08-10T14:35:47Z,FuboTV Looks Set To Break Out From Long-Term Pattern: What's Next?,"FuboTV (NYSE: FUBO) is set to print its earnings after the closing bell on Tuesday. When the sports-focused streaming company reported its first-quarter earnings beat, it raised guidance for the second quarter and full fiscal year."
,FUBO,2021-08-10T20:06:14Z,"FuboTV Q2 Sales $130.90M Beat $118.88M Estimate, Live TV Streaming Platform Up Ad Sales 281% Year Over Year To $16.5M",
,FUBO,2021-08-10T20:13:03Z,fuboTV Raises Guidance,
,FUBO,2021-08-10T20:14:01Z,UPDATE: fuboTV Raises FY21 Sales Guidance From $520M-$530M to $560M-$570M vs $531.7M Est.,
,FUBO,2021-08-10T20:14:45Z,UPDATE: fuboTV Raises FY21 Subcribers Guidance From 830K-850K To 910K-920K,
,FUBO,2021-08-10T20:15:11Z,"fuboTV Sees Q3 Sales $140M-$144M vs $126.9M Estimate, Subscribers 810K-820K",
,FUBO,2021-08-10T20:39:03Z,"fuboTV Amended S-3 Filing Shows Registration For $750M Mixed Securities Shelf Offering, ~623K Common Shares Via Selling Shareholders",
,FUBO,2021-08-10T20:52:22Z,12 Information Technology Stocks Moving In Tuesday's After-Market Session," Gainers

"
,FUBO,2021-08-10T21:16:28Z,Why FuboTV's Stock Is Trading Higher Today,"fuboTV Inc. (NYSE: FUBO) shares are trading higher after the company reported better-than-expected second-quarter sales results, total paid subscribers up 138% year over year and advertising revenue up 281% year over year. The company also raised FY21 subscribers guidance."
,FUBO,2021-08-10T22:06:22Z,"Fubo Q2 Earnings Recap: Sportsbook Q4 Preview, Raised Guidance, Strong Advertising Demand",The leading sports-first streaming platform fuboTV Inc (NYSE: FUBO) reported second-quarter financial results and updated its guidance Tuesda
,FUBO,2021-08-10T22:15:21Z,7 Stocks Moving In Tuesday's After-Hours Session,"Gainers

Upstart (NASDAQ: UPST) shares are trading higher after the company reported better-than-expected Q2 EPS and sales results and issued Q3 sales guidance above estimates. The company also raised FY21 sales guidance above estimates."
,FUBO,2021-08-11T09:00:44Z,"5 Stocks To Watch For August 11, 2021","Some of the stocks that may grab investor focus today are:
	Wall Street expects  eBay Inc (NASDAQ: EBAY) to report quarterly earnings at $0.95 per share on revenue of $3.00 billion before the opening bell. eBay shares rose 0.1% to $ $67.40 in after-hours trading.
"
,FUBO,2021-08-11T09:58:36Z,A Peek Into The Markets: US Stock Futures Mostly Lower; Inflation Data In Focus,Pre-open movers
,FUBO,2021-08-11T11:02:57Z,22 Stocks Moving in Wednesday's Pre-Market Session,"Gainers


	CohBar, Inc. (NASDAQ: CWBR) shares rose 78.3% to $2.30 in pre-market trading after the company reported results from the Phase 1a/1b study of CB4211 under development for NASH and obesity met its primary endpoint. The company also released Q2 results.
"
,FUBO,2021-08-11T12:07:27Z,12 Information Technology Stocks Moving In Wednesday's Pre-Market Session, 
,FUBO,2021-08-11T12:09:01Z,Why FuboTV Shares Are Trading Higher Today,FuboTV Inc (NYSE: FUBO) is trading higher Wednesday after the company announced better-than-expected second-quarter financial results.
,FUBO,2021-08-11T13:22:12Z,"Top 20 Trending Stocks On WallStreetBets As Of Wednesday Aug. 11, 2021 (Via Swaggy Stocks)",
,FUBO,2021-08-11T13:31:00Z,"Cramer Gives His Opinion On Skyworks Solutions, Paysafe And More","On CNBC&#39;s &#34;Mad Money Lightning Round,&#34; Jim Cramer said EVgo Inc. (NASDAQ: EVGO) is one of his favorites."
,FUBO,2021-08-11T13:40:17Z,"Roth Capital Maintains Buy on FuboTV, Raises Price Target to $45",
,FUBO,2021-08-11T14:57:46Z,fuboTV Shares Up 11% Following Tuesday Evening Earnings; Hearing Co. CEO To Appear On CNBC Shortly,
,FUBO,2021-08-11T15:19:34Z,"fuboTV YouTube Channel Posted Video Tuesday Teasing Integration Of Co.'s Sportsbook Software With Roku, Apple TV, Fire TV, Others; BZ NOTE: Co.'s fuboTV Platform Had Already Been Integrated But Details Of Sportsbook Integration Were Not Known",
,FUBO,2021-08-11T15:31:27Z,"fuboTV Shares Up 10%; Co. Founder, CEO Now Interviewing On CNBC",
,FUBO,2021-08-11T15:32:21Z,fuboTV CEO Says Co. Continues To Take Market Share As Far As Hours Viewed,
,FUBO,2021-08-11T15:34:48Z,fuboTV Says Wagering During Streaming TV Is 'Very Important Part Of Our Business',
,FUBO,2021-08-11T15:37:34Z,"fuboTV CEO Interview On CNBC Concludes; Stock Was Quiet Over The Course Of Interview, Exec Didn't Say Anything New",
,FUBO,2021-08-11T16:03:49Z,48 Stocks Moving In Wednesday's Mid-Day Session,"Gainers


	Rani Therapeutics Holdings, Inc. (NASDAQ: RANI) gained 82% to $25.19. The company, last month, priced its IPO at $11 per share.
"
,FUBO,2021-08-11T19:52:42Z,fuboTV Shares Break Above Resistance At $31.50 Few Mins Before Close; Stock Now Up 11%,
,FUBO,2021-08-12T09:27:10Z,66 Biggest Movers From Yesterday,"Gainers


	Rani Therapeutics Holdings, Inc. (NASDAQ: RANI) shares jumped 50.5% to close at $20.74 on Wednesday. The company, last month, priced its IPO at $11 per share.
"
,FUBO,2021-08-12T16:35:54Z,8 Communication Services Stocks Showing Unusual Options Activity In Today's Session, This unusual options alert can help traders track potentially big trading opportunities. Traders often look for circumstances when the market estimation of an option diverges away from its normal worth. Unusual trading activity could push option prices to hyperbolic or underperforming levels. 
,FUBO,2021-08-13T11:14:10Z,FuboTV Announced it Entered Into Sales Agreement With Evercore Under Which Co May Sell Shares of Its Common Stock of Up to $500M Through Managers,
,FUBO,2021-08-13T14:34:35Z,Unusual Options Activity Insight: FuboTV," Shares of FuboTV (NYSE:FUBO) saw some unusual options activity on Friday. Following the unusual option alert, the stock price moved down to $29.84. "
,FUBO,2021-08-13T19:02:03Z,"fuboTV Shares Quiet, Traders Circulate TipRanks Article Titled 'fuboTV Stock Could Climb Over 80% From Here, Says Analyst'",
,FUBO,2021-08-17T13:05:53Z,fubotv Reports Its Sports Network Will Premiere Season 2 Of 'No Chill' With Gilbert Arenas On Aug. 22,
,FUBO,2021-08-17T13:50:55Z,Hearing Dealreporter Says Comcast May Be Eyeing FuboTV,
,FUBO,2021-08-17T13:53:24Z,BZ NOTE: Comcast Previously Disclosed 9.3% Stake In FuboTV,
,FUBO,2021-08-17T15:49:27Z,Understanding FuboTV's Unusual Options Activity," On Tuesday, shares of FuboTV (NYSE:FUBO) saw unusual options activity. After the option alert, the stock price moved up to $28.49. "
,FUBO,2021-08-17T16:43:53Z,7 Communication Services Stocks Showing Unusual Options Activity In Today's Session, This unusual options alert can help traders track potentially big trading opportunities. Traders often look for circumstances when the market estimation of an option diverges away from its normal worth. Unusual trading activity could push option prices to hyperbolic or underperforming levels. 
,FUBO,2021-08-19T13:02:59Z,fuboTV Acquires Exclusive Serie A And Coppa Italia Rights For Canada,
,FUBO,2021-08-19T15:42:27Z,Watching Sports Gambling Stocks; Crossing Broad Reports 'Arizona Sports Betting on Track for September 9 Launch',
,FUBO,2021-08-19T15:50:06Z,'Sports betting is a step closer to being legal in North Carolina' -The News & Observer Report,
,FUBO,2021-08-19T16:01:16Z,BZ NOTE: North Carolina House Will Hold Final Vote On Sports Betting In State 'This Afternoon',
,FUBO,2021-08-23T13:03:12Z,Curiosity Stream And Curiosity Channel To Launch On fuboTV,
,FUBO,2021-08-24T18:06:54Z,8 Communication Services Stocks With Unusual Options Alerts In Today's Session, This unusual options alert can help traders discover the next big trading opportunities. Traders will search for circumstances when the market estimation of an option diverges heavily from its normal worth. Unusual trading activity could push option prices to exaggerated or underestimated levels. 
,FUBO,2021-08-27T18:47:16Z,ESPN Seeking To License Its Brand To Sports-Betting Companies; Co Seeing At Least $3B,
,FUBO,2021-08-30T12:37:31Z,"Fubo Gaming, Ak-Chin Indian Community Announce Completion of Market Access Agreement In Arizona For Forthcoming Mobile Fubo Sportsbook",
,FUBO,2021-08-30T19:17:00Z,"FuboTV Launches Predictive Free-to-Play Games, FanView Live Stats For 2022 Football World Cup Qualifiers","
"
,FUBO,2021-08-31T13:04:02Z,"fuboTV's Gaming Unit Receives Approval To Offer Online Sports Wagering From Iowa Racing, Gaming Commission",
,FUBO,2021-08-31T13:43:41Z,Fubo Wins Online Sports Betting Approval In Iowa,"
"
,FUBO,2021-08-31T16:27:02Z,fuboTV Shares Up 4% As Afternoon Trading Session Beginning; Co. CEO Expected To Appear On CNBC After 3 p.m. EDT Tuesday,
,FUBO,2021-08-31T20:30:03Z,Watching fuboTV Shares As Co. CEO Currently Interviewing On CNBC,
,FUBO,2021-09-01T12:17:46Z,CryptoPunks Are Worth How Much? AssetDash Is Tracking NFT Market Caps,"The rise of non-fungible token popularity and valuation has created a need for ways to track stats on various projects.

Enter Assetdash.com, a site launched in August 2020 to track the market caps and movements of stocks, cryptocurrencies, ETFs and now NFTs."
,FUBO,2021-09-01T17:28:14Z,FuboTV Option Alert: Sep 17 $33 Calls Sweep (17) near the Ask: 500 @ $0.731 vs 914 OI; Ref=$29.7 13:26:16;  FuboTV Option Alert: Sep 17 $35 Calls Sweep (31) near the Ask: 961 @ $0.43 vs 3869 OI; Ref=$29.72,
,FUBO,2021-09-02T20:06:14Z,Fubo Gaming Receives License To Offer Mobile Event Wagering From Arizona Department Of Gaming,
,FUBO,2021-09-03T13:01:48Z,FuboTV Shares Gain On Sports Betting Deal Wins,"
"
,FUBO,2021-09-08T12:46:17Z,New York Jets Announce Multi-Year Partnership With Fubo Sportsbook,
,FUBO,2021-09-08T15:43:25Z,Fubo Ups Sports Betting With Sportbook's Professional Sports Team Sponsorship Debut,"
"
,FUBO,2021-09-08T16:40:32Z,9 Communication Services Stocks With Unusual Options Alerts In Today's Session,This unusual options alert can help traders discover the next big trading opportunities. Traders will search for circumstances when the market estimation of an option diverges heavily from its normal worth. Unusual trading activity could push option prices to exaggerated or underestimated levels. 
,FUBO,2021-09-09T13:15:35Z,"fuboTV Brings Live And On-Demand Sports, News And Entertainment To VIZIO SmartCast",
,FUBO,2021-09-09T22:01:05Z,"ROOT SPORTS, fuboTV Announce Distribution Agreement",
,FUBO,2021-09-14T12:07:59Z,fuboTV Selects Magnite As Preferred SSP,
,FUBO,2021-09-14T12:42:22Z,Magnite Shares Gain On FuboTV Collaboration,"
"
,FUBO,2021-09-15T13:47:53Z,FuboTV Option Alert: Jan 21 $40 Calls Sweep (37) near the Ask: 304 @ $1.62 vs 8838 OI; Earnings 11/9 After Close [est] Ref=$27.0543,
,FUBO,2021-09-16T16:04:01Z,"'Louisiana Gaming Control Board Chair Ronnie Johns reaffirms there is no set timeline for Louisiana's sports betting launch during today's board meeting but said ""hopefully we'll have some good news soon."" -Sports Betting Reporter Tweet",
,FUBO,2021-09-21T14:46:11Z,FuboTV's Return On Capital Employed Insights,"FuboTV (NYSE:FUBO) brought in sales totaling $130.88 million during Q2 according to data provided by Benzinga Pro. However, earnings decreased 268.1%, resulting in a loss of $81.07 million."
,FUBO,2021-09-24T15:26:04Z,FuboTV Option Alert: Oct 15 $28 Calls at the Ask: 2000 @ $0.72 vs 1944 OI; Earnings 11/9 After Close [est] Ref=$25.21,
,FUBO,2021-09-28T13:03:36Z,fuboTV Launches Ecommerce Shop For Exclusive Branded Merchandise,
,FUBO,2021-09-28T18:12:59Z,"FuboTV Option Alert: Jan, 2023 $50 Calls Sweep (10) near the Ask: 211 @ $3.15 vs 3354 OI; Earnings 11/9 After Close [est] Ref=$23.94",
,FUBO,2021-09-30T09:29:13Z,Fubo Sportsbook to Plug into Paysafe for Full Suite of Traditional and Alternative Payments,
,FUBO,2021-09-30T11:18:18Z,Paysafe Collaborates With Fubo Gaming Over Sports Betting Payments,"
"
,FUBO,2021-09-30T18:40:10Z,Why FuboTV Shares Are Trading Higher Today,"FuboTV Inc (NYSE: FUBO) is trading higher Thursday after the company&#39;s subsidiary, Fubo Gaming, announced a partnership with Paysafe (NYSE: PSFE). "
,FUBO,2021-10-06T13:08:23Z,"Cleveland Cavaliers, Fubo Gaming Announce Long-Term Partnership, Fubo's First Deal With NBA Franchise",
,FUBO,2021-10-06T13:58:16Z,FuboTV Announces Cleveland Cavaliers Sports Betting Partnership: What Investors Should Know,"A sports focused streaming company is venturing into sports betting and announced its first NBA partnership Wednesday.

What Happened: Fubo Gaming, a segment of fuboTV Inc (NYSE: FUBO), is partnering with the Cleveland Cavaliers."
,FUBO,2021-10-06T17:53:19Z,10 Communication Services Stocks With Unusual Options Alerts In Today's Session, This unusual options alert can help traders discover the next big trading opportunities. Traders will search for circumstances when the market estimation of an option diverges heavily from its normal worth. Unusual trading activity could push option prices to exaggerated or underestimated levels. 
,FUBO,2021-10-07T16:20:16Z,FuboTV Option Alert: Jan 21 $31 Calls Sweep (12) near the Ask: 565 @ $2.09 vs 884 OI; Earnings 11/9 After Close [est] Ref=$25.1612,
,FUBO,2021-10-07T16:47:17Z,10 Communication Services Stocks With Unusual Options Alerts In Today's Session, This unusual options alert can help traders discover the next big trading opportunities. Traders will search for circumstances when the market estimation of an option diverges heavily from its normal worth. Unusual trading activity could push option prices to exaggerated or underestimated levels. 
,FUBO,2021-10-08T15:33:50Z,"Sports Betting Reporter Tweets 'Iowa reports a record $210.4 million in handle for September 2021, nearly double last month's handle and roughly triple its September 2020 total. Operators hold less than 3 percent of total handle, less than half the state'",
,FUBO,2021-10-08T17:25:46Z,"Sports Betting Reporter Tweets 'Maryland's governor is pushing for a 2021 sports betting launch. The Commission is set to approve retail licenses for Caesars, DraftKings and BetMGM at its Oct. 14 meeting'",
,FUBO,2021-10-08T17:31:32Z,"Sports Reporter Tweets 'The Maryland gaming director yesterday said six to 12 months for now for online. Retail launch is a step in the right direction, but it looks like its going to be a while no matter what for online'",
,FUBO,2021-10-11T13:01:38Z,"fuboTV, AT&T SportsNet Rocky Mountain Report Distribution Deal, No Terms Disclosed",
,FUBO,2021-10-11T18:27:54Z,FuboTV Option Alert: Fri $26 Calls at the Ask: 960 @ $0.58 vs 4192 OI; Earnings 11/9 After Close [est] Ref=$25.685,
,FUBO,2021-10-11T18:31:01Z,"fuboTV, AT&T SportsNet Rocky Mountain Forge Distribution Agreement","
"
,FUBO,2021-10-12T15:22:59Z,'Nets ban Kyrie Irving from games AND practice until he is fully vaccinated #nbc4ny #nets #nba' -New York 4 Report,
,FUBO,2021-10-14T20:32:06Z,"fuboTV Reports Its Sportsbook Named Authorized Gaming Operator Of NASCAR, No Terms Disclosed",
,FUBO,2021-10-15T11:57:10Z,Fubo Sportsbook Becomes NASCAR's Authorized Gaming Operator,"
"
,FUBO,2021-10-15T13:42:13Z,"Sports Betting Reporter Ryan Butler, In Response To Maryland Sports Betting Bill, Tweets 'They're still discussing a bill in the legislature. They believe they can get it passed this year, which means sports betting possibly by next fall...'",
,FUBO,2021-10-18T16:07:07Z,FuboTV Option Alert: Jan 21 $37 Calls Sweep (11) near the Ask: 210 @ $1.81 vs 828 OI; Earnings 11/9 After Close [est] Ref=$29.33,
,FUBO,2021-10-19T09:53:59Z,"Berenberg Assumed Coverage on Fubo With Buy Rating and $50 Price Target, Reuters Reported",
,FUBO,2021-10-19T15:25:57Z,New Jersey Governor Phil Murphy Tweets 'Incredible news: We just became the first state in the nation to take in more than $1 billion in sports bets in a single month.',
,FUBO,2021-10-19T17:47:05Z,fuboTV Shares Tick Higher On Volume Following Streamable Report 'NBA League Pass is Available to fuboTV Subscribers For 2021-22 NBA Season',
,FUBO,2021-10-26T13:42:58Z,Watching Shares Of FuboTV; Hearing Oppenheimer Says They Think Co Is Next Takeover Target From DraftKings As DraftKings Drops Bid For Entain,
,FUBO,2021-10-27T08:57:18Z,BTIG Initiates Coverage On FuboTV with Neutral Rating,
,FUBO,2021-10-27T14:03:59Z,"Benzinga's Top Ratings Upgrades, Downgrades For October 27, 2021","Upgrades


"
,FUBO,2021-10-28T12:05:46Z,'fuboTV Adds Regional Sports Fee For MSG in New York City and Surrounding Areas' -The Streamable Report,
,FUBO,2021-11-01T14:05:47Z,FuboTV Shares Move Higher; Hearing Investors Business Daily Names Stock As New Buy,
,FUBO,2021-11-01T18:39:54Z,Looking At FuboTV's Recent Whale Trades," Someone with a lot of money to spend (and possibly insider knowledge) has taken a bullish stance on FuboTV (NYSE:FUBO).
And retail traders should know.
We noticed this today when the big position showed up on publicly available options history that we track here at Benzinga."
,FUBO,2021-11-01T20:24:28Z,fuboTV Announces It Is Fully Integrated With  dentsu international's M1 Data Platform,
,FUBO,2021-11-03T17:00:40Z,"Sports Betting Reporter Ryan Butler Tweets 'Maryland sports betting will be delayed again; regulators will not award the state's first casino retail sportsbook licenses today, and instead will ask each applicant for supplemental ownership information..",
,FUBO,2021-11-03T20:48:37Z,fuboTV's Fubo Gaming Highlights Is Now Live In Mobile Sports Betting Market With Official Launch Of Fubo Sportsbook In Iowa,
,FUBO,2021-11-09T09:41:22Z,"Earnings Scheduled For November 9, 2021"," 

Companies Reporting Before The Bell

• Imara (NASDAQ:IMRA) is projected to report earnings for its third quarter.

• KT (NYSE:KT) is projected to report earnings for its third quarter."
,FUBO,2021-11-09T18:30:13Z,fubo Shares Quiet Following Recent Streamable Article 'FuboTV Adds 18 More ABC Affiliates',
,FUBO,2021-11-09T21:20:58Z,fuboTV Reports Purchase Of Molotov For ~$190M,
,FUBO,2021-11-09T21:21:45Z,FuboTV Q3 Sales $156.70M Beat $143.55M Estimate; Raises Guidance,
,FUBO,2021-11-09T21:23:10Z,"fuboTV Q3 Net Loss $105.9M vs Net Loss $274.1M In Same Qtr. Last Year, Adj. EBITDA Loss $81.3M vs Loss $47.5M Year Over Year",
,FUBO,2021-11-09T21:23:29Z,"fuboTV Q3 Subscribers 945K, Up 108% From 455K In Same Qtr. Last Year",
,FUBO,2021-11-09T21:29:33Z,UPDATE: FuboTV Raises FY21 Sales Guidance From $560M-$570M To $612M-$617M vs $577.7M Estimate,
,FUBO,2021-11-09T21:30:10Z,UPDATE: fuboTV Raises FY21 Subscribers Guidance From 910K-920K To 1.06M-1.07M,
,FUBO,2021-11-09T22:25:36Z,"FuboTV Q3 Highlights: Revenue Beat, Best Advertising Quarter, International Acquisition, Sports Betting Update",Streaming company fuboTV Inc (NYSE: FUBO) announced third-quarter results after market close along with a new company milestone.
