ID,Ticker,Date,Headline,Summary
,FUBO,2021-01-02T16:25:30Z,"Benzinga's Final Bulls And Bears Of The Year: Alibaba, Apple, Intel, Tesla And More","
	Benzinga has examined the prospects for many investor favorite stocks over the past week. 
	The week&#39;s bullish calls included the iPhone maker and electric vehicle stocks.
	A semiconductor maker and a Chinese internet giant were among the bearish calls.


"
,FUBO,2021-01-04T09:55:53Z,63 Biggest Movers From Thursday,"Gainers


	Bonso Electronics International Inc. (NASDAQ: BNSO) shares jumped 70.9% to close at $7.69 on Thursday.
"
,FUBO,2021-01-04T17:38:02Z,10 Information Technology Stocks With Unusual Options Alerts In Today's Session,This unusual options alert can help traders track potentially big trading opportunities. Traders often look for circumstances when the market estimation of an option diverges away from its normal worth. Unusual trading activity could push option prices to hyperbolic or underperforming levels.
,FUBO,2021-01-04T17:51:17Z,12 Information Technology Stocks Moving In Monday's Intraday Session, 
,FUBO,2021-01-05T13:23:45Z,12 Information Technology Stocks Moving In Tuesday's Pre-Market Session, 
,FUBO,2021-01-05T13:58:45Z,FuboTV Sees Q4 Revs. $94B-$98B,
,FUBO,2021-01-05T13:59:13Z,FuboTV Says Paid Subscribers At Year-End Expected To Exceed 545K,
,FUBO,2021-01-05T14:08:11Z,"UPDATE: fuboTV CEO Says Co. 'will continue to be laser focused on executing our growth strategies, which include continuing to grow advertising revenues, working to implement sports wagering into our product' In 2021",
,FUBO,2021-01-05T15:16:18Z,Unusual Options Activity Insight: FuboTV,FuboTV (NYSE: FUBO) shares experienced unusual options activity on Tuesday. The stock price moved up to $28.25 following the option alert.
,FUBO,2021-01-05T15:36:12Z,Analyzing The Price Action In FuboTV Stock Today,"The Price And Volume Action In FuboTV&#39;s Stock Today

FuboTV’s (NYSE: FUBO) stock has been rising Tuesday, up 20.11% to a price of $28.85. Tuesday the stock has been traded at a volume of 32.10 million, about 180.74% of its recent 30-day volume average of 17.76 million."
,FUBO,2021-01-05T16:13:46Z,FuboTV Shares Surge On Updated Guidance: What Investors Should Know,"One of the hottest stocks in December was FuboTV, a live TV streaming provider. The company saw its stock fall recently on valuation concerns and short sellers activity.

FuboTV issued updated guidance Tuesday, sending shares higher. "
,FUBO,2021-01-05T17:02:39Z,54 Stocks Moving In Tuesday's Mid-Day Session,"Gainers


	Synthetic Biologics, Inc. (NYSE: SYN) shares jumped 148% to $1.24 after gaining over 30% on Monday.
"
,FUBO,2021-01-05T17:48:18Z,10 Information Technology Stocks With Unusual Options Alerts In Today's Session,"This unusual options alert can help traders track potentially big trading opportunities. Traders often look for circumstances when the market estimation of an option diverges away from its normal worth. Unusual trading activity could push option prices to hyperbolic or underperforming levels.

Here&#39;s the list of some unusual options activity happening in today&#39;s session:"
,FUBO,2021-01-05T17:50:04Z,12 Information Technology Stocks Moving In Tuesday's Intraday Session, 
,FUBO,2021-01-06T10:03:40Z,77 Biggest Movers From Yesterday,"Gainers


	Synthetic Biologics, Inc. (NYSE: SYN) shares climbed 100% to close at $1.00 on Tuesday after gaining over 30% on Monday.
"
,FUBO,2021-01-06T12:25:51Z,"Is Now The Time To Buy Stock In Apple, GE, Boeing, FuboTV Or Ideanomics?","One of the most common questions traders have about stocks is “Why Is It Moving?”

That’s why Benzinga created the Why Is It Moving, or WIIM, feature in Benzinga Pro. WIIMs are a one-sentence description as to why that stock is moving.

Here’s why shares of Apple, GE, Boeing, FuboTV and Ideanomics are moving."
,FUBO,2021-01-12T14:10:26Z,fuboTV To Acquire Interactive Gaming Company Vigtory; Terms Not Disclosed,
,FUBO,2021-01-12T17:04:04Z,DraftKings Shares Quiet Following Report 'The University of Richmond suspends Men's Basketball due to COVID-19',
,FUBO,2021-01-12T17:05:23Z,52 Stocks Moving In Tuesday's Mid-Day Session,"Gainers


	Qilian International Holding Group Ltd (NASDAQ: QLI) shares jumped 76.2% to $8.81 after the company priced its IPO at $5 per share.
"
,FUBO,2021-01-12T17:57:42Z,11 Information Technology Stocks Moving In Tuesday's Intraday Session, 
,FUBO,2021-01-12T19:56:53Z,PreMarket Prep Stock Of The Day: FuboTV,"Benzinga&#39;s PreMarket Prep airs every morning from 8-9 a.m. ET. During that fast-paced, highly informative hour, traders and investors tune in to get the major news of the day, the catalysts behind those moves and the corresponding price action for the upcoming session."
,FUBO,2021-01-13T10:14:36Z,70 Biggest Movers From Yesterday,"Gainers


	CPS Technologies Corporation (NASDAQ: CPSH) shares climbed 113.8% to close at $6.84 on Tuesday. The company, last week, was granted EU patent titled &#39;Scalable modular design of 48-volt li-ion battery management system.&#39;
"
,FUBO,2021-01-13T13:21:14Z,11 Information Technology Stocks Moving In Wednesday's Pre-Market Session, 
,FUBO,2021-01-13T20:39:45Z,Watching Online/Sports Gambling Stocks Amid Figures From Play New Jersey State's Sportsbooks Hit Record $6B In Bets During 2020,
,FUBO,2021-01-14T17:35:41Z,10 Information Technology Stocks With Unusual Options Alerts In Today's Session,"This unusual options alert can help traders track potentially big trading opportunities. Traders often look for circumstances when the market estimation of an option diverges away from its normal worth. Unusual trading activity could push option prices to hyperbolic or underperforming levels.

Here&#39;s the list of some unusual options activity happening in today&#39;s session:"
,FUBO,2021-01-15T17:40:39Z,10 Information Technology Stocks With Unusual Options Alerts In Today's Session," 

This unusual options alert can help traders track potentially big trading opportunities. Traders often look for circumstances when the market estimation of an option diverges away from its normal worth. Unusual trading activity could push option prices to hyperbolic or underperforming levels."
,FUBO,2021-01-20T16:28:38Z,"Cramer Gives His Opinion On Canopy Growth, Quanta Services And More","On CNBC&#39;s &#34;Mad Money Lightning Round,&#34; Jim Cramer said he would rather buy Penn National Gaming, Inc (NASDAQ: PENN) and Draftkings Inc (NASDAQ: "
,FUBO,2021-01-21T13:15:47Z,"Barrington Research Initiates Coverage On FuboTV with Outperform Rating, Announces Price Target of $40",
,FUBO,2021-01-21T15:02:56Z,"Benzinga's Top Ratings Upgrades, Downgrades For January 21, 2021", 
,FUBO,2021-01-21T15:14:38Z,"FuboTV Shares Spike To Session High, Now Up 14%; CNBC's Scott Wapner Reporting David Einhorn's Greenlight Invested In Co. When Co. Was Private And Saw 'Significant' Gains When Co. Went Public",
,FUBO,2021-01-21T15:21:00Z,Understanding FuboTV's Unusual Options Activity,FuboTV (NYSE:FUBO) shares experienced unusual options activity on Thursday. The stock price moved up to $33.12 following the option alert.
,FUBO,2021-01-21T16:10:57Z,Why Barrington Research Is Bullish On FuboTV,Shares of streaming TV provider Fubotv Inc (NYSE: FUBO) were rallying Thursday after the company scored a bullish analyst initiation on Wall Street.
,FUBO,2021-01-21T17:20:18Z,David Einhorn — Notorious Tesla Short Seller — Just Had His Best Quarter Ever,"Greenlight Capital hedge fund manager and notorious value investor David Einhorn just released his annual letter to investors, which revealed a record quarte"
,FUBO,2021-01-21T18:07:43Z,"Citron's Andrew Left Calls GameStop 'The Opposite Of FuboTV,' Sees Growth In Fubo's Future, Indicates Does Not See That For GameStop",
,FUBO,2021-01-21T18:11:19Z,Citron's Andrew Left Now Discussing FuboTV On Benzinga's ZingerNation Power Hour,
,FUBO,2021-01-21T18:31:29Z,Citron's Andrew Left Tells Benzinga He Is Long FuboTV,
,FUBO,2021-01-21T20:00:06Z,Citron's Andrew Left Says GameStop Is 'Pretty Much In Terminal Decline',Citron Research editor and notorious short seller Andrew Left joined Benzinga’s ZingerNation Power Hour Thursday to discuss his short thesis on GameStop Corp. (NYSE: GME).
,FUBO,2021-01-22T09:54:13Z,77 Biggest Movers From Yesterday,"Gainers


"
,FUBO,2021-01-22T17:55:17Z,FuboTV Shares Spike To Session High On Volume Over $35; Shares Up 1.5% For Session; Stock Is A Fav By Wall Street Bets Reddit Community,
,FUBO,2021-01-22T17:58:11Z,"FuboTV Shares Up 6% Over Last Few Mins, Volume Very Heavy; Stock Up 4% For Session",
,FUBO,2021-01-22T18:01:18Z,"Wall Street Bets Favorite Stocks Today: GameStop Shares Up 66%, Palantir, Bed Bath & Beyond Up 14%, FuboTV Up 6%, BlackBerry Up 6%",
,FUBO,2021-01-22T20:10:21Z,Why FuboTV's Stock Is Trading Higher Today,FuboTV (NYSE: FUBO) shares are trading higher Friday on above-average volume amid continued volatility in the name stemming from increased popularity amongst traders on Reddit&#39;s Wall Street Bets community.
,FUBO,2021-01-26T17:03:11Z,Streaming Service FuboTV's Pre-Super Bowl Price Action,"Shares of Fubotv Inc. (NYSE: FUBO) have seen three strong sessions, and at one point Monday, shares of the new streaming service were up as much as 18%.

The stock was giving back some of the gains at last check Tuesday, trading down 4.33% at $39.09. "
,FUBO,2021-01-26T18:43:46Z,10 Information Technology Stocks Showing Unusual Options Activity In Today's Session,This unusual options alert can help traders discover the next big trading opportunities. Traders will search for circumstances when the market estimation of an option diverges heavily from its normal worth. Unusual trading activity could push option prices to exaggerated or underestimated levels.
,FUBO,2021-01-27T12:02:39Z,48 Stocks Moving in Wednesday's Pre-Market Session,"Gainers


"
,FUBO,2021-01-27T15:15:03Z,"Top 30 High Short Interest Stocks As Of Wednesday, Jan. 27, 2021 (Via HighShortInterest.com)",
,FUBO,2021-01-27T15:23:05Z,"AMC, National Beverage And 8 Heavily Shorted Stocks To Watch","The rise in GameStop Corp (NYSE: GME) has been one of the hottest stories of the year. The move comes as retail traders on Reddit, Robinhood and elsewhere are searching for stocks with large short percentages."
,FUBO,2021-01-27T17:00:43Z,66 Stocks Moving In Wednesday's Mid-Day Session,"Gainers


"
,FUBO,2021-01-27T19:33:45Z,"Top 20 Trending Stocks On WallStreetBets For Wednesday, Jan. 27, 2020 (Via Swaggy Stocks)",
,FUBO,2021-01-27T20:12:05Z,"'painting a target on the back of their short position.  Kerrisdale Capital: ""We'll do a Twitter Live video on Friday afternoon to provide our updated thoughts on our $FUBO short thesis and why the current valuation is overstretched' -CNBC's Steve Weiss",
,FUBO,2021-01-28T00:09:07Z,Watching Stocks Of Heavily-Shorted Stocks As WallStreetBets Subreddit Switched To Private Forum,
,FUBO,2021-01-28T12:10:47Z,fuboTV Reports $350M Convertible Senior Notes Due 2026 Offering,
,FUBO,2021-01-28T15:28:46Z,"'Soooo upon further review, and with all the helpful input from the comments below, we're going to cancel this. My wife is concerned for her life (as is her boyfriend)' -Kerrisdale Capital",
,FUBO,2021-02-01T14:08:00Z,"fuboTV To Announce Q4 And Full Year 2020 Financial Results On March 2, 2021 After The Close",
,FUBO,2021-02-01T14:58:04Z,Why FuboTV Is Trading Higher Today,"FuboTV&#39;s Stock Price And Volume Action

FuboTV&#39;s (NYSE:FUBO) stock has been rising Monday, up 5.2% to a price of $46.0. The stock&#39;s current volume for the day is 3.30 million, which is approximately 8.65% of its previous 30-day average volume of 38.18 million."
,FUBO,2021-02-01T16:45:48Z,"Wedbush Maintains Outperform on FuboTV, Raises Price Target to $50",
,FUBO,2021-02-01T17:08:37Z,"Top 20 Trending Stocks On WallStreetBets As Of Monday, Feb. 1, 2021 (Via Swaggy Stocks)",
,FUBO,2021-02-01T17:57:30Z,11 Information Technology Stocks Moving In Monday's Intraday Session, 
,FUBO,2021-02-01T18:29:06Z,70 Stocks Moving In Monday's Mid-Day Session,"Gainers


	Viela Bio, Inc. (NASDAQ: VIE) shares surged 52.6% to $52.91 after the company agreed to be acquired by Horizon Therapeutics for $53 per share in cash.
"
,FUBO,2021-02-02T09:29:23Z,102 Biggest Movers From Yesterday,"Gainers


	Leisure Acquisition Corp. (NASDAQ: LACQ) shares jumped 111.2% to close at $23.99 on Monday after the company entered into a merger agreement for business combination with Ensysce Biosciences, Inc.
"
,FUBO,2021-02-02T16:24:20Z,"Top 20 Trending Stocks On WallStreetBets As Of Tuesday, Feb. 2, 2021 (Via Swaggy Stocks)",
,FUBO,2021-02-02T16:29:29Z,"Top 30 High Short Interest Stocks As Of Tuesday, Feb. 2, 2021 (Via HighShortInterest.com)",
,FUBO,2021-02-03T13:41:32Z,"UMA 'Decentralized Financial Contracts Platform' Unveiles uSTONKS Token, 'a synthetic that tracks an index consisting of ten stocks that are most commented on r/wallstreetbets'",
,FUBO,2021-02-03T14:42:52Z,"Top 30 High Short Interest Stocks As Of Wednesday, Feb. 3, 2021 (Via HighShortInterest.com)",
,FUBO,2021-02-04T14:32:37Z,"Top 30 High Short Interest Stocks As Of Thursday, Feb. 4, 2021 (Via HighShortInterest.com)",
,FUBO,2021-02-04T21:27:08Z,"fuboTV Reports Support Of Its United ID2.0 Solution In Collaboration With The Trade Desk, Other Companies Across Digital Ad Industry",
,FUBO,2021-02-05T14:01:05Z,"Top 30 High Short Interest Stocks As Of Friday, Feb. 5, 2021 (Via HighShortInterest.com)",
,FUBO,2021-02-08T14:17:21Z,"Top 30 High Short Interest Stocks As Of Monday, Feb. 8, 2021 (Via HighShortInterest.com)",
,FUBO,2021-02-09T14:02:00Z,"Top 30 High Short Interest Stocks As Of Tuesday, Feb. 9, 2021 (Via HighShortInterest.com)",
,FUBO,2021-02-10T14:49:13Z,"Roundhill Investments Earlier Issued Press Release Highlighting Wednesday Launch Of 'Roundhill Streaming Services & Technology ETF,' Ticker 'SUBZ'; Includes Netflix, fuboTV, Spotify, Tencent Music, Roku",
,FUBO,2021-02-10T17:43:03Z,10 Information Technology Stocks With Unusual Options Alerts In Today's Session,This unusual options alert can help traders discover the next big trading opportunities. Traders will search for circumstances when the market estimation of an option diverges heavily from its normal worth. Unusual trading activity could push option prices to exaggerated or underestimated levels.
,FUBO,2021-02-11T13:29:16Z,"Benzinga Pro's Top 5 Stocks To Watch For Thursday, Feb. 11, 2021: CLII, MTCH, ACB, FUBO, OGI",
,FUBO,2021-02-11T16:44:37Z,"Cramer Weighs In On GrowGeneration, Qualcomm And More","On CNBC&#39;s &#34;Mad Money Lightning Round,&#34; Jim Cramer said Mitek Systems, Inc. (NASDAQ: MITK) is a good company."
,FUBO,2021-02-12T13:16:56Z,"Benzinga Pro's Top 5 Stocks To Watch For Friday, Feb. 12, 2021: SUBZ, SPCE, MARK, CLSK, FUSE",
,FUBO,2021-02-16T17:45:46Z,10 Information Technology Stocks Showing Unusual Options Activity In Today's Session,This unusual options alert can help traders discover the next big trading opportunities. Traders will search for circumstances when the market estimation of an option diverges heavily from its normal worth. Unusual trading activity could push option prices to exaggerated or underestimated levels.
,FUBO,2021-02-16T21:44:10Z,12 Information Technology Stocks Moving In Tuesday's After-Market Session,"Gainers

"
,FUBO,2021-02-16T22:13:13Z,13F From David Einhorn's Greenlight Capital Shows New Stake In FuboTV,
,FUBO,2021-02-16T22:26:48Z,17 Stocks Moving In Tuesday's After-Hours Session,"Gainers


	SolarEdge (NASDAQ: SEDG) shares are trading higher after the company reported better-than-expected Q4 EPS and sales results and issued Q1 sales guidance above estimates.
"
,FUBO,2021-02-17T17:37:18Z,10 Information Technology Stocks Showing Unusual Options Activity In Today's Session,"This unusual options alert can help traders track potentially big trading opportunities. Traders often look for circumstances when the market estimation of an option diverges away from its normal worth. Unusual trading activity could push option prices to hyperbolic or underperforming levels.

Here&#39;s the list of some unusual options activity happening in today&#39;s session:"
,FUBO,2021-02-17T19:44:10Z,"Q4 13F Roundup: How Buffett, Einhorn, Ackman And Others Adjusted Their Portfolios","The latest round of 13F filings from institutional investors is out, revealing to the world the stocks that some of the richest and most successful investors have been buying and selling."
,FUBO,2021-02-19T13:46:02Z,"Benzinga Pro's Top 5 Stocks To Watch For Friday, Feb. 19, 2021: SQ, PLTR, NLS, FUBO, CASA",
,FUBO,2021-02-19T18:01:49Z,10 Information Technology Stocks With Unusual Options Alerts In Today's Session,This unusual options alert can help traders discover the next big trading opportunities. Traders will search for circumstances when the market estimation of an option diverges heavily from its normal worth. Unusual trading activity could push option prices to exaggerated or underestimated levels.
,FUBO,2021-02-23T21:38:27Z,12 Information Technology Stocks Moving In Tuesday's After-Market Session,"Gainers

Sphere 3D (NASDAQ:ANY) shares moved upwards by 8.36% to $2.85 during Tuesday&#39;s after-market session. Sphere 3D&#39;s trading volume hit 7.7K shares by close, accounting for 0.57% of its average volume over the last 100 days. The market value of their outstanding shares is at $22.4 million."
,FUBO,2021-02-26T16:47:22Z,Why Is AMC Networks Trading Higher Today?,"
"
,FUBO,2021-03-01T17:36:56Z,10 Information Technology Stocks With Unusual Options Alerts In Today's Session,This unusual options alert can help traders discover the next big trading opportunities. Traders will search for circumstances when the market estimation of an option diverges heavily from its normal worth. Unusual trading activity could push option prices to exaggerated or underestimated levels.
,FUBO,2021-03-01T18:11:06Z,"What You Need To Know In Options This Week: Gamestop, Zoom, Nio, Snowflake, Costco And More","The Broader Markets

The major indices were lower on the week and implied volatility spiked higher, with the VIX ending the week near 28."
,FUBO,2021-03-01T21:56:54Z,What's Moving The Market Monday? After The Close Update,"Indices Around The Globe


	S&amp;P 500 Futures closed at 3,902, up 2.40%
	UK&#39;s FTSE closed at 6,588, down 0.95%
	Japan&#39;s Nikkei 225 closed at 29,663, up 2.41%


 

Bonds


	U.S 10-year treasury yield at 1.43%


 "
,FUBO,2021-03-02T08:40:11Z,"Earnings Scheduled For March 2, 2021"," 

Companies Reporting Before The Bell

• Kopin (NASDAQ:KOPN) is expected to report quarterly loss at $0.01 per share on revenue of $9.33 million."
,FUBO,2021-03-02T14:00:56Z,"Top 20 Trending Stocks On WallStreetBets As Of Tuesday, Mar. 2, 2021 (Via Swaggy Stocks)",
,FUBO,2021-03-02T14:20:24Z,fuboTV Shares Up 8% As Traders Circulate Co. Website fubobet.com Which Suggests 'All bets go live in 2021'; BZ NOTE: Benzinga Pro Newsdesk Cannot Confirm If/When This Site Was Recently Updated; We Had Heard About fuboBET Previously,
,FUBO,2021-03-02T14:55:09Z,fuboTV Spokesperson Tells Benzinga fuboBET.com Site Being Circulated By Traders Is 'Not An Official Page',
,FUBO,2021-03-02T18:49:21Z,"Needham Analyst Laura Martin Comments On Earlier Circulation Of Third-Party, Unofficial Website Promoting Sports Betting Via fuboTV, Notes Co. Said It Will Develop An App, Not A Website",
,FUBO,2021-03-02T18:49:39Z,Needham Analyst Laura Martin Tells Benzinga FuboTV Would Need To 'Run Like Hell' To Get Sports Betting App Set Up By Q4'21 Or Q1'22,
,FUBO,2021-03-02T20:46:06Z,"Notable After-Hours Earnings For Tuesday, Mar. 2, 2021 And Expected Report Times: BOX, FUBO, HPE, JWN, VEEV",
,FUBO,2021-03-02T21:06:11Z,FuboTV Q4 Sales $105.10M Beat $93.94M Estimate,
,FUBO,2021-03-02T21:07:01Z,fuboTV Q4 Net Subscriber Additions 92.8K,
,FUBO,2021-03-02T21:15:50Z,fuboTV Q4 Adj. EBITDA Loss $43.5M,
,FUBO,2021-03-02T21:16:35Z,"fuboTV Sees Q1 Sales $100M-$103M vs $99.4M Estimate, Subscribers 520K-530K",
,FUBO,2021-03-02T21:17:22Z,"fuboTV Raises FY21 Sales Guidance From $415M-$435M To $460M-$470M vs $457M Estimate, Year-End Subscribers 760K-770K",
,FUBO,2021-03-02T21:37:00Z,12 Information Technology Stocks Moving In Tuesday's After-Market Session,"Gainers

Sigmatron International (NASDAQ:SGMA) shares rose 9.88% to $5.89 during Tuesday&#39;s after-market session. Trading volume for this security closed at 378, accounting for 0.83% of its average full-day volume over the last 100 days. The market value of their outstanding shares is at $25.0 million."
,FUBO,2021-03-02T21:57:14Z,"FuboTV Reports 2020 Revenue Up 83%, Lays Out Sports Betting Launch Timeline","Sports first streaming company fuboTV Inc (NYSE: FUBO) reported full-year fiscal earnings and updated investors on its plans to launch sports betting.

What Happened: Fourth-quarter revenue of $105.1 million beat Street estimates of $93.9 million."
,FUBO,2021-03-03T05:44:12Z,"Rocket Companies Overtakes GameStop, Palantir As WallStreetBets' Top Interest","The Reddit forum that led the short squeeze in the shares of GameStop Corp (NYSE: GME) is buzzing with discussion on new short squeeze targets.

Here are the most discussed companies on r/WallStreetBets:"
,FUBO,2021-03-03T12:10:05Z,36 Stocks Moving in Wednesday's Pre-Market Session,"Gainers


"
,FUBO,2021-03-03T13:31:21Z,12 Information Technology Stocks Moving In Wednesday's Pre-Market Session, 
,FUBO,2021-03-03T13:50:59Z,"DraftKings And Dish Network Partner On Sports Betting, TV Integration",A strategic partnership was announced Wednesday between television provider DISH Network (NASDAQ: DISH) and sports betting operator DraftKings
,FUBO,2021-03-03T13:52:47Z,"Benzinga Pro's Top 5 Stocks To Watch For Wednesday, Mar. 3, 2021: ARKQ, LDI, FUBO, BYND, UONE",
,FUBO,2021-03-03T14:05:04Z,"Top 20 Trending Stocks On WallStreetBets As Of Wednesday, Mar. 3, 2021 (Via Swaggy Stocks)",
,FUBO,2021-03-03T17:03:05Z,52 Stocks Moving In Wednesday's Mid-Day Session,"Gainers


	Cohen &amp; Company Inc.  (NASDAQ: COHN) shares jumped 102.5% to $35.54 after the company reported a strong rise in Q4 earnings and sales.
"
,FUBO,2021-03-03T17:39:09Z,10 Information Technology Stocks Moving In Wednesday's Intraday Session, 
,FUBO,2021-03-03T20:40:31Z,fuboTV Shares Relatively Quiet Following Tweet From FOX's Liz Claman 'CEO of @fuboTV 1st on FoxBiz NOW on @ClamanCountdown',
,FUBO,2021-03-03T22:00:53Z,"fuboTV Reports Secured Market Access Deals for Its fubo Sportsbook In Indiana, New Jersey Through Caesars Entertainment",
,FUBO,2021-03-03T22:01:59Z,fuboTV Shares Spike ~5% After Hours Following News Of Deal With Caesars,
,FUBO,2021-03-04T07:32:27Z,"FuboTV Shares Pop On Caesars Partnership, Access To Additional States For Sports Betting",Sports first streaming company fuboTV shared more news on its sports betting aspirations with a new partnership announced after market close Wednesday.
,FUBO,2021-03-04T10:04:05Z,65 Biggest Movers From Yesterday,"Gainers


	Cohen &amp; Company Inc.  (NASDAQ: COHN) shares climbed 133.6% to close at $41.00 on Wednesday after the company reported a strong rise in Q4 earnings and sales.
"
,FUBO,2021-03-04T14:06:53Z,"Top 20 Trending Stocks On WallStreetBets As Of Thursday, Mar. 4, 2021 (Via Swaggy Stocks)",
,FUBO,2021-03-04T17:48:20Z,10 Information Technology Stocks Showing Unusual Options Activity In Today's Session,This unusual options alert can help traders track potentially big trading opportunities. Traders often look for circumstances when the market estimation of an option diverges away from its normal worth. Unusual trading activity could push option prices to hyperbolic or underperforming levels.
,FUBO,2021-03-05T11:11:46Z,"fuboTV CEO, David Gandler, To Appear On Benzinga's PreMarket Prep YouTube Show At 9 a.m. EST Friday",
,FUBO,2021-03-05T13:03:17Z,"Benzinga Pro's Top 5 Stocks To Watch For Friday, Mar. 5, 2021: FUBO, RCL, GWAC, LIZI, WTRH",
,FUBO,2021-03-05T14:01:09Z,"EXCLUSIVE: fuboTV CEO, David Gandler, Currently Interviewing On Benzinga's PreMarket Prep",
,FUBO,2021-03-05T14:01:56Z,"EXCLUSIVE: fuboTV CEO Discussing Deal With Caesars, Notes Mgmt.'s Goal For 2021 Was To Have 3 States For Online Betting And Co. Has Already Accomplished That",
,FUBO,2021-03-05T14:02:44Z,EXCLUSIVE: fuboTV CEO Says 'I Think We've Demonstrated Over The Last Few Years That We Move Very Quickly',
,FUBO,2021-03-05T14:03:33Z,EXLCUSIVE: fuboTV CEO Says Co. Is 'Well In Advance Of Our Initial Plans' For Launching A Sportsbook Later In 2021,
,FUBO,2021-03-05T14:04:51Z,"EXCLUSIVE: fuboTV CEO Notes Average Online Gaming Customer Has 4 Apps, Says 'It's Not An Either Or' When Considering Co.'s Competition",
,FUBO,2021-03-05T14:06:02Z,"EXCLUSIVE: fuboTV CEO On Recent Website Circulation For fuboBET, Says This Is A Co. Page But Page Has Been Online Since Nov. 30, Site Being Up Was Not Indication Of Official Launch",
,FUBO,2021-03-05T14:06:38Z,"EXCLUSIVE: fuboTV CEO Says Target Quarter For Launching Sportsbook Is Q4'21, Says Cannot Yet Give A Target Date",
,FUBO,2021-03-05T14:07:33Z,"fuboTV CEO Notes Target Quarter For Launching Sportsbook Was Pulled Forward From Initial Mgmt. Estimate Of End Of Dec. '21, Possibly Q1'22",
,FUBO,2021-03-05T14:09:12Z,"EXCLUSIVE: fuboTV CEO, On Co.'s Recent Bottom-Line Loss, Notes Loss Related To Special Items, Notes Cash Burn Rate Around/Below $200M",
,FUBO,2021-03-05T14:09:39Z,EXCLUSIVE: fuboTV CEO Says 'We Have Been Excellent Stewards For Our Shareholders',
,FUBO,2021-03-05T14:11:48Z,EXCLUSIVE: fuboTV CEO Notes Q4 Ad Spend Was Up From Under $7 To Over $8/User,
,FUBO,2021-03-05T14:13:14Z,"EXCLUSIVE: fuboTV CEO Notes Benefits Co. Saw Over Q4 Were Benefits Competitors In The Space Didn't Show, Says That Shows 'We Are Executing Extremely Well'",
