ID,Ticker,Date,Headline,Summary
,FUBO,2022-11-04T19:05:45Z,"Needham Maintains Buy on FuboTV, Lowers Price Target to $4.5",
,FUBO,2022-11-05T14:51:37Z,Ryan Reynolds Could Be Buying This NHL Team: Could Deadpool Actor Be The Latest Celebrity Team Owner?,Canadian-born actor Ryan Reynolds could be the latest celebrity owner of a North American sports team. Here’s the latest rumor in celebrity team ownership and which team Reynolds has his eye on.
,FUBO,2022-11-11T17:21:32Z,"FuboTV CEO, David Gandler To Appear On Benzinga's Live YouTube TV At 1:15 p.m. ET",
,FUBO,2022-11-11T18:18:05Z,"FuboTV CEO, David Gandler Now Interviewing On Benzinga's Live YouTube TV",
,FUBO,2022-11-11T20:51:06Z,FuboTV CEO David Gandler On Streaming Platform's Performance: 'We're Doing All The Right Things',"Fubotv Inc (NYSE: FUBO) recently issued third-quarter earnings, beating both the top and bottom lines by solid margins, helped by the 6% bump in CPM (cost per mille), which helped drive revenues 21% higher sequen"
,FUBO,2022-11-14T18:22:25Z,"FuboTV's Shifting Priorities Create Focus On Path To Profitability, Says Analyst","
	Barrington Research analyst James Goss has reiterated the Market Perform rating on the shares of FuboTV Inc (NYSE: FUBO)
"
,FUBO,2022-11-25T17:22:28Z,Is Tesla Signaling A Comeback For Growth Stocks?,The S&amp;P 500 index has made a sustained move higher from its October low off the rotation to value or low price-to-earnings ratio stocks.
,FUBO,2022-11-29T21:08:54Z,Fubo Sports Network Now Available On Amazon Freevee,
,FUBO,2022-12-05T14:47:26Z,FuboTV Option Alert: Fri $3.5 Calls Sweep (50) near the Ask: 4262 @ $0.061 vs 1919 OI; Ref=$3.02,
,FUBO,2022-12-05T14:50:06Z,FuboTV Shares Up 5.6%; Co Presenting At UBS Global TMT Conference,
,FUBO,2022-12-14T20:53:32Z,FuboTV is Down During World Cup Semifinal Game between France and Morocco,
,FUBO,2022-12-15T14:03:55Z,"Statement From FuboTV Regarding December 14, 2022 Cyber Attack",
,FUBO,2022-12-15T16:19:26Z,Stocks That Hit 52-Week Lows On Thursday," 

On Thursday, 241 companies hit new 52-week lows."
,FUBO,2022-12-16T17:39:14Z,Stocks That Hit 52-Week Lows On Friday," 

During Friday&#39;s trading, 293 companies set new 52-week lows."
,FUBO,2022-12-19T17:40:15Z,Stocks That Hit 52-Week Lows On Monday," 

On Monday, 297 companies reached new 52-week lows."
,FUBO,2022-12-19T21:36:54Z,FuboTV Announces Carriage Agreement With Scripps Networks,
,FUBO,2022-12-20T16:55:13Z,Stocks That Hit 52-Week Lows On Tuesday," 

On Tuesday, 298 companies achieved new lows for the year."
,FUBO,2022-12-21T14:01:27Z,"FuboTV & Sinclair Broadcast Group Announce Comprehensive Carriage Agreement, Including Launch Of Bally Sports Regional Sports Networks",
,FUBO,2022-12-22T18:13:23Z,Stocks That Hit 52-Week Lows On Thursday," 

Thursday&#39;s session saw 329 companies set new 52-week lows."
,FUBO,2022-12-23T10:36:41Z,"Needham Maintains Buy on FuboTV, Lowers Price Target to $3",
,FUBO,2022-12-27T16:31:45Z,Stocks That Hit 52-Week Lows On Tuesday," 

Tuesday&#39;s session saw 325 companies set new 52-week lows."
,FUBO,2022-12-28T16:23:23Z,Stocks That Hit 52-Week Lows On Wednesday," 

On Wednesday, 258 companies hit new 52-week lows."
,FUBO,2023-01-03T11:35:42Z,"Benzinga Pro's Top 5 Stocks To Watch For Tuesday, January 3, 2023: QCOM, WEN, TLRY, FUBO, LEDS",
,FUBO,2023-01-03T11:44:40Z,5 Cheapest Tech And Telecom Stocks You Should Think About,The most oversold stocks in the communication services sector presents an opportunity to buy into undervalued companies.
,FUBO,2023-01-11T14:33:40Z,'Fubo TV To Test Video AI Integrations In France' - TheDesk,
,FUBO,2023-01-13T17:31:13Z,12 Communication Services Stocks Moving In Friday's Intraday Session, 
,FUBO,2023-01-19T13:06:09Z,12 Communication Services Stocks Moving In Thursday's Pre-Market Session, 
,FUBO,2023-01-19T13:35:04Z,"If You Invested $1,000 In FuboTV Stock At Its COVID-19 Pandemic Low, Here's How Much You'd Have Now","Investors who bought stocks during the COVID-19 market crash in 2020 have generally experienced some big gains in the past 2 1/2 years.

But there was no question some big-name stocks performed better than others since the pandemic bottom."
,FUBO,2023-01-19T18:33:13Z,Why Jupiter Wellness Shares Are Trading Lower By Around 40%? Here Are Other Stocks Moving In Thursday's Mid-Day Session,"Gainers


	Genius Group Limited (NYSE: GNS) jumped 87% to $1.00. Genius Group authorized issue of special dividend and appointed Timothy Murphy to lead Illegal Trading Task Force.
"
,FUBO,2023-01-20T15:23:23Z,Here's Why FuboTV Stock Is Moving,FuboTV Inc (NYSE: FUBO) shares are trading higher by 4.62% to $2.06 Friday morning.
,FUBO,2023-01-29T14:29:50Z,FuboTV To Lose Some CBS Affiliates Monday,
,FUBO,2023-01-30T16:52:02Z,FuboTV Option Alert: Feb 17 $2.5 Calls Sweep (12) near the Ask: 2339 @ $0.32 vs 6307 OI; Earnings 2/22 After Close [est] Ref=$2.4099,
,FUBO,2023-02-03T16:33:32Z,"'FuboTV To Launch Bally Sports Regional Sports Networks On Monday, Feb. 6' - TheStreamable",
,FUBO,2023-02-06T14:48:30Z,FuboTV Option Alert: Feb 24 $3 Calls Sweep (33) near the Ask: 598 @ $0.42 vs 1362 OI; Earnings 2/24 Before Open Ref=$3.01,
,FUBO,2023-02-07T17:31:24Z,12 Communication Services Stocks Moving In Tuesday's Intraday Session, 
,FUBO,2023-02-10T15:48:33Z,FuboTV Option Alert: Feb 24 $2 Calls Sweep (25) near the Ask: 1000 @ $0.281 vs 2245 OI; Earnings 2/24 Before Open Ref=$2.045,
,FUBO,2023-02-24T14:02:00Z,Earnings Preview: FuboTV, 
,FUBO,2023-02-24T19:04:07Z,FuboTV Option Alert: Apr 21 $3 Calls Sweep (39) near the Ask: 1500 @ $0.29 vs 3538 OI; Earnings 2/27 Before Open Ref=$2.295,
,FUBO,2023-02-27T09:46:14Z,"Earnings Scheduled For February 27, 2023","Companies Reporting Before The Bell

• Kosmos Energy (NYSE:KOS) is projected to report quarterly earnings at $0.14 per share on revenue of $505.61 million."
,FUBO,2023-02-27T12:13:09Z,FuboTV Q4 Sales $319.31M Beat $285.54M Estimate,
,FUBO,2023-02-27T12:13:54Z,"FuboTV Q4 North America Subscribers Up 29% YoY, Rest Of World Subscribers Up 117% YoY",
,FUBO,2023-02-27T12:15:56Z,"FuboTV Sees North America Q1 Subscribers 1.14M-1.16M, Revenue $295M-$300M; Sees North America FY23 Revenue $1.195B-$1.225B",
,FUBO,2023-02-27T13:41:57Z,FuboTV Registered Over 38% Topline Growth In Q4 Backed By North America Subscribers,"FuboTV Inc (NYSE: FUBO) reported fourth-quarter revenue growth of 38.2% year-on-year to $319.32 million Monday, "
,FUBO,2023-02-27T14:53:29Z,Dow Rises Over 200 Points; US Durable Goods Orders Down 4.5%,"U.S. stocks traded higher this morning, with the Dow Jones gaining over 200 points on Monday.

Following the market opening Monday, the Dow traded up 0.68% to 33,041.22 while the NASDAQ rose 1.04% to 11,513.25. The S&amp;P 500 also rose, gaining, 0.77% to 4,000.58."
,FUBO,2023-02-27T14:54:38Z,FuboTV Stock Is Trading Down Today: What's Going On?,FuboTV Inc (NYSE: FUBO) shares are plunging Monday morning after the company reported fourth-quarter financial results and issued guidance.
,FUBO,2023-02-27T14:59:52Z,"CORRECTION: FuboTV Sees North America Q1 Subscribers 1.14M-1.16M, North America Revenue $295M-$300M ; Sees North America FY23 Revenue $1.195B-$1.225B",
,FUBO,2023-02-27T17:40:16Z,Barrington Research Reiterates Market Perform on FuboTV,
,FUBO,2023-02-27T18:05:14Z,Why Smith Micro Software Shares Are Trading Lower By Over 46%? Here Are Other Stocks Moving In Monday's Mid-Day Session,"Gainers


	Lucira Health, Inc. (NASDAQ: LHDX) jumped 354% to $0.6369 after the company announced FDA authorization for its at-home combination COVID-19 &amp; flu test.
"
,FUBO,2023-02-28T09:30:43Z,"Needham Reiterates Buy on FuboTV, Maintains $3 Price Target",
,FUBO,2023-02-28T10:40:42Z,"Evercore ISI Group Downgrades FuboTV to In-Line, Lowers Price Target to $3",
,FUBO,2023-02-28T14:26:19Z,"Stephens & Co. Maintains Equal-Weight on FuboTV, Lowers Price Target to $3",
,FUBO,2023-02-28T14:49:51Z,FuboTV's Return on Invested Capital Insights, 
,FUBO,2023-02-28T15:00:37Z,"Benzinga's Top Ratings Upgrades, Downgrades For February 28, 2023", 
,FUBO,2023-03-07T18:01:54Z,10 Communication Services Stocks Whale Activity In Today's Session,"This whale alert can help traders discover the next big trading opportunities.

Whales are entities with large sums of money and we track their transactions here at Benzinga on our options activity scanner."
,FUBO,2023-03-10T18:27:52Z,Stocks That Hit 52-Week Lows On Friday," 

On Friday, 497 companies set new 52-week lows."
,FUBO,2023-03-15T16:14:28Z,Ryan Reynolds' Mobile Company Gets $1.35B Buyout From T-Mobile: Will He Purchase An NHL Team With That Money?,A leading actor and entrepreneur is the subject of another company he helped launch getting bought out. Here’s the latest on Ryan Reynolds and his golden touch.
,FUBO,2023-03-15T17:25:24Z,Stocks That Hit 52-Week Lows On Wednesday," 

On Wednesday, 479 stocks made new 52-week lows."
,FUBO,2023-03-16T18:14:03Z,Stocks That Hit 52-Week Lows On Thursday," 

Thursday&#39;s session saw 337 companies set new 52-week lows."
,FUBO,2023-03-20T17:29:01Z,Stocks That Hit 52-Week Lows On Monday," 

On Monday, 198 companies hit new 52-week lows."
,FUBO,2023-03-21T13:04:26Z,FuboTV Rebrands As Fubo And Launches Ad Campaign Produced By Maximum Effort Productions Featuring Kevin Garnett And Mark Sanchez,
,FUBO,2023-03-23T13:02:19Z,Fubo Announces MLB.TV Content Partnership,
,FUBO,2023-03-23T13:06:34Z,11 Communication Services Stocks Moving In Thursday's Pre-Market Session, 
,FUBO,2023-03-24T11:19:19Z,fuboTV And 2 Other Stocks Under $3 Insiders Are Aggressively Buying,"The Dow Jones closed higher by around 75 points on Thursday. When insiders purchase or sell shares, it indicates their confidence or concern around the company&#39;s prospects. Investors and traders interested in penny stocks can consider this a factor in their overall investment or trading decision."
,FUBO,2023-03-29T17:02:27Z,Apple TV Could Allow Viewers To View Multiple Sports Simultaneously After Rival Launches Similar Feature,"
	Apple Inc (NASDAQ: AAPL) Apple TV is reportedly working on a new “multiview” feature that allows viewers to watch multiple sports content streams simultaneously.
"
,FUBO,2023-03-31T18:44:43Z,Fubo Is Playing Relatively Safer Than Rival YouTubeTV; Its ARPU Is An Added Strength: Analyst,Needham analyst Laura Martin reiterates a Buy rating on FuboTV Inc (NYSE: FUBO) with a pric
,FUBO,2023-04-19T13:26:11Z,Short Interest Sector Focus: Communication Services Sector,"As of the close of business on Tuesday, 4/18, we captured the Top 10 Highest Short Interest % stocks within the Communication Services sector.

The average short interest for stocks within the Communication Services sector stands at 2.44%. Therefore, the below stocks are showing a more pessimistic outlook than their peers within the respective sector."
,FUBO,2023-05-04T15:02:23Z,A Preview Of FuboTV's Earnings, 
,FUBO,2023-05-05T09:59:04Z,"Earnings Scheduled For May 5, 2023","Companies Reporting Before The Bell

• CNH Industrial (NYSE:CNHI) is estimated to report quarterly earnings at $0.32 per share on revenue of $5.08 billion."
,FUBO,2023-05-05T12:02:03Z,FuboTV Q1 Sales $324.37M Beat $303.39M Estimate,
,FUBO,2023-05-05T12:02:47Z,Fubo Q1 Paid subscribers 1.285M,
,FUBO,2023-05-05T12:03:24Z,Fubo Raises FY23 Total Revenue Guidance To $1.235-1.265B vs $1.25B Est.,
,FUBO,2023-05-05T12:06:41Z,"FuboTV Q1 EPS $(0.27) Beats $(0.43) Estimate, Sales $324.37M Beat $303.39M Estimate",
,FUBO,2023-05-05T13:07:01Z,12 Communication Services Stocks Moving In Friday's Pre-Market Session, 
,FUBO,2023-05-05T13:08:49Z,"CORRECTION: FuboTV Q1 Total Revenue $324.37M , North America Sales $316.50M",
,FUBO,2023-05-05T14:54:02Z,Why FuboTV Shares Are Skyrocketing Today,"
	FuboTV Inc. (NYSE: FUBO) shares are jumping Friday morning as the sports-first live TV streaming platform&#39;s first-quarter results outperformed consensus and raised its FY23 forecast. The company also revealed confidence in its current cash balance.
"
,FUBO,2023-05-05T16:56:05Z,Why Atlassian Shares Are Trading Lower By 10%? Here Are Other Stocks Moving In Friday's Mid-Day Session,"Gainers


"
,FUBO,2023-05-05T17:31:50Z,12 Communication Services Stocks Moving In Friday's Intraday Session, 
,FUBO,2023-05-08T08:05:37Z,"Needham Reiterates Buy on FuboTV, Maintains $3 Price Target",
,FUBO,2023-05-08T12:24:54Z,"Wedbush Reiterates Outperform on FuboTV, Maintains $5 Price Target",
,FUBO,2023-05-08T14:40:14Z,"Six Flags Entertainment, Zscaler, Energizer And Other Big Stocks Moving Higher On Monday","U.S. stocks traded lower, with the Dow Jones dropping around 100 points on Monday. Here are some big stocks recording gains in today’s session.
"
,FUBO,2023-05-08T15:53:43Z,Why FuboTV Stock Is Soaring Today,"
"
,FUBO,2023-05-08T16:59:01Z,Why Tredegar Shares Are Trading Lower By 15%? Here Are Other Stocks Moving In Monday's Mid-Day Session,"Gainers


	Trevena, Inc. (NASDAQ: TRVN) shares surged 170% to $1.74 after the company announced the approval of OLINVYK in China.
"
,FUBO,2023-05-08T18:39:02Z,Nasdaq Edges Higher; Six Flags Reports Upbeat Results,"U.S. stocks traded mixed toward the end of trading, with the S&amp;P 500 and Nasdaq Composite turning higher later during the session on Monday.

The Dow traded down 0.20% to 33,606.80 while the NASDAQ rose 0.14% to 12,252.53. The S&amp;P 500, also rose, gaining, 0.04% to 4,138.09."
,FUBO,2023-05-10T13:09:08Z,Fubo Enhances CTV Advertising Measurement With iSpot.tv; Proves Incremental Reach Beyond Traditional Linear TV Advertising,
,FUBO,2023-05-11T13:04:00Z,Fubo Announces 2023 Season Partnership With Cleveland Guardians; Will Launch Fubo Branding At Progressive Field,
,FUBO,2023-05-22T09:29:24Z,"Needham Reiterates Buy on FuboTV, Maintains $3 Price Target",
,FUBO,2023-05-25T15:00:45Z,Barrington Research Reiterates Market Perform on FuboTVto Market Perform,
,FUBO,2023-05-25T17:01:22Z,Where FuboTV Stands With Analysts, 
,FUBO,2023-06-13T17:32:20Z,11 Communication Services Stocks Moving In Tuesday's Intraday Session, 
,FUBO,2023-06-14T12:06:56Z,Top 5 Tech And Telecom Stocks That May Implode This Month,The most overbought stocks in the communication services sector presents an opportunity to go short on these overvalued companies.
,FUBO,2023-06-14T13:17:06Z,"Benzinga Pro's Top 5 Stocks To Watch For Wednesday, June 14, 2023: AMD, STZ, FUBO, WGO, NKLA","
	
		
			
			
				
				Advanced Micro Devices (AMD) - Shares sold off on Tuesday as investors took profit ahead of a company event with AMD&#39;s CEO Lisa Su. At the early-afternoon event, Su highlighted several new"
,FUBO,2023-06-15T13:10:42Z,FuboTV Announces Jun. 20 Launch Of Maximum Effort Channel,
,FUBO,2023-06-15T14:49:08Z,Sweet Dreams with FuboTV: Ryan Reynolds Tucks Viewers in with New Bedtime Stories Series,FuboTV Inc (NYSE: FUBO) and Ryan Reynolds&#39; Maximum Effort announced the June 20 launch of the 
,FUBO,2023-06-16T13:02:09Z,"Maximum Effort Channel, A Partnership Between Fubo And Ryan Reynolds' Maximum Effort, Will Launch On Fubo, Amazon Freevee, LG Channels, Plex, Sling Freestream, VIDAA, VIZIO WatchFree+, Xumo Play",
,FUBO,2023-06-20T13:03:11Z,"Maximum Effort Channel, A Partnership Between Fubo And Ryan Reynolds' Maximum Effort, Premieres Today With Slate Of Original And Licensed Content",
,FUBO,2023-07-06T14:09:37Z,'Spotify Veteran Dan Sormaz Joins Fubo To Lead Product Design',
,FUBO,2023-07-10T16:34:28Z,Why Icahn Enterprises Shares Are Trading Higher By 18%? Here Are Other Stocks Moving In Monday's Mid-Day Session,"Gainers


	Mobilicom Limited  (NASDAQ: MOB) shares jumped 81.3% to $2.7187 after the company announced it received a commercial scale purchase order from Teledyne-FLIR for the production of drones for the U.S. Department of Defense.
"
,FUBO,2023-07-24T13:14:17Z,"Ryan Reynolds' Maximum Effort Channel Partners With ALF Creator Paul Fusco, Alongside Shout! Studios, To Integrate New Original ALF Content Into Upcoming ALF Marathon",
,FUBO,2023-07-24T17:31:09Z,10 Communication Services Stocks Moving In Monday's Intraday Session, 
,FUBO,2023-07-24T18:54:54Z,Why Ryanair Holdings Shares Are Trading Lower By 8%? Here Are Other Stocks Moving In Monday's Mid-Day Session,"Gainers


	Tupperware Brands Corporation  (NYSE: TUP) shares jumped 59% to $1.43 on above-average volume amid retail investor interest.
"
,FUBO,2023-07-27T19:54:54Z,"Ryan Reynolds Is Bringing A Popular Television Alien Back To Screens, Hide Your Cats!",Actor Ryan Reynolds could be making fans of a popular 1980s television show happy with news that beloved character ALF is set for a comeback.
,FUBO,2023-07-31T19:30:12Z,Why Apellis Pharmaceuticals  Shares Are Trading Lower By Around 19%? Here Are Other Stocks Moving In Monday's Session,"Gainers


	Yellow Corporation (NASDAQ: YELL) shares jumped 106% to $1.46. The trucking company ceased operations on Sunday, according to a Wall Street Journal report.
"
,FUBO,2023-08-03T16:01:04Z,Earnings Preview For FuboTV, 
,FUBO,2023-08-04T09:30:16Z,"Earnings Scheduled For August 4, 2023","Companies Reporting Before The Bell

• WPP (NYSE:WPP) is projected to report earnings for its first quarter.

• Anglogold Ashanti (NYSE:AU) is likely to report earnings for its first quarter."
,FUBO,2023-08-04T12:03:48Z,"FuboTv Is Projecting 1.327M-1,347M Paid Subscribers In 3Q",
,FUBO,2023-08-04T12:05:39Z,"FuboTV Q2 Adj EPS $(0.12) Beats $(0.23) Estimate, Sales $312.74M Beat $301.93M Estimate",
,FUBO,2023-08-04T12:14:31Z,"FuboTV Expects Q3 Revenue $279.7M-$285.7M Vs $295.75M Est, FY23 Revenue $1.2894B-$1.3134B (Prior $1.264B-$1.298B) Vs $1.29B Est",
,FUBO,2023-08-04T12:39:44Z,Top 12 Trending Stocks On WallStreetBets As Of August 4 (Via Swaggy Stocks),
,FUBO,2023-08-04T13:06:07Z,12 Communication Services Stocks Moving In Friday's Pre-Market Session, 
,FUBO,2023-08-04T13:51:54Z,What's Going On With FuboTV Stock Friday?,"FuboTV Inc (NYSE: FUBO) reported second-quarter FY23 sales growth of 41% year-on-year to $312.7 million, beating the "
,FUBO,2023-08-04T14:32:23Z,"Atlassian, Universal Display, Booking, Dropbox And Other Big Stocks Moving Higher On Friday","U.S. stocks traded higher, with the Dow Jones gaining around 150 points on Friday. Here are some big stocks recording gains in today’s session."
,FUBO,2023-08-04T14:34:05Z,"Nikola's Abrupt CEO Transition, Carl Icahn Led Icahn Enterprises Cuts Dividend Payout, FDA Rejects Mesoblast's Cell Therapy For Kids: Today's Top Stories",Wall Street Journal
,FUBO,2023-08-04T16:49:59Z,"Needham Maintains Buy on FuboTV, Raises Price Target to $4",
,FUBO,2023-08-07T12:48:31Z,"Wedbush Reiterates Outperform on FuboTV, Maintains $5 Price Target",
,FUBO,2023-08-07T13:07:24Z,"Stephens & Co. Reiterates Equal-Weight on FuboTV, Maintains $3 Price Target",
,FUBO,2023-08-07T17:28:18Z,Why Krystal Biotech Shares Are Trading Lower By 12%? Here Are Other Stocks Moving In Monday's Mid-Day Session,"Gainers


	Vistagen Therapeutics, Inc.  (NASDAQ: VTGN) shares jumped 747.6% to $14.24 after the company announced its Phase 3 PALISADE-2 trial evaluating the efficacy, safety, and tolerability of fasedienol met the primary and secondary endpoints.
"
,FUBO,2023-08-08T13:25:57Z,"Stephens & Co. Reiterates Equal-Weight on FuboTV, Maintains $3 Price Target",
,FUBO,2023-08-11T08:06:10Z,"Needham Reiterates Buy on FuboTV, Maintains $4 Price Target",
,FUBO,2023-08-11T12:00:20Z,The Latest Analyst Ratings for FuboTV, 
,FUBO,2023-08-16T10:28:15Z,"Needham Reiterates Buy on FuboTV, Maintains $4 Price Target",
,FUBO,2023-08-16T17:35:25Z,10 Communication Services Stocks With Whale Alerts In Today's Session, 
,FUBO,2023-08-18T11:20:16Z,"Needham Reiterates Buy on FuboTV, Maintains $4 Price Target",
,FUBO,2023-09-05T14:43:12Z,"Brady, Airbnb, Insmed And Other Big Stocks Moving Higher On Tuesday","U.S. stocks traded lower, with the Dow Jones falling around 100 points on Tuesday. Here are some big stocks recording gains in today’s session."
,FUBO,2023-09-05T17:34:34Z,Why America's Car-Mart Are Trading Lower By 12%? Here Are Other Stocks Moving In Tuesday's Mid-Day Session,"Gainers


	Verb Technology Company, Inc.  (NASDAQ: VERB) shares jumped 164% to $1.89 after the completed and launched a technology integration and strategic relationship with global social media platform TikTok.
"
,FUBO,2023-09-06T15:38:38Z,"Roth MKM Reiterates Neutral on FuboTV, Maintains $3 Price Target",
,FUBO,2023-09-07T14:03:10Z,"Fubo Selects Digital Harmonic's NextGen Media Solution, KeyFrame, As Their Advanced Video Pre-Encode Filter To Enhance Their Video Quality While Enabling Significant Bitrate Reduction",
,FUBO,2023-09-07T16:30:14Z,Disney Should Cave To Charter Demands: Analysts Size Up Missed Revenue Without A Deal,An ongoing dispute between media giant The Walt Disney Company (NYSE: DIS) and Charter Communications (NASDAQ: CHTR) could see consumers miss out on being able to watch NFL games and the 
,FUBO,2023-09-08T19:21:17Z,Future of Charter Communications Amid Disney Programming Dispute: Analyst Weighs,Benchmark analyst Matthew Harrigan reiterated Charter Communications Inc (NASDAQ: CHTR) with a Buy and a 
,FUBO,2023-09-11T17:31:22Z,10 Communication Services Stocks Moving In Monday's Intraday Session, 
,FUBO,2023-09-11T19:58:18Z,Why FuboTV Stock Is Falling Today,FuboTV Inc. (NYSE: FUBO) shares are trading lower Monday following a report suggesting Disney and Charter are nearing a carriage deal.
,FUBO,2023-09-21T17:16:52Z,Why Seelos Therapeutics Shares Are Trading Lower By 31%? Here Are Other Stocks Moving In Thursday's Mid-Day Session,"Gainers

MSP Recovery, Inc.  (NASDAQ: LIFW) shares climbed 81.5% to $0.2793 after jumping 64% on Wednesday."
,FUBO,2023-10-02T12:34:41Z,Jim Cramer Likes This Oil Giant Up Almost 28% In A Year — 'It Has Room To Grow',"On CNBC’s &#34;Mad Money Lightning Round,&#34; Jim Cramer recommended buying  Caterpillar Inc.  (NYSE: CAT)."
,FUBO,2023-10-06T14:32:58Z,Seaport Global Initiates Coverage On FuboTV with Neutral Rating,
,FUBO,2023-10-06T15:00:44Z,"Benzinga's Top Ratings Upgrades, Downgrades For October 6, 2023", 
,FUBO,2023-10-06T21:00:35Z,The Latest Analyst Ratings for FuboTV, 
,FUBO,2023-10-19T14:15:47Z,"Shares of streaming stocks are trading higher in sympathy with Netflix, which reported better-than-expected Q3 sales results raised some subscription prices.",
,FUBO,2023-10-19T14:51:57Z,Why FuboTV Stock Is Moving,FuboTV Inc (NASDAQ: FUBO) shares are trading higher by 3.7% to $2.55 Thursday morning.
,FUBO,2023-10-24T15:40:50Z,"General Electric, Verizon, Cleveland-Cliffs And Other Big Stocks Moving Higher On Tuesday","U.S. stocks traded higher Tuesday, with the Nasdaq Composite gaining over 100 points. Here are some big stocks recording gains in the trading session. "
,FUBO,2023-10-31T13:15:36Z,'Fubo To Offer Exclusive Perks For Investors Through Partnership With Shareholder Loyalty Leader TiiCKER',
,FUBO,2023-11-02T15:01:14Z,FuboTV's Earnings Outlook, 
,FUBO,2023-11-03T11:12:01Z,"Earnings Scheduled For November 3, 2023","Companies Reporting Before The Bell

• Arcutis Biotherapeutics (NASDAQ:ARQT) is expected to report quarterly loss at $0.86 per share on revenue of $32.83 million."
,FUBO,2023-11-03T11:36:41Z,FuboTV Q3 Sales $311.82M Beat $286.18M Estimate,
,FUBO,2023-11-03T11:39:36Z,"Fubo Raises FY23 Revenue Guidance From $1.26B - $1.28B To $1.319B - $1.324B Vs. $1.3B Estimate, Raises Paid Subs Guidance From 1.565M - 1.585M To 1.584M - 1.599M",
,FUBO,2023-11-03T11:45:11Z,"Fubo Q3 NA Subs Hit All Time High Of 1.477M, NA ARPU $83.51, +17% Y/Y",
,FUBO,2023-11-03T11:46:23Z,"FuboTV Q3 Adj. EPS $(0.22) Beats $(0.32) Estimate, Sales $311.82M Beat $286.18M Estimate",
,FUBO,2023-11-03T13:12:39Z,"Top 10 Trending Stocks On WallStreetBets As Of November 3, 2023 (Via Swaggy Stocks)",
,FUBO,2023-11-03T14:58:41Z,Why Live TV Streaming Platform FuboTV's Stock Is Shooting Higher Today,FuboTV Inc (NYSE: FUBO) shares are trading higher after the company reported Q3 FY23 results. 
,FUBO,2023-11-06T19:54:02Z,"FuboTV's Subscription And Ad Revenue Soar, But Analyst Cautious Amid Decelerating Q4 Growth",Stephens analyst Nicholas Zangler remained Equal-Weight on FuboTV Inc (NYSE: FUBO) with a 
,FUBO,2023-11-14T19:43:41Z,Are FuboTV's Ambitious Goals for Subscriber Growth and ARPU Expansion Too Optimistic? This Analyst Exercises Caution,Barrington analyst James Goss has reiterated a Hold rating on FuboTV Inc (NYSE: 
,FUBO,2023-12-01T11:57:23Z,"Needham Reiterates Buy on FuboTV, Maintains $4 Price Target",
,FUBO,2023-12-08T18:47:22Z,Is FuboTV a Hidden Gem? Analyst's Latest Rating Sparks Curiosity,Needham analyst Laura Martin maintained a Buy rating on FuboTV Inc (NYSE: FUBO) with a pric
,FUBO,2023-12-12T13:49:26Z,"Cantor Fitzgerald Initiates Coverage On FuboTV with Overweight Rating, Announces Price Target of $5",
,FUBO,2023-12-19T14:03:24Z,"EDO And FuboTV Partnered To Measure Consumer Behavior Across Fubo's Premium Sports, News And Entertainment Content; EDO To Provide Connected TV Ad Engagement Data Across All Advertiser Campaigns",
,FUBO,2024-01-03T21:06:35Z,"Nexstar Media Reaches Multi-Year Distribution Agreement With Fubo; Agreement Covers 89 Nexstar-Owned Local Television Stations Across The U.S. And Nexstar's National Cable News Network, NewsNation; Financial Terms Were Not Disclosed",
,FUBO,2024-01-04T13:59:28Z,What's Going On With FuboTV Stock?,FuboTV Inc (NYSE: FUBO) shares are trading higher. The company on Thursday inked a multi-year distribution agreement with Nexstar Media.
,FUBO,2024-01-26T09:58:11Z,"KLA Reports Q2 Results, Joins Visa, Western Digital And Other Big Stocks Moving Lower In Friday's Pre-Market Session","U.S. stock futures were lower this morning, with the Dow futures falling around 100 points on Friday."
,FUBO,2024-01-29T15:15:27Z,How Is The Market Feeling About FuboTV?, 
