ID,Ticker,Date,Headline,Summary
,FUBO,2022-04-22T16:26:29Z,Stocks That Hit 52-Week Lows On Friday," 

On Friday, 431 companies hit new 52-week lows."
,FUBO,2022-04-25T13:13:13Z,"Stephens & Co. Initiates Coverage On FuboTV with Equal-Weight Rating, Announces Price Target of $6",
,FUBO,2022-04-25T14:07:25Z,"Benzinga's Top Ratings Upgrades, Downgrades For April 25, 2022", 
,FUBO,2022-04-26T17:44:57Z,Stocks That Hit 52-Week Lows On Tuesday," 

During Tuesday, 581 stocks hit new 52-week lows.

Interesting Highlights From Today&#39;s 52-Week Lows

Meta Platforms (NASDAQ:FB) was the biggest company on a market cap basis to set a new 52-week low."
,FUBO,2022-04-27T18:41:04Z,Stocks That Hit 52-Week Lows On Wednesday," 

Wednesday&#39;s session saw 784 companies set new 52-week lows."
,FUBO,2022-04-28T17:01:54Z,Looking Into fuboTV Inc. Common Stock's Recent Short Interest,"fuboTV Inc. Common Stock&#39;s (NYSE:FUBO) short percent of float has fallen 10.45% since its last report. The company recently reported that it has 31.08 million shares sold short, which is 23.14% of all regular shares that are available for trading."
,FUBO,2022-04-28T19:31:01Z,Stocks That Hit 52-Week Lows On Thursday," 

During Thursday, 849 stocks hit new 52-week lows."
,FUBO,2022-04-29T16:20:29Z,"'Earlier today Kansas lawmakers passed the state's online sports betting legalization bill, sending it to Gov. Laura Kelly; assuming Kelly signs the bill, Kansas would have legal statewide mobile wagering, possibly as early as this fall' -Ryan Butler",
,FUBO,2022-05-05T08:43:22Z,"Earnings Scheduled For May 5, 2022"," 

Companies Reporting Before The Bell

• Mirum Pharmaceuticals (NASDAQ:MIRM) is expected to report quarterly loss at $1.34 per share on revenue of $8.46 million."
,FUBO,2022-05-05T19:09:27Z,"Notable Earnings Expected Out After The Close For Thursday, May 5, 2022: DASH, ILMN, NWSA, MNST, DBX, LCID, Z, SHAK, FUBO, SPWR, LYV, TWOU",
,FUBO,2022-05-05T20:13:29Z,"FuboTV Q1 North American Sales $236.70M, Up 98% Year Over Year, 305K Total Paid Subs, Ended Qtr. With $456M In Cash",
,FUBO,2022-05-05T20:14:04Z,"fuboTV Sees Positive Cash Flow, Adj. EBITDA In 2025",
,FUBO,2022-05-05T20:42:39Z,Why FuboTV Shares Are Trading Lower After Hours,FuboTV Inc (NYSE: FUBO) shares are trading lower in Thursday&#39;s after-hours session after the company reported 
,FUBO,2022-05-06T08:49:49Z,JP Morgan Downgrades FuboTV to Underweight,
,FUBO,2022-05-06T09:30:30Z,"Roth Capital Downgrades FuboTV to Neutral, Lowers Price Target to $4.25",
,FUBO,2022-05-06T10:11:30Z,24 Stocks Moving in Friday's Pre-Market Session,"Gainers


	Vinco Ventures, Inc. (NASDAQ: BBIG) shares rose 35% to $3.47 in pre-market trading. Vinco Ventures set record date as May 18, 2022 For dividend of shares related to Cryptyde deal. The dividend is expected to be distributed on May 27, 2022.
"
,FUBO,2022-05-06T10:32:21Z,"Needham Maintains Buy on FuboTV, Lowers Price Target to $5",
,FUBO,2022-05-06T13:10:48Z,"Top WallStreetBets Mentions for Friday May 6, 2022 Premarket: TSLA, GME, BBIG, DTE, UVXY, DKNG, FUBO, ARKK, NET, OXY",
,FUBO,2022-05-06T14:02:00Z,"Benzinga's Top Ratings Upgrades, Downgrades For May 6, 2022","Upgrades
For Coupang Inc (NYSE:CPNG), JP Morgan upgraded the previous rating of Neutral to Overweight. The stock has a 52-week-high of $46.00 and a 52-week-low of $11.91. At the end of the last trading period, Coupang closed at $11.99.   "
,FUBO,2022-05-06T15:02:33Z,4 Analysts Have This to Say About FuboTV,"Over the past 3 months, 4 analysts have published their opinion on FuboTV (NYSE:FUBO) stock. These analysts are typically employed by large Wall Street banks and tasked with understanding a company&#39;s business to predict how a stock will trade over the upcoming year."
,FUBO,2022-05-06T16:00:48Z,55 Stocks Moving In Friday's Mid-Day Session,"Gainers


	Swvl Holdings Corp. (NASDAQ: SWVL) surged 24.4% to $7.50. Swvl Holdings 13D Filing from investor Ahmed Sabbah showed a new 6.4% stake in the company.
"
,FUBO,2022-05-06T16:06:50Z,Stocks That Hit 52-Week Lows On Friday," 

On Friday, 1043 companies hit new 52-week lows."
,FUBO,2022-05-06T16:46:26Z,Fubo Shares Bleed As Analysts Re-rate Stock Post Q1 Results,"
"
,FUBO,2022-05-09T10:27:28Z,92 Biggest Movers From Friday,"Gainers


	Sidus Space, Inc. (NASDAQ: SIDU) jumped 51.8% to settle at $2.99 on Friday after the company announced a a memorandum of understanding with Dhruva Space to expand its partnership to further the commercialization of space technologies and services.
"
,FUBO,2022-05-09T17:37:59Z,Looking At FuboTV's Recent Whale Trades,"A whale with a lot of money to spend has taken a noticeably bearish stance on FuboTV.
Looking at options history for FuboTV (NYSE:FUBO) we detected 14 strange trades."
,FUBO,2022-05-10T13:33:15Z,3 Stocks Under $5 Insiders Are Aggressively Buying,"US crude oil futures traded lower on Tuesday. Investors, meanwhile, focused on some notable insider trades.

When insiders purchase or sell shares, it indicates their confidence or concern around the company&#39;s prospects. Investors and traders interested in penny stocks can consider this a factor in their overall investment or trading decision."
,FUBO,2022-05-13T14:13:36Z,FuboTV Option Alert: May 20 $3.5 Calls Sweep (66) near the Ask: 1417 @ $0.325 vs 1856 OI; Ref=$3.46,
,FUBO,2022-05-24T18:05:59Z,Analyzing FuboTV's Short Interest,"FuboTV&#39;s (NYSE:FUBO) short percent of float has risen 15.11% since its last report. The company recently reported that it has 34.91 million shares sold short, which is 25.98% of all regular shares that are available for trading."
,FUBO,2022-05-27T13:21:46Z,UEFA National Team Competitions Kick Off On FOX Sports And FuboTV With UEFA Nations League Broadcast Schedule,
,FUBO,2022-05-31T15:26:45Z,"'New from Gov. Hochul: Online sports betting has generated a record-breaking amount of tax revenue. $267M after just five months, more than any other state. Fund to be reinvested into education, youth programming, gambling prevention & recovery.' -News 8",
,FUBO,2022-06-02T13:06:30Z,FuboTV To Expand Distribution Of 4 Exclusive UEFA Nations League Matches To Pay-Per-View,
,FUBO,2022-06-13T16:18:42Z,Stocks That Hit 52-Week Lows On Monday," 

During Monday&#39;s trading, 1214 companies set new 52-week lows."
,FUBO,2022-06-14T16:11:58Z,Stocks That Hit 52-Week Lows On Tuesday," 

On Tuesday, 951 companies hit new 52-week lows."
,FUBO,2022-06-16T13:02:23Z,FuboTV To Launch 'Pick'em Games' Free-To-Play Sports Contests,
,FUBO,2022-06-17T18:18:27Z,Stephens Analyst Remains Cautious On Fubo's Latest Launch - Read Why,"
"
,FUBO,2022-06-22T18:26:21Z,"This Wedbush Analyst Talks AMC, Netflix And Other Stock Ideas In Hard-Hit Entertainment Sector","We&#39;re over two years into the coronavirus pandemic, and consumer behavior is still adjusting and the ramifications are still playing out in the financial markets."
,FUBO,2022-06-23T19:08:22Z,"FuboTV Says Currently In Negotiations to Renew Content Agreement With Univision; Says Univision's New Contract Offer Would Cost Co More Than Double The Current Rates, Which Are Already At A Premium To Market",
,FUBO,2022-06-28T18:40:05Z,"'In their latest contract offer presented to us for continued carriage of their networks on FuboTV, Univision is seeking to unreasonably increase rates for each Hispanic customer.' - Tweet By Co.",
,FUBO,2022-06-29T16:39:04Z,Stocks That Hit 52-Week Lows On Wednesday," 

During Wednesday&#39;s session, 340 companies made new 52-week lows."
,FUBO,2022-06-30T16:05:48Z,Stocks That Hit 52-Week Lows On Thursday," 

On Thursday, 588 stocks hit new 52-week lows."
,FUBO,2022-07-01T13:41:57Z,'Statement from FuboTV Regarding Univision' - Tweet From Co.,
,FUBO,2022-07-05T16:09:52Z,Stocks That Hit 52-Week Lows On Tuesday," 

During Tuesday&#39;s session, 539 stocks hit new 52-week lows."
,FUBO,2022-07-06T15:30:13Z,Read Why Needham Reiterated Buy On fuboTV Despite Slashing Its Price Target By 67%,Needham analyst Laura Martin saw fuboTV Inc (NYSE: FUBO) as an inexpensive way for public investors to participate in the U.S.
,FUBO,2022-07-17T21:40:16Z,Is YouTube Taking Market Share From Cable Companies? Here's What The Latest Data Reveals,"A narrative of consumers cutting the cord and choosing to get rid of cable television could be further supported in a new report from YouTube. The report shows that not only are cable companies losing subscribers, but virtual multichannel video providers are taking away market share."
,FUBO,2022-07-20T14:04:44Z,'fuboTV Adds New Premium Plan in Canada with 13 Corus Channels' -The Streamable Report,
,FUBO,2022-07-21T15:20:25Z,Short Interest Sector Focus: Communication Services Sector,"As of the close of business on Wednesday, 7/20, we captured the Top 10 Highest Short Interest % stocks within the Communication Services Sector.

The average short interest for stocks within the Communication Services sector stands at 3.31%. Therefore, the below stocks are showing a more pessimistic outlook than their peers within the respective sector.

 "
,FUBO,2022-08-04T08:23:01Z,"Earnings Scheduled For August 4, 2022"," 

Companies Reporting Before The Bell

• Toyota Motor (NYSE:TM) is projected to report earnings for its first quarter."
,FUBO,2022-08-04T20:26:08Z,"FuboTV Q2 EPS $(0.45) Beats $(0.69) Estimate, Sales $202.50M Miss $227.80M Estimate",
,FUBO,2022-08-04T20:26:54Z,Fubo Sees Q3 2022 Subscribers 350K; Sees FY22 Subscribers 350K,
,FUBO,2022-08-04T20:27:29Z,Fubo Reports Q2 2022 Subscribers 347K,
,FUBO,2022-08-04T20:27:57Z,CORRECTION: Fubo Sees Q3 2022 Subscribers 350K; Sees FY22 Subscribers 350K,
,FUBO,2022-08-04T21:43:12Z,12 Communication Services Stocks Moving In Thursday's After-Market Session,"Gainers

"
,FUBO,2022-08-04T21:44:01Z,Recap: FuboTV Q2 Earnings,"FuboTV (NYSE:FUBO) reported its Q2 earnings results on Thursday, August 4, 2022 at 04:05 PM.
Here&#39;s what investors need to know about the announcement.
Earnings
FuboTV beat estimated earnings by 34.78%, reporting an EPS of $-0.45 versus an estimate of $-0.69."
,FUBO,2022-08-05T00:27:56Z,"Top Wall Street Bets Mentions For Thursday August 4, 2022 After-Hours: AMC, GME, TSLA, BBBY, NET, DASH, SIGA, FUBO, COIN, CVNA",
,FUBO,2022-08-05T11:35:01Z,Why Is Marker Therapeutics Trading Higher By 119%: Here Are 42 Stocks Moving Premarket,"Gainers


	Assure Holdings Corp. (NASDAQ: IONM) shares rose 141.4% to $5.07 in pre-market trading after jumping around 104% on Thursday.
"
,FUBO,2022-08-05T16:53:59Z,"Why Cooper-Standard Is Trading Higher By 70%, Here Are 81 Stocks Moving In Friday's Mid-Day Session","Gainers


	Assure Holdings Corp. (NASDAQ: IONM) shares jumped 88.8% to $3.9650 after jumping around 104% on Thursday.
"
,FUBO,2022-08-05T19:09:36Z,12 Communication Services Stocks Moving In Friday's Intraday Session, 
,FUBO,2022-08-08T07:05:40Z,Why Quoin Pharmaceuticals Plunged Over 62%; Here Are 120 Biggest Movers From Friday,Gainers
,FUBO,2022-08-08T13:10:57Z,FuboTV Enters Partnership With Maximum Effort Productions Including First-Look Unscripted Deal; Maximum Effort To Receive Equity From FuboTV,
,FUBO,2022-08-08T17:53:26Z,Did Ryan Reynolds Cause A 10% Jump In This Streaming Company's Stock?,A streaming company is seeing shares spike Monday and actor Ryan Reynolds might be the reason behind the move. Here are the details.
,FUBO,2022-08-11T15:08:46Z,This Sports Wagering Network Starts Streaming On FuboTV,"
"
,FUBO,2022-08-11T15:37:34Z,"Top Wall Street Bets Mentions For Thursday August 11, 2022 Since 9:30 AM ET Open: BBBY, BNGO, TSLA, NVTA, ASTS, GME, DIS, FUBO, VERU, AMC",
,FUBO,2022-08-11T17:50:42Z,12 Communication Services Stocks Moving In Thursday's Intraday Session, 
,FUBO,2022-08-11T18:00:55Z,'Options Abound For FuboTV As Streaming Service Mulls Next Steps For Sportsbook' -SportsHandle,
,FUBO,2022-08-16T14:49:15Z,FuboTV's Investor Day Starts At 2:30 EDT Today,
,FUBO,2022-08-16T15:49:57Z,"Top Wall Street Bets Mentions for August 16, 2022 Since 9:30 AM ET Open: BBBY, GME, TSLA, BBY, AMC, WMT, REV, ASTS, APRN, FUBO",
,FUBO,2022-08-16T15:51:45Z,"Ten Stocks Trending on Discord for Tuesday August 16, 2022: BBBY, GBOX, APRN, FUBO, TSLA, ARTL, GME, REV, AMC, HLBZ",
,FUBO,2022-08-16T18:03:12Z,11 Communication Services Stocks Moving In Tuesday's Intraday Session, 
,FUBO,2022-08-16T18:04:43Z,10 Communication Services Stocks With Whale Alerts In Today's Session," 

This whale alert can help traders discover the next big trading opportunities.

Whales are entities with large sums of money and we track their transactions here at Benzinga on our options activity scanner."
,FUBO,2022-08-16T18:32:56Z,Shares of FuboTV Pull Back from High as Company Investor Day Event Starts,
,FUBO,2022-08-16T21:49:11Z,"Fubo Shares Took Off, Then Dropped, Then Reversed: What Happened To The Sports Streaming Platform On Its Investor Day","Fubotv Inc (NYSE: FUBO) is a streaming platform primarily focusing on live sports. On Tuesday afternoon, the company hosted its Investor Day as shares traded up more than 40%. "
,FUBO,2022-08-17T00:30:21Z,"Top Wall Street Bets Mentions for August 16, 2022 After-Hours: BBBY, GME, FUBO, AMC, BBY, APRN, TSLA, PRTY, SAVA, TLRY",
,FUBO,2022-08-17T09:38:47Z,This Technology Stock Jumped 55% Following Q2 Results; Here Are 96 Biggest Movers From Yesterday,"Gainers


	Eargo, Inc. (NASDAQ: EAR) jumped 77.2% to close at $2.02. The FDA finalized rule enabling access to over-the-counter hearing aids.
"
,FUBO,2022-08-17T10:54:13Z,"Top Wall Street Bets Mentions for August 17, 2022 Premarket: BBBY, GME, BBY, FUBO, AMC, ENDP, TSLA, TGT,  TLRY, AAPL",
,FUBO,2022-08-17T11:16:41Z,"Wedbush Downgrades FuboTV to Neutral, Raises Price Target to $6",
,FUBO,2022-08-17T12:27:48Z,"This Analyst Boosts Price Target On Home Depot Following Strong Earnings, Plus Citigroup Slashes PT On This Stock By Over 60%","
	Baird boosted the price target for  The Home Depot, Inc. (NYSE: HD) from $335 to $360. Home Depot shares fell 0.2% to $326.58 in pre-market trading.
"
,FUBO,2022-08-17T14:14:43Z,"Evercore ISI Group Maintains Outperform on FuboTV, Raises Price Target to $8",
,FUBO,2022-08-17T14:15:36Z,"Benzinga's Top Ratings Upgrades, Downgrades For August 17, 2022", 
,FUBO,2022-08-17T15:48:59Z,"Fubo Must 'Cut Cash Burn,' Former Bull Says Of Sports Streamer Following Investor Day",Webush dropped its bullish stance on Fubotv Inc (NYSE: FUBO) Wednesday.
,FUBO,2022-08-17T16:11:57Z,"Ten Stocks Trending on Discord for Wednesday August 17, 2022: BBBY, EAR, BBIG, SAVA, FUBO, KIRK, ENDP, AAPL, APRN, GNUS",
,FUBO,2022-08-17T16:19:04Z,"Top Reddit Short Squeeze Mentions For Wednesday August 17, 2022: BBBY, APRN, BBIG, GME, REV, ATER, GOVX, AMC, PRTY, FUBO",
,FUBO,2022-08-17T16:23:29Z,"Top Wall Street Bets Mentions for Wednesday August 17, 2022 Since 9:30 AM ET Open: BBBY, GME, FUBO, AAPL, AMC, TLRY, BBY, TSLA, SAVA, PRTY",
,FUBO,2022-08-17T16:48:47Z,"Top 15 Trending Stocks On WallStreetBets As Of Wednesday, August 17, 2022 (Via Swaggy Stocks)",
,FUBO,2022-08-17T23:29:39Z,"Top Wall Street Bets Mentions for Wednesday August 17, 2022 After-Hours: BBBY, GME, AMC, FUBO, AAPL, TLRY, BBIG, BBY, PRTY, TSLA, WISH",
,FUBO,2022-08-18T00:13:02Z,"Ten Stocks Trending on Discord for Wednesday August 17, 2022: BBBY, BBIG, EAR, BLUE, KIRK, SAVA, FUBO, APRN, AAPL, PSTV",
,FUBO,2022-08-18T09:28:59Z,"Needham Maintains Buy on FuboTV, Raises Price Target to $7",
,FUBO,2022-08-18T10:16:48Z,"Top Wall Street Bets Mentions for Thursday August 18, 2022 Since 12:00 AM ET: BBBY, GME, AMC, FUBO, AAPL, BBY, TSLA, TLRY, APRN, PRTY",
,FUBO,2022-08-18T11:46:09Z,"Ten Stocks Trending on Discord for Thursday August 18, 2022: BBBY, BLUE, BBIG, PSTV, EAR, VEEE, FUBO, SSR, MNMD, ASTS",
,FUBO,2022-08-18T18:07:19Z,"Top Wall Street Bets Mentions for Thursday August 18, 2022 Since 9:30 AM AM ET Open: BBBY, GME, MNMD, AMC, AAPL, TSLA, AMD, BBY, FUBO, PRTY",
,FUBO,2022-08-18T20:47:39Z,"Top 15 Trending Stocks On WallStreetBets As Of Thursday, August 18, 2022 (Via Swaggy Stocks)",
,FUBO,2022-08-18T23:33:07Z,"Top Wall Street Bets Mentions for Thursday August 18, 2022 After-Hours: BBBY, GME, WEBR, MNMD, AMC, PRTY, BBY, TSLA, FUBO, AAPL",
,FUBO,2022-08-19T16:16:42Z,"Top 15 Trending Stocks On WallStreetBets As Of Friday, August 19, 2022 (Via Swaggy Stocks)",
,FUBO,2022-08-19T18:26:56Z,11 Communication Services Stocks Moving In Friday's Intraday Session, 
,FUBO,2022-08-22T14:59:37Z,FuboTV Option Alert: Fri $4 Calls at the Ask: 996 @ $0.29 vs 1493 OI; Ref=$4.05,
,FUBO,2022-08-23T13:55:33Z,Short Interest Sector Focus: Communication Services Sector,"As of the close of business on Monday, 8/22, we captured the Top 10 Highest Short Interest % stocks within the Communication Services Sector.

The average short interest for stocks within the Communication Services sector stands at 2.90%. Therefore, the below stocks are showing a more pessimistic outlook than their peers within the respective sector.

 "
,FUBO,2022-08-23T17:49:22Z,10 Communication Services Stocks With Whale Alerts In Today's Session,"This whale alert can help traders discover the next big trading opportunities.
Whales are entities with large sums of money and we track their transactions here at Benzinga on our options activity scanner."
,FUBO,2022-09-02T19:58:07Z,FuboTV Option Alert: Oct 21 $7 Puts at the Bid: 2500 @ $3.74 vs 11011 OI; Ref=$3.3795,
,FUBO,2022-09-07T13:03:38Z,Fubo Sportsbook Launches Statewide In New Jersey,
,FUBO,2022-09-08T15:19:42Z,"Top Wall Street Bets Mentions for Thursday September 8, 2022 Since 9:30 AM ET Open: BBBY, GME, TSLA, AAPL, BYND, AMD, GSAT, ZIM, FUBO, SNAP",
,FUBO,2022-09-09T18:48:07Z,"Dow Climbs More Than 400 Points, S&P 500 Rises 1.5%","U.S. stocks traded higher toward the end of trading, with the Dow Jones gaining more than 400 points on Friday."
,FUBO,2022-09-12T07:23:40Z,Why Immunocore Shares Dipped 22%; Here Are 73 Biggest Movers From Friday,"Gainers


	Digital Media Solutions, Inc. (NYSE: DMS) shares climbed 71.9% to close at $2.20 on Friday after the company received a non-binding go-private proposal from Prism Data for $2.50 per share in cash.
"
,FUBO,2022-09-12T13:10:32Z,"Benzinga Pro's Top 5 Stocks To Watch For Monday, Sept. 12, 2022: FUBO, UNP, NKLA, SNDL, PEI",
,FUBO,2022-09-12T19:42:29Z,FuboTV Shares Are Popping Off Monday: Here's Why,FuboTV Inc (NYSE: FUBO) shares are trading higher by 8.01% to $4.79 going into the close of Monday&#39;s trading session.
,FUBO,2022-09-15T09:21:04Z,Why Vintage Wine Estates Shares Tumbled 40%; Here Are 70 Biggest Movers From Yesterday,"Gainers


	AMTD Digital Inc. (NYSE: HKD) shares jumped 311.8% to settle at $189.42 on Wednesday as the stock experienced a resurgence in momentum despite a lack of fundamental news.
"
,FUBO,2022-09-19T12:46:01Z,12 Communication Services Stocks Moving In Monday's Pre-Market Session, 
,FUBO,2022-09-19T14:22:37Z,Short Interest Sector Focus: Communication Services Sector,"As of the close of business on Friday, 9/16, we captured the Top 10 Highest Short Interest % stocks within the Communication Services Sector.

The average short interest for stocks within the Communication Services sector stands at 2.93%. Therefore, the below stocks are showing a more pessimistic outlook than their peers within the respective sector.

 "
,FUBO,2022-09-23T07:42:10Z,Why Avenue Therapeutics Shares Surged Around 106%; Here Are 87 Biggest Movers From Yesterday,"Gainers


"
,FUBO,2022-09-23T10:30:08Z,FuboTV Shares Spike Higher; Hearing Wedbush Upgrades Stock From Neutral to Outperform,
,FUBO,2022-09-23T10:45:51Z,Wedbush Upgrades FuboTV to Outperform,
,FUBO,2022-09-23T14:14:24Z,"Benzinga's Top Ratings Upgrades, Downgrades For September 23, 2022"," Upgrades
"
,FUBO,2022-09-23T14:30:36Z,"Domino's Pizza, Athersys And Some Other Big Stocks Moving Higher On Friday","U.S. stocks traded lower, with the Dow Jones dropping around 400 points on Friday. Here are some big stocks recording gains in today’s session."
,FUBO,2022-10-03T13:44:37Z,FuboTV Reports Results For Advertisers Adopting Unified ID 2.0 After Becoming First Connected TV Partner,
,FUBO,2022-10-03T18:46:01Z,What's Going On With FuboTV Stock Today?,Shares of sports-first live TV streaming platform company FuboTV Inc (NYSE: FUBO) are trading higher Monday. What&#39;s going on?
,FUBO,2022-10-06T13:02:18Z,"FuboTV, Altitude Sports Announce Carriage Agreement, Streaming Deal For Denver Nuggets, Colorado Avalanche Coverage",
,FUBO,2022-10-10T15:14:56Z,Short Interest Sector Focus: Communication Services Sector,"As of the close of business on Friday, 10/7, we captured the Top 10 Highest Short Interest % stocks within the Communication Services Sector.

The average short interest for stocks within the Communication Services sector stands at 3.11%. Therefore, the below stocks are showing a more pessimistic outlook than their peers within the respective sector.

 "
,FUBO,2022-10-17T20:36:12Z,"FuboTV Says Expects To Close Q3 With North America Revenue $210M+, Up From Prior Guidance Of $200M-$205M",
,FUBO,2022-10-17T20:36:32Z,FuboTV Says 'Revenue and subscriber growth for North America (NA) are expected to exceed previously issued guidance.',
,FUBO,2022-10-17T20:37:39Z,FuboTV Ceases Operation Of Fubo Sportsbook,
,FUBO,2022-10-17T20:38:44Z,"FuboTV Says Paid Subscribers For North America Are Expected To Exceed 1.22M, Up Over 27% YoY",
,FUBO,2022-10-17T21:08:22Z,What's Going On With FuboTV Stock Exploding Higher During Monday's After-Hours Session,FuboTV Inc (NYSE: FUBO) shares are trading higher by 9.88% to $4.45 during Monday&#39;s after-hours session after the company 
,FUBO,2022-10-18T08:03:45Z,"Goldman Sachs, Johnson & Johnson And 3 Stocks To Watch Heading Into Tuesday","With US stock futures trading higher this morning on Tuesday, some of the stocks that may grab investor focus today are as follows:"
,FUBO,2022-10-18T10:04:15Z,"US Stock Futures Surge Following Monday's Rally; Goldman Sachs, Johnson & Johnson Earnings In Focus","Pre-open movers

U.S. stock futures traded higher in early pre-market trade on Tuesday after closing sharply higher in the previous session. The Dow Jones jumped by more than 550 points in the previous session following Friday&#39;s selloff after the UK reversed its proposed tax cuts."
,FUBO,2022-10-18T10:52:31Z,Why fuboTV Shares Are Trading Higher By 11%; Here Are 22 Stocks Moving Premarket,"Gainers


	COMSovereign Holding Corp. (NASDAQ: COMS) shares rose 78.1% to $0.0787 in pre-market trading after gaining 4% on Monday.
"
,FUBO,2022-10-18T11:38:41Z,"AVEO Pharmaceuticals, Akouos And Some Other Big Stocks Moving Higher In Today's Pre-Market Session",U.S. stock futures traded higher this morning. Here are some big stocks recording gains in today’s pre-market trading session.
,FUBO,2022-10-18T14:03:54Z,What's Going On With FuboTV Shares,FuboTV Inc (NYSE: FUBO) shares are trading higher by 10.00% to $4.46 during Tuesday morning after the company issued preliminary third
,FUBO,2022-10-18T19:34:59Z,'Fubo Sportsbook Users Unable To Withdraw Cash After App Goes Belly Up' - Action Network,
,FUBO,2022-10-18T20:24:41Z,"Streaming Stocks Move Higher After Netflix Reports Better-Than-Expected Earnings, Guidance",
,FUBO,2022-10-19T17:10:32Z,Analyst Finds A Cheaper Way To Invest In Streaming Wars - Looks To Fubo Amid Recent Data,Needham analyst Laura Martin reiterated a Buy on fuboTV Inc (NYSE: FUBO) and a $7 price tar
,FUBO,2022-10-19T18:15:07Z,FuboTV Bet On A Sportsbook And Lost: Shocking Closure Of Gambling Unit And What's Ahead For Sports Media,Sports streaming platform company FuboTV Inc (NYSE: FUBO) shared a company update Monday that could change how it is positioning itself moving forward. Here’s what the company said and what could be ahead for shareholders.
,FUBO,2022-10-28T14:00:43Z,Short Interest Sector Focus: Communication Services Sector,"As of the close of business on Thursday, 10/27, we captured the Top 10 Highest Short Interest % stocks within the Communication Services sector.

The average short interest for stocks within the Communication Services sector stands at 2.97%. Therefore, the below stocks are showing a more pessimistic outlook than their peers within the respective sector.

 "
,FUBO,2022-11-03T16:00:41Z,Preview: FuboTV's Earnings," FuboTV (NYSE:FUBO) is set to give its latest quarterly earnings report on Friday, 2022-11-04. Here&#39;s what investors need to know before the announcement.
Analysts estimate that FuboTV will report an earnings per share (EPS) of $-0.74. "
,FUBO,2022-11-04T08:53:43Z,"Earnings Scheduled For November 4, 2022","Companies Reporting Before The Bell

• Sprott (NYSE:SII) is likely to report quarterly earnings at $0.49 per share on revenue of $49.95 million.

• Telefonica (NYSE:TEF) is likely to report earnings for its third quarter."
,FUBO,2022-11-04T12:02:05Z,FuboTV Q3 North America Sales $219.20M,
,FUBO,2022-11-04T12:03:26Z,CORRECTION: FuboTV Q3 North America Sales $219.20M,
,FUBO,2022-11-04T12:08:08Z,"FuboTV Q3 EPS $(0.52) Beats $(0.73) Estimate, Sales $224.80M Beat $213.18M Estimate",
,FUBO,2022-11-04T12:09:10Z,FuboTV Sees Q4 2022 North America Revenue $277.5M-$282.5M; Sees FY22 $949.7M-$954.7M,
,FUBO,2022-11-04T12:10:10Z,FuboTV Says Ended Quarter With ~358K Total Paid Subscribers,
,FUBO,2022-11-04T12:58:23Z,Recap: FuboTV Q3 Earnings,"FuboTV (NYSE:FUBO) reported its Q3 earnings results on Friday, November 4, 2022 at 08:00 AM.

Here&#39;s what investors need to know about the announcement.

Earnings

FuboTV beat estimated earnings by 28.77%, reporting an EPS of $-0.52 versus an estimate of $-0.73."
,FUBO,2022-11-04T17:17:59Z,"fuboTV Posts Double-Digit Growth In North America In Q3 Aided By Aggregation Of Premium Sports, News, Entertainment","
"
,FUBO,2022-11-04T18:20:41Z,What's Going On With Netflix Shares,"Netflix Inc (NASDAQ: NFLX) shares are trading lower by 4.13% to $257.96, possibly in sympathy with Warner Bros Discovery Inc (NASDAQ: WB) and FuboTV Inc (NYSE: "
