ID,Ticker,Date,Headline,Summary
32493474,HD,2023-05-19T20:02:33Z,"S&amp;P 500 Maintains Weekly Gain Despite Uncertainty: Republicans Abandon Debt Ceiling Talks, Retail Sector Sends Mixed Signals",The S&amp;P 500 responded positively this week to investor hopes of a deal being struck to extend the U.S. government debt ceiling. 
32503698,HD,2023-05-22T10:28:32Z,"US Stocks Rise Ahead of Crucial Debt Ceiling Talks, S&P 500 Enters Bull Market, But Analyst Predicts False Bullish Breakout",U.S. equities inched higher on Monday as investors awaited the outcome of a crucial meeting over the debt ceiling raise between President Joe Biden and House Speaker Republican Kevin McCarthy. The meeting will take place in Washington at 5.30 p.m.
32504987,HD,2023-05-22T11:29:41Z,This Analyst With 83% Accuracy Rate  Sees Around 37% Upside In Alibaba - Here Are 5 Stock Picks For Last Week From Wall Street's Most Accurate Analysts,"U.S. stocks closed lower on Friday after Republicans withdrew from debt ceiling negotiations. However, all three major indices recorded gains last week."
32511454,HD,2023-05-22T15:33:39Z,Lowe's Earnings: Investors Look For Clues Amid Recession Fears, 
32512778,HD,2023-05-22T16:30:40Z,How Is The Market Feeling About Home Depot?, 
32514243,HD,2023-05-22T17:35:25Z,10 Consumer Discretionary Stocks With Whale Alerts In Today's Session, 
32519382,HD,2023-05-22T20:46:57Z,Home Depot Unusual Options Activity For May 22, 
32533671,HD,2023-05-23T15:31:00Z,Check Out What Whales Are Doing With Home Depot, 
32553830,HD,2023-05-24T14:46:20Z,Thinking of Buying Prologis? These Are The Properties And Tenants You'd Be Adding To Your Portfolio,"When investors buy real estate investment trusts (REITs), they aren’t just buying real estate companies. They also are buying the tenants that comprise the REITs leasing portfolio."
32577105,HD,2023-05-25T15:00:59Z,$1000 Invested In Home Depot 10 Years Ago Would Be Worth This Much Today, 
32581174,HD,2023-05-25T17:35:24Z,10 Consumer Discretionary Stocks Whale Activity In Today's Session, 
32596061,HD,2023-05-26T14:45:28Z,"Home Depot's Ex-Dividend Date Is Wednesday, Here's What You Need To Know", 
32615892,HD,2023-05-29T17:35:29Z,10 Consumer Discretionary Stocks With Whale Alerts In Today's Session, 
32649267,HD,2023-05-31T14:46:53Z,Home Depot Unusual Options Activity, 
32720953,HD,2023-06-05T17:16:58Z,Home Depot Unusual Options Activity, 
32763743,HD,2023-06-07T17:01:51Z,Home Depot Unusual Options Activity For June 07, 
32773110,HD,2023-06-08T08:03:07Z,AI-Powered ETF Dumps Nvidia In June For A FAANG Stock, 
32780003,HD,2023-06-08T14:27:45Z,"Wells Fargo Maintains Overweight on Home Depot, Raises Price Target to $345",
32784713,HD,2023-06-08T18:05:34Z,"Home Depot Spokesperson Says Shipping Supplies Including Air Filters, Box Fans, Air Scrubbers, Respirator Masks To Meet Increased Customer Demand In Areas Impacted By Poor Air Quality",
32797231,HD,2023-06-09T15:00:54Z,Here's How Much You Would Have Made Owning Home Depot Stock In The Last 10 Years, 
32813178,HD,2023-06-12T11:52:39Z,This Analyst With 87% Accuracy Rate Sees Around 16% Upside In Home Depot - Here Are 5 Stock Picks For Last Week From Wall Street's Most Accurate Analysts,"The S&amp;P 500 settled higher on Friday, surpassing the 4,300 level for the first time since August. The index also recorded gains for four weeks in a row."
32816392,HD,2023-06-12T13:59:46Z,"Morgan Stanley Reiterates Overweight on Home Depot, Maintains $320 Price Target",
32821190,HD,2023-06-12T18:05:57Z,Morgan Stanley Reaffirms Home Depot's Positive Outlook And Potential EBIT Margin Expansion,Morgan Stanley analyst Simeon Gutman reiterated an 
32823200,HD,2023-06-12T20:00:40Z,17 Analysts Have This to Say About Home Depot, 
32830753,HD,2023-06-13T10:02:44Z,Home Depot Reaffirms Fiscal 2023 Guidance,
32830764,HD,2023-06-13T10:03:52Z,Home Depot Sees Mid-To-High-Single-Digit Diluted PES Growth In Market Stability Base Case Outlook;  Sees Sales Growth Between 3% And 4% Per Year In Market Stability Base Case Outlook,
32831855,HD,2023-06-13T11:57:37Z,Home Depot Reaffirms FY23 Guidance; Provides Market Stability Outlook,Home Depot Inc (NYSE: HD) has 
32838508,HD,2023-06-13T15:23:39Z,Home Depot Inc Exec Says Committed To Further Reduce Costs By Approx $500M To Be Fully Realized In Fiscal 2024,
32850327,HD,2023-06-14T09:18:05Z,"Telsey Advisory Group Maintains Outperform on Home Depot, Maintains $315 Price Target",
32853291,HD,2023-06-14T12:18:40Z,"Wedbush Reiterates Neutral on Home Depot, Maintains $290 Price Target",
32874145,HD,2023-06-15T13:23:10Z,"Morgan Stanley Reiterates Overweight on Home Depot, Maintains $320 Price Target",
32897698,HD,2023-06-16T17:35:39Z,10 Consumer Discretionary Stocks Whale Activity In Today's Session, 
32931907,HD,2023-06-20T17:39:12Z,10 Consumer Discretionary Stocks With Whale Alerts In Today's Session, 
32952886,HD,2023-06-21T17:32:31Z,Home Depot Unusual Options Activity For June 21, 
32969020,HD,2023-06-22T15:03:26Z,Home Depot Sets Goal For Battery Powered Products To Drive Over 85% Of Outdoor Lawn Equipment Sales By 2028,
32986784,HD,2023-06-23T16:45:45Z,Home Depot Agrees To Pay $72.5M In California Wage Lawsuit: Report,Home Depot Inc (NYSE: HD) will reportedly settle a long-running lawsuit for underpaying workers in California by paying $72.5 million.
33008848,HD,2023-06-26T16:01:36Z,Home Depot Unusual Options Activity, 
33028070,HD,2023-06-27T15:30:41Z,$100 Invested In Home Depot 10 Years Ago Would Be Worth This Much Today, 
33050151,HD,2023-06-28T20:16:00Z,ETF Returns: Mid-Cap Winners And Losers,"We performed a screening of mid-cap ETFs - defined as having Assets Under Management (AUM) between $2 billion and $10 billion - to determine what funds had the largest positive and negative returns on the week, according to data from etfdb.com. Only non-leveraged funds were considered. "
33063915,HD,2023-06-29T17:00:43Z,"CNBC Halftime Report Final Trades: Charles Schwab, JP Morgan Chase & Co, Home Depot, Wynn Resorts",
33064609,HD,2023-06-29T17:39:04Z,10 Consumer Discretionary Stocks With Whale Alerts In Today's Session, 
33074304,HD,2023-06-30T11:52:32Z,"Home Depot, Wynn Resorts, Charles Schwab And This Big US Bank: CNBC's 'Final Trades'","On CNBC’s &#34;Halftime Report Final Trades,&#34;  Stephanie Link  of Hightower named  The Charles Schwab Corporation  (NYSE: SCHW) "
33080239,HD,2023-06-30T16:06:42Z,"15 Stocks Up, 15 Stocks Down: A Look At The Dow Jones Industrial Average Halfway Through 2023","The stock market rebounded in 2023 with top indexes trading higher after 2022, which saw market declines."
33099149,HD,2023-07-03T17:23:08Z,"Apple Now Worth More Than These 5 Leading U.S. Retailers (Including Amazon And Walmart), 2 Beverage Giants Combined",Technology giant Apple Inc (NASDAQ: AAPL) passed the $3 trillion market capitalization threshold on Friday for the second time in history.
33152666,HD,2023-07-07T20:01:48Z,How Is The Market Feeling About Home Depot?, 
33160421,HD,2023-07-10T12:24:26Z,"Home Depot, Live Nation Entertainment, Diamondback Energy, And A Tech Giant Taking On Musk's Twitter: CNBC's 'Final Trades'","On CNBC’s &#34;Halftime Report Final Trades,&#34;  Josh Brown  of Ritholtz Wealth Management said  Live Nation Entertainment, Inc. (NYSE: LYV), looks like it’"
33189427,HD,2023-07-11T17:38:15Z,10 Consumer Discretionary Stocks With Whale Alerts In Today's Session, 
33201979,HD,2023-07-12T16:33:28Z,This Is What Whales Are Betting On Home Depot, 
33202142,HD,2023-07-12T17:49:32Z,"Bernie Sanders Doesn't Own Individual Stocks But His Mutual Fund Holdings Include Stakes In Companies He's Criticized, Including Tesla","U.S. Sen. Bernie Sanders has made waves over the years for targeting the ultra-wealthy, with some of the billionaires accumulating their wealth through stock investments."
33224097,HD,2023-07-13T21:30:32Z,Here's How Much You Would Have Made Owning Home Depot Stock In The Last 15 Years, 
33231616,HD,2023-07-14T14:06:47Z,"Truist Securities Maintains Buy on Home Depot, Raises Price Target to $348",
33234583,HD,2023-07-14T18:00:29Z,Analyst Expectations for Home Depot's Future, 
33299040,HD,2023-07-20T10:31:10Z,Tesla Races Toward $100B Annual Revenue For 1st Time — But Will It Be Faster Than Large Cap Peers?,"Estimates for the third and fourth quarters indicate revenue of $25.36 billion and $26.83 billion, respectively."
33327114,HD,2023-07-21T17:35:23Z,10 Consumer Discretionary Stocks Whale Activity In Today's Session, 
33350149,HD,2023-07-24T16:30:58Z,Home Depot Unusual Options Activity For July 24, 
33351285,HD,2023-07-24T17:35:24Z,10 Consumer Discretionary Stocks With Whale Alerts In Today's Session, 
33375631,HD,2023-07-25T18:00:21Z,"If You Invested $100 In This Stock 10 Years Ago, You Would Have $400 Today", 
33398229,HD,2023-07-26T16:36:18Z,"Argus Research Maintains Buy on Home Depot, Lowers Price Target to $350",
33400666,HD,2023-07-26T18:45:15Z,(HD) - Analyzing Home Depot's Short Interest, 
33501199,HD,2023-08-01T17:35:25Z,10 Consumer Discretionary Stocks With Whale Alerts In Today's Session, 
33517938,HD,2023-08-02T11:33:27Z,"Citigroup Maintains Buy on Home Depot, Raises Price Target to $375",
33520308,HD,2023-08-02T12:44:49Z,AMD To Rally Around 16%? Here Are 10 Other Analyst Forecasts For Wednesday,"
	Rosenblatt raised the price target for  Pinterest, Inc.  (NYSE: PINS) from $27 to $35. Rosenblatt analyst Barton Crockett upgraded the stock from Neutral to Buy. Pinterest shares fell 3.4% to $27.97 in pre-market trading.
"
33525612,HD,2023-08-02T16:01:07Z,What 23 Analyst Ratings Have To Say About Home Depot, 
33555309,HD,2023-08-03T17:15:48Z,Looking At Home Depot's Recent Unusual Options Activity, 
33618795,HD,2023-08-08T09:05:41Z,"Telsey Advisory Group Downgrades Home Depot to Market Perform, Announces $315 Price Target",
33633845,HD,2023-08-08T15:00:33Z,"Benzinga's Top Ratings Upgrades, Downgrades For August 8, 2023", 
33639433,HD,2023-08-08T17:35:27Z,10 Consumer Discretionary Stocks With Whale Alerts In Today's Session, 
33668527,HD,2023-08-09T13:54:36Z,"Oppenheimer Reiterates Outperform on Home Depot, Maintains $360 Price Target",
33718153,HD,2023-08-10T17:31:04Z,Home Depot Unusual Options Activity, 
33757848,HD,2023-08-11T18:00:53Z,Home Depot Unusual Options Activity For August 11, 
33762230,HD,2023-08-11T20:37:32Z,"Penn-ESPN Deal Transforms Sports Betting, 2 Inflation Data Points Send Mixed Signals, Markets Look Ahead To Retail Earnings", 
33826989,HD,2023-08-14T16:28:50Z,"US Stocks Surge, Chipmakers Rally Despite China's Woes: What's Driving Markets Monday?",U.S. stocks kicked off the week positively as the S&amp;P 500 Index aims to break a four-day losing streak.
33840324,HD,2023-08-14T17:35:27Z,10 Consumer Discretionary Stocks Whale Activity In Today's Session, 
33840380,HD,2023-08-14T18:54:08Z,"Home Depot Q2 Earnings Preview: Earnings Estimates, What Analysts Are Saying And Key Metrics To Watch","Leading home improvement retailer Home Depot Inc (NYSE: HD) will report second quarter financial results before market open Tuesday.

Here’s a look at what analysts are expecting from the company and key aspects to watch."
33848536,HD,2023-08-14T21:20:11Z,Home Depot And Lowe's Q2 Earnings Preview: Foot Traffic Data Shows Resilience, 
33852137,HD,2023-08-15T07:06:20Z,Investor Optimism Falls Further Ahead Of Economic Reports,"The CNN Money Fear and Greed index showed further decline in overall sentiment among U.S. investors on Monday.

The Nasdaq added over 1% on Monday amid a recovery in chip stocks with  NVIDIA Corporation  (NASDAQ: NVDA) adding over 7%. The VanEck Semiconductor ETF (SMH) gained 3% on Monday."
33852553,HD,2023-08-15T08:02:28Z,"Earnings Scheduled For August 15, 2023","Companies Reporting Before The Bell

• Mainz Biomed (NASDAQ:MYNZ) is projected to report earnings for its second quarter."
33852831,HD,2023-08-15T09:11:13Z,"Home Depot, Agilent Technologies And 3 Stocks To Watch Heading Into Tuesday","With U.S. stock futures trading mixed this morning on Tuesday, some of the stocks that may grab investor focus today are as follows:"
33853186,HD,2023-08-15T10:00:55Z,"Home Depot Q2 EPS $4.65 Beats $4.46 Estimate, Sales $42.92B Beat $42.25B Estimate",
33853188,HD,2023-08-15T10:01:48Z,Home Depot Announces $15B Share Repurchase Authorization,
33853226,HD,2023-08-15T10:04:14Z,"Home Depot Q2 Comparable Sales -2% YoY, Comparable Sales US -2%, Customer Transactions 459.1M (-1.8% YoY), Average Ticket $90.07 (+0.1% YoY)",
33853252,HD,2023-08-15T10:05:20Z,Home Depot Reaffirms FY23 Outlook,
33853253,HD,2023-08-15T10:06:33Z,"CORRECTION: Home Depot Q2 EPS $4.65 Beats $4.46 Estimate, Sales $42.92B Beat $42.25B Estimate",
33855870,HD,2023-08-15T12:18:08Z,"Home Depot's Q2 Performance: Revenue Dip, New Stock Buyback And More",Home improvement retailer Home Depot Inc (NYSE: HD) reported a 
33858118,HD,2023-08-15T13:08:49Z,"Telsey Advisory Group Reiterates Market Perform on Home Depot, Maintains $315 Price Target",
33858128,HD,2023-08-15T13:09:19Z,"Home Depot Exec Says In Q2, As Weather Improved, Saw An Increase In Spring Sales And Strength In Smaller-Ticket Projects",
33859346,HD,2023-08-15T13:59:35Z,"First Solar's Internal Audit Reveals Instances Of Forced Labor, Philips Recalls Faulty Ventilators, Home Depot's Q2 Performance: Today's Top Stories","Benzinga

Home Depot&#39;s Q2 Performance: Revenue Dip, New Stock Buyback And More"
33861636,HD,2023-08-15T15:19:45Z,"Consumers Splurge But Fitch Warning And China Data Hit The Sentiment, Saudi Arabia Buys Nvidia Chips","To gain an edge, this is what you need to know today.

"
33861750,HD,2023-08-15T15:26:32Z,Home Depot Adjusts To Pre-Pandemic Consumer Behavior,"This week’s earnings repertoire is led by Home Depot (NYSE: HD) who reported today, along with Walmart Inc (NYSE: WMT), TJ Maxx parent company The TJX Companies Inc (NYSE: TJX) and othe"
33862485,HD,2023-08-15T16:00:12Z,Crude Oil Down 2%; Home Depot Posts Upbeat Earnings,"U.S. stocks traded lower midway through trading, with the Nasdaq Composite falling around 90 points on Tuesday.

The Dow traded down 0.75% to 35,042.16 while the NASDAQ fell 0.66% to 13,697.15. The S&amp;P 500, also fell, dropping, 0.76% to 4,455.45."
33855549,HD,2023-08-15T16:47:10Z,"US Stocks Resume Losses, Banks Fall on Fitch's Downgrade Concerns: What's Driving Markets Tuesday?","Sentiment remained depressed on Tuesday, with the U.S."
33863157,HD,2023-08-15T18:25:59Z,Can Home Depot Survive The Current Hosing Market Headwinds? Analyst Discusses Future,Telsey Advisory Group analyst Joseph Feldman reiterated a 
33865408,HD,2023-08-15T19:04:08Z,Nasdaq Falls 100 Points; Siyata Mobile Shares Spike Higher,"U.S. stocks traded lower toward the end of trading, with the Nasdaq Composite falling over 100 points on Tuesday.

The Dow traded down 0.82% to 35,017.95 while the NASDAQ fell 0.77% to 13,682.54. The S&amp;P 500, also fell, dropping, 0.87% to 4,450.59."
33865768,HD,2023-08-15T20:32:58Z,Home Depot May Be Setting Itself Up To Nail Future Estimates: Analyst Says Home Improvement Retailer 'Knows How To Manage Expectations',"Home Depot Inc (NYSE: HD) beat earnings estimates for the first time in three quarters Tuesday morning, but sales slipped on a year-over-year basis as customers held off on big-ticket purchases."
33870863,HD,2023-08-16T06:57:57Z,Investor Sentiment Declines Further After Weak China Data,"The CNN Money Fear and Greed index showed further decline in overall sentiment among U.S. investors on Tuesday.

The Dow Jones fell more than 300 points on Tuesday, snapping a three-day positive streak. Regional banks moved lower, with the SPDR S&amp;P Regional Banking ETF (KBE) declining around 3% on Tuesday."
33871058,HD,2023-08-16T08:21:02Z,"Telsey Advisory Group Maintains Market Perform on Home Depot, Raises Price Target to $335",
33872329,HD,2023-08-16T10:34:14Z,"Goldman Sachs Maintains Buy on Home Depot, Raises Price Target to $350",
33872337,HD,2023-08-16T10:35:09Z,"JP Morgan Maintains Overweight on Home Depot, Raises Price Target to $335",
33872368,HD,2023-08-16T10:36:02Z,"Barclays Maintains Equal-Weight on Home Depot, Raises Price Target to $333",
33873219,HD,2023-08-16T11:24:42Z,Home Depot Analysts Raise Their Forecasts After Upbeat Q2 Results,"The Home Depot, Inc. (NYSE: HD) reported better-than-expected results for its second quarter."
33873250,HD,2023-08-16T11:28:15Z,"Bernstein Maintains Market Perform on Home Depot, Raises Price Target to $328",
33873342,HD,2023-08-16T11:32:01Z,"Wells Fargo Maintains Overweight on Home Depot, Raises Price Target to $360",
33873799,HD,2023-08-16T11:59:32Z,Occidental Petroleum To Rally Around 18%? Here Are 10 Other Analyst Forecasts For Wednesday,"
	Piper Sandler lowered the price target for  Riskified Ltd.  (NYSE: RSKD) from $8 to $7. Piper Sandler analyst Brent Bracelin maintained an Overweight rating. Riskified shares gained 12% to close at $4.77 on Tuesday.
"
33874576,HD,2023-08-16T12:36:35Z,"Wedbush Maintains Neutral on Home Depot, Raises Price Target to $350",
33874834,HD,2023-08-16T12:50:30Z,"Morgan Stanley Maintains Overweight on Home Depot, Raises Price Target to $350",
33876465,HD,2023-08-16T14:11:27Z,"DA Davidson Maintains Neutral on Home Depot, Raises Price Target to $320",
33876824,HD,2023-08-16T14:30:45Z,Target Makes An Earnings Turnaround But Slashes Outlook,"In a week of retail earnings reports, Target Corporation (NYSE: TGT) managed to beat second-quarter earnings estimates but its revenue fell short of Wall Street&#39;s expectations despite its efforts to compete with Amazon.com Inc (NASDAQ: AMZN) and its Pr"
33876835,HD,2023-08-16T14:32:01Z,"Truist Securities Maintains Buy on Home Depot, Raises Price Target to $372",
33878795,HD,2023-08-16T16:17:43Z,"Loop Capital Maintains Hold on Home Depot, Raises Price Target to $315",
33878916,HD,2023-08-16T16:24:22Z,"Jefferies Maintains Buy on Home Depot, Raises Price Target to $384",
33879559,HD,2023-08-16T17:03:46Z,"Guggenheim Maintains Buy on Home Depot, Raises Price Target to $360",
33877903,HD,2023-08-16T17:10:05Z,Home Depot Had  A Mixed Q2 But Some Analysts See Upside In The Stock - Here's Why,"Several analysts raised the price target of The Home Depot, Inc. (NYSE: HD) following "
33880947,HD,2023-08-16T18:29:58Z,"Unlike Other Retailers, TJX Benefited From Price-Conscious Consumers Who Are Still Willing To Splurge On Discounted Premium Apparel","Unlike Target Corporation (NYSE: TGT) whose sales slid as consumers prioritized needs over wants, The TJX Companies Inc (NYSE: TJX) told quite a different second quarter story with its price-conscious consumers still spending big at its stores."
33895824,HD,2023-08-17T14:17:36Z,Walmart Smashes Q2 Expectations By Thriving On Cost-Conscious Consumer Behavior,Walmart Inc (NASDAQ: WMT) just reported its latest quarterly performance before the bell and it delivered plenty of good news.
33901116,HD,2023-08-17T20:02:55Z,"If You Invested $100 In This Stock 15 Years Ago, You Would Have $1,200 Today", 
33918192,HD,2023-08-18T15:47:10Z,"Hurricane Hilary, Now A Category 4 Storm, Is Barreling Toward The Los Angeles Area", 
33959092,HD,2023-08-21T10:35:12Z,This Analyst With 86% Accuracy Rate Sees Over 15% Upside In NVIDIA - Here Are 5 Stock Picks For Last Week From Wall Street's Most Accurate Analysts,"U.S. stocks recorded losses last week, with the Dow falling 2.2%. The S&amp;P 500 declined 2.1%, recording losses for the straight week."
33964563,HD,2023-08-21T14:30:27Z,Looking Into Home Depot's Recent Short Interest, 
33971659,HD,2023-08-21T20:16:06Z,Home Depot Unusual Options Activity For August 21, 
33971458,HD,2023-08-21T20:50:56Z,"Lowe's Companies Q2 Earnings Preview: What Analysts Are Saying, How Rival Home Depot's Q2 Beat Could Help And Hurt",Leading home improvement retailer Lowe’s Companies (NYSE: LOW) will report second-quarter financial results before the market opens Tuesday.
33990692,HD,2023-08-22T17:35:20Z,10 Consumer Discretionary Stocks Whale Activity In Today's Session, 
33992576,HD,2023-08-22T21:20:25Z,"Energy MLPs Beat The Market, China And Home Building Down Big - ETF Winners And Losers: Mid-Cap Returns","We performed a screening of mid-cap ETFs, defined as having Assets Under Management (AUM) between $400 million and $2 billion - to determine what funds had the largest positive and negative returns on the week, according to data from etfdb.com. Only non-leveraged funds were considered."
34040978,HD,2023-08-25T12:29:25Z,"Salesforce, Home Depot And 2 Other Stocks Insiders Are Selling","The Nasdaq 100 closed lower by more than 300 points on Thursday. Investors, meanwhile, focused on some notable insider trades."
34043601,HD,2023-08-25T14:45:30Z,Home Depot: Dividend Insights, 
34046514,HD,2023-08-25T16:49:44Z,"Live On CNBC, Jim Lebenthal Announces He Trimmed Home Depot Position",
34066375,HD,2023-08-28T12:14:07Z,"The Home Depot Foundation Announced An Incremental Investment Of More Than $6M In Skilled Trades Training And Launched New Strategic Partnerships To Address The Nearly 400,000 Job Openings Across The Construction Industry",
34072048,HD,2023-08-28T17:43:58Z,US Luxury Retailer Neiman Marcus Mulls Sale To Rival Saks Fifth Avenue: Report,
34099477,HD,2023-08-29T18:19:13Z,The Story Of Sharply Different Retail Fates Continues,"A story of sharply divergent quarterly results that began with Target Corporation (NYSE: TGT) and The Home Depot Inc (NYSE: HD) struggling on one side, and Walmart Inc (NYSE: WMT) a"
34116675,HD,2023-08-30T14:23:22Z,"Home Depot Spokesperson Says Due To Hurricane Idalia, Closed Stores, Distribution Centers In Impacted Area To Keep Associates, Customers Safe",
34121894,HD,2023-08-30T17:35:21Z,10 Consumer Discretionary Stocks Whale Activity In Today's Session, 
34153301,HD,2023-08-31T17:35:21Z,10 Consumer Discretionary Stocks With Whale Alerts In Today's Session, 
34213713,HD,2023-09-04T21:30:28Z,"$100 Invested In This Stock 15 Years Ago Would Be Worth $1,100 Today", 
34250110,HD,2023-09-05T19:00:48Z,Home Depot Unusual Options Activity For September 05, 
34306032,HD,2023-09-07T08:14:01Z,"Stifel Initiates Coverage On Home Depot with Hold Rating, Announces Price Target of $350",
34323067,HD,2023-09-07T15:00:41Z,"Benzinga's Top Ratings Upgrades, Downgrades For September 7, 2023", 
34366342,HD,2023-09-08T16:28:56Z,"Evercore ISI Group Maintains Outperform on Home Depot, Raises Price Target to $370",
34366925,HD,2023-09-08T17:00:55Z,What 25 Analyst Ratings Have To Say About Home Depot, 
34445800,HD,2023-09-11T15:15:28Z,Peering Into Home Depot's Recent Short Interest, 
34496340,HD,2023-09-12T16:00:21Z,$1000 Invested In Home Depot 15 Years Ago Would Be Worth This Much Today, 
34538919,HD,2023-09-13T14:22:22Z,Home Depot Exec Says Going To Open 13 Stores This Year; 9 Of Them Will Be In The Back Half Of The Year,
34552723,HD,2023-09-13T21:04:12Z,Starlink Revenue Is 11% Of What Elon Musk Promised Investors In 2015, 
34584688,HD,2023-09-14T15:03:45Z,Check Out What Whales Are Doing With Home Depot, 
34587471,HD,2023-09-14T18:46:53Z,"Hurricane Lee Picks Up Pace, On Track To Hit Northeastern US","Hurricane Lee hit Bermuda early Thursday morning, bringing heavy rain and high winds to the region. The storm is picking up pace and moving faster than what some experts anticipated."
34734307,HD,2023-09-19T15:15:58Z,Home Depot Unusual Options Activity, 
34769706,HD,2023-09-20T17:35:24Z,10 Consumer Discretionary Stocks With Whale Alerts In Today's Session, 
34819823,HD,2023-09-22T11:03:56Z,"HSBC Initiates Coverage On Home Depot with Hold Rating, Announces Price Target of $365",
34823153,HD,2023-09-22T13:14:35Z,"Nike, McDonald's And Other Consumer Stocks From Wall Street's Most Accurate Analysts","Wall Street analysts make new stock picks on a daily basis. Unfortunately for investors, not all analysts have particularly impressive track records at predicting market movements. Even when it comes to one single stock, analyst ratings and price targets can vary widely, leaving investors confused about which analyst&#39;s opinion to trust."
34825538,HD,2023-09-22T15:00:39Z,"Benzinga's Top Ratings Upgrades, Downgrades For September 22, 2023", 
34829620,HD,2023-09-22T17:35:20Z,10 Consumer Discretionary Stocks With Whale Alerts In Today's Session, 
34923076,HD,2023-09-26T18:46:15Z,This Is What Whales Are Betting On Home Depot, 
34984098,HD,2023-09-28T17:54:06Z,Costco Continues To Do It Its Own Way,"On Tuesday, Costco Wholesale Corporation (NASDAQ: COST) topped quarterly earnings expectation despite a persistent weakness in sales."
35037542,HD,2023-10-02T17:16:25Z,Check Out What Whales Are Doing With Home Depot, 
35082422,HD,2023-10-04T09:15:31Z,"Telsey Advisory Group Maintains Market Perform on Home Depot, Lowers Price Target to $330",
35093954,HD,2023-10-04T17:00:47Z,Analyst Expectations for Home Depot's Future, 
35094526,HD,2023-10-04T17:35:23Z,10 Consumer Discretionary Stocks Whale Activity In Today's Session, 
35094256,HD,2023-10-04T18:44:38Z,Home Depot Poised For Long-Term Win In Retail Despite Current Macro Challenges: Analyst,"Telsey Advisory Group analyst Joseph Feldman reiterated the Market Perform rating on Home Depot, Inc. (NYSE: HD), "
35107759,HD,2023-10-05T13:13:58Z,"Truist Securities Maintains Buy on Home Depot, Lowers Price Target to $341",
35112346,HD,2023-10-05T16:00:56Z,"If You Invested $1000 In This Stock 20 Years Ago, You Would Have $8,200 Today", 
35149587,HD,2023-10-09T17:35:22Z,10 Consumer Discretionary Stocks Whale Activity In Today's Session, 
35202527,HD,2023-10-11T19:18:05Z,Home Depot Unusual Options Activity For October 11, 
35231309,HD,2023-10-12T21:46:00Z,Iran's Involvement In Israel-Hamas Conflict Is Key For The Future Of US Inflation,The outbreak of war in the Middle East is threatening to hamper the Fed&#39;s efforts to control inflation.
