ID,Ticker,Date,Headline,Summary
40334855,HD,2024-08-13T11:39:49Z,"Home Depot Q2 Earnings: Customer Transactions Decline, Cites Weaker Home Improvement Spending But Raises Annual Revenue Outlook","Home Depot (NYSE: HD) missed Q2 2024 revenue expectations, with sales growth of 0.6% YoY. Company cites higher interest rates and macro uncertainty."
40334874,HD,2024-08-13T11:40:57Z,"Nasdaq, S&P 500 Futures Waver As Home Depot Sags And PPI Report Awaited: Analyst Says 'Insufficient Technical Evidence' That Bottom Has Been Set","Wall Street is priming for a positive start on Tuesday, as the market resiliently holds onto optimism regarding receiving benign inflation data, which will likely seal the fate of a rate cut."
40338542,HD,2024-08-13T13:15:30Z,"Top 10 Trending Stocks On WallStreetBets As Of August 13, 2024 (Via Swaggy Stocks)",
40339619,HD,2024-08-13T13:54:29Z,"Telsey Advisory Group Maintains Market Perform on Home Depot, Maintains $360 Price Target",
40342260,HD,2024-08-13T15:09:13Z,"Pay Attention: Inflation Headline Is Misleading, Home Depot Earnings Show Consumer Weakness","To gain an edge, this is what you need to know today."
40345499,HD,2024-08-13T16:15:58Z,S&P 500 Gains 1%; Home Depot Earnings Top Views, 
40345592,HD,2024-08-13T16:20:54Z,What's Going On With Lowe's Shares Tuesday,"Lowe&#39;s stock initially traded lower in sympathy with Home Depot, which reported a revenue miss for the second quarter and issued adjusted EPS outlook below estimates. Both stocks have since reversed."
40346275,HD,2024-08-13T16:55:01Z,"Tech Stocks Soar, Treasury Yields Fall On Cool Inflation Data; Starbucks Rockets, Chipotle Plummets: What's Driving Markets Tuesday?","A wave of bullish sentiment swept through Wall Street on Tuesday after lower-than-expected producer inflation data solidified expectations for Federal Reserve rate cuts, prompting speculators to increase bets on a more significant 50"
40358457,HD,2024-08-14T06:49:23Z,"Nasdaq, Dow Jones Jump Over 400 Points Following PPI Report: Investor Sentiment Improves But Greed Index Remains In 'Extreme Fear' Zone", 
40364257,HD,2024-08-14T12:06:39Z,"Stifel Maintains Hold on Home Depot, Lowers Price Target to $375",
40364995,HD,2024-08-14T12:20:27Z,"Evercore ISI Group Maintains Outperform on Home Depot, Lowers Price Target to $400",
40365299,HD,2024-08-14T12:34:08Z,Home Depot Analysts Cut Their Forecasts Following Q2 Results, 
40366567,HD,2024-08-14T13:05:44Z,"UBS Maintains Buy on Home Depot, Raises Price Target to $425",
40349028,HD,2024-08-14T13:11:43Z,Home Depot Sales Fall Short As Consumers 'Become Increasingly Cautious': Analyst (CORRECTED),Home Depot&#39;s revenue declined in Q2 due to cautious consumers and tough market trends. Analysts predict lower financing costs and maintain $360 target.
40369105,HD,2024-08-14T14:16:01Z,"Truist Securities Maintains Buy on Home Depot, Lowers Price Target to $395",
40369594,HD,2024-08-14T14:35:13Z,Home Depot Sends A Clear Consumer Health Warning,"On Tuesday, The Home Depot Inc (NYSE: HD) kicks off the retail reports ahead of Walmart (NYSE: WMT) and Target (NYSE: TGT) by posting its fiscal second-quarter earnings and sal"
40371467,HD,2024-08-14T15:22:54Z,"Loop Capital Maintains Hold on Home Depot, Lowers Price Target to $330",
40373007,HD,2024-08-14T16:15:16Z,"RBC Capital Maintains Sector Perform on Home Depot, Lowers Price Target to $363",
40375185,HD,2024-08-14T17:48:16Z,"Home Depot's Price Forecasts For 2024 Lowered By Analysts Amid Modest Sales Growth, Cite Weaker Consumer Outlook","Home Depot shares rise on lower price target and estimates after Q2 earnings results, with raised sales guidance and adjusted EPS forecast."
40381559,HD,2024-08-14T20:57:37Z,Home Depot CEO Says 'Inflation Keeps Eating Away At Disposable Income': Are Home Repairs Being Put Off Due To The Economy?,"Homeowners are delaying renovations due to high interest rates, affecting companies like Home Depot, Wayfair, and LL Flooring. Interest rate cuts could bring relief."
40399824,HD,2024-08-15T15:46:08Z,Home Depot Options Trading: A Deep Dive into Market Sentiment, 
40421745,HD,2024-08-16T17:00:11Z,"CNBC Final Trades: Amazon, Applied Materials, Home Depot",
40424172,HD,2024-08-16T19:21:17Z,"Walmart Surges, Home Depot Stumbles: Retail Giants Navigate Conflicted Economy","Walmart beats earnings forecast and raises outlook, but economic indicators and declining commodity prices suggest caution in consumer spending"
40438975,HD,2024-08-19T12:40:40Z,"Home Depot, Amazon, Applied Materials On CNBC's 'Final Trades'","On CNBC&#39;s &#34;Halftime Report Final Trades,&#34; Stephanie Link of Hightower said Home Depot reported better-than-expected gross margins."
40446039,HD,2024-08-19T17:35:17Z,10 Consumer Discretionary Stocks Whale Activity In Today's Session, 
40446352,HD,2024-08-19T17:50:53Z,"Lowe's Q2 Earnings Preview: Analysts Stress 'Critical' Margin Performance As Investors Focus On Housing Market, Home Repair Trends",A look at Lowe&#39;s second-quarter earnings estimates and key items to watch as investors look to the housing market and home repairs for consumer indicators.
40463021,HD,2024-08-20T13:23:14Z,Walmart's Results Suggest Consumer Health Is Stabilizing,"On Thursday, Walmart Inc (NYSE: WMT) reported its fiscal second quarter results, topping Wall Street estimates for both sales and profits. Based on the strength its half year results reflected, the largest U.S. retailer raised its full-year outlook."
40469607,HD,2024-08-20T17:37:37Z,Lowe's Q2 Earnings: Analysts Highlight Margin Strength Despite Revenue Miss and Sales Pressure,"Lowe&#39;s Q2 earnings beat expectations with strong margins, though revenue missed targets; analysts remain positive."
40484259,HD,2024-08-21T12:52:24Z,"Electronic Arts, Home Depot And 2 Other Stocks Executives Are Selling", 
40485533,HD,2024-08-21T13:25:30Z,"Home Depot Spokesperson On Potential Canada Rail Strike Says, Has Implemented Several Short-Term Actions To Mitigate Impact On Customers, Associates",
40489599,HD,2024-08-21T15:53:51Z,"Lowe's Q2 Earnings Reflect Pro Strength, DIY Weakness, Analysts Say: How Retailer Stacks Up To Home Depot","Lowe&#39;s Companies reports mixed results for Q2, beating earnings estimate but delivering a comps miss."
40489954,HD,2024-08-21T16:13:29Z,5 Things To Know In Investing This Week: The Disinflation Issue,The Disinflation Issue
40494701,HD,2024-08-21T20:22:29Z,Is The Consumer OK? What We Know From Retailers About Spending In 2024,"Today&#39;s consumer is &#34;willing to shop when they find that right combination of fashion and newness at the right price,&#34; one retail exec said."
40515606,HD,2024-08-22T19:20:21Z,"2 Railway Strikes, 3 US Sectors In Trouble: $277B In Goods At Stake As Canadian Unions Call For New Contracts","Railway strike could impact sectors relying on goods from CNR and CP. Auto, timber, and grain companies in jeopardy?"
40533958,HD,2024-08-23T18:04:59Z,Market Whales and Their Recent Bets on Home Depot Options, 
40583948,HD,2024-08-27T17:35:18Z,10 Consumer Discretionary Stocks Whale Activity In Today's Session, 
40608330,HD,2024-08-28T17:30:42Z,"If You Invested $1000 In This Stock 20 Years Ago, You Would Have $9,900 Today", 
40611728,HD,2024-08-28T20:09:24Z,"Home Depot To End Marijuana Testing, Limit Screening For Most Employees, Internal Memo Reveals",The new initiative makes Home Depot one of the largest private companies in the country to do away with screening for cannabis.
40634898,HD,2024-08-29T18:16:14Z,Unpacking the Latest Options Trading Trends in Home Depot, 
40658770,HD,2024-08-30T17:35:17Z,10 Consumer Discretionary Stocks Whale Activity In Today's Session, 
40679572,HD,2024-09-03T05:25:09Z,Elon Musk 'Can't Wait' To Work With Trump In Cutting 'Waste And Needless Regulation' As Reports Suggest Ex-President May Tap Tesla CEO To Audit Federal Agencies,"Former president Donald Trump is contemplating appointing Tesla Inc.  CEO Elon Musk to a commission aimed at auditing U.S. agencies, ahead of the 2024 presidential election. The plan has been in discussion for months."
40693751,HD,2024-09-03T18:00:34Z,Expert Outlook: Home Depot Through The Eyes Of 13 Analysts, 
40713418,HD,2024-09-04T16:03:39Z,"Retailers Plea For Deal: US Ports, Union Start Two-Day Talk In Effort To Prevent Disruptive Strike","Employers &amp; dockworkers meet in New Jersey to prevent a strike at 6 of the 10 busiest ports, affecting 45,000 workers and 36 ports. Retailers urge the government to help."
40715300,HD,2024-09-04T17:35:19Z,10 Consumer Discretionary Stocks Whale Activity In Today's Session, 
40737314,HD,2024-09-05T17:35:23Z,10 Consumer Discretionary Stocks Whale Activity In Today's Session, 
40755400,HD,2024-09-06T19:02:32Z,"If You Invested $1000 In This Stock 20 Years Ago, You Would Have $9,600 Today", 
40769126,HD,2024-09-09T10:24:28Z,"Trump Vs. Harris Spurs Early Holiday Sales: Costco, Home Depot Unveil Christmas And Halloween Merchandise, Amazon Announces October Deals Amid Economic Uncertainty",The upcoming presidential election is prompting retailers to kick off holiday sales earlier than usual. This shift aims to counteract potential November shopping slowdowns.
40780011,HD,2024-09-09T18:30:54Z,Market Whales and Their Recent Bets on Home Depot Options, 
40800761,HD,2024-09-10T17:35:17Z,10 Consumer Discretionary Stocks Whale Activity In Today's Session, 
40818333,HD,2024-09-11T16:30:58Z,Behind the Scenes of Home Depot's Latest Options Trends, 
40831116,HD,2024-09-12T12:17:56Z,"Telsey Advisory Group Maintains Market Perform on Home Depot, Maintains $360 Price Target",
40831857,HD,2024-09-12T12:41:30Z,"PayPal Is A Buy, Jim Cramer Says: As For Rivian? 'Let It Percolate'",PayPal will become an additional credit and debit card processor for Shopify Payments through its PayPal Complete Payments solution.
40884187,HD,2024-09-16T17:35:19Z,10 Consumer Discretionary Stocks Whale Activity In Today's Session, 
40898386,HD,2024-09-17T12:58:44Z,"Loop Capital Maintains Hold on Home Depot, Raises Price Target to $360",
40904782,HD,2024-09-17T16:30:20Z,Looking Into Home Depot's Recent Short Interest, 
40906726,HD,2024-09-17T18:00:34Z,"US Port Strike In October Could Lead To Major Supply-Chain Disruptions, Says Container Trade Expert","Potential strike by dockworkers at U.S. ports in October could disrupt the supply chain. and impact sectors like retail, automotive and semiconductors."
40915432,HD,2024-09-18T10:30:58Z,Home Depot Agrees To $2M Settlement In Customer Overcharging Lawsuit,Home Depot has agreed to a settlement of almost $2 million to resolve allegations that it overcharged customers at checkout.
40924883,HD,2024-09-18T17:16:51Z,Spotlight on Home Depot: Analyzing the Surge in Options Activity, 
40942441,HD,2024-09-19T15:31:09Z,"Stock Of The Day: Home Depot Agrees To Settlement, While Overbought Signals Warn Of Potential Sell-Off",Home Depot settles $2 million customer overcharging lawsuit and faces potential resistance level on stock; expert traders use psychology to profit.
40944354,HD,2024-09-19T17:00:29Z,"CNBC Halftime Report Final Trades: Target, The Home Depot, iShares Core S&P Small-Cap ETF",
40944941,HD,2024-09-19T17:35:35Z,10 Consumer Discretionary Stocks With Whale Alerts In Today's Session, 
40956690,HD,2024-09-20T12:34:48Z,"Target, Home Depot And More On CNBC's 'Final Trades'","On CNBC&#39;s &#34;Halftime Report Final Trades,&#34; Stephanie Link of Hightower named Target Corporation as her final trade."
40963952,HD,2024-09-20T18:18:11Z,Behind the Scenes of Home Depot's Latest Options Trends, 
40968987,HD,2024-09-21T12:11:01Z,"Benzinga Bulls And Bears: Apple, Palantir, Walmart, Home Depot — And An Analyst Predicts Dogecoin Will Outperform Bitcoin In 2025","Benzinga examined the prospects for many investors’ favorite stocks over the last week — here’s a look at some of our top stories.



The three major averages posted weekly gains, with the S&amp;P 500 rising 1.36% and up over 19% for 2024, while the Dow gained 1.62% and the Nasdaq advanced 1.49%. "
40987567,HD,2024-09-23T17:48:17Z,"Melius Research Initiates Coverage On Home Depot with Buy Rating, Announces Price Target of $420",
40987750,HD,2024-09-23T18:00:30Z,A Glimpse Into The Expert Outlook On Home Depot Through 16 Analysts, 
41002354,HD,2024-09-24T12:44:52Z,"Oppenheimer Maintains Perform on Home Depot, Raises Price Target to $400",
41008424,HD,2024-09-24T15:58:57Z,"Lowe's Set For 'Delayed Benefits' From Macro Demand Improvements, Says Optimistic Analyst",Lowe&#39;s is poised to witness stronger demand for home improvement as rates are cut by the Fed. Analyst upgrades stock.
41028566,HD,2024-09-25T15:40:21Z,"Tropical Storm Helene Set To Become Hurricane: Generac, Duke Energy Stocks React As Florida Braces","Forecasted to become a hurricane, Tropical Storm Helene is expected to hit Florida on Thursday, causing potential flooding and affecting multiple companies"
41033622,HD,2024-09-25T19:30:34Z,"If You Invested $100 In This Stock 20 Years Ago, You Would Have $1,000 Today", 
41053573,HD,2024-09-26T17:46:02Z,"Hurricane Helene Disrupts Flights, Sports Events, Disney Operations: Affected Regions, Stocks To Watch",Hurricane Helene could cause severe damage to regions in Florida and Georgia Thursday and Friday. A look at the impact on sports and stocks to watch.
41073069,HD,2024-09-27T18:19:57Z,"Hurricane Helene Update: 28 Dead, Power Outages, Insurance Damages And More",The death toll continues to rise after Hurricane Helene slammed into Florida&#39;s coast as a Category 4 hurricane.
41074007,HD,2024-09-27T19:17:36Z,Home Depot's Options: A Look at What the Big Money is Thinking, 
41093259,HD,2024-09-30T13:21:04Z,"Piper Sandler Maintains Overweight on Home Depot, Raises Price Target to $455",
41096388,HD,2024-09-30T14:55:59Z,"Hurricane Helene: 102 Dead, 2 Million Without Power After Storm Destruction In 6 States",Fatalities from Hurricane Helene passed 100 on Monday morning. A look at the devastation left from the storm and the industries and stocks that are most impacted.
41111978,HD,2024-10-01T09:48:43Z,Dockworkers Strike: Will It Impact Your Holiday Shopping?,"The timing is critical, with the U.S. presidential election a month away and the holiday season approaching. "
41137452,HD,2024-10-02T10:55:15Z,"Gordon Haskett Upgrades Home Depot to Buy, Announces $450 Price Target",
41142801,HD,2024-10-02T14:14:30Z,This Salesforce Analyst Turns Bullish; Here Are Top 5 Upgrades For Wednesday, 
41189513,HD,2024-10-04T17:07:58Z,"Guggenheim Maintains Buy on Home Depot, Raises Price Target to $450",
41209505,HD,2024-10-07T14:55:00Z,"Hurricane Milton Is Florida's Second Storm In Two Weeks: How Disney, Theme Parks, Insurance Companies Could Be Impacted","Hurricane Milton could make landfall in Florida on Wednesday, marking two powerful storms to hit the state in less than two weeks."
41211658,HD,2024-10-07T16:22:16Z,Live On CNBC: Brian Belski Trims Home Depot,
41216561,HD,2024-10-07T20:30:26Z,Behind the Scenes of Home Depot's Latest Options Trends, 
41217015,HD,2024-10-07T21:00:20Z,Here's How Much You Would Have Made Owning Home Depot Stock In The Last 20 Years, 
41222716,HD,2024-10-08T08:59:20Z,"As Florida Prepares For One Of Deadliest Hurricanes, Here Are Some Potential Stock Winners And Losers From Milton Threat","The second Category 5 storm of the 2024 hurricane season named Hurricane Milton is threatening large-scale destruction, as it quickly graduated from Category 1 status and is approaching the state of Florida."
41233381,HD,2024-10-08T15:46:28Z,A Closer Look at Home Depot's Options Market Dynamics, 
41247304,HD,2024-10-09T11:35:39Z,"Loop Capital Upgrades Home Depot to Buy, Raises Price Target to $460",
41247908,HD,2024-10-09T12:01:57Z,Breaking Down Home Depot: 20 Analysts Share Their Views, 
41248153,HD,2024-10-09T12:09:46Z,Netflix To $650? Here Are 10 Top Analyst Forecasts For Wednesday, 
41251950,HD,2024-10-09T14:14:50Z,This Home Depot Analyst Turns Bullish; Here Are Top 5 Upgrades For Wednesday, 
41314255,HD,2024-10-14T14:29:02Z,"Truist Securities Maintains Buy on Home Depot, Raises Price Target to $455",
41366552,HD,2024-10-16T19:16:01Z,Home Depot Unusual Options Activity, 
41388087,HD,2024-10-17T17:35:18Z,10 Consumer Discretionary Stocks Whale Activity In Today's Session, 
41445790,HD,2024-10-22T10:02:45Z,"Bernstein Initiates Coverage On Home Depot with Market Perform Rating, Announces Price Target of $451",
41490451,HD,2024-10-23T14:15:54Z,Home Depot Unusual Options Activity, 
41497129,HD,2024-10-23T17:35:19Z,10 Consumer Discretionary Stocks Whale Activity In Today's Session, 
41521161,HD,2024-10-24T15:00:18Z,Here's How Much You Would Have Made Owning Home Depot Stock In The Last 20 Years, 
41552221,HD,2024-10-25T17:17:35Z,"DA Davidson Maintains Buy on Home Depot, Raises Price Target to $466",
41573488,HD,2024-10-28T12:36:52Z,"TD Cowen Maintains Buy on Home Depot, Raises Price Target to $460",
41574283,HD,2024-10-28T13:00:56Z,Navigating 24 Analyst Ratings For Home Depot, 
41595963,HD,2024-10-29T11:32:49Z,Jim Cramer Says Home Depot 'Will Still Win' Even If Fed Doesn't Cut Rates: 'Company's Secular Characteristics Carry It Through The Cyclical Pain',Cramer identified several secular trends that contribute to Home Depot&#39;s success.
41633839,HD,2024-10-30T18:45:15Z,Peering Into Home Depot's Recent Short Interest, 
41667380,HD,2024-10-31T22:27:45Z,Which Industries Have The Highest Cannabis Consumption At Work? New Data Has Answers,Explore the latest CDC analysis on workplace cannabis use across industries. Discover which sectors are driving this trend!
41721059,HD,2024-11-04T17:30:38Z,Home Depot Unusual Options Activity For November 04, 
41745790,HD,2024-11-05T14:12:11Z,"Barclays Maintains Overweight on Home Depot, Raises Price Target to $420",
41776459,HD,2024-11-06T15:02:46Z,"Wells Fargo Maintains Overweight on Home Depot, Raises Price Target to $430",
41793507,HD,2024-11-07T00:20:27Z,Hurricane Rafael Hits Cuba As Category 3 Storm: Stocks To Watch As Storm Heads Into Gulf Of Mexico,Hurricane Rafael made landfall in Cuba as a Category 3 storm on Wednesday. Here&#39;s a look at what stocks could be affected as the hurricane takes aim at the Gulf of Mexico.
41809651,HD,2024-11-07T14:33:56Z,"Truist Securities Maintains Buy on Home Depot, Raises Price Target to $459",
41814901,HD,2024-11-07T16:30:53Z,Here's How Much $100 Invested In Home Depot 15 Years Ago Would Be Worth Today, 
41841795,HD,2024-11-08T12:53:40Z,"Telsey Advisory Group Upgrades Home Depot to Outperform, Raises Price Target to $455",
41842016,HD,2024-11-08T13:01:26Z,This Bank of America Analyst Turns Bullish; Here Are Top 5 Upgrades For Friday, 
41877497,HD,2024-11-11T13:24:39Z,How To Earn $500 A Month From Home Depot Stock Ahead Of Q3 Earnings,"Home Depot offers an annual dividend yield of 2.22%, a quarterly dividend amount of $2.25 per share. Here&#39;s how to earn $500 month."
41882877,HD,2024-11-11T16:15:06Z,"Stifel Maintains Hold on Home Depot, Raises Price Target to $400",
41883417,HD,2024-11-11T16:38:44Z,"RBC Capital Maintains Sector Perform on Home Depot, Raises Price Target to $413",
41884572,HD,2024-11-11T17:39:08Z,"Home Depot Q3 Earnings Preview: Hurricane Impact, Home Repairs Top Themes To Watch",Home Depot looks to turn the corner on revenue in the third quarter after missing analyst estimates in two straight quarters.
41886262,HD,2024-11-11T19:05:27Z,Home Depot's Bullish Streak Confronts Q3 Earnings Expectations,The Home Depot reports Q3 earnings on Tuesday. Wall Street expects $3.64 EPS and $39.17B in revenue. Stock is up 42.56% in the past year.
41892426,HD,2024-11-12T06:55:53Z,"Home Depot, Tyson Foods And 3 Stocks To Watch Heading Into Tuesday", 
41892574,HD,2024-11-12T07:12:39Z,"Dow Settles Above 44,000 For The First Time As Tesla Continues To Surge After Trump Win: Investor Sentiment Improves, Fear Index In 'Greed' Zone", 
41893442,HD,2024-11-12T08:32:46Z,"Earnings Scheduled For November 12, 2024", 
41895065,HD,2024-11-12T11:01:32Z,"Home Depot Q3 2024 Adj. EPS $3.78 Beats $3.64 Estimate, Sales $40.217B Beat $39.173B Estimate",
41895087,HD,2024-11-12T11:02:28Z,"Home Depot Q3 Comp Sales -1.3%, Comp Sales US -1.2%",
41895102,HD,2024-11-12T11:03:29Z,Home Depot shares are trading higher after the company reported better-than-expected Q3 EPS and sales.,
41895120,HD,2024-11-12T11:06:27Z,Home Depot Raises FY24 GAAP EPS Guidance from $14.51-$14.81 to $14.81 vs $14.84 Est; Sales from $156.49B-$158.01B to $158.78B vs $157.38B Est,
41895937,HD,2024-11-12T11:41:11Z,"Wall Street Futures Show Weakness As Investors Look To Lock In Gains After Strong Post-Election Rally: 'Bull Market Sentiment Remains Intact,' Says Wharton Economist","U.S. stocks could open on a negative note on Tuesday after the averages scaled record highs last week. Futures of all three major indices were slightly down on Tuesday, pointing to a cautious sentiment on Wall Street."
41902698,HD,2024-11-12T14:22:45Z,"Home Depot Q3 Earnings: Revenue And EPS Beat, Lifts Full-Year Forecast Despite Customer Traffic Dip","Home Depot reported strong Q3 earnings, beating estimates and raising full-year outlook. Sales, gross profit, and EPS all increased."
41905392,HD,2024-11-12T14:55:06Z,"Home Depot Exec On China Tariffs, Whatever Policy Changes Happen Will Have An Industry-Wide Impact",
41907482,HD,2024-11-12T15:27:56Z,Stock Of The Day: Home Depot Flashes Buy Signal As Earnings Beat Expectations,Shares of Home Depot (HD) may have just flashed a sell signal. The 5-day moving average has crossed above the 12-day.
41911959,HD,2024-11-12T17:08:56Z,"Telsey Advisory Group Maintains Outperform on Home Depot, Maintains $455 Price Target",
41912573,HD,2024-11-12T17:28:43Z,"Home Depot's Earnings Beat Sets Conservative Tone for FY24, J.P. Morgan Predicts Slowing Deterioration Ahead","J.P. Morgan analyst with an Overweight rating, notes that Home Depot&#39;s EPS forecast appears to be somewhat conservative."
41912971,HD,2024-11-12T17:43:21Z,"Stocks Fall On Tariffs Fears, Dollar Hits 6-Month Peak, Yen Tumbles: What's Driving Markets Tuesday?","Wall Street saw the first surge in risk aversion after Donald Trump&#39;s election victory last week, as concerns grew over potential tariffs and trade policy shifts spurred by the incoming administration&#39;s key appointments."
41913527,HD,2024-11-12T18:01:12Z,What the Options Market Tells Us About Home Depot, 
41916474,HD,2024-11-12T19:31:24Z,Dow Dips Over 200 Points; Home Depot Posts Upbeat Earnings, 
41929909,HD,2024-11-13T06:09:21Z,"Dow, S&P Decline Ahead Of Key Inflation Data, Tesla, Trump Media Slides: Fear Index Remains In 'Greed' Zone", 
41935014,HD,2024-11-13T12:06:30Z,"Mizuho Maintains Outperform on Home Depot, Raises Price Target to $440",
41937836,HD,2024-11-13T13:17:11Z,"B of A Securities Maintains Buy on Home Depot, Raises Price Target to $450",
41939716,HD,2024-11-13T14:01:04Z,Expert Ratings For Home Depot, 
41946406,HD,2024-11-13T16:37:49Z,"Evercore ISI Group Maintains Outperform on Home Depot, Raises Price Target to $430",
41946896,HD,2024-11-13T16:55:35Z,"Home Depot Hammers Down Strong Q3 Sales, Builds For Long-Term Success","Home Depot has strong Q3 earnings and revenue, with analyst notes from Goldman Sachs, J.P. Morgan and BofA Securities showing continued bullishness."
41947299,HD,2024-11-13T17:06:09Z,"Truist Securities Maintains Buy on Home Depot, Raises Price Target to $465",
41948392,HD,2024-11-13T17:35:23Z,10 Consumer Discretionary Stocks Whale Activity In Today's Session, 
41959248,HD,2024-11-13T23:48:50Z,"Telsey Advisory Group Maintains Outperform on Home Depot, Maintains $455 Price Target",
41974407,HD,2024-11-14T14:28:27Z,"Stifel Maintains Hold on Home Depot, Raises Price Target to $405",
42069863,HD,2024-11-19T17:35:17Z,10 Consumer Discretionary Stocks With Whale Alerts In Today's Session, 
42094182,HD,2024-11-20T16:46:23Z,Check Out What Whales Are Doing With Home Depot, 
42095321,HD,2024-11-20T17:35:17Z,10 Consumer Discretionary Stocks With Whale Alerts In Today's Session, 
42143747,HD,2024-11-22T17:35:21Z,9 Consumer Discretionary Stocks Whale Activity In Today's Session, 
42196221,HD,2024-11-26T17:35:16Z,10 Consumer Discretionary Stocks Whale Activity In Today's Session, 
42219998,HD,2024-11-27T17:31:00Z,This Is What Whales Are Betting On Home Depot, 
42234722,HD,2024-11-28T16:30:24Z,Looking Into Home Depot's Recent Short Interest, 
42244324,HD,2024-11-29T14:07:31Z,"Black Friday Frenzy: Shoppers Queue For Taylor Swift Merch, Retro Gadgets And More As Retailers Open Doors Early Amid Shortened Shopping Season","As stores opened as early as 5 a.m. following Thanksgiving, retailers are eager to attract shoppers despite a shortened shopping season."
42272146,HD,2024-12-02T17:30:34Z,Unpacking the Latest Options Trading Trends in Home Depot, 
42398359,HD,2024-12-09T19:45:32Z,Smart Money Is Betting Big In Home Depot Options, 
42492211,HD,2024-12-13T21:15:22Z,Here's How Much $1000 Invested In Home Depot 15 Years Ago Would Be Worth Today, 
42535719,HD,2024-12-17T17:15:33Z,Unpacking the Latest Options Trading Trends in Home Depot, 
42598904,HD,2024-12-19T17:35:15Z,7 Consumer Discretionary Stocks With Whale Alerts In Today's Session, 
42619016,HD,2024-12-20T15:00:26Z,Home Depot's Options Frenzy: What You Need to Know, 
42674173,HD,2024-12-24T17:35:21Z,9 Consumer Discretionary Stocks With Whale Alerts In Today's Session, 
42706349,HD,2024-12-27T17:00:30Z,Smart Money Is Betting Big In Home Depot Options, 
42707299,HD,2024-12-27T17:35:22Z,10 Consumer Discretionary Stocks With Whale Alerts In Today's Session, 
42756524,HD,2025-01-01T17:35:19Z,10 Consumer Discretionary Stocks With Whale Alerts In Today's Session, 
42786243,HD,2025-01-03T14:45:13Z,Here's How Much You Would Have Made Owning Home Depot Stock In The Last 10 Years, 
