ID,Ticker,Date,Headline,Summary
39256116,PDD,2024-06-10T17:35:22Z,10 Consumer Discretionary Stocks With Whale Alerts In Today's Session, 
39265394,PDD,2024-06-11T09:14:33Z,"Alibaba's New E-Commerce Strategy Prioritizes Growth Over Profitability: 'To Some Extent, We Shot Ourselves In The Foot,' Analyst Warns","Alibaba Group Holding is prioritizing long-term growth over near-term profits. However, analysts are warning that the e-commerce giant&#39;s efforts might be hampered by fierce competition."
39274163,PDD,2024-06-11T15:32:03Z,PDD Holdings Unusual Options Activity For June 11, 
39276689,PDD,2024-06-11T17:35:17Z,10 Consumer Discretionary Stocks Whale Activity In Today's Session, 
39277856,PDD,2024-06-11T18:48:40Z,Chinese Retailer Temu Gains Edge Over eBay In US Market,"Surpassing eBay, Chinese e-commerce giant Temu, part of PDD Holdings (NASDAQ
), now attracts more repeat U.S. shoppers, with 34% shopping monthly compared to eBay&#39;s 29%. Temu&#39;s aggressive marketing strategies, including Super Bowl ads, have significantly boosted its U.S. market presence."
39365073,PDD,2024-06-17T19:30:23Z,Here's How Much $1000 Invested In PDD Holdings 5 Years Ago Would Be Worth Today, 
39387535,PDD,2024-06-18T18:51:38Z,3 Mega Cap Stock Bargains As Markets Hit All-Time Highs,We ran a screener using Benzinga Pro to filter out three mega-cap stocks that are currently trading at attractive valuations.
39401153,PDD,2024-06-19T17:35:20Z,10 Consumer Discretionary Stocks With Whale Alerts In Today's Session, 
39413906,PDD,2024-06-20T14:16:30Z,Looking At PDD Holdings's Recent Unusual Options Activity, 
39454930,PDD,2024-06-24T12:41:24Z,Chinese Tech Workers Made To Work 'Like Gears Grinding Until They Break:' Report,"Executives across China&#39;s tech industry grapple with low growth, increasing competition, and investor apathy, leading to staff cuts and higher demands on remaining employees."
39508625,PDD,2024-06-26T17:10:28Z,'Amazon To Launch Temu-Like Discount Section With Direct Shipping From China' - The Information,
39509033,PDD,2024-06-26T17:35:17Z,10 Consumer Discretionary Stocks With Whale Alerts In Today's Session, 
39519823,PDD,2024-06-27T10:13:39Z,Amazon To Challenge Shein And Temu With New Bargain Site: Report,"Amazon.com is reportedly launching a new marketplace targeting overseas consumers with affordable items shipped directly from China. Competing with sites like Temu and Shein, The platform will feature unbranded fashion, home goods, and daily necessities, with delivery times of 9 to 11 days."
39521291,PDD,2024-06-27T11:22:51Z,"What's Going On With Chinese E-Commerce Stocks Alibaba, PDD And More On Thursday?","Amazon to launch affordable fashion and lifestyle section for Chinese sellers to directly ship to US consumers, competing with PDD and Shein."
39531134,PDD,2024-06-27T16:33:37Z,PDD Holdings Unusual Options Activity, 
39532768,PDD,2024-06-27T17:31:16Z,E-commerce's Ascent Stalls As One Sub-Segment Grows By Over 100%: Report,"COVID-19 accelerated shift to online shopping, with luxury, cosmetics &amp; fashion seeing growth. Inflation affected e-commerce, but Temu &amp; Olive Young thrived. BTS &amp; Korean culture drove popularity."
39532797,PDD,2024-06-27T17:33:47Z,"Stocks Show Modest Gains Ahead Of Fed's Inflation Report; Chipmakers Struggle, While Gold And Bitcoin Rebound: What's Driving Markets Thursday?","Wall Street experienced a subdued trading day on Thursday, as traders likely chose to remain on the sidelines in anticipation of Friday’s release of the Federal Reserve’s preferred inflation gauge."
39532864,PDD,2024-06-27T17:35:18Z,10 Consumer Discretionary Stocks With Whale Alerts In Today's Session, 
39550367,PDD,2024-06-28T14:31:20Z,A Closer Look at PDD Holdings's Options Market Dynamics, 
39555211,PDD,2024-06-28T17:35:19Z,10 Consumer Discretionary Stocks Whale Activity In Today's Session, 
39556243,PDD,2024-06-28T18:42:33Z,"'Amazon's Bargain Store Would Use Same Trade 'Loophole' as Temu, Shein' - The Information",
39602984,PDD,2024-07-02T17:35:19Z,10 Consumer Discretionary Stocks With Whale Alerts In Today's Session, 
39615301,PDD,2024-07-03T11:51:16Z,"After Regulatory Hurdles In US, Alibaba-Rivals Shein And Temu Face Customs In EU",The proposed changes would apply to any online retailer shipping to EU customers directly from outside the bloc.
39624328,PDD,2024-07-03T19:27:48Z,"'Temu Is Functionally Malware': Arkansas AG Files Lawsuit Against Chinese Retailer, Calls It A 'Data Theft Business'",Chinese online retailer Temu faces lawsuit for deceptive practices amid high inflation; also facing regulatory hurdles in EU and competition from Amazon.
39646965,PDD,2024-07-05T13:47:32Z,PDD Holdings Unusual Options Activity, 
39672166,PDD,2024-07-08T17:35:18Z,10 Consumer Discretionary Stocks Whale Activity In Today's Session, 
39692486,PDD,2024-07-09T15:31:11Z,PDD Holdings's Options Frenzy: What You Need to Know, 
39695175,PDD,2024-07-09T17:35:20Z,10 Consumer Discretionary Stocks Whale Activity In Today's Session, 
39708215,PDD,2024-07-10T12:47:18Z,"Amazon Vs. Temu, Shein, TikTok Shop: Who's Winning The US E-Commerce Battle?","Amazon still dominates eCommerce, but Temu, Shein, and TikTok Shop are gaining ground. Investors should watch the shifting spending habits and consumer satisfaction in this competitive market."
39715374,PDD,2024-07-10T17:35:19Z,10 Consumer Discretionary Stocks Whale Activity In Today's Session, 
39731745,PDD,2024-07-11T14:32:16Z,Here's How Much You Would Have Made Owning PDD Holdings Stock In The Last 5 Years, 
39733222,PDD,2024-07-11T15:28:39Z,PDD Expands To South America As Regulatory Headwinds Grow,By UOB-Kay Hian
39736159,PDD,2024-07-11T17:35:18Z,10 Consumer Discretionary Stocks With Whale Alerts In Today's Session, 
39754409,PDD,2024-07-12T17:35:18Z,10 Consumer Discretionary Stocks With Whale Alerts In Today's Session, 
39756357,PDD,2024-07-12T19:33:27Z,"IPO-Ready Shein Enjoys More Traffic Than Fast-Fashion Rivals, Data Shows: Are Temu, Poshmark In The Dust?","Shein is positioned for a successful London IPO, but is marred by regulatory challenges in the U.S. and forced labor allegations."
39768528,PDD,2024-07-15T10:59:53Z,"Alibaba, Chinese Tech Stocks And EV Stocks NIO, XPeng, Li Auto Tumble After Disappointing Economic Report","Chinese tech stocks, including Alibaba, are down after China&#39;s economy grew slower than expected. Analysts predict more stimulus measures."
39810709,PDD,2024-07-17T09:58:59Z,What's Going On With Alibaba And Peer Chinese Stocks On Wednesday?,"US considering stricter trade measures against Chinese AI companies, including Alibaba, as semiconductor sanctions intensify. Shares down premarket."
39845404,PDD,2024-07-18T17:35:18Z,10 Consumer Discretionary Stocks With Whale Alerts In Today's Session, 
39863073,PDD,2024-07-19T16:00:28Z,Here's How Much $1000 Invested In PDD Holdings 5 Years Ago Would Be Worth Today, 
39878618,PDD,2024-07-22T10:13:39Z,What's Going On With Alibaba And Other Chinese Stocks On Monday?,China lowers interest rates to boost economy amidst challenges. Alibaba and other tech stocks trade higher. PBOC adjusts lending programs to stabilize yields.
39890432,PDD,2024-07-22T17:35:19Z,10 Consumer Discretionary Stocks Whale Activity In Today's Session, 
39910078,PDD,2024-07-23T15:09:19Z,"'PDD-owned Temu's first-half sales surge to US$20 billion, exceeding 2023 total: report' - South China Morning Post",
39910751,PDD,2024-07-23T15:25:08Z,Alibaba's Taobao Introduces Free Overseas Shipping to Compete with Rivals,Alibaba introduces free overseas shipping on Taobao to compete with PDD &amp; Shein. Program starts Aug 3 for 7 Asian markets &amp; plans to expand. BABA shares closed 1.82% higher.
39937723,PDD,2024-07-24T16:31:22Z,A Closer Look at PDD Holdings's Options Market Dynamics, 
39949372,PDD,2024-07-25T06:01:00Z,China's Central Bank Surprises Markets With Second Lending Operation This Week: Fed Likely To Hold Rates Steady At July FOMC,"The People&#39;s Bank of China has executed an unscheduled lending operation at significantly lower rates, indicating a potential increase in monetary stimulus to support the economy."
39990588,PDD,2024-07-26T17:35:17Z,10 Consumer Discretionary Stocks Whale Activity In Today's Session, 
40007141,PDD,2024-07-29T10:53:37Z,Alibaba Stock Soars As New Service Fees Boost Revenue,"Alibaba to increase service fees for merchants on Tmall and Taobao platforms, boosting core revenue. Shift to percentage-based model aligns with other e-commerce platforms. Stock surges 5.8% in Hong Kong."
40009533,PDD,2024-07-29T12:24:00Z,"Abbott, Integra LifeSciences And Other Big Stocks Moving Lower In Monday's Pre-Market Session", 
40018728,PDD,2024-07-29T17:35:17Z,10 Consumer Discretionary Stocks With Whale Alerts In Today's Session, 
40038877,PDD,2024-07-30T13:45:55Z,PDD Holdings Unusual Options Activity, 
40043353,PDD,2024-07-30T15:20:39Z,Alibaba Rival Temu's Aggressive Model Shift Sparks Supplier Protests: Report,China&#39;s Temu faces backlash from suppliers over new business model. Alibaba and PDD stocks up. Taobao offers free overseas shipping to compete.
40077140,PDD,2024-07-31T17:35:17Z,10 Consumer Discretionary Stocks With Whale Alerts In Today's Session, 
40112679,PDD,2024-08-01T19:30:15Z,Looking Into PDD Holdings's Recent Short Interest, 
40195485,PDD,2024-08-06T16:01:30Z,Unpacking the Latest Options Trading Trends in PDD Holdings, 
40197998,PDD,2024-08-06T17:35:16Z,10 Consumer Discretionary Stocks With Whale Alerts In Today's Session, 
40229078,PDD,2024-08-07T17:38:52Z,"'Amazon develops China seller network to take on Temu, Shein' - NIKKEI",
40251560,PDD,2024-08-08T12:37:13Z,"Amazon Boosts Recruitment Efforts In China, Targets Rivalry With Temu: Report","Amazon is recruiting more sellers in China to expand its affordable product offerings and compete with Chinese rivals. BABA, JD, and PDD stocks are up."
40269782,PDD,2024-08-08T21:00:38Z,$100 Invested In PDD Holdings 5 Years Ago Would Be Worth This Much Today, 
40278435,PDD,2024-08-09T09:49:53Z,Amazon's Chinese Rival Temu's Billionaire Founder Colin Huang Replaces Bottled-Water King Zhong Shanshan To Become China's Richest Person,"Colin Huang, founder of PDD Holdings, has surpassed bottled-water magnate Zhong Shanshan to become China&#39;s richest person with a net worth of $48.6 billion, driven by the global expansion of Pinduoduo under the name Temu."
40290836,PDD,2024-08-09T17:02:49Z,Spotlight on PDD Holdings: Analyzing the Surge in Options Activity, 
40320301,PDD,2024-08-12T17:35:16Z,10 Consumer Discretionary Stocks Whale Activity In Today's Session, 
40347361,PDD,2024-08-13T17:35:18Z,10 Consumer Discretionary Stocks With Whale Alerts In Today's Session, 
40374812,PDD,2024-08-14T17:34:06Z,Two Bullish Bets On China, 
40425002,PDD,2024-08-16T20:09:33Z,"S&P 500, Nasdaq 100 Mark Seventh Straight Positive Session, Strongest Week Since October 2023: Friday's Top Movers","S&amp;P 500 and Nasdaq 100 indices gain for seventh straight day, marking best weekly performance since October 2023 on positive economic data. SPY and QQQ close with modest daily gains while DIA has best week since December 2023. "
40446039,PDD,2024-08-19T17:35:17Z,10 Consumer Discretionary Stocks Whale Activity In Today's Session, 
40462864,PDD,2024-08-20T13:17:19Z,Alibaba's E-Commerce Challenges Overshadow Cloud Acceleration,"On Thursday, Alibaba Group Holding Limited (NYSE: BABA) missed estimates with its June quarter results."
40463780,PDD,2024-08-20T13:51:18Z,What's Going On With Alibaba And Other Chinese Stocks On Tuesday?,"China likely keeping benchmark lending rates unchanged, after surprising interest rate cut in July. Tech &amp; EV stocks down. China to lend $ using IP as collateral."
40469595,PDD,2024-08-20T17:36:46Z,Reported Earlier: 'Shein Is Suing Temu For Copyright Infringement' - 404media,
40473720,PDD,2024-08-20T20:39:21Z,"S&P 500, Nasdaq 100 Snap 8-Day Winning Streak: What Triggered Wall Street's Setback On Tuesday?","S&amp;P 500 ended Tuesday&#39;s session with slight declines, halting its best winning streak since May 2024. Here&#39;s the latest."
40483613,PDD,2024-08-21T12:28:33Z,"'What's The True Worth Of Chinese Stocks,' Asks Jim Cramer As He Praises Walmart For 'Smart' Move To Exit JD.com — Names Alibaba As Only Name That Has Real Liquidity","Walmart&#39;s strategic decision to have a bigger presence in China, has reportedly forced to snap its ties with the domestic partner."
40487567,PDD,2024-08-21T14:50:49Z,Shein Takes Legal Action Against Temu: Design Theft and Fraud Allegations Fly,"Shein filed lawsuit against PDD for stealing designs and fraud. PDD also facing accusations from other brands. Alibaba profits decline, Amazon launching bargain site."
40487638,PDD,2024-08-21T14:55:13Z,Looks Like The Bull Market's Back (For Now), 
40512002,PDD,2024-08-22T16:07:03Z,"Watch These Second-Hand, Refurbished Stocks That Rocked In Q2 As Customer Trends Shift","Amid constrained global consumer spending, the refurbished market has grown. Reasons include affordability and sustainability."
40513935,PDD,2024-08-22T17:35:16Z,10 Consumer Discretionary Stocks Whale Activity In Today's Session, 
40525344,PDD,2024-08-23T11:34:07Z,What's Going On With Alibaba Stock On Friday?,"Alibaba (BABA) stock rises on plans to allow mainland investors to trade through changes to listing status in Hong Kong, infusing liquidity."
40532929,PDD,2024-08-23T17:03:09Z,Temu Parent Company PDD Faces Slight Selling Pressure Ahead Of Q2 Earnings: Bullish Trends Vs. Bearish Blips,PDD reports Q2 earnings on Monday. Charts suggest potential bullish momentum with short-term bearishness. Analysts see 45% upside.
40533504,PDD,2024-08-23T17:35:20Z,10 Consumer Discretionary Stocks Whale Activity In Today's Session, 
40543907,PDD,2024-08-25T16:07:18Z,"Snowflake, JD.com And Temu Parent PDD Are Among Top 8 Large Cap Losers Last Week (Aug 18-Aug 24): Are The Others In Your Portfolio?","8 large-cap stocks were the worst performers last week: TBN, GFI, SNOW, NTES, BEN, JD, PDD, MRNA. Are they in your portfolio?"
40546556,PDD,2024-08-26T07:01:16Z,"Heico, PDD Holdings And 3 Stocks To Watch Heading Into Monday", 
40548347,PDD,2024-08-26T10:32:13Z,"PDD Holdings Q2 Adj EPADS $3.20 Beats $2.73 Estimate, Sales $13.36B Miss $14.02B Estimate",
40548430,PDD,2024-08-26T10:47:29Z,"Nasdaq, S&P 500 Futures Climb As Hopes Of Positive Nvidia Earnings And Rate Cuts Drive Sentiment Higher: Fund Manager Says Flurry Of Catalysts Could Keep Rally's Momentum Going",U.S. stocks could continue to push higher as traders factor in a boost from Nvidia Corp.’s (NASDAQ:NVDA) quarterly results.
40548945,PDD,2024-08-26T11:17:55Z,"Temu Parent PDD Posts 86% Q2 Topline Growth, Stock Drops After CEO Flags Upcoming Challenges",PDD Holdings reported 86% revenue growth in Q2 2024 but missed analyst estimates. Adjusted earnings increased and revenues from online services rose.
40550107,PDD,2024-08-26T12:09:13Z,Market-Moving News for August 26th,
40550557,PDD,2024-08-26T12:25:39Z,"PDD Holdings, Daqo New Energy And Other Big Stocks Moving Lower In Monday's Pre-Market Session", 
40553429,PDD,2024-08-26T13:41:11Z,Dow Jumps 100 Points; PDD Posts Weak Revenue, 
40553441,PDD,2024-08-26T13:41:54Z,"Benzinga Market Summary: Oil Rises On Middle East Tension And Libya's Production Halt, Chinese E-Commerce Fall On PDD Sales Miss, NVIDIA Preview Suggests Strong Sales Ahead Of Wednesday's Q2 Report",
40557480,PDD,2024-08-26T16:16:35Z,Nasdaq Dips 1%; US Durable Goods Orders Increase In July, 
40559511,PDD,2024-08-26T17:30:41Z,"Dow Jones Briefly Sets Record Highs, Tech Drops, Chipmakers Tumble As Oil Prices Spike On Geopolitical Risks: What's Driving Markets Monday?","It&#39;s a mixed start to the week on Wall Street, with technology stocks dragging down the Nasdaq 100 and S&amp;P 500 indices, while blue-chip stocks in the Dow Jones Industrial Average reached new all-time highs during the morning session in New York as traders weighed the latest surge"
40559640,PDD,2024-08-26T17:35:17Z,10 Consumer Discretionary Stocks With Whale Alerts In Today's Session, 
40560676,PDD,2024-08-26T18:40:51Z,Crude Oil Rises Sharply; Daqo New Energy Reports Weak Q2 Results, 
40561208,PDD,2024-08-26T19:12:51Z,Chinese Retail Giant PDD Plummets Nearly 30% After Disappointing Earnings: Which ETFs Are Most Impacted?,"ADRs of PDD Holdings Inc. plunged 30% due to disappointing Q2 earnings and a bleaker revenue forecast, causing ETFs with exposure to suffer."
40561297,PDD,2024-08-26T19:19:09Z,Why Bilibili (BILI) Stock Is Trading Lower,Bilibili shares are trading lower by 5% Monday afternoon. Shares are trading lower due to PDD Holdings&#39; disappointing Q2 sales results.
40561887,PDD,2024-08-26T19:57:19Z,"Reported Earlier, 'Shein Sues Temu Over Copyright Infringement, Alleges Rival Loses Money On Every Sale' - CNBC",
40563191,PDD,2024-08-26T20:32:00Z,"Nasdaq 100 Falls 1%, Tests 50-Day Average Support: Tech Stocks In Flux On Monday",Nasdaq 100 slips by 1% due to decline in semiconductor stocks and poor earnings from PDD Holdings. Tech stocks find support at 50-day moving average.
40563371,PDD,2024-08-26T20:40:57Z,Macquarie Downgrades PDD Holdings to Neutral,
40563562,PDD,2024-08-26T20:49:16Z,"Jefferies Maintains Buy on PDD Holdings, Lowers Price Target to $151",
40568543,PDD,2024-08-27T06:25:27Z,Dow Closes At Record High While Nasdaq Tumbles As Nvidia Falls Ahead Of Earnings: Fear & Greed Index Remains In 'Neutral' Zone, 
40571611,PDD,2024-08-27T10:50:01Z,"Bernstein Maintains Outperform on PDD Holdings, Lowers Price Target to $170",
40572886,PDD,2024-08-27T11:45:32Z,"B of A Securities Maintains Buy on PDD Holdings, Lowers Price Target to $170",
40575267,PDD,2024-08-27T12:38:36Z,"Citigroup Downgrades PDD Holdings to Neutral, Lowers Price Target to $120",
40575491,PDD,2024-08-27T12:48:30Z,These Analysts Slash Their Forecasts On PDD Holdings Following Q2 Results, 
40576158,PDD,2024-08-27T13:00:52Z,This Hershey Analyst Turns Bearish; Here Are Top 5 Downgrades For Tuesday, 
40576445,PDD,2024-08-27T13:08:57Z,"Benchmark Maintains Buy on PDD Holdings, Lowers Price Target to $185",
40577998,PDD,2024-08-27T13:57:49Z,NEWS WRAP: Temu Parent PDD's Shares Plummet After Worrisome Results,By Teri Yu
40578659,PDD,2024-08-27T14:17:27Z,"Barclays Maintains Overweight on PDD Holdings, Lowers Price Target to $158",
40582085,PDD,2024-08-27T16:08:03Z,What's Going On With Temu Parent PDD Holdings' Stock After Earnings?,PDD Holdings shares continue trading lower Tuesday after the stock posted its largest single-day loss on Monday following its second-quarter results. Here&#39;s what to know:
40582575,PDD,2024-08-27T16:32:14Z,"Resurging Walmart, Shaky JD.com Go Their Separate Ways In China","Key Takeaways:


	Walmart has sold its stake in JD.com at a time when its Chinese operations are flying on a growing local preference for Costco-style warehouse shopping
	JD.com continues to face stiff competition in China’s tough e-commerce market as consumption in the country remains sluggish


By Xiao Lin"
40583948,PDD,2024-08-27T17:35:18Z,10 Consumer Discretionary Stocks Whale Activity In Today's Session, 
40584147,PDD,2024-08-27T17:40:18Z,"Wall Street Mixed Ahead Of Week's Key Events, Cruise Lines Rally, Oil Slips: What's Driving Markets Tuesday?",Wall Street remained relatively quiet during Tuesday morning trading as investors held their breath for key events later in the week. 
40588993,PDD,2024-08-27T20:56:47Z,"Chinese E-Commerce Giant Drops 35% In 2 Days, But Analysts See 92% Upside Potential","PDD Holdings Inc. (NASDAQ: PDD) saw a 29% drop after disappointing Q2 results, but analysts remain bullish with price targets ranging from $84 to $185."
40603532,PDD,2024-08-28T14:45:50Z,What the Options Market Tells Us About PDD Holdings, 
40608454,PDD,2024-08-28T17:35:16Z,10 Consumer Discretionary Stocks With Whale Alerts In Today's Session, 
40612271,PDD,2024-08-28T20:20:42Z,Alibaba Shares Are Trading Lower Today: What You Need To Know,"Alibaba shares are trading lower Wednesday, following a decline that has affected many U.S.-listed Chinese stocks."
40626540,PDD,2024-08-29T14:00:37Z,Here's How Much You Would Have Made Owning PDD Holdings Stock In The Last 5 Years, 
40633360,PDD,2024-08-29T17:35:20Z,10 Consumer Discretionary Stocks With Whale Alerts In Today's Session, 
40655975,PDD,2024-08-30T15:32:58Z,Temu Parent PDD Stock Free Falls After Hitting Death Cross: Time To Bail Out?,"PDD Holdings, the parent company of Temu, shocked investors with its recent earnings report, causing the stock to plummet."
40658770,PDD,2024-08-30T17:35:17Z,10 Consumer Discretionary Stocks Whale Activity In Today's Session, 
40660544,PDD,2024-08-30T19:19:43Z,PDD Stock Fell 22% In August: What Happened To The Chinese E-Commerce Giant?,PDD Holdings shares fell 22% in August after missing Q2 revenue expectations. Analysts lowered their price targets.
40674824,PDD,2024-09-02T13:07:21Z,"Consumer Tech News (Aug 25-Aug 31): Canada Plans To Impose 100% Tariff On Chinese EV Imports, Amazon Launches AI-Powered Shopping Assistant",Canada imposes tariffs on Chinese EV imports. Russian ally accuses US of orchestrating arrest of Telegram CEO. PDD and Nvidia report earnings. Sony launches Accessories app for PS5 controllers.
40675182,PDD,2024-09-02T13:55:17Z,"Dollar General, Temu Parent PDD And Super Micro Computer Are Among Top 10 Large Cap Losers Last Week (Aug 25-Aug 31): Are The Others In Your Portfolio?","10 worst performing large-cap stocks in the last week. Dollar General, Super Micro Computer, Okta, Pure Storage, Neurocrine Biosciences among them."
40675332,PDD,2024-09-02T14:15:12Z,"Temu Parent PDD Dwarfs Tesla In Cash Pile, But Investors Are Skeptical","PDD and Tesla have significant cash reserves, but PDD&#39;s reluctance to offer dividends or buyback shares has raised concerns among investors."
40676964,PDD,2024-09-02T17:35:17Z,10 Consumer Discretionary Stocks Whale Activity In Today's Session, 
40683461,PDD,2024-09-03T11:11:16Z,"Why Alibaba, Li Auto, Baidu And Other Chinese Stocks Are Falling In Pre-Market","The Shanghai Composite Index plunged by up to 0.6%, slipping below the crucial support level of 2,800., leading to the drop in the US listed stocks of certain Chinese companies.Chinese stocks such as Alibaba Group Holdings Ltd. (NYSE:BABA) and Li Auto Inc. (NASDAQ:"
40693391,PDD,2024-09-03T17:35:22Z,9 Consumer Discretionary Stocks Whale Activity In Today's Session, 
40701030,PDD,2024-09-04T07:22:31Z,US Demands Probe Into Shein And Temu Over 'Deadly' Baby Products,"Shein and Temu have been flagged by the Commission due to their use of de minimis, a rule which permits packages valued at $800 or less to evade tariffs if shipped directly to consumers."
40714022,PDD,2024-09-04T16:30:36Z,A Closer Look at PDD Holdings's Options Market Dynamics, 
40715300,PDD,2024-09-04T17:35:19Z,10 Consumer Discretionary Stocks Whale Activity In Today's Session, 
40737314,PDD,2024-09-05T17:35:23Z,10 Consumer Discretionary Stocks Whale Activity In Today's Session, 
40752447,PDD,2024-09-06T15:55:45Z,PDD Fails To Shield Itself From The Weakened Chinese E-Commerce Trend,"Before August came to a close, Temu-parent PDD Holdings Inc (NASDAQ: PDD) issued its second quarter results after which its shares plunged almost 29%. This was the biggest one-day share fall for PDD since it listed in the U.S. six years ago, erasing almost $55 billion from its market capitalization."
40754093,PDD,2024-09-06T17:35:19Z,10 Consumer Discretionary Stocks With Whale Alerts In Today's Session, 
40764160,PDD,2024-09-08T15:47:17Z,"Consumer Tech News (Sep 1-Sep 7): Elon Musk Launches Beta Version Of X TV, Alibaba Launches AI To Help American Buyers & More","Donald Trump misunderstood Taiwan&#39;s role in the semiconductor industry, according to Taiwan&#39;s Economy Minister."
40764325,PDD,2024-09-08T17:05:02Z,"Intel, Moderna And Dollar General Were Among Top 10 Large Cap Losers In August: Are The Others In Your Portfolio?","10 worst performing large-cap stocks in August: Super Micro, Dollar General, Snap, PDD Holdings, Intel, Tencent Music, Gold Fields, Charles River, Moderna, Neurocrine Biosciences."
40779030,PDD,2024-09-09T17:35:18Z,10 Consumer Discretionary Stocks Whale Activity In Today's Session, 
40796709,PDD,2024-09-10T15:00:34Z,PDD Holdings's Options: A Look at What the Big Money is Thinking, 
40813395,PDD,2024-09-11T12:59:28Z,"Jack Ma Urges Alibaba to Embrace Competition, Highlights Growth Opportunities",Jack Ma urges Alibaba to trust in market forces despite challenges and competition. Company reports 4% Y/Y growth and $3.34B net income in Q1 2024.
40836154,PDD,2024-09-12T15:00:49Z,$100 Invested In PDD Holdings 5 Years Ago Would Be Worth This Much Today, 
40853105,PDD,2024-09-13T12:49:01Z,Team Biden Targets Shein And Temu With New Rules To Curb 'Abuse' Of US Trade Loophole By Chinese E-Commerce Giants,"As per the official statement from the White House on Friday, the de minimis exemption, which allows goods valued at $800 or less to enter the U.S. duty-free, has seen &#34;increased abuse&#34; over the past decade. "
40854896,PDD,2024-09-13T14:09:58Z,"Temu Spokesperson On Biden Administration Moving To Curb Low-Value Shipments Says Co's Growth Does Not Depend On The De Minimis Policy; Says ""We Are Reviewing The New Rule Proposals And Remain Committed To Delivering Value To Consumers""",
40855622,PDD,2024-09-13T14:45:04Z,"PDD Holdings shares are trading lower after the Biden Administration announce measures to curb low-value shipments, which could impact Chines e-commerce companies shipping to US customers.",
40856610,PDD,2024-09-13T15:17:51Z,Why Temu Parent PDD Holdings' Stock Is Down,PDD Holdings shares are moving lower Friday after the White House announced new measures to tackle the abuse of the de minimis exemption by Chinese e-commerce platforms including Temu and Shein. Here&#39;s a look at what&#39;s going on:
