ID,Ticker,Date,Headline,Summary
27704749,PDD,2022-06-14T17:09:29Z,Pinduoduo Stock Is Surging Today: What's Going On?,Pinduoduo Inc (NASDAQ: PDD) shares are trading higher Tuesday alongside several Chinese companies in possible anticipation of the country&#39;s &#34;618&#34; holiday shopping event.
27748863,PDD,2022-06-16T17:36:49Z,10 Consumer Discretionary Stocks Whale Activity In Today's Session,"This whale alert can help traders discover the next big trading opportunities.
Whales are entities with large sums of money and we track their transactions here at Benzinga on our options activity scanner."
27771267,PDD,2022-06-17T20:59:58Z,Pinduoduo Whale Trades For June 17,"Someone with a lot of money to spend has taken a bullish stance on Pinduoduo (NASDAQ:PDD).
And retail traders should know.
We noticed this today when the big position showed up on publicly available options history that we track here at Benzinga."
27815903,PDD,2022-06-22T16:51:15Z,Looking At Pinduoduo's Recent Whale Trades,"A whale with a lot of money to spend has taken a noticeably bearish stance on Pinduoduo.
Looking at options history for Pinduoduo (NASDAQ:PDD) we detected 19 strange trades."
27887544,PDD,2022-06-28T17:32:28Z,Check Out What Whales Are Doing With PDD,"Someone with a lot of money to spend has taken a bearish stance on Pinduoduo (NASDAQ:PDD).
And retail traders should know.
We noticed this today when the big position showed up on publicly available options history that we track here at Benzinga."
27928148,PDD,2022-07-01T13:22:13Z,China Cracks Down On Counterfeit Investment Platforms,"
	China&#39;s cyberspace regulator has cracked down on counterfeit investment platforms, Reuters reports.
"
27948849,PDD,2022-07-05T11:37:35Z,Sequoia Capital China Nears $9B Fundraising Amid Domestic Regulatory Uncertainties,"Sequoia Capital China is close to raising nearly $9 billion to invest in cash-strapped Chinese start-ups amid concerns over Beijing&#39;s zero-Covid policies, a crackdown on technology groups, and heightened geopolitical risk, "
27951516,PDD,2022-07-05T12:36:55Z,"Benzinga Before The Bell: Record Inflows In 'Short Bitcoin' Funds, Elon Musk's Trillionaire Possibility, Gmail's Political Bias And Other Top Financial Stories Tuesday, July 5",Reuters
27957285,PDD,2022-07-05T18:37:03Z,10 Consumer Discretionary Stocks Whale Activity In Today's Session,"This whale alert can help traders discover the next big trading opportunities.
Whales are entities with large sums of money and we track their transactions here at Benzinga on our options activity scanner."
27964882,PDD,2022-07-06T13:13:16Z,Alibaba's Share Price Recovery Earns It Bullish Calls From Some Brokerages,"Some of Wall Street&#39;s biggest brokerages have reiterated their bullish calls for Alibaba Group Holding Limited (NYSE: BABA), indicating more gains after it surged from a mid-March low, "
27971442,PDD,2022-07-06T14:10:55Z,Looking At Pinduoduo's Recent Whale Trades,"A whale with a lot of money to spend has taken a noticeably bearish stance on Pinduoduo.
Looking at options history for Pinduoduo (NASDAQ:PDD) we detected 18 strange trades."
27976649,PDD,2022-07-06T19:07:06Z,So What's Going On With Pinduoduo Shares Falling Today?,Pinduoduo Inc - ADR (NASDAQ: PDD) shares are trading lower by 8.59% to $60.93 Wednesday afternoon. Shares of Chinese companies at large are trading lower after Shanghai announced it will be conducting mass COVID-19 testing in several districts following a rise in cases.
28019707,PDD,2022-07-11T15:18:50Z,Why Pinduoduo Shares Are Getting Hammered Today,Pinduoduo Inc - ADR (NASDAQ: PDD) shares are trading lower by 11.55% to $53.78 Monday morning. Shares of several Chinese companies at large are trading lower amid a resurgence in COVID cases which has caused the closure of Macau casinos.
28020631,PDD,2022-07-11T16:11:18Z,"Why These Casino Stocks Are Moving Lower, Here's 45 Stocks Moving In Monday's Mid-Day Session","Gainers


	Pliant Therapeutics, Inc.  (NASDAQ: PLRX) jumped 112.6% to $18.88 after the company said its treatment for Idiopathic Pulmonary Fibrosis was well tolerated in a Phase 2a study.
"
28028374,PDD,2022-07-12T09:35:16Z,"Alibaba, Zoom Video And 76 Biggest Movers From Yesterday","Gainers


	Kaspien Holdings Inc. (NASDAQ: KSPN) shares climbed 161.9% to close at $6.81 on Monday on heavy volume amid mention of the stock on social media.
"
28036075,PDD,2022-07-12T15:18:53Z,Pinduoduo Whale Trades For July 12,"Someone with a lot of money to spend has taken a bearish stance on Pinduoduo (NASDAQ:PDD).
And retail traders should know.
We noticed this today when the big position showed up on publicly available options history that we track here at Benzinga."
28038822,PDD,2022-07-12T17:40:37Z,10 Consumer Discretionary Stocks Whale Activity In Today's Session,"This whale alert can help traders discover the next big trading opportunities.
Whales are entities with large sums of money and we track their transactions here at Benzinga on our options activity scanner."
28164667,PDD,2022-07-22T11:31:05Z,EXCLUSIVE: Nisun Collaborates With Pinhutang Distillery To Boost China's Agricultural Practices,"NiSun Intl Enterprise Development Group Co, Ltd (NASDAQ: NISN) affiliate Fanlunke Supply Chain Management (Shanghai) Co, Ltd, a subsidiary of Fintech (Shanghai) Digital Technology Co, Ltd, forged a supply chain services agreement with Yunnan Pinh"
28172657,PDD,2022-07-22T17:43:50Z,Looking At Pinduoduo's Recent Whale Trades,"Someone with a lot of money to spend has taken a bearish stance on Pinduoduo (NASDAQ:PDD).
And retail traders should know.
We noticed this today when the big position showed up on publicly available options history that we track here at Benzinga."
28173147,PDD,2022-07-22T17:47:33Z,10 Consumer Discretionary Stocks Whale Activity In Today's Session,"This whale alert can help traders discover the next big trading opportunities.
Whales are entities with large sums of money and we track their transactions here at Benzinga on our options activity scanner."
28233267,PDD,2022-07-27T21:25:46Z,Check Out What Whales Are Doing With PDD,"Someone with a lot of money to spend has taken a bullish stance on Pinduoduo (NASDAQ:PDD).
And retail traders should know.
We noticed this today when the big position showed up on publicly available options history that we track here at Benzinga."
28252690,PDD,2022-07-28T17:37:38Z,10 Consumer Discretionary Stocks With Whale Alerts In Today's Session," 

This whale alert can help traders discover the next big trading opportunities.

Whales are entities with large sums of money and we track their transactions here at Benzinga on our options activity scanner."
28292419,PDD,2022-08-01T14:46:58Z,Alibaba Eyes Hong Kong Primary Listing as Hedge to U.S. Delisting Threat,"Key Takeaways:


	Alibaba said it expects the upgrade of its secondary Hong Kong listing to primary listing status to be complete by the end of 2022
	The SEC has placed Alibaba on a list of Chinese firms facing potential delisting as the deadline nears for U.S.-listed Chinese firms to comply with American audit rules


By Ken Lo"
28294939,PDD,2022-08-01T17:05:12Z,Pinduoduo Shares Are Falling: Here's Why,Pinduoduo Inc - ADR (NASDAQ: PDD) shares are trading lower by 3.65% to $47.22 during Monday&#39;s trading session. Shares of Chinese companies at large are trading lower after July factory activity pulled back from June levels.
28295626,PDD,2022-08-01T17:36:58Z,10 Consumer Discretionary Stocks Whale Activity In Today's Session,"This whale alert can help traders discover the next big trading opportunities.
Whales are entities with large sums of money and we track their transactions here at Benzinga on our options activity scanner."
28338219,PDD,2022-08-03T20:00:11Z,Pinduoduo Whale Trades Spotted,"A whale with a lot of money to spend has taken a noticeably bullish stance on Pinduoduo.

Looking at options history for Pinduoduo (NASDAQ:PDD) we detected 13 strange trades."
28380426,PDD,2022-08-05T18:00:22Z,"Shares of Chinese companies are trading lower amid weakness in Alibaba following reports suggesting the company lost 9,241 employees in the June quarter.",
28399303,PDD,2022-08-08T14:54:16Z,A Bullish Sign Appears On Pinduoduo's Chart," 

If history is any guide, there may be good fortune ahead for shares of Pinduoduo (NASDAQ:PDD). A so-called &#34;golden cross&#34; has formed on its chart and, not surprisingly, this could be bullish for the stock."
28439320,PDD,2022-08-10T17:54:15Z,10 Consumer Discretionary Stocks With Whale Alerts In Today's Session," 

This whale alert can help traders discover the next big trading opportunities.

Whales are entities with large sums of money and we track their transactions here at Benzinga on our options activity scanner."
28457574,PDD,2022-08-11T15:02:55Z,"Shares of Chinese companies are trading higher in sympathy with US markets, which have gained amid hopes of easing inflation following CPI and PPI data. Investors also continue to assess US-China tensions.",
28459382,PDD,2022-08-11T16:52:14Z,What Are Whales Doing With Pinduoduo," 

Someone with a lot of money to spend has taken a bullish stance on Pinduoduo (NASDAQ:PDD).

And retail traders should know.

We noticed this today when the big position showed up on publicly available options history that we track here at Benzinga."
28471411,PDD,2022-08-12T11:34:09Z,"Illumina, CS Disco And Some Other Big Stocks Moving Lower In Today's Pre-Market Session","
	Olo Inc. (NYSE: OLO) shares fell 31.7% to $8.87 in pre-market trading after the company reported Q2 results and issued FY22 guidance below consensus estimates.
"
28524723,PDD,2022-08-16T20:01:58Z,This Is What Whales Are Betting On Pinduoduo," 

Someone with a lot of money to spend has taken a bullish stance on Pinduoduo (NASDAQ:PDD).

And retail traders should know.

We noticed this today when the big position showed up on publicly available options history that we track here at Benzinga."
28579407,PDD,2022-08-22T14:49:12Z,US TikTok Frenzy Forces China's PinduoDuo's Hand In US Expansion Plans,"
"
28605581,PDD,2022-08-23T17:48:39Z,10 Consumer Discretionary Stocks Whale Activity In Today's Session,"This whale alert can help traders discover the next big trading opportunities.
Whales are entities with large sums of money and we track their transactions here at Benzinga on our options activity scanner."
28607108,PDD,2022-08-23T19:43:40Z,Here's Why Pinduoduo Shares Are Rising 5% Today,"Pinduoduo Inc - ADR (NASDAQ: PDD) shares are trading higher by 5.64% to $50.64 Tuesday afternoon in sympathy with JD.Com Inc (NASDAQ: JD)

which reported better-than-expected second-quarter earnings results."
28618607,PDD,2022-08-24T15:29:08Z,Is Tencent Winding Down Its Big Investments?,"Key Takeaways:


	Reuters reported Tencent might sell some or all of its Meituan holdings this year, though Tencent called the report ‘inaccurate’
	Some think Tencent might sell other stakes in its more than 70 U.S.- and Hong Kong-listed portfolio companies to raise funds to buy back its shares


By Fai Pui"
28619823,PDD,2022-08-24T17:12:23Z,Check Out What Whales Are Doing With PDD,"A whale with a lot of money to spend has taken a noticeably bullish stance on Pinduoduo.
Looking at options history for Pinduoduo (NASDAQ:PDD) we detected 20 strange trades."
28628450,PDD,2022-08-25T10:07:50Z,"Tesla, Autodesk And Some Other Big Stocks Moving Higher In Today's Pre-Market Session","
	Snowflake Inc. (NYSE: SNOW) surged 17.4% to $187.18 in pre-market trading after the company reported better-than-expected Q2 sales results and issued product revenue guidance.
"
28630627,PDD,2022-08-25T12:12:24Z,Why Splunk Is Trading Lower By Around 10%; Here Are 28 Stocks Moving Premarket,"Gainers


	ECMOHO Limited (NASDAQ: MOHO) shares rose 47% to $0.2149 in pre-market trading.
"
28637135,PDD,2022-08-25T17:02:41Z,"Why Snowflake Is Trading Higher By 20%, Here Are 51 Stocks Moving In Thursday's Mid-Day Session","Gainers


	Kiora Pharmaceuticals, Inc. (NASDAQ: KPRX) jumped 91% to $0.2530 after Ladenburg Thalmann initiated coverage on the stock with a Buy rating and announced a price target of $6.50.
"
28637901,PDD,2022-08-25T18:44:43Z,Why Alibaba And Several Other Chinese Stocks Are Surging Today,Shares of several Chinese companies are ripping higher Thursday.
28645151,PDD,2022-08-26T08:22:50Z,"NetApp, Autodesk And Other Big Gainers From Thursday",U.S. stocks closed higher with the Dow Jones gaining more than 300 points on Thursday. Here is the list of some big stocks recording gains in the previous session.
28645574,PDD,2022-08-26T09:54:48Z,Why Several Chinese Stocks Traded Higher; Here Are 58 Biggest Movers From Yesterday,"Gainers


	Kiora Pharmaceuticals, Inc. (NASDAQ: KPRX) surged 95.3% to close at $0.2580 on Thursday after Ladenburg Thalmann initiated coverage on the stock with a Buy rating and announced a price target of $6.50.
"
28649707,PDD,2022-08-26T14:58:06Z,Looking At Pinduoduo's Recent Whale Trades,"A whale with a lot of money to spend has taken a noticeably bearish stance on Pinduoduo.
Looking at options history for Pinduoduo (NASDAQ:PDD) we detected 23 strange trades."
28651044,PDD,2022-08-26T15:10:11Z,Preview: Pinduoduo's Earnings,"Pinduoduo (NASDAQ:PDD) is set to give its latest quarterly earnings report on Monday, 2022-08-29. Here&#39;s what investors need to know before the announcement.
Analysts estimate that Pinduoduo will report an earnings per share (EPS) of $0.39. "
28663395,PDD,2022-08-29T08:01:05Z,Bitcoin Tumbles Below This Major Level Following Powell's Remarks; Here Are The Top Crypto Movers For Monday,"Bitcoin (CRYPTO: BTC), the world’s most valued cryptocurrency, recorded a massive sell-off, with price for the cryptocurrency falling below the $20,000 level this morning following comments from US Federal Reserve Chair Jerome Powell."
28663542,PDD,2022-08-29T08:35:55Z,"Catalent, Pinduoduo And 3 Stocks To Watch Heading Into Monday","With US stock futures trading lower this morning on Monday, some of the stocks that may grab investor focus today are as follows:"
28663519,PDD,2022-08-29T09:13:51Z,"Earnings Scheduled For August 29, 2022"," 

Companies Reporting Before The Bell

• NAPCO Security (NASDAQ:NSSC) is expected to report earnings for its fourth quarter."
28663806,PDD,2022-08-29T09:28:17Z,"Dow, Nasdaq Futures Lower Following Friday's Sell-Off; US Dollar Surges To 20-Year High","Pre-open movers

U.S. stock futures traded lower in early pre-market trade after the Dow Jones tumbled more than 1,000 points in the previous session following speech from Federal Reserve Chairman Jerome Powell at the central bank’s Jackson Hole economic symposium. The US dollar index, meanwhile, jumped to its strongest level in 20 years on Monday."
28664417,PDD,2022-08-29T10:31:36Z,"Pinduoduo Q2 EPS $0.23, Earnings Per ADS $0.93, Sales $4.69B Beat $3.49B Estimate",
28664507,PDD,2022-08-29T10:41:11Z,"Fear & Greed Index Moves To 'Fear' Zone As Dow Dips Over 1,000 Points Following Powell's Speech","The CNN Money Fear and Greed index moved to the &#34;fear&#34; zone after the Dow Jones dipped more than 1,000 points on Friday following Powell’s comments.

Fed Chair Jerome Powell, at the Jackson Hole symposium, said the Federal Reserve’s goal remains getting inflation back down to a goal of 2%."
28664602,PDD,2022-08-29T11:10:14Z,Here's Why Pinduoduo Shares Are Trading Higher Premarket,"
"
28664611,PDD,2022-08-29T11:19:51Z,Pinduoduo: Q2 Earnings Insights," 

Pinduoduo (NASDAQ:PDD) reported its Q2 earnings results on Monday, August 29, 2022 at 06:30 AM.

Here&#39;s what investors need to know about the announcement."
28666339,PDD,2022-08-29T12:08:45Z,12 Consumer Discretionary Stocks Moving In Monday's Pre-Market Session, 
28666323,PDD,2022-08-29T12:36:32Z,Why Pinduoduo Stock Is Rising Today,Pinduoduo Inc (NASDAQ: PDD) shares are trading higher Monday after the company reported second-quarter revenue results that beat average analyst estimates. 
28667571,PDD,2022-08-29T13:00:50Z,"Benzinga Pro's Top 5 Stocks To Watch For Monday, Aug. 29, 2022: BIDU, ADP, CRWD, RDW, BCDA",
28669385,PDD,2022-08-29T14:18:38Z,Dow Falls Over 200 Points After Friday's Plunge,"U.S. stocks traded lower this morning, with the Dow Jones dropping more than 200 points on Monday."
28671143,PDD,2022-08-29T15:34:55Z,"Pinduoduo, JinkoSolar And Some Other Big Stocks Moving Higher On Monday"," 
	Minerva Neurosciences, Inc. (NASDAQ: NERV) jumped 25% to $12.96. Point72 Asset Management recently reported an 8.8% passive stake in the company.
	
"
28671643,PDD,2022-08-29T16:02:13Z,Nasdaq Down Over 1%; Crude Oil Rises Sharply,"U.S. stocks traded lower midway through trading, with the Nasdaq Composite dropping more than 100 points on Monday."
28672403,PDD,2022-08-29T16:49:59Z,"Why Chimerix Is Trading Higher By Over 19%, Here Are 53 Stocks Moving In Monday's Mid-Day Session","Gainers


	Advanced Human Imaging Limited (NASDAQ: AHI) shares jumped 53% to $1.04. Advanced Human Imaging announced Sunday it signed a Master Services Agreement with Estonia-based Activate Health OÜ.
"
28673180,PDD,2022-08-29T17:41:21Z,12 Consumer Discretionary Stocks Moving In Monday's Intraday Session, 
28674754,PDD,2022-08-29T19:09:34Z,US Stocks Pare Losses; Pinduoduo Shares Spike Higher,"U.S. stocks pared losses toward the end of trading, with the Dow Jones dropping just 40 points on Monday."
28680541,PDD,2022-08-30T09:23:24Z,Why Bed Bath & Beyond Jumped Around 25%; Here Are 68 Biggest Movers From Yesterday,"Gainers


"
28681067,PDD,2022-08-30T10:13:28Z,"HSBC Upgrades Pinduoduo to Buy, Announces $93 Price Target",
28681331,PDD,2022-08-30T10:41:39Z,"Citigroup Maintains Buy on Pinduoduo, Raises Price Target to $83",
28681828,PDD,2022-08-30T11:05:42Z,"B of A Securities Maintains Buy on Pinduoduo, Raises Price Target to $89",
28679380,PDD,2022-08-30T11:51:12Z,"Alibaba Rival Gets 'Buy' Rating From Analyst: As Giants Slowed Down, This Company 'Surprised' With Fast Revenue Growth","US Tiger Securities analyst Bo Pei has upgraded the rating on China’s largest agricultural products platform Pinduoduo Inc (NASDAQ: PDD) from “hold” to “buy,” after having raised the price target to $80 from $"
28683708,PDD,2022-08-30T12:21:33Z,McDonald's Gets A Price Target Boost By This Analyst; Also Check Out Some Other Major PT Changes,"
	Tigress Financial raised the price target on  McDonald&#39;s Corporation  (NYSE: MCD) from $314 to $320. Tigress Financial analyst Ivan Feinseth maintained a Buy rating on the stock. McDonald&#39;s shares rose 0.3% to $256.44 in pre-market trading.
"
28686276,PDD,2022-08-30T14:02:48Z,"Benzinga's Top Ratings Upgrades, Downgrades For August 30, 2022", 
28687363,PDD,2022-08-30T15:32:24Z,Why Alibaba And Other Chinese Stocks Are Sliding Today,Shares of Alibaba Group Holding Ltd (NYSE: BABA) and other Chinese names including JD.com Inc (NASDAQ: JD) and Pinduoduo Inc (NASDAQ: 
28699057,PDD,2022-08-31T12:10:16Z,"Macquarie Maintains Outperform on Pinduoduo, Raises Price Target to $104",
28699383,PDD,2022-08-31T12:19:35Z,"HP To $33, Plus Citigroup Predicts $204 For Baidu","
	Credit Suisse cut the price target for  HP Inc. (NYSE: HPQ) from $39 to $33. HP shares fell 6.6% to $29.05 in pre-market trading.
"
28700541,PDD,2022-08-31T13:48:44Z,Where Pinduoduo Stands With Analysts,Analysts have provided the following ratings for Pinduoduo (NASDAQ:PDD) within the last quarter: 
28723108,PDD,2022-09-01T17:36:10Z,10 Consumer Discretionary Stocks With Whale Alerts In Today's Session,"This whale alert can help traders discover the next big trading opportunities.
Whales are entities with large sums of money and we track their transactions here at Benzinga on our options activity scanner."
28730515,PDD,2022-09-02T09:23:29Z,Pinduoduo Launched U.S. e-Commerce Site on Thursday,
28733263,PDD,2022-09-02T14:45:49Z,"China's E-commerce Giant Pinduoduo Makes US Debut, Intensifies Rivalry With Amazon","
"
28761189,PDD,2022-09-06T16:06:52Z,Pinduoduo Whale Trades Spotted,"Someone with a lot of money to spend has taken a bearish stance on Pinduoduo (NASDAQ:PDD).
And retail traders should know.
We noticed this today when the big position showed up on publicly available options history that we track here at Benzinga."
28762847,PDD,2022-09-06T18:14:53Z,Why Pinduoduo Shares Are Falling Sharply Today,"Pinduoduo Inc - ADR (NASDAQ: PDD) shares are trading lower by 7.58% to $66.72 Tuesday afternoon. Shares of several Chinese companies at large are trading lower amid continued COVID-19 lockdowns in China.

What Happened?"
28813114,PDD,2022-09-09T16:00:20Z,Here's Why Pinduoduo Shares Are Moving,"Pinduoduo Inc - ADR (NASDAQ: PDD) shares are trading higher by 3.30% to $70.44 Friday morning as Chinese stocks gain following slower-than-expected China inflation data.

What Happened?"
28814477,PDD,2022-09-09T17:37:01Z,10 Consumer Discretionary Stocks With Whale Alerts In Today's Session,"This whale alert can help traders discover the next big trading opportunities.
Whales are entities with large sums of money and we track their transactions here at Benzinga on our options activity scanner."
28834141,PDD,2022-09-12T17:04:33Z,This Is What Whales Are Betting On Pinduoduo,"A whale with a lot of money to spend has taken a noticeably bearish stance on Pinduoduo.
Looking at options history for Pinduoduo (NASDAQ:PDD) we detected 25 strange trades."
28843789,PDD,2022-09-13T10:53:38Z,PDD's Temu Launches Global Online Shopping Marketplace,
28846598,PDD,2022-09-13T12:50:22Z,Pinduoduo's Sister Company Temu Launches Online Marketplace In US,"
"
28869644,PDD,2022-09-14T16:59:41Z,"A Year After Splashy IPO, Missfresh Looks Well Past Its 'Sell Date'","Key Takeaways:


	Missfresh announced a major reshuffle of its top ranks, including the resignation of both of its co-CFOs, one of whom was also among three board members to resign
	The changes came as the company faces a cash crunch caused by swelling losses, big debt and massive back wages owed to former employees


"
28936929,PDD,2022-09-20T17:37:50Z,10 Consumer Discretionary Stocks Whale Activity In Today's Session,"This whale alert can help traders discover the next big trading opportunities.
Whales are entities with large sums of money and we track their transactions here at Benzinga on our options activity scanner."
28949909,PDD,2022-09-21T14:57:05Z,What Are Whales Doing With Pinduoduo," A whale with a lot of money to spend has taken a noticeably bearish stance on Pinduoduo.
Looking at options history for Pinduoduo (NASDAQ:PDD) we detected 13 strange trades."
28953359,PDD,2022-09-21T17:36:25Z,10 Consumer Discretionary Stocks Whale Activity In Today's Session," This whale alert can help traders discover the next big trading opportunities.
Whales are entities with large sums of money and we track their transactions here at Benzinga on our options activity scanner."
29013396,PDD,2022-09-26T15:41:31Z,What's Happening With Pinduoduo Shares,"Pinduoduo Inc - ADR (NASDAQ: PDD) shares are trading higher by 2.04% to $61.28 during Monday&#39;s trading session, rebounding following recent weakness."
29043339,PDD,2022-09-28T13:04:25Z,China's 'Rapid' Debt Buildup May Portend A Looming Financial Crisis: New York Fed,China’s recent debt buildup following the Covid-19 pandemic has researchers from the Federal Reserve Bank of New York wondering if the country can avoid a financial crisis in the years to come.
29063393,PDD,2022-09-28T19:38:59Z,Check Out What Whales Are Doing With PDD," Someone with a lot of money to spend has taken a bearish stance on Pinduoduo (NASDAQ:PDD).
And retail traders should know.
We noticed this today when the big position showed up on publicly available options history that we track here at Benzinga."
29123238,PDD,2022-10-03T17:36:08Z,10 Consumer Discretionary Stocks Whale Activity In Today's Session," This whale alert can help traders discover the next big trading opportunities.
Whales are entities with large sums of money and we track their transactions here at Benzinga on our options activity scanner."
29157637,PDD,2022-10-05T18:17:49Z,Looking At Pinduoduo's Recent Whale Trades," A whale with a lot of money to spend has taken a noticeably bearish stance on Pinduoduo.
Looking at options history for Pinduoduo (NASDAQ:PDD) we detected 20 strange trades."
29185617,PDD,2022-10-07T14:35:37Z,Cross-Border E-commerce Trader Zibuyu Files for IPO Despite Sinking Profits,"Key Takeaways:


	Cross-border e-commerce company Zibuyu has filed for a Hong Kong IPO, but could be undermined by its heavy reliance on Amazon and the U.S. market
	The company’s first-half profit plunged 46% as its merchandise return rates and costs both rose sharply


By Stone Shek"
29202616,PDD,2022-10-10T14:53:34Z,Why Pinduoduo Shares Are Diving,"Pinduoduo Inc - ADR (NASDAQ: PDD) shares are trading lower by 7.49% to $58.80 Monday morning. Shares of Chinese stocks at large are trading lower after the US announced export controls restricting China&#39;s ability to purchase certain chips.

What Happened?"
29219325,PDD,2022-10-11T14:09:54Z,Brighter Times Could Beckon for JD.com after Stormy Spell,"Key Takeaways:


	Key factors in a JD share-price rally would be the results of a U.S. regulatory review of Chinese stocks and the expected launch next year of a scheme to promote dual-currency share trading in Hong Kong
	A settlement in a sexual assault case against company founder Richard Liu has also removed a shadow over the share price
"
29221221,PDD,2022-10-11T15:30:50Z,What's Happening With Pinduoduo Stock,"Pinduoduo Inc - ADR (NASDAQ: PDD) shares are trading lower by 2.42% to $56.85, but off the session low of $54.95, Tuesday morning."
29222059,PDD,2022-10-11T16:03:36Z,This Is What Whales Are Betting On Pinduoduo," A whale with a lot of money to spend has taken a noticeably bullish stance on Pinduoduo.
Looking at options history for Pinduoduo (NASDAQ:PDD) we detected 24 strange trades."
