ID,Ticker,Date,Headline,Summary
41144842,TTE,2024-10-02T15:33:38Z,"TotalEnergies Chairman And CEO Says Planned Mozambique Project Remains Profitable, We Remain Committed To It; Plans To Visit Mozambique By End Of This Month To Meet New President; On Mozambique Project: Waiting For Another Three Countries To Confirm Commitments On Financing, Waiting On Green Light On Financing From Three Credit Agencies, As Soon As That Is In Place We Will Move, Targeting First Oil From This Project In 2029; Targeting First Oil From This Project In 2029",
41147964,TTE,2024-10-02T17:52:51Z,"TotalEnergies Bets Big On Expansion: LNG, Renewables, And Billions In Buybacks","TotalEnergies shares rise on strategy presentation, plan to increase global energy production, reduce emissions, and implement share repurchase program."
41189213,TTE,2024-10-04T16:49:28Z,Why TotalEnergies Shares Are Surging Today,TotalEnergies secured the top spot in the tender for LNG supply at Alexandroupolis terminal in Greece for Nov-Dec 2024. 
41210034,TTE,2024-10-07T15:11:46Z,TotalEnergies Acquires 50% Stake In Two Offshore Wind Projects In North Sea: Details,"TotalEnergies agrees to acquire 50% stake in two offshore wind projects from RWE, expanding their presence in German market."
41225523,TTE,2024-10-08T11:53:56Z,TotalEnergies Locks In Renewable Electricity Supply Deal With Saint-Gobain,"TotalEnergies signs PPA with Saint-Gobain to supply renewable electricity to French facilities, targeting 30% renewable energy in France by 2027."
41277977,TTE,2024-10-10T17:21:53Z,"Scotiabank Maintains Sector Perform on TotalEnergies, Lowers Price Target to $75",
41325875,TTE,2024-10-15T10:00:18Z,Why Is TotalEnergies Stock Sliding Today?,"TotalEnergies expects 2.4 Mboe/d production in Q3, offsetting unplanned shutdowns. Inflation and price declines may affect investments."
41601988,TTE,2024-10-29T14:43:37Z,TotalEnergies To Power Europe With Moroccan Green Hydrogen And New North Sea Gas Find,"TotalEnergies shares are trading higher premarket after signing a contract with the Moroccan government for the &#39;Chbika&#39; project,"
41645792,TTE,2024-10-31T08:02:49Z,"TotalEnergies Q3 2024 Adj. EPS $1.74 Misses $1.82 Estimate, Sales $52.021B Beat $46.207B Estimate",
41658107,TTE,2024-10-31T15:48:50Z,"TotalEnergies Boasts Strong Revenue Despite Q3 EPS Miss, Decline In LNG And Production",TotalEnergies shares are trading lower premarket on Thursday. The company reported third-quarter adjusted EPS of $1.74.
41720697,TTE,2024-11-04T17:22:28Z,TotalEnergies Bolsters LNG Presence In China With 15-Year Supply Deal: Details,TotalEnergies secures 15-year agreement with Sinopec to supply 2 million tons of LNG annually in China.
41963018,TTE,2024-11-14T06:59:59Z,TechnipFMC Lands Major iEPCI Contract For TotalEnergies' GranMorgu Project,
42012197,TTE,2024-11-15T15:54:15Z,"TotalEnergies Joins BP, Equinor, And Shell In $500M Drive For Global Energy Access","Four energy companies pledge $500M for UN SDG7, investing in energy access solutions for underserved communities in Africa and Asia."
42068616,TTE,2024-11-19T16:56:18Z,TotalEnergies Expands Decarbonization Efforts Through Partnership with Oil India Limited,TotalEnergies signed an agreement with Oil India Limited to use AUSEA technology for methane emissions detection.
42170188,TTE,2024-11-25T17:24:57Z,TotalEnergies Suspends Financial Ties With Adani Group Amid US Investigation,"TotalEnergies shares down as Adani Group executives indicted for corruption, but TTE not implicated and halts new contributions."
42212364,TTE,2024-11-27T13:01:17Z,"Trump's Tariff Threat To Canada May Disrupt Oil Markets, Inflate Prices: 'Would Likely Raise The Price Of Fuels,' Says Analyst","President-elect Donald Trump&#39;s move to impose 25% tariffs on Canada can thwart the growth of the stock markets and affect corporate profits, inflation, transportation and oil marketing companies."
42288695,TTE,2024-12-03T13:10:38Z,"Saudi Arabia, France Sign Power Purchase Agreement Along With Chinese Company For Solar Power Plant Project; Saudi Arabia, TotalEnergies Sign Agreements For Solar Power Plants",
42305773,TTE,2024-12-03T23:48:24Z,"Key Stocks, ETF To Watch As French Government Faces No-Confidence Vote",French Prime Minister faces no confidence vote after passing controversial austerity budget without approval.
42313870,TTE,2024-12-04T13:23:27Z,TotalEnergies Announced The Signing Of An Agreement With Swiss Asset Manager Partners Group For The Acquisition Of  VSB Group for $1.57B,
42328909,TTE,2024-12-04T22:29:58Z,French Government Collapses After Vote Of No Confidence,"The French government collapsed on Wednesday following a successful no-confidence vote, throwing France, the eurozone&#39;s second-largest economy, into political turmoil."
42330913,TTE,2024-12-05T02:03:49Z,"Mohamed El-Erian Calls Michel Barnier's Ouster An Example Of 'Messy Politics,' Notes Greek And French Bonds Achieving Historic Parity","Mohamed El-Erian, Allianz&#39;s Chief Economic Advisor, warned Wednesday Dec. 4, 2024 about the growing intersection of political and economic challenges in France following Prime Minister Michel Barnier&#39;s historic no-confidence ouster, even as Greek bonds achieved parity with French sovereign debt for the first time since the Eurozone crisis."
42388571,TTE,2024-12-09T13:19:22Z,Why Is Private Equity Giant Apollo Global Management Stock Shooting Higher Today?,Apollo and Santander partner on $370M infrastructure portfolio financing. APO aims for $50B in clean energy investments by 2027.
42486154,TTE,2024-12-13T15:26:43Z,Macron Taps Bayrou To Navigate France's Fractured Politics: ETFs To Watch,"François Bayrou would be France&#39;s fourth prime minister this year, following Elisabeth Borne, Gabriel Attal and Michel Barnier."
42512472,TTE,2024-12-16T16:41:27Z,"Reported Earlier, ""Integrated Power: TotalEnergies Sells 50% Of Its Shares In West Burton Energy In The United Kingdom To EPUKI""; No Financial Terms Disclosed",
42599261,TTE,2024-12-19T17:47:16Z,"Piper Sandler Maintains Neutral on TotalEnergies, Lowers Price Target to $62",
42673531,TTE,2024-12-24T17:00:11Z,P/E Ratio Insights for TotalEnergies, 
42839565,TTE,2025-01-07T11:25:29Z,"Morgan Stanley Downgrades TotalEnergies to Equal-Weight, Lowers Price Target to $64.1",
42883117,TTE,2025-01-08T18:39:10Z,In an Unpredictable Market Here Are Some Potential Winners and Losers for the First Quarter,"Every year, analysts discuss the stocks and sectors they favor for the coming year, often providing price targets for where major indexes might land by year-end. I believe both of these practices are futile. The market is dynamic and ever-changing; the environment can shift on a dime, so don’t get attached to a one-year playbook. Focusing on quarterly trends is a better approach."
43013634,TTE,2025-01-15T19:47:30Z,OPEC's Optimism Clashes With IEA's Conservative 2025 Oil Growth Projections,"IEA revises 2025 global oil demand outlook to 1.05 million barrels per day, citing economic recovery and lower fuel prices. OPEC projects higher growth."
43029175,TTE,2025-01-16T14:27:47Z,TotalEnergies Highlights Resilient LNG And Power Performance Amid Refining Challenges For Q4,"TotalEnergies shares up premarket on expected increase in Q4 production, strong LNG and power results, weak downstream sector."
43221229,TTE,2025-01-27T17:16:40Z,"Trump's Executive Orders Fuel Tech, Weaken Energy Stocks In His First Week: Immigration, Tariff Reforms On Cards But Experts Say 'Don't Play Politics With Your Portfolio' (CORRECTED)","Donald Trump&#39;s first week focused on four key areas, driven by macroeconomic considerations: technology, tariffs, energy, and immigration."
43303305,TTE,2025-01-29T14:05:01Z,"TotalEnergies, STMicroelectronics Sign First-Of-Its-Kind 15-Year Renewable Power Deal In France",TotalEnergies SE (NYSE: TTE) enters 15-year renewable energy deal with STMicroelectronics N.V. (NYSE: STM) for 1.5 TWh in France.
43487792,TTE,2025-02-05T08:32:24Z,"Earnings Scheduled For February 5, 2025", 
43487932,TTE,2025-02-05T08:53:38Z,"TotalEnergies Q4 2024 Adj. EPS $1.90 Beats $1.84 Estimate, Sales $52.508B Beat $42.766B Estimate",
43487943,TTE,2025-02-05T08:57:41Z,"TotalEnergies Proposes A Dividend Of €3.22 /Share For Fiscal Year 2024, A 7% Increase YoY",
43489453,TTE,2025-02-05T11:20:58Z,"US Stocks Likely To Open Lower Following Alphabet, AMD Earnings: Walt Disney, Uber, Ford, Qualcomm In Focus",U.S. stock futures declined on Wednesday after Tuesday&#39;s advances amid trade war concerns and major earnings reports.
43499706,TTE,2025-02-05T16:08:35Z,"TotalEnergies Q4: Sales And EPS Beat, 2025 Outlook Signals Growth In LNG & Hydrocarbons","TotalEnergies reports Q4 earnings, beats estimates with $1.90 adjusted EPS. Sales of $52.51B exceed consensus. Company proposes €3.22/share dividend. Outlook: 2.5-2.55 Mboe/d hydrocarbon production in Q1 FY25, 3% production growth in 2025, over 40 Mt of LNG sales, 5% energy production increase, net investments of $17B-$17.5B in FY25. "
43737177,TTE,2025-02-14T16:45:09Z,A Look Into TotalEnergies Inc's Price Over Earnings, 
43776626,TTE,2025-02-18T11:53:52Z,TotalEnergies Powers Up With Air Liquide For Hydrogen Breakthrough,"TotalEnergies partners with Air Liquide to develop green hydrogen projects in the Netherlands, aiming to reduce CO2 emissions."
44104134,TTE,2025-03-04T11:44:32Z,"TotalEnergies Powers Taiwan with New 640 MW Offshore Wind Farm, Strengthening Renewable Portfolio","TotalEnergies says Yunlin offshore wind farm in Taiwan becomes fully operational, supplying 640 MW of renewable energy."
44146328,TTE,2025-03-05T17:00:22Z,Price Over Earnings Overview: TotalEnergies, 
44195675,TTE,2025-03-07T16:31:28Z,"""Hedge fund Elliott Bets €670 Million Against TotalEnergies"" - Financial Times",
44274976,TTE,2025-03-12T13:01:34Z,"TotalEnergies Teams Up With RWE For Largest Green Hydrogen Deal In Germany, Set To Cut CO2 By 300K Tons","TotalEnergies SE to supply 30,000 tons of green hydrogen annually to Leuna refinery in Germany for 15 years starting in 2030, reducing CO2 emissions."
44404956,TTE,2025-03-19T19:59:02Z,'TotalEnergies Eyes Brazil Green Hydrogen For European Refineries' - Bloomberg News,
44491149,TTE,2025-03-26T11:49:56Z,Citigroup Upgrades TotalEnergies to Buy,
44492045,TTE,2025-03-26T12:20:04Z,TotalEnergies Pursues Growth In Electricity By Launching Six New Battery Storage Projects,
44499032,TTE,2025-03-26T17:10:42Z,TotalEnergies' Clean Energy Push: More Than $170 Million Investment For Battery Storage In Germany,"TotalEnergies (NYSE: TTE) to invest €160 million in six battery storage projects, expanding clean energy role in Germany by 221 MW by early 2026."
44775407,TTE,2025-04-11T21:46:24Z,"Scotiabank Maintains Sector Perform on TotalEnergies, Lowers Price Target to $60",
44786568,TTE,2025-04-14T12:04:30Z,NextDecade Announces 1.5 MTPA LNG Sale And Purchase Agreement With TotalEnergies From Rio Grande LNG Train 4; No Financial Terms Disclosed,
44807592,TTE,2025-04-15T09:49:51Z,TotalEnergies Inks Sales And Purchase Agreement With NextDecade To Buy 1.5 Mtpa Of LNG For 20 Years From The Future Train 4 At the Rio Grande LNG Facility,
44816075,TTE,2025-04-15T14:42:46Z,"TotalEnergies Inks 20-Year LNG Deal With NextDecade, Awaits Key Investment Decision","TotalEnergies signs 20-year LNG deal with NextDecade, pending key investment decision on Rio Grande&#39;s Train 4.








"
44885581,TTE,2025-04-18T17:00:19Z,P/E Ratio Insights for TotalEnergies, 
44898294,TTE,2025-04-21T14:02:14Z,EU vs China: The Power Struggle For Central Asia's Resources,EU Vs. China: Central Asia has again emerged as a center of geopolitical rivalry over natural resources and political influence.
44902787,TTE,2025-04-21T16:00:33Z,Chevron & TotalEnergies Fire Up Ballymore: Deepwater Gulf Project Targeting 150 Million Barrels Over Life,"Chevron has started production from Ballymore project in the Gulf of Mexico. It is expected to deliver 75,000 barrels/day and marks Chevron&#39;s first in the Norphlet trend."
45091631,TTE,2025-04-30T06:41:19Z,"TotalEnergies Q1 Adj. EPS $1.83 Misses $1.88 Estimate, Sales $52.25B Beat $44.91B Estimate",
45092803,TTE,2025-04-30T08:32:41Z,"Earnings Scheduled For April 30, 2025", 
45113720,TTE,2025-04-30T18:54:02Z,"TotalEnergies Misses Q1 Earnings But Lifts Dividend, Plans $2 Billion Buyback","TotalEnergies (NYSE:TTE) shares down premarket on lower Q1 adjusted EPS of $1.83 (-15% Y/Y), missed consensus of $1.88, but sales of $52.25B topped $44.91B."
45351004,TTE,2025-05-12T14:30:40Z,"Morgan Stanley Upgrades TotalEnergies to Overweight, Maintains Price Target to $60.8",
45383919,TTE,2025-05-13T16:07:57Z,"Piper Sandler Maintains Neutral on TotalEnergies, Raises Price Target to $65",
45414021,TTE,2025-05-14T15:59:49Z,Why Is TotalEnergies Stock Trading Lower On Wednesday?,TotalEnergies (NYSE: TTE) to sell 50% stake in PGB to HitecVision for €190M. PGB is a leading biogas producer in Poland with plans for expansion and decarbonization.
45500924,TTE,2025-05-19T17:15:37Z,'TotalEnergies Signs New LNG Deal with Proposed Canadian Site'- Bloomberg,
45514510,TTE,2025-05-20T11:26:12Z,"TotalEnergies Bets On Ksi Lisims LNG, Acquires Developer Stake And Supply",TotalEnergies (NYSE: TTE) signed an agreement to buy 2Mtpa of LNG for 20 years from Ksi Lisims LNG. It also acquired a 5% stake in Western LNG.
45563987,TTE,2025-05-22T13:03:50Z,"TotalEnergies' New Spain Solar Field Capable Of Powering 150,000 Homes","TotalEnergies opens largest solar power complex in Europe near Seville, Spain. Five farms with 263MW capacity to generate 515GWh annually."
45613749,TTE,2025-05-27T10:45:51Z,Why Is TotalEnergies Stock Trading Higher On Tuesday?,TotalEnergies SE (NYSE: TTE) shares are trading higher premarket on Tuesday as the company begins oil production from Mero-4 in Brazil&#39;s Santos Basin.
45664619,TTE,2025-05-29T10:12:49Z,Shell Boosts Nigerian Deepwater Assets With TotalEnergies Stake Purchase,"
Shell Nigeria Exploration acquired TotalEnergies&#39; 12.5% interest in OML 118 PSC for $510 million, increasing its ownership to 67.5%. This will boost Shell&#39;s production and growth in its Upstream portfolio, with the Bonga North project expected to contribute to sustained liquids production. Completion of the deal is expected by the end of the year. SHEH and ABLD are ETFs that provide exposure to Shell."
45697337,TTE,2025-05-30T14:56:29Z,"TotalEnergies, RGE JV Gets Green Light To Import Renewable Power To Singapore","TotalEnergies SE and RGE JV&#39;s joint venture, Singa Renewables, has received a conditional license from Singapore."
45749065,TTE,2025-06-03T14:36:01Z,"TotalEnergies To Power 100,000 UK Homes With New Solar & Battery Projects","TotalEnergies (TTE) acquires 8 solar projects (350 MW capacity) and 2 battery storage projects (85 MW capacity) from Low Carbon, to be operational by 2028."
45796472,TTE,2025-06-05T15:14:14Z,'TotalEnergies Accused in France of Greenwashing After Rebrand'- Bloomberg,
45924005,TTE,2025-06-13T12:40:32Z,Top 2 Energy Stocks That May Fall Off A Cliff in June, 
45944442,TTE,2025-06-16T10:00:10Z,TotalEnergies Partners With Petronas In Multiple Blocks Offshore Malaysia And One Block Offshore Indonesia,
45974813,TTE,2025-06-17T14:17:32Z,TotalEnergies Is Granted A New Exploration License,
46149362,TTE,2025-06-27T18:20:04Z,'Total Gets Offers for Potential Sale of Argentina Shale Oil Assets'- Bloomberg,
46227651,TTE,2025-07-02T16:58:32Z,"Piper Sandler Maintains Neutral on TotalEnergies, Raises Price Target to $68",
46490040,TTE,2025-07-18T12:16:48Z,"Piper Sandler Maintains Neutral on TotalEnergies, Lowers Price Target to $66",
46499079,TTE,2025-07-18T16:45:02Z,TotalEnergies: Why I Expect Dividend Growth To Slow From Recent Years,"TotalEnergies (NYSE:TTE) is a French company with over 100 years of experience in the oil industry and a presence in more than 130 countries.



It is considered one of the major oil companies, with a leading position in the upstream, midstream, and downstream oil segments."
46541965,TTE,2025-07-22T12:29:50Z,SLB Announces It Has Been Awarded A Technologies And Services Contract For Carbon Storage Site Development In The North Sea,
46548735,TTE,2025-07-22T15:04:23Z,"Reuters Cites TotalEnergies Saying In The U.S. Co Expands Its Investments In Sustainable Forestry Operations To Preserve Carbon Sinks;- Signs An Agreement With Nativstate; Transaction Includes 13 Improved Forest Management Projects Located In Arkansas, Louisiana, Mississippi And Tennessee, U.S.A",
46573433,TTE,2025-07-23T14:02:09Z,TotalEnergies Earnings Preview, 
46593760,TTE,2025-07-24T06:16:20Z,"TotalEnergies Q2 Adj. EPS $1.57 Misses $1.66 Estimate, Sales $49.63B Miss $51.20B Estimate",
46594887,TTE,2025-07-24T08:32:31Z,"Earnings Scheduled For July 24, 2025", 
46612677,TTE,2025-07-24T18:04:27Z,TotalEnergies Upholds Shareholder Payouts Even After Rough Quarter,TotalEnergies SE (NYSE: TTE) reported Q2 2025 earnings below expectations due to lower commodity prices and maintenance. But maintained shareholder returns.
47029957,TTE,2025-08-11T13:20:47Z,NextDecade  Enters Agreements With Totalenergies And GIP For Train 4 Project; TTE And GIP Commit $300M And $1.5B Respectively For Train 4,
47190568,TTE,2025-08-18T16:21:12Z,"Piper Sandler Maintains Neutral on TotalEnergies, Raises Price Target to $68",
47444200,TTE,2025-09-02T10:22:37Z,TotalEnergies Expands West Africa Footprint With New Offshore Exploration Licenses,"TotalEnergies signed exploration agreements in Africa, including a PSC for Nigeria&#39;s offshore blocks and an offshore exploration permit in Republic of Congo."
47629946,TTE,2025-09-11T19:00:51Z,What's Driving the Market Sentiment Around TotalEnergies?, 
47711368,TTE,2025-09-17T11:58:49Z,TotalEnergies Signs Production Sharing Contracts For Four Offshore Exploration Blocks In Liberia Following 2024 Licensing Round,
47836316,TTE,2025-09-24T09:39:34Z,France Selects TotalEnergies And RWE For €4.5B Centre Manche 2 Offshore Wind Project Supplying Power To 1M Households,
47846730,TTE,2025-09-24T16:25:01Z,"TotalEnergies SE Says Board Of Directors Confirms Priority Given To Dividend Growth Through Cycles; Decides To Adjust The Pace Of Share Buybacks To Energy Environment In Order To Face Economic And Geopolitical Uncertainties; Confirmed Shareholder Return Policy Of At Least 40% Of Annual Cash Flow From Operations Through Cycles; To Adjust The Pace Of Share Buybacks To Hydrocarbon Prices, Refining And Petrochemical Margins And The $/€ Exchange Rate",
47846748,TTE,2025-09-24T16:26:02Z,TotalEnergies SE Says Expects To Maintain Gearing Ratio Below 20% In An Uncertain Economic And Geopolitical Environment; BOD Approved 2026 Share Buyback Guidance Between $750M And $1.5B Per Quarter For Brent Price Between $60/B And $70/B And Exchange Rate Around 1.20 $/€,
47909579,TTE,2025-09-29T07:33:53Z,TotalEnergies Acquires 49% Interest In Anadarko Basin Gas Assets From Continental Resources To Strengthen US LNG Value Chain Integration,
47913952,TTE,2025-09-29T12:43:24Z,TotalenErgies SE Says Deploying A $7.5B Cash Savings Program Over 2026-2030 With Attractive Shareholder Returns Of Over 40% Payout Through Cycles; Reduces Its Net Capex Guidance To Around $16B In 2026 And $15B-$17B Per Year During 2027-2030; Plans For +3% Per Year Oil And Gas Growth Between 2024 And 2030; Integrated LNG Is Expected To Deliver Cash Flow Growth Of More Than 70% By 20302 Compared To 2024 At $70/B And $8/MBTU; Plans To Increase Electricity Production By Approximately 20% Per Year Through 2030,
47921250,TTE,2025-09-29T15:51:53Z,TotalEnergies SE CEO Says We Are Assuming Russian Yamal LNG Volumes Are Not There In 2030; If EU Bans Russian LNG Imports We Can Take It To Turkey Or India; If EU Sanctions Yamal LNG We Would Have To Declare Force Majeure And Stop Delivering It,
47922884,TTE,2025-09-29T16:40:59Z,"'TotalEnergies May Sell Part of Adani Green Stake, CEO Says' -Bloomberg",
47963342,TTE,2025-10-01T10:21:56Z,TotalEnergies Sells Stakes In Three Shut-Down North Sea Oil Fields To Vår Energi And Orlen,
47963365,TTE,2025-10-01T10:22:58Z,"TotalEnergies To Divest 39.89% In West Ekofisk And Albuskjell To Vår Energi, 20.23% In Tommeliten Gamma To Orlen",
47987980,TTE,2025-10-02T08:15:16Z,TotalEnergies And CarbonVault Join Forces In Denmark's Bifrost CCS Project To Advance European CO₂ Storage And Decarbonization Ambitions,
48023072,TTE,2025-10-03T17:06:57Z,10 Defensive Stocks To Consider Buying As Experts Get Skittish, 
48035736,TTE,2025-10-06T07:20:10Z,"TotalEnergies And Veolia Sign Memorandum To Advance Energy Transition, Circular Economy, And Reduce Greenhouse Gas Emissions",
48037495,TTE,2025-10-06T10:48:40Z,"TotalEnergies, Veolia Partner To Drive Low-Carbon Future",TotalEnergies and Veolia signed a new agreement to collaborate on reducing GHG emissions and water consumption while accelerating innovation.
48127248,TTE,2025-10-09T14:49:39Z,"Scotiabank Maintains Sector Perform on TotalEnergies, Raises Price Target to $67",
48131716,TTE,2025-10-09T17:00:35Z,What Does the Market Think About TotalEnergies SE?, 
48219844,TTE,2025-10-15T10:46:22Z,TotalEnergies Profit Outlook Brightens On Refining Strength,TotalEnergies (NYSE: TTE) expects 3Q25 performance to improve with 4% Y/Y increase in oil &amp; gas production.
48320858,TTE,2025-10-21T07:37:44Z,TotalEnergies Divests GreenFlex To French Group Oteis As Part Of Strategy To Focus On Energy Production And Supply,
48355678,TTE,2025-10-22T14:47:39Z,'Germany Rejects TotalEnergies' Call for Better Wind Farm Terms' - Bloomberg,
48401698,TTE,2025-10-24T12:21:34Z,'TotalEnergies Said to Weigh Stake Sale in German Battery Storage' - Bloomberg,
48455230,TTE,2025-10-28T09:37:41Z,"TotalEnergies And Aljomaih Energy & Water Win 400 MW As Sufun Solar Project To Power 68,400 Homes Under 25-Year PPA In Saudi Arabia",
48455357,TTE,2025-10-28T09:59:25Z,TotalEnergies Wins Big In Saudi Arabia With 400 MW Solar Power Deal,TotalEnergies (NYSE:TTE) and Aljomaih Energy &amp; Water won a tender to build and operate a 400MW solar plant in KSA.
48519067,TTE,2025-10-30T07:34:20Z,"TotalEnergies Q3 Adj. EPS $1.77 Misses $1.81 Estimate, Sales $48.691B Miss $54.933B Estimate",
48522846,TTE,2025-10-30T11:12:06Z,"Earnings Scheduled For October 30, 2025", 
48528800,TTE,2025-10-30T14:00:55Z,What Does the Market Think About TotalEnergies SE?, 
48530687,TTE,2025-10-30T14:39:43Z,TotalEnergies Mixed Q3: Weak LNG Earnings Offset by Refining Strength,"TotalEnergies reported Q3 2025 adjusted EPS of $1.77 and revenue of $48.69B, missing estimates, as strong refining gains offset weaker LNG performance."
48614341,TTE,2025-11-04T10:50:34Z,TotalEnergies Strikes Major Green Power Deal With Data4 In Spain,TotalEnergies (NYSE: TTE) shares trade lower as the company secures 10-year renewable energy deal with Data4 for its Spanish sites.
48681018,TTE,2025-11-06T11:13:52Z,KBR Secures Design Role In TotalEnergies' Gas Growth Integrated Project To Boost Iraq's Energy Production,
48749118,TTE,2025-11-10T12:54:35Z,"Piper Sandler Maintains Neutral on TotalEnergies, Raises Price Target to $70",
48775232,TTE,2025-11-11T11:07:00Z,Honeywell Partners with TotalEnergies to Test New AI Assistant at Texas Refinery,
48778514,TTE,2025-11-11T14:23:39Z,AI Meets Refining: Honeywell Pilots Experion Assistant With TotalEnergies,"Honeywell partners with TotalEnergies to pilot its AI-powered Experion Operations Assistant at Port Arthur Refinery, predicting incidents and improving efficiency."
48796136,TTE,2025-11-12T08:44:14Z,"Reported Earlier, TotalEnergies (40%, Operator) And Its Partners QatarEnergy (35%) And Petronas (25%) Have Signed A Production Sharing Contract For Block S4 With Guyana's Ministry Of National Resources",
48796138,TTE,2025-11-12T08:45:24Z,TotalEnergies And Google Have Signed A 15-year Power Purchase Agreement To Supply Google With A Total Volume Of 1.5 TWh Of Certified Renewable Electricity,
48797098,TTE,2025-11-12T10:46:48Z,Google To Run Ohio Data Centers On Solar Power From TotalEnergies,TotalEnergies and Google have signed a 15-year PPA for renewable electricity. The deal aligns with both companies&#39; goals.
48796940,TTE,2025-11-12T13:30:24Z,"Stock Market Today: Nasdaq, Dow Jones, S&P 500 Futures Rise Ahead Of House Vote To Reopen Government— Bill Holdings, AMD, Cisco In Focus (UPDATED)","(Editor’s note: The future prices of benchmark tracking ETFs and the headline were updated in the story.)



U.S. stock futures rose on Wednesday after Tuesday’s mixed close. Futures of major benchmark indices were higher."
48892105,TTE,2025-11-17T08:40:56Z,TotalEnergies Announces The Signing Of An Agreement With EPH For The Acquisition Of 50% Of Its Flexible Power Generation Platform In Western Europe Valued At €10.6B ($12.3B),
48893743,TTE,2025-11-17T11:12:36Z,TotalEnergies Adds 14 GW Of Power Assets In Massive Europe Deal,TotalEnergies SE (NYSE: TTE) will acquire a 50% stake in EPH&#39;s 14 GW flexible power generation portfolio for €10.6B.
49056517,TTE,2025-11-25T14:45:00Z,"Reported Earlier: TotalEnergies' Nigeria Unit Divests 12.5% Non-Operated Stake In OML118 Production Sharing Contract To Shell Nigeria Exploration,  Nigerian Agip Exploration For $510M",
49056852,TTE,2025-11-25T14:47:11Z,TotalEnergies To Demobilize Le Havre LNG Terminal As France's Gas Supply Stabilizes,
49065467,TTE,2025-11-25T17:58:44Z,TotalEnergies Demobilizes Le Havre LNG Terminal As Europe's Gas Markets Stabilize,"TotalEnergies to deploy LNG FSRU in France without subsidies, demobilizes terminal in Le Havre due to stable gas supplies."
49129829,TTE,2025-12-01T08:04:45Z,TotalEnergies And Chevron Expand Offshore Exploration Collaboration With 40% Farmout In Nigeria's West Delta Basin,
49133093,TTE,2025-12-01T12:49:12Z,TotalEnergies Sells 40% Stake In Nigeria Offshore Blocks To Chevron,"TotalEnergies EP Nigeria will sell a 40% stake in PPL 2000 and PPL 2001 to Chevron&#39;s Star Deep Water, expanding offshore collaboration in West Delta basin."
