ID,Ticker,Date,Headline,Summary
49154561,TTE,2025-12-02T10:08:50Z,"TotalEnergies, TES, Osaka Gas, Toho Gas And Itochu Have Struck A Deal Giving The Japanese Companies 33.3% Of The Live Oak E-methane Project In Nebraska, With TotalEnergies And TES Each Retaining 33.35%",
49154926,TTE,2025-12-02T11:01:27Z,Japan's Gas Majors Rally Behind TotalEnergies Nebraska Project To Drive Clean Gas Growth,TotalEnergies partners with TES and 3 Japanese companies to develop the Live Oak project in Nebraska for e-methane production.
49160489,TTE,2025-12-02T14:46:29Z,'TotalEnergies Is Leading Bidder for Galp's Namibia Oil Stake' - Bloomberg,
49230413,TTE,2025-12-05T14:32:40Z,JP Morgan Downgrades TotalEnergies to Neutral,
49251216,TTE,2025-12-08T08:30:12Z,"TotalEnergies Merges UK Assets to Create Region's Largest Oil Producer, Taking 47.5% Stake in Deal",
49274539,TTE,2025-12-09T09:24:05Z,"TotalEnergies To Acquire 40% Operated Interest In PEL83 Holding Mopane, While Galp Takes 10% In PEL56 Holding Venus",
49287392,TTE,2025-12-09T18:00:31Z,Peering Into TotalEnergies SE's Recent Short Interest, 
49412339,TTE,2025-12-16T06:43:36Z,TotalEnergies Strengthens Malaysia Partnership With PTTEP By Divesting 9.998% Stake While Retaining 30.002% Interest In SK408,
49412953,TTE,2025-12-16T08:14:41Z,TotalEnergies And Google Sign 21-Year Renewable Power Purchase Agreement To Supply Malaysia Data Centers With Solar Energy,
49413961,TTE,2025-12-16T10:12:27Z,Google Taps TotalEnergies For Clean Power To Run Malaysia Data Centers,TotalEnergies pens 21-year power purchase agreement with Google to supply 1 TWh of renewable electricity from a solar project in Malaysia.
49441277,TTE,2025-12-17T08:56:35Z,TotalEnergies Sold 50% Of Its 424 Mw Wind And Solar Portfolio In Greece For Transaction Valued At €508 Million (Around $595M),
49444918,TTE,2025-12-17T12:37:05Z,TotalEnergies Divests Half Of Greek Wind And Solar Assets For $595 Million,TotalEnergies (NYSE: TTE) stock rose after selling 50% stake in its Greek wind and solar portfolio for 508 million euros.
49690968,TTE,2026-01-05T14:00:28Z,Peering Into TotalEnergies SE's Recent Short Interest, 
49778144,TTE,2026-01-08T12:04:07Z,Jefferies Upgrades TotalEnergies to Buy,
49810530,TTE,2026-01-09T13:18:23Z,"TotalEnergies, Eni, QatarEnergy Strike Agreement With Lebanese Government For Block 8 Exploration Permit Offshore Lebanon",
49897391,TTE,2026-01-14T07:56:24Z,"TotalEnergies And Bapco Energies Establish BXT Trading, A 50/50 Trading Joint Venture Backed By Flows From The Bapco Energies Refinery",
49900189,TTE,2026-01-14T11:56:04Z,"TotalEnergies Strengthens Portfolio With Bahrain JV, Nigeria Sale",TotalEnergies announces two major deals in Middle East and West Africa - launching BxT Trading and selling stake in Nigerian oil licenses.
50012268,TTE,2026-01-20T16:57:54Z,TotalEnergies Sees Refining Gains Softening Oil Price Hit,"TTE stock rose on 2025 oil and gas production expectations, with 4% full-year growth and improved segment performance."
50076056,TTE,2026-01-22T17:19:51Z,"TD Cowen Maintains Hold on TotalEnergies, Raises Price Target to $70",
50107444,TTE,2026-01-23T18:41:16Z,Trump Promised To Cut Your Energy Bill In Half — Why Are Costs Still Surging?,"Americans were promised cheaper energy. Instead, heating costs are projected to rise 9.2% this season, the NEADA projects."
50116478,TTE,2026-01-24T14:47:01Z,"'Libya Signs 25-Year Oil Deal With TotalEnergies And ConocoPhillips; Deal Is Aimed At Boosting Production Capacity By Up To 850,000 Barrels Per Day And Is Expected To Generate Net Revenues Of More Than $376B' - Reuters News",
50116898,TTE,2026-01-24T19:17:44Z,"Libya Signs 25-Year Oil Deal Worth Billions With TotalEnergies, ConocoPhillips","Libya signed a 25-year Waha-led oil pact with TotalEnergies and ConocoPhillips, aiming for major output growth."
50119690,TTE,2026-01-26T07:57:06Z,TotalEnergies Signs Agreement To Extend Libya Waha Concessions Through 2050 At Libya Energy And Economy Summit,
50257331,TTE,2026-01-30T09:03:33Z,"Reported Earlier, TotalEnergies And Mozambique Plan To Relaunch Development Of $20B Liquefied Natural Gas Project, Nearly Five Years After Construction Was Suspended",
50257993,TTE,2026-01-30T10:31:58Z,TotalEnergies Reboots Africa's Biggest LNG Bet In Mozambique,"TotalEnergies SE (TTE) and Mozambique&#39;s President announced the full restart of Mozambique LNG project, creating 7,000 jobs."
50267206,TTE,2026-01-30T15:00:37Z,Is TotalEnergies SE Gaining or Losing Market Support?, 
50272342,TTE,2026-01-30T16:40:46Z,TotalEnergies Advances Mopane Discoveries in Orange Basin,"TotalEnergies will take over operatorship of PEL 83 in Namibia&#39;s Orange Basin, covering the Mopane discoveries, while Galp acquires interests in Venus-linked licenses."
50331591,TTE,2026-02-03T13:52:02Z,"TotalEnergies, Kuwait Oil Sign MoU To Enhance Cooperation, Exchange Expertise, Carry Out Technical Studies",
50346306,TTE,2026-02-03T18:18:36Z,TotalEnergies Strikes Big Kuwait Deal To Unlock New Oil And Gas Finds,"TotalEnergies (TTE) stock rose after signing MoU with Kuwait Oil Company to enhance collaboration, support new exploration opportunities."
50366052,TTE,2026-02-04T11:38:51Z,TotalEnergies Joins Tikehau to Boost Urban EV Charging In Benelux,"TotalEnergies partners with Tikehau Capital to expand urban EV charging infrastructure in Belgium and the Netherlands, powering stations with certified renewable energy to accelerate the EV transition."
50402406,TTE,2026-02-05T08:45:27Z,TotalEnergies And Airbus Signed Two Clean Firm Power Contracts To Supply 3.3 TWh To All Major Airbus Sites Located In Germany And The United Kingdom,
50406466,TTE,2026-02-05T12:14:22Z,Airbus Taps TotalEnergies For Clean Firm Power Starting 2027,TotalEnergies (TTE) signs power agreements with Airbus (EADSY) to supply renewable electricity to sites in Germany and UK starting in 2027.
50438854,TTE,2026-02-06T08:56:23Z,TotalEnergies Expands Namibia Exploration With 42.5% Operated Stake In Offshore PEL104 License Alongside Petrobras And Namcor,
50438982,TTE,2026-02-06T09:20:47Z,"'Japan's Mitsui Close To buying Stake In Qatar LNG Project, Sources Say' - Reuters Exclusive",
50458481,TTE,2026-02-06T18:46:30Z,TotalEnergies Doubles Down On Namibia With New Offshore Oil Bet,"TotalEnergies expands exploration portfolio in Namibia through acquisition of 42.5% interest in PEL104 license, operatorship with Petrobras."
50472606,TTE,2026-02-09T08:31:25Z,TotalEnergies Inked Two New Long-term Power Purchase Agreements To Deliver 1 GW Of Solar Capacity To Supply Google's Data Centers In Texas,
50473620,TTE,2026-02-09T10:49:06Z,TotalEnergies Signed 2 Long-Term PPAs To Deliver 1 GW Solar Capacity Supplying 28 TWh Over 15 Years To Google Data Centers In Texas,
50474207,TTE,2026-02-09T11:14:03Z,TotalEnergies Locks In 15-Year Solar Deal To Power Google's Texas Data Centers,"TotalEnergies signs 2 PPAs with Google to supply 1 GW of solar capacity in Texas, supporting decarbonization goals and creating local jobs."
50485675,TTE,2026-02-09T16:30:44Z,"Robinhood, AppLovin, Rivian and More Stocks With Earnings This Week","Investors are anticipating reports from Robinhood, Pinterest, Rivian and more. Here&#39;s a look at the earnings calendar for the week ahead."
50509001,TTE,2026-02-10T14:01:03Z,What to Expect from TotalEnergies's Earnings, 
50533781,TTE,2026-02-11T09:22:22Z,Peter Thiel's Palantir Extends Partnership With Boeing Rival Airbus,"Palantir expands partnership with Airbus, joining forces on open data platform Skywise amid Michael Burry&#39;s 60% stock decline prediction."
50534269,TTE,2026-02-11T10:22:54Z,'Syria Taps Energy Majors To Explore For 'Trillions' Of Cubic Metres Of Gas' - FT,
50534565,TTE,2026-02-11T11:00:23Z,"TotalEnergies Q4 Adj. EPS $1.73 Misses $1.78 Estimate, Sales $50.624B Beat $33.936B Estimate",
50535044,TTE,2026-02-11T11:11:24Z,"Earnings Scheduled For February 11, 2026", 
50543981,TTE,2026-02-11T15:05:46Z,TotalEnergies Refining Strength Cushions Oil Slump,"TotalEnergies (TTE) stock up on Q4 2025 earnings release, with adjusted EPS of $1.73 and revenue of $50.62B."
50544017,TTE,2026-02-11T15:06:22Z,"TotalEnergies CEO Says We Are Increasing Our Cost Savings Goal To $12.5 Billion Saved By 2030, Versus $7.5 Billion Previously; This Involves Moving Certain Operations To India And Buying Romanian Equipment Where Costs Are Lower",
50576177,TTE,2026-02-12T14:17:30Z,"EU Moves To Deepen Ties With Turkey To Counter Russian Drones, Energy Security Fears", 
50722048,TTE,2026-02-19T15:09:51Z,'TotalEnergies Asked to End Oil and Gas Exploration in Paris Lawsuit'- Bloomberg,
50777097,TTE,2026-02-23T13:25:59Z,"TotalEnergies, Repsol, and HitecVisio Receive European Commission Approval For Proposed Acquisition Of Neo Next Energy",
50812478,TTE,2026-02-24T13:41:34Z,'Oil majors running Kazakh Kashagan field file arbitration over $4.6 billion fine' - Reuters,
50920484,TTE,2026-02-27T09:51:52Z,TotalEnergies Locks In Massive 20-Year Alaska LNG Deal To Fuel Asia,TotalEnergies secures long-term LNG supply from Alaska LNG project with Glenfarne. Aims to strengthen position as leading buyer of US LNG.
50924232,TTE,2026-02-27T12:39:15Z,'TotalEnergies Buys Bumper Mideast Oil Volumes on Dubai Window' - Bloomberg,
50959245,TTE,2026-03-02T11:20:59Z,TotalEnergies Signs New Oil Exploration Deal With Kuwait Oil Company,
50961890,TTE,2026-03-02T12:44:27Z,Energy Stocks Surge As 'Operation Epic Fury' Ignites Middle East Oil Risk Premium,"Oil giants and related ETFs rocketed in pre-market action Monday, fueled by Brent crude&#39;s sharp climb on U.S.-Iran hostilities."
50963285,TTE,2026-03-02T13:18:24Z,JP Morgan Upgrades TotalEnergies to Overweight,
50967708,TTE,2026-03-02T15:00:36Z,What Does the Market Think About TotalEnergies SE?, 
50991985,TTE,2026-03-03T08:35:35Z,TotalEnergies Signed An Agreement With Allianz Global Investors For The Sale Of A 50% Stake In A Portfolio Of 11 Battery Storage Projects With A Total Capacity Of 789 MW–1628 MWh,
50993159,TTE,2026-03-03T10:46:56Z,TotalEnergies Invests $581 Million To Develop 800 MW Of Battery Storage Projects In Germany,TotalEnergies&#39; €500 million investment enhances Germany&#39;s renewable energy and grid stability.
51035804,TTE,2026-03-04T14:55:13Z,'Middle East Oil Prices Soar After Platts Excludes Gulf Loadings' - Bloomberg,
51097390,TTE,2026-03-06T14:56:57Z,"'Total evacuated its expatriate personnel from projects in Iraq's Basra, sources say' - Reuters",
51183690,TTE,2026-03-11T12:29:00Z,TotalEnergies Starts Lapa South-West Project In Santos Basin Offshore Brazil,
51205825,TTE,2026-03-12T09:58:09Z,"TotalEnergies Brings Libya's Mabruk Oil Field Back Online With 25,000 Barrels Per Day Capacity, Production Was Stopped In 2015",
51206528,TTE,2026-03-12T10:20:41Z,TotalEnergies Moves To Shield French Drivers From Oil Shock With Temporary Price Caps,TTE Stock Update: TotalEnergies shares move lower as investors weigh fuel caps and Libya production restart. Current P/E sits at 14.1x.
51219196,TTE,2026-03-12T16:20:01Z,"Total Energies Says Has Shut Down Or Is In Process Of Shutting Down Production In Qatar, Iraq, UAE Offshore, Representing 15% Of Total Output; Says Our Onshore UAE Production Of About 210,000 Barrels Per Day Is Not Affected By The Conflict",
51219267,TTE,2026-03-12T16:21:06Z,"TotalEnergies Says Impact Of Qatar Shutdowns On Our LNG Trading Is Limited, Around 2 Million Tonnes; 15% Of Affected Production Account For About 10% Of Our Upstream Cash Flow",
51219426,TTE,2026-03-12T16:24:10Z,"TotalEnergies Says Growth Of Accretive Barrels Expected To Come Overwhelmingly From Outside The Middle East In 2026, Higher Oil Price More Than Offsets Loss Of Middle East Production; Operations At The Satorp Refinery Are Continuing Normally For Now And Are Supplying The Saudi Domestic Market",
51219628,TTE,2026-03-12T16:28:39Z,"Piper Sandler Maintains Neutral on TotalEnergies, Raises Price Target to $92",
51264028,TTE,2026-03-16T10:49:36Z,Conflict Forces TotalEnergies To Suspend Key Middle East Operations,"TotalEnergies confirms 15% production cuts in Qatar, Iraq, and UAE due to conflict. High oil prices expected to offset cash flow impacts."
51289155,TTE,2026-03-17T08:35:50Z,"TotalEnergies' 11.8%-Owned Quiluma Field Begins Production In Angola, To Supply 2M Tons Of LNG Per Year To European And Asian Markets",
51289572,TTE,2026-03-17T09:24:44Z,The New York Times Reported Trump Officials Weigh $1B Deal To Block Offshore Wind Farms Off New York And North Carolina,
51291886,TTE,2026-03-17T11:32:23Z,What's Going On With TotalEnergies Stock Tuesday?,"TTE hits new 52-week highs amid Angola gas launch. Get the latest technical analysis, RSI levels, and key resistance for TotalEnergies SE."
51347321,TTE,2026-03-19T09:03:54Z,TotalEnergies Starts Production At France's First Advanced Plastics Recycling Plant At Grandpuits Zero-Crude Platform Southeast Of Paris,
51351849,TTE,2026-03-19T12:43:34Z,France's Advanced Plastic Recycling Era Begins With TotalEnergies,"TotalEnergies launches a 15,000-ton annual plastics recycling plant in France, part of its Grandpuits zero-crude platform and environmental impact reduction strategy."
51410721,TTE,2026-03-23T15:30:55Z,"U.S. Interior Secretary Doug Burgum Says U.S., France's Total To Redirect Nearly $1B From Offshore Wind Leases To Us Natural Gas Production; TotalEnergies CEO Pouyanne Says Offshore Wind Is Not The Most Affordable Way To Produce Electricity In The United States; Innovative Agreement Allows Us To Recycle Money In Smarter Investment; We Will Recoup $928M In Wind Lease Costs And Invest It In U.S LNG, Natural Gas And Oil",
51411475,TTE,2026-03-23T15:49:26Z,"TotalEnergies CEO Says Is Pleased To Sign Agreements With U.S. And To Support The Energy Policy Of The U.S. Administration; Considering That The Development Of Offshore Wind Projects Is Not In The Interest Of The U.S. We Have Decided To Forgo These Projects In That Country, In Exchange For The Reimbursement Of Royalties Paid To The U.S. Government; Will Reinvest The Refunded Lease Fees To Finance The Construction Of The 29 Mt Rio Grande LNG Plant And The Development Of Our Oil And Gas Production And Export",
51424719,TTE,2026-03-24T08:47:42Z,"TotalEnergies To End US Offshore Wind Development After Lease Relinquishment Agreements, Plans To Reinvest In LNG And Gas Projects",
51425697,TTE,2026-03-24T10:19:23Z,"TotalEnergies Dumps US Wind Projects, Doubles Down On Gas Bets","TotalEnergies exits U.S. offshore wind, signing agreements with the DOI to relinquish leases and reinvest in U.S. gas and power projects."
51453483,TTE,2026-03-25T12:14:54Z,"TotalEnergies, EPH Receive European Commission Approval To Form JV",
51481736,TTE,2026-03-26T13:43:03Z,"'Total Goes on Mideast Oil-Buying Spree, Adding to Market Turmoil' - Bloomberg",
