ID,Ticker,Date,Headline,Summary
35197256,XOM,2023-10-11T15:40:08Z,"Emerging Market Shares Look ""Very Cheap"" While Tech Stocks Are Also A Buy, Says Citi Analyst","Beata Manthey, Citigroup Inc.’s (NYSE: C) head of equity strategy, doubled down on the bank’s bullish stance for global and in particular emerging market equities Wednesday, despite almost a year-long sell-off in the sector."
35198342,XOM,2023-10-11T16:25:19Z,"Company Execs Say Two-Third Of Synergies From Exxon-Pioneer Deal To Come From Increased Resource Recovery, Remaining Mostly From Capex Efficiencies; Exxon Not Looking At Cutting Rig Operations Or Headcount After Pioneer Deal Closes",
35199020,XOM,2023-10-11T16:56:33Z,Letter From Pioneer CEO Scott Sheffield To Employees Says All Pioneer's Oilfield Employees Will Be Offered Positions With Exxon; Most Of Pioneer's Office Employees Will Be Offered A Position In The Combined Co,
35199026,XOM,2023-10-11T16:56:59Z,Letter From Pioneer CEO Scott Sheffield To Employees Says Pioneer's COO Richard Dealy Named Leader Of The Pioneer Transition And Integration Team,
35189363,XOM,2023-10-11T17:10:10Z,"Stocks In The Red, Bonds On The Rise As Investors Brace for FOMC Minutes, Crucial CPI Report: What's Driving Markets Wednesday?","Risk sentiment weakened during Wednesday trading on Wall Street, following significant gains in the previous session."
35201718,XOM,2023-10-11T19:24:38Z,"If You Invested $1,000 In Exxon Mobil Stock When The Merger Closed In 1999, Here's How Much You'd Have Today",Oil giant Exxon Mobil Corporation (NYSE: XOM) is making headlines this week after agreeing to acquire Pioneer Natural Resources (NYSE: PXD) in one of its largest acquisitions
35212382,XOM,2023-10-12T07:14:19Z,Investor Fears Ease Further Ahead Of More Inflation Data: Here's Why,"The CNN Money &#34;Fear and Greed&#34; index showed further easing in the fear level, but the index remained in the &#34;Fear&#34; zone on Wednesday.

U.S. stocks settled higher on Wednesday as investors awaited the release of the consumer price index, due to be released on Thursday. Economists are expecting consumer prices to rise 0.3% from the prior month in September."
35213096,XOM,2023-10-12T07:52:37Z,Jim Cramer Urges Reevaluation Following Pioneer's $60B Exxon Deal: 'I Will Sell Every Share...', 
35216567,XOM,2023-10-12T11:34:16Z,"Truist Securities Upgrades Exxon Mobil to Buy, Raises Price Target to $131",
35218021,XOM,2023-10-12T12:21:51Z,Exxon Mobil To Rally Around 23%? Here Are 10 Top Analyst Forecasts For Thursday,"Top Wall Street analysts changed their outlook on these top names. For a complete view of all analyst rating changes, including upgrades and downgrades, please see our analyst ratings page"
35212922,XOM,2023-10-12T13:19:50Z,How To Earn $500 A Month From Exxon Mobil After Pioneer Deal,"Exxon Mobil Corporation (NYSE: XOM) announced a definitive agreement to acquire Pioneer Natural Resources Company (NYSE: PXD) in an all-stock transaction valued at $59.5 billion, or $253 per share."
35222586,XOM,2023-10-12T15:00:35Z,"Benzinga's Top Ratings Upgrades, Downgrades For October 12, 2023", 
35225314,XOM,2023-10-12T16:50:19Z,"RBC Capital Reiterates Sector Perform on Exxon Mobil, Maintains $120 Price Target",
35228346,XOM,2023-10-12T19:22:49Z,"Jefferies Maintains Buy on Exxon Mobil, Raises Price Target to $145",
35230616,XOM,2023-10-12T21:00:29Z,18 Analysts Have This to Say About Exxon Mobil, 
35231309,XOM,2023-10-12T21:46:00Z,Iran's Involvement In Israel-Hamas Conflict Is Key For The Future Of US Inflation,The outbreak of war in the Middle East is threatening to hamper the Fed&#39;s efforts to control inflation.
35240230,XOM,2023-10-13T14:14:29Z,US Is Producing More Oil Under Biden Than At Any Point Under The Trump Administration,"The U.S. oil production rose to new all-time highs during the third quarter, according to the U.S. Energy Information Administration."
35241417,XOM,2023-10-13T14:19:43Z,What's Going On With Exxon Mobil (XOM) Stock,Exxon Mobil Corp (NYSE: XOM) shares are trading higher by 1.9% to $108.45. Shares of oil companies are trading higher as crude rises after the U.S. on Thursday imposed sanctions on two shipping companies for violating the price cap on Russian oil.
35238289,XOM,2023-10-13T17:53:30Z,"US Stocks Falter, Oil, Gold Rally As Israel-Hamas Conflict Escalates: What's Driving Markets Friday?","Risk aversion intensified during Friday’s morning trading, with stocks taking a sharp downturn while gold and oil rallied in the wake of heightened tensions in the Middle East."
35248880,XOM,2023-10-13T20:33:31Z,"Israel-Hamas War Shakes Middle East, Inflation Reawakens, Oil Surges: The Week In The Markets","Higher-than-expected inflation data this week caught markets off guard, and the Israel-Hamas conflict is sending the markets running to safer assets. "
35270196,XOM,2023-10-16T15:27:16Z,Oil Prices Rise As Concerns Over Supply Grow Amid Middle East Unrest: This Fund Offers 2X Leverage To Play The Sector Bullishly,"Direxion Daily S&amp;P Oil &amp; Gas Exp &amp; Prod Bull 2X Shares (ARCA: GUSH) was rising about 0.8% higher on Monday, continuing its rally amid increased geopolitical conflict, which caused International Monetary Fund Managing Director Kristalina Georgieva to "
35271120,XOM,2023-10-16T16:38:35Z,"Analyst Favors Exxon Mobil Deal, But Downgrades Pioneer Natural Resources: Here's Why",BMO Capital Markets analyst Phillip Jungwirth downgraded Pioneer Natural Resources Co (NYSE: PXD) to 
35281833,XOM,2023-10-17T09:47:08Z,"Bernstein Initiates Coverage On Exxon Mobil with Outperform Rating, Announces Price Target of $140",
35290838,XOM,2023-10-17T15:00:55Z,"Benzinga's Top Ratings Upgrades, Downgrades For October 17, 2023", 
35293783,XOM,2023-10-17T16:47:13Z,Exxon Expects To Final Investment Decision Guyana's Whiptail Oil Project By Q1 2024,
35310354,XOM,2023-10-18T14:31:37Z,Check Out What Whales Are Doing With XOM, 
35323824,XOM,2023-10-19T12:49:57Z,"Devon Energy Eyes Marathon Oil, Weighs Strategic Acquisitions To Boost US Shale Presence",Oil and gas player Devon Energy Corp (NYSE: DVN) is reportedly exploring potential acquisition opportunities to bolster its presence in the U.S.
35348608,XOM,2023-10-20T13:26:59Z,Exxon Engages In Discussions To Join UN-Led Methane Reporting Agreement: Report,Exxon Mobil Corporation (NYSE: XOM) reportedly plans to join a U.N.-led initiative that would mandate disclosing 
35358005,XOM,2023-10-20T20:08:03Z,"Investor Risk Sentiment Wavers Amid War, Interest Rate Concerns; Tesla Earnings Disappoint: The Week In The Markets","In the week ahead, earnings season moves into full swing with reports from companies like Microsoft, Alphabet, Meta Platforms and Amazon. "
35362439,XOM,2023-10-21T18:04:58Z,Iraqi Prime Minister Sounds Alarm On Israel-Hamas Conflict's Impact On Oil Supply,Iraqi Prime Minister Mohammed Shia al-Sudani issued a stark warning on the potential consequences of the Israel-Hamas conflict extending into neighboring regions.
35367409,XOM,2023-10-23T07:15:17Z,"Amazon, Alphabet, Meta, Intel Q3 Earnings This Week: Will Mega-Caps Shatter Forecasts And Revive Market?","Factset data indicates that out of the 17% of the S&amp;P 500 companies that have reported so far, 73% have reported positive EPS surprises."
35374215,XOM,2023-10-23T13:45:43Z,Looking At Exxon Mobil's Recent Unusual Options Activity, 
35380824,XOM,2023-10-23T18:26:18Z,Chevron's Acquisition Of Hess Corp. Sends Ripples Through Energy Sector: Reasons Behind Stock Price Dip,"Chevron Corp. (NYSE: CVX), the second-largest oil company in the United States after Exxon Mobil Corp. (NYSE: XOM), sent shockwaves through the market with its announcement of a planned acquisition of Hess Corp. (NYSE: HES) on Monday. However, the market&#39;s initial response has been far from enthusiastic."
35402928,XOM,2023-10-24T19:46:01Z,Check Out What Whales Are Doing With XOM, 
35423488,XOM,2023-10-25T18:52:09Z,"JP Morgan Maintains Overweight on Exxon Mobil, Lowers Price Target to $134",
35440850,XOM,2023-10-26T14:00:41Z,Earnings Outlook For Exxon Mobil, 
35444488,XOM,2023-10-26T16:16:49Z,Warren Buffett's Berkshire Hathaway Boosts Stake in Occidental Petroleum as Oil Industry Sees Shakeups,Berkshire Hathaway Inc (NYSE: BRK-A) (NYSE: BRK-B) ramped up stake in Occidental Petroleum Corp (NYSE: OXY) as 
35457839,XOM,2023-10-27T07:06:02Z,Exxon Mobil Gears Up For Q3 Print; Here's A Look At Recent Price Target Changes By The Most Accurate Analysts,"Exxon Mobil Corporation (NYSE: XOM) is expected to release financial results for its third quarter, before the opening bell on Oct. 27, 2023."
35458491,XOM,2023-10-27T08:33:22Z,"Earnings Scheduled For October 27, 2023","Companies Reporting Before The Bell

• Sanofi (NASDAQ:SNY) is projected to report quarterly earnings at $2.26 per share on revenue of $12.56 billion."
35459576,XOM,2023-10-27T10:31:10Z,ExxonMobil Q3 EPS $2.25,
35459589,XOM,2023-10-27T10:32:11Z,ExxonMobil Q3 Total revenues $90.76B vs $88.813B Est.,
35459629,XOM,2023-10-27T10:34:56Z,"Exxonmobil Says Results Improved With Strong Operating Performance, Including Record Refining Throughput, Higher Crude Price And Industry Refining Margin Environment",
35459631,XOM,2023-10-27T10:35:08Z,"Exxonmobil Says Results Were Partly Offset By Weaker Chemical Margins, Unfavorable Derivative Mark-to-Market Impacts And Trading Timing Effects That Are Expected To Unwind Over Time.",
35459642,XOM,2023-10-27T10:36:08Z,ExxonMobil Increases Q4 Dividend From $0.91 To $0.95/Share,
35462875,XOM,2023-10-27T13:40:00Z,"Oil and Gas Giant Exxon's Q3 Profits Slump To $9.1B, Still Raises Annual Outlook","Exxon Mobil Corp&#39;s (NYSE: XOM) reported Q3 FY23 adjusted net profit of $9.12 billion, or $2.27 per share, down from 18.682 billion, or $4.45 per share, a year earlier. Analyst estimates stand at $2.37. "
35468356,XOM,2023-10-27T16:16:00Z,To Infinity And Exxon!,"You heard correctly: Exxon Mobil Corp (NYSE: XOM) is in talks to create an out-of-this-world acquisition of Pioneer Natural Resources (NYSE: PXD) for approximately $60 billion, with debt included."
35460910,XOM,2023-10-27T18:09:07Z,"US Stocks Waver, Tech Outperforms As September Inflation Data Solidifies Interest Rate Hold; Oil Giants Fall: What's Driving Markets Friday?","It’s a mixed Friday on Wall Street, with tech investors cheering stellar earnings from Amazon.com, Inc. (NASDAQ:AMZN) and an in-line personal consumption expenditure inflation rate, while bears continued to weigh on the broader stock market. "
35483899,XOM,2023-10-30T07:24:15Z,Fear Among US Investors Is Growing; Fear & Greed Index Moves To 'Extreme Fear' Zone,"The CNN Money Fear and Greed index showed further growth in the overall fear level, with the index moving to the &#34;Extreme Fear&#34; zone on Friday."
35484208,XOM,2023-10-30T07:40:15Z,"Apple, AMD, Palantir Earnings On Deck This Week As Market Seeks Positive Catalysts In Fed Decision Week","S&amp;P 500 earnings is expected to grow in Q3, reversing a four-quarter slide, as the reporting season enters its third week."
35498313,XOM,2023-10-30T18:49:34Z,These Analysts Revise Their Forecasts On Chevron After Q3 Earnings,Chevron Corp (NYSE: CVX) reported weaker-than-expected earnings for its third quarter on Friday.
35516459,XOM,2023-10-31T15:00:55Z,Exxon Mobil Unusual Options Activity For October 31, 
35532576,XOM,2023-11-01T10:50:58Z,Senate Majority Leader Schumer Is Urging The FTC To Look Into Whether Exxon Mobil Corp. And Chevron Corp.'s Proposed Oil And Gas Acquisitions Could Violate Antitrust Laws.,
35535967,XOM,2023-11-01T14:47:34Z,"Israel-Hamas War, Day 26 : Airstrike Kills Key Hamas Orchestrator, US Commandos To Help Identify Hostages","Twenty-six days have passed since the tragic events of Oct. 7, when the Hamas militant group executed a series of fatal attacks in Israel."
35547129,XOM,2023-11-01T19:15:27Z,"UBS Maintains Buy on Exxon Mobil, Lowers Price Target to $142",
35572051,XOM,2023-11-02T19:45:56Z,"Big Oil & Gas Names Chevron, Hess, Exxon Mobil Shares Up Today: What's Going On?",Bernstein analyst Bob Brackett revised the rating on several oil majors following their earnings release.
35589808,XOM,2023-11-03T14:25:21Z,"Israel-Hamas War, Day 28: Hezbollah And Houthis Get Vocal, Blinken Presses For Pause In Fighting",Paramilitary group Hezbollah has been relatively quiet since the start of the Hamas-Israel war 28 days ago.
35621018,XOM,2023-11-06T14:41:43Z,Air Products To Build Europe's Largest Blue Hydrogen Plant And Strengthens Long-Term Agreement,
35624425,XOM,2023-11-06T16:45:54Z,Exxon Mobil Unusual Options Activity For November 06, 
35646320,XOM,2023-11-07T15:01:09Z,Exxon Mobil Unusual Options Activity For November 07, 
35679757,XOM,2023-11-08T17:32:00Z,WTI Crude Enters Bear Market: Is It Time For Value-Contrarian Investors To Jump Into Cheap US Oil Stocks?,"Oil prices are currently on a downward trend, heading for their third consecutive week of losses and reaching levels similar to those observed in mid-July: 10 cheap stocks to consider."
35693708,XOM,2023-11-09T08:58:56Z,ExxonMobil Overtakes Tesla In Becoming The Most Shorted Large-Cap Stock In S&P 500, 
35695992,XOM,2023-11-09T11:52:20Z,Over $26M Bet On Exxon Mobil? Check Out These 4 Stocks Insiders Are Buying,"Although U.S. stocks closed mixed on Wednesday, there were a few notable insider trades."
35731344,XOM,2023-11-10T19:41:51Z,"Exxon Mobil Is This Analyst's Top Pick, Citing Premium Valuation Relative To Peers",Piper Sandler analyst Ryan M.
35740498,XOM,2023-11-12T15:53:16Z,"Reuters Reported Saturday Exxon Mobil Plans To Produce 10,000 Metric Tons Of Lithium Annually By 2026 With Partner Tetra Technologies, Citing Sources",
35743279,XOM,2023-11-13T11:41:30Z,Exxon Mobil Plans To Start Lithium Production By 2026 In Arkansas: Report,"Exxon Mobil Corp (NYSE: XOM) is reportedly planning to unveil its long-awaited lithium strategy today. 

The company plans to start production of the electric vehicle (EV) battery metal in Arkansas by 2026, as per Reuters."
35748655,XOM,2023-11-13T13:41:06Z,Exxon Mobil President Dan Ammann Says Sees Lithium Demand Quadrupling By 2030,
35756798,XOM,2023-11-13T17:29:54Z,What's Going On With Exxon Mobil (XOM) Stock?,Exxon Mobil Corp (NYSE: XOM) shares are trading higher Monday.
35757203,XOM,2023-11-13T18:17:07Z,"Why Livent, Albemarle Shares Are Sliding Monday",Shares of lithium producers including Livent Corp (NYSE: LTHM) and Albemarle Corp (NYSE: ALB) are trading lower Monday.
35774566,XOM,2023-11-14T13:07:20Z,"ExxonMobil Starts Production at Third Offshore Guyana Project Bringing Total Production Capacity in Guyana to approximately 620,000 Barrels/Day",
35774568,XOM,2023-11-14T13:07:27Z,ExxonMobil Begins Production At Third Offshore Guyana Project,
35780184,XOM,2023-11-14T15:45:42Z,This Is What Whales Are Betting On Exxon Mobil, 
35786393,XOM,2023-11-14T18:40:17Z,"Mizuho Maintains Buy on Exxon Mobil, Lowers Price Target to $133",
35792577,XOM,2023-11-14T22:37:13Z,"Elon Musk, Satya Nadella Orbit Joe Biden's Summit With Xi Jinping As US Aims To Thaw Relations With China",Summit in San Francisco is the stage for talks between U.S. and China as Biden and Xi prepare to meet in-person after a year of mounting tensions.
35811422,XOM,2023-11-15T20:17:41Z,Pioneer Natural Resources Downgraded Amid Exxon Mobil Acquisition: Here's Why,Mizuho Securities analyst Nitin Kumar downgraded Pioneer Natural Resources Co (NYSE: PXD) to Neutral from Buy and 
35817281,XOM,2023-11-15T21:47:08Z,"On December 6, 2023, ExxonMobil Intends To Release Additional Details About Its Corporate Plans, Including Its Capital Plans To 2027 - Filing",
35874901,XOM,2023-11-20T15:20:48Z,A Comprehensive Look At The Challenges In Refilling America's Emergency Oil Supply,"With a 20% retreat in oil prices from year-to-date highs, traders and market observers continue to speculate about the Department of Energy&#39;s (DOE) plans to refill the Strategic Petroleum Reserve (SPR). Although efforts have started, the scale is relatively small compared to the total replenishment required."
35879641,XOM,2023-11-20T18:32:04Z,OPEC To Discuss Deeper Production Cuts To Underpin Volatile Oil Prices,What can investors expect from OPEC this weekend? One Goldman Sachs analyst suggests that &#34;deeper cuts should not be ruled out.&#34; 
35883432,XOM,2023-11-20T21:36:41Z,6 Stocks To Watch As The World Turns To The 2023 UN Climate Change Conference,New agreements are expected to be set in order to avoid a climate catastrophe within this century.
35905071,XOM,2023-11-21T20:13:41Z,Musk And The Magnificent 9: How World's 10 Richest People Bagged $400B In 2023,A look at the soaring wealth of the ten richest people in the world in 2023.
35923118,XOM,2023-11-22T19:01:35Z,Exxon Mobil's Options Frenzy: What You Need to Know, 
35962733,XOM,2023-11-27T16:22:18Z,Oil Majors: Are BP And Chevron Attractively Valued After Share Price Tumbles?,"BP shares have fallen sharply since February, but with an attractive dividend yield, could now be time to buy?"
35964077,XOM,2023-11-27T18:17:08Z,Oil And Gas Prices Fall As Production Floods The Market: This 2X Leveraged ETF Tracks The Sector To The Downside,"Direxion Daily S&amp;P Oil &amp; Gas Exp &amp; Prod Bear 2X Shares (ARCA: DRIP) was rising about 2.5% Monday ahead of Thursday’s OPEC+ oil policy meeting, which was originally scheduled to take place on Sunday."
35987823,XOM,2023-11-28T19:51:50Z,Historic Low In Producer Short Positioning In Crude Oil: A Signal Of A Potential Major Shift In The Global Oil Market,"The latest Commitment of Traders report (COT) raises questions about the future of the energy complex. Producer short positioning has hit its lowest level since August 2015, an indication that weakness in the oil market may not be a short-term phenomenon, but rather it could usher in a new dynamic within the global economy."
36008115,XOM,2023-11-29T18:01:38Z,Spotlight on Exxon Mobil: Analyzing the Surge in Options Activity, 
36028451,XOM,2023-11-30T17:12:50Z,"COP28 Climate Summit: A Moment Of Reckoning For Oil Execs, Or Just Déja Vu?","Focus will be on cutting use of fossil fuels, while carbon capture will remain controversial"
36031535,XOM,2023-11-30T19:40:57Z,"What COP28 Says About Geopolitics, US-UAE Relations And Fate Of The Oil Sector",The BBC reported that the UAE is planning to use its role as COP28 host &#34;as an opportunity to strike oil and gas deals.&#34;
36070049,XOM,2023-12-04T14:51:58Z,Exxon Defends Carbon Capture Amid Skepticism At COP28: Report,"On Saturday, the oil giant Exxon Mobil Corp&#39;s (NYSE: XOM) CEO Darren Woods reportedly rejected the International Energy Agency&#39;s (IEA) recent claim that using wide-scale carbon capture to fight climate change was an implausible &#34;illusion&#34; at the "
36070489,XOM,2023-12-04T14:55:46Z,Al Jaber Controversy At COP28: Event's President Says 'No Science' Comments Misrepresented,Global oil prices fell on Monday after COP28 president Sultan Al Jaber hit back at criticisms of comments he made before the climate summit.
36093674,XOM,2023-12-05T14:55:35Z,How To Earn $500 Per Month From Exxon Mobil Stock,"If you want to earn $500 per month, or $6,000 annually, from Exxon Mobil dividends, your investment value should be roughly $165,290.Exxon Mobil Corp. (NYSE:XOM) stock started trading at $104.27 on Nov. 29, with a market cap exceeding $414 billion."
36097040,XOM,2023-12-05T17:06:28Z,'FTC Investigating Exxon's $60B Deal For Pioneer; The Regulator Is Seeking More Information From The Oil Producers About The Megadeal' - WSJ,
36108629,XOM,2023-12-06T11:31:47Z,ExxonMobil Provides Update To Its Corporate Plan Through 2027; Intends To Deliver $6B In Additional Structural Cost Reductions By Year-end 2027,
36108645,XOM,2023-12-06T11:33:18Z,ExxonMobil Says Pursuing More Than $20B Of Lower-Emissions Opportunities Through 2027,
36108699,XOM,2023-12-06T11:37:22Z,ExxonMobil Says On Track To Deliver ~$14B Of Further Earnings And Cash Flow Growth Potential Over Next Four Years,
36108703,XOM,2023-12-06T11:38:54Z,ExxonMobil Says Upstream Earnings Potential Is On Track To More Than Double By 2027 Versus 2019,
36111983,XOM,2023-12-06T13:49:31Z,"Stocks Eye Rebound Following 2-Day Slump; Bitcoin, Ethereum Surge Past Trillion-Dollar Combined Market Value","Wall Street is poised for a rebound in Wednesday’s session, with futures on major U.S. indices in the green at 8:00 a.m. New York time, following two consecutive sessions of declines for the S&amp;P 500."
36111738,XOM,2023-12-06T13:55:34Z,"Exxon Mobil's Big Bet: $20B Annual Buybacks, Doubling Upstream Earnings By 2027 Amid Pioneer Merger Scrutiny",Exxon Mobil Corporation (NYSE: XOM) said it expects oil and gas production in 2024 to be about 
36114768,XOM,2023-12-06T15:22:23Z,Exxon Mobil Says Our Surplus Cash Potential Through 2027 Remains Impressive. At $80B Even If Brent Falls By More Than 20% From Where It Is Today,
36116920,XOM,2023-12-06T16:53:40Z,Oil Majors To Consolidate: Watch For Further M&A Activity Across Sector In 2024,The oil and gas production sector has already seen some mega deals in 2023; M&amp;A activity is expected to continue into 2024.
36119446,XOM,2023-12-06T19:03:57Z,"Stocks Stall While Gold, Treasuries Rise; Oil Puts Pressure On Energy Stocks: What's Driving Markets Wednesday?","Major large-cap stock indices hovered around parity during early afternoon trading in New York, in a rather subdued trading session on Wall Street. "
36137701,XOM,2023-12-07T16:32:44Z,Behind the Scenes of Exxon Mobil's Latest Options Trends, 
36138385,XOM,2023-12-07T17:07:10Z,"RBC Capital Reiterates Sector Perform on Exxon Mobil, Maintains $120 Price Target",
36156029,XOM,2023-12-08T16:33:10Z,"JP Morgan Maintains Overweight on Exxon Mobil, Lowers Price Target to $127",
36157580,XOM,2023-12-08T18:00:28Z,Expert Ratings for Exxon Mobil, 
36175515,XOM,2023-12-11T13:30:12Z,P/E Ratio Insights for Exxon Mobil, 
36182856,XOM,2023-12-11T19:01:08Z,Check Out What Whales Are Doing With XOM, 
36185311,XOM,2023-12-11T21:14:34Z,"Crude Conundrum: US Oil Production Hits Record Levels, But Energy Stocks Aren't Pumping","U.S. oil production is at record levels, beating pre-pandemic records, helping push global oil prices down, meanwhile Energy stocks are trading lower."
36197548,XOM,2023-12-12T14:19:12Z,U.S. Crude Oil Producers May Have Reached Peak Production Rates. Further Downside Pressure Will Be Demand Driven,"
"
36201332,XOM,2023-12-12T17:47:07Z,Oil And Gas Stocks Tank With Record Supply Fueling Sector Sell Off: This Inverse ETF (DRIP) Offers A 200% Return,"Direxion Daily S&amp;P Oil &amp; Gas Exp &amp; Prod Bear 2X Shares (ARCA: DRIP) was rising about 4.5% Tuesday after data released by the Bureau of Labor Statistics showed the Consumer Price Index (CPI) eased to an annual rate of 3.1% in November, "
36210917,XOM,2023-12-13T07:31:23Z,COP28 Draft Proposes Historic Shift From Fossil Fuels Amid Global Debate,The deal has sparked controversy for insufficient financial and equity provisions for developing nations and resistance from major oil-producing countries.
36215596,XOM,2023-12-13T13:55:19Z,Oil Prices Under Pressure As COP28 Climate Summit Agrees To Energy 'Transition',"While the commitment to transition away from fossil fuels was a historic moment at COP&#34;8, critics said the message was watered down."
36218182,XOM,2023-12-13T15:43:26Z,"""Exxon Will Pay Some Oil Traders Cash Bonuses In Expansion Plan; Risk-Taking Traders Will Receive Cash Bonuses Under New Plan; Compensation Has Been Point Of Contention For Some Traders"" - Bloomberg News",
36222009,XOM,2023-12-13T18:56:45Z,Revamping Rewards: Exxon Mobil Reportedly Shifts To Cash Bonuses For Select Traders,"Exxon Mobil Corporation (NYSE: XOM) has reportedly implemented a novel compensation policy, offering cash bonuses to certain traders, marking a substantial shift for the U.S."
36222772,XOM,2023-12-13T18:59:27Z,Energy Sector Stocks Flush With Cash Amid Oil's Bear Market: Is There A Buy Signal In Sight?,Oil has entered a bear market as oil majors have cash piles. Will they be deployed towards accretive investments and/or shareholder returns?
36233680,XOM,2023-12-14T12:12:43Z,"IEA Forecasts Slowdown In Oil Demand, Contrasts Positive Outlook By OPEC+",The IEA cautions that this forecast &#34;masks the impact of a further weakening of the macroeconomic climate.&#34; 
36241704,XOM,2023-12-14T16:52:01Z,"UBS Maintains Buy on Exxon Mobil, Lowers Price Target to $133",
36248465,XOM,2023-12-14T21:50:14Z,"If You Invested $1,000 In Exxon Mobil When Joe Biden Was Elected President, Here's How Much You'd Have Today",Oil stocks had a strong 2022 and Exxon Mobil made new all-time highs in 2023. The increase comes with a vocal opponent to oil pipelines as president.
36250261,XOM,2023-12-15T00:54:53Z,"Guyana, Venezuela Agree To Continue Dialogue On Pending Matters Related To Territorial Dispute; Agree To Avoid Conflict Escalation",
36256372,XOM,2023-12-16T15:00:15Z,"Benzinga Bulls And Bears: Microsoft, Lucid, Exxon, Bitcoin And Analyst Foresees Dogecoin Spike To 14 Cents If Support Level Holds",Benzinga examined the prospects for many investors&#39; favorite stocks over the last week — here&#39;s a look at some of our top stories.
36279712,XOM,2023-12-18T12:32:50Z,ExxonMobil Plans To Build CFC Pilot Plant With FuelCell Energy Using Carbonate Fuel Cell Technology,
36282512,XOM,2023-12-18T14:45:09Z,FuelCell Energy Stock Is Trading Higher: Here's Why,FuelCell Energy Inc (NASDAQ: FCEL) shares are trading higher Monday after the company announced that ExxonMobil Corp (NYSE: XOM) plans to build a 
36286936,XOM,2023-12-18T17:01:29Z,Oil Prices Jump As BP Halts Shipments Through Red Sea After Rebel Attacks,"Oil prices find respite as BP halts Red Sea shipments due to security threat. Nymex WTI up 3.9%, Brent crude up 3.8%, USO up 3.6%."
