ID,Ticker,Date,Headline,Summary
41322319,XOM,2024-10-15T00:22:03Z,"Gavin Newsom Approves New Law to Tackle Gas Prices, Says Oil Industry Raising Prices To 'Scare Voters' Into Supporting Trump", 
41341989,XOM,2024-10-15T18:15:41Z,Exxon Mobil Unusual Options Activity For October 15, 
41343435,XOM,2024-10-15T19:41:01Z,What's Going On With Exxon Mobil (XOM) Stock,"Exxon Mobil shares are trading lower by 2.5% Tuesday afternoon. Energy stocks are down as oil prices drop following reports that Israel may target military, but not oil or nuclear, sites in Iran."
41385938,XOM,2024-10-17T16:09:18Z,"B of A Securities Reinstates Neutral on Exxon Mobil, Announces $124 Price Target",
41411541,XOM,2024-10-18T20:30:37Z,Unpacking the Latest Options Trading Trends in Exxon Mobil, 
41495672,XOM,2024-10-23T16:42:57Z,Lithium Reserve Found In Arkansas With Help From AI: Why It Impacts Exxon Mobil,"USGS found massive lithium reserve in Arkansas, enough to supply nation&#39;s green tech transition. Exxon plans to extract it by 2027 with DLE tech."
41552274,XOM,2024-10-25T17:19:53Z,Tech Stocks Rally As Investors Await Magnificent 7 Earnings; Dollar Eyes Fourth Straight Positive Week: What's Driving Markets Friday?,"Stocks are ending the week on a high note, with tech leading the charge as investors position ahead of next week’s pivotal earnings releases from five of the “Magnificent Seven” stocks."
41553999,XOM,2024-10-25T18:45:37Z,Exxon Mobil's Golden Pass LNG Plant Gets 3-Year Extension Amid Contractor Challenges: Report,"Exxon and Qatar Energy&#39;s LNG plant gets 3-year extension to complete due to bankruptcy of lead contractor, faces Q3 earnings hit due to oil price changes."
41554030,XOM,2024-10-25T18:46:17Z,Exxon Mobil Unusual Options Activity, 
41570515,XOM,2024-10-28T11:30:48Z,"US Stocks Likely To Open In Green As Investors Eye 'Magnificent 7' Earnings This Week: Oil Prices Tumble, Expert Highlights Best 'Sell In May' Period Since 2009","Stocks set for positive start after mixed week, earning news may cushion downside. Nasdaq gains 7th straight week, 7 &#39;Magnificent&#39; companies to post earnings.U.S."
41571526,XOM,2024-10-28T12:06:24Z,"Exxon, Shell, Warren Buffett-Backed Occidental Petroleum And Other Oil Stocks Tumble In Premarket After Israel's Strikes On Iran",Analysts have suggested that the impact on oil supplies may not be as severe as initially feared.
41581789,XOM,2024-10-28T16:53:14Z,Stock Of The Day: Can Exxon Mobil's Selloff Reverse At Critical Support Zone?,"Oil is declining due to Israel&#39;s decision not to target Iranian facilities, causing Exxon Mobil stock to potentially find support at $109.50 level."
41582797,XOM,2024-10-28T17:33:56Z,What's Going On With Exxon Mobil (XOM) Stock?,"Exxon Mobil shares dropped as crude oil prices fell over 6% due to Israel&#39;s airstrikes on Iran, raising regional stability concerns. Analysts believe the measured actions may prevent expected spikes in oil prices, with West Texas Intermediate now at $67 per barrel."
41585490,XOM,2024-10-28T19:45:24Z,What the Options Market Tells Us About Exxon Mobil, 
41654965,XOM,2024-10-31T14:00:47Z,What's Next: Exxon Mobil's Earnings Preview, 
41659147,XOM,2024-10-31T16:28:20Z,"Exxon Mobil Q3 Preview: Will Rising Production, Cost Cuts Boost Earnings?",Exxon Mobil will release its Q3 earnings Friday morning. Investors will likely focused on the company&#39;s ongoing production growth.
41676503,XOM,2024-11-01T07:03:03Z,"Apple, Amazon And 3 Stocks To Watch Heading Into Friday", 
41676524,XOM,2024-11-01T07:07:01Z,"S&P 500 Records Worst Session In Over A Month, Meta And Microsoft Tumble: Greed Index Moves To 'Fear' Zone", 
41679061,XOM,2024-11-01T10:31:13Z,"Exxon Mobil Q3 2024 Adj. EPS $1.92 Beats $1.88 Estimate, Sales $90.016B Miss $93.938B Estimate",
41679062,XOM,2024-11-01T10:31:49Z,Exxon Mobil Raises Quarterly Dividend By 4% To $0.99/Share From $0.95 Prior,
41680446,XOM,2024-11-01T11:20:31Z,"US Stocks Likely To Open Higher After 'Mag 7' Wrap Up Busy Week, Apple, Amazon And Intel On Radar: Investors Eye Monthly Jobs Report, Economist Says Earnings Won't Trump Bonds","Investors on Wall Street could see some respite after major indices registered a downbeat session on Thursday. Index futures point to a positive start on Friday, ahead of the crucial monthly report on jobs data."
41683914,XOM,2024-11-01T12:24:06Z,"Exxon Q3 Earnings: $11.3 Billion Cost Savings, Rising Production, Dividend Hike And More","Exxon Mobil reports Q3  results with adjusted net profit of $8.61 billion and increased production, plans to deliver cost savings and boost dividend and maintain capital and exploration expenditures for FY24."
41689431,XOM,2024-11-01T15:35:20Z,Oil Prices Almost Recoup Week Losses As Iran Mulls Retaliatory Attack On Israel Prior To US Elections,"Crude prices are nearing full recovery from early-week losses, poised for a third consecutive daily gain on Friday."
41689553,XOM,2024-11-01T15:42:01Z,Chevron CEO Mike Wirth Says We Have Advantaged Inventory With Around 75% Locations At A Break Even Or Below $50; Says We Will See Shutdown At Pasadena Refinery In Current Quarter; Capital Spending In Permian Shale Basin Will Likely Peak This Year; Hess Deal Closing Conditions Requires End To Arbitration; CFO Says Expects To See Benefit Of New Cost Cutting Program To Appear In 2027,
41692530,XOM,2024-11-01T18:01:35Z,"Tech Stocks Surge But S&P 500 Faces Second Weekly Decline, Amazon Rallies, Bitcoin Drops Below $70,000: What's Driving Markets Friday?","Wall Street rebounded Friday following Thursday’s selloff, yet midday gains were still insufficient to prevent a second consecutive weekly decline for the S&amp;P 500, currently down 1% for the week. "
41717531,XOM,2024-11-04T15:37:19Z,"Exxon Mobil Q3 Earnings Impress Analysts With Record Production, Dividend Hike","Exxon Mobil reported upbeat Q3 earnings, driven by record production. Analysts maintain Hold/Sector Perform ratings on macro concerns."
41718632,XOM,2024-11-04T16:12:58Z,"RBC Capital Reiterates Sector Perform on Exxon Mobil, Maintains $120 Price Target",
41719818,XOM,2024-11-04T16:53:51Z,"TD Cowen Maintains Buy on Exxon Mobil, Lowers Price Target to $127",
41724383,XOM,2024-11-04T19:06:50Z,"Wall Street Struggles Ahead Of Election Day, Energy Sector Outperforms, Solar Stocks Rise: What's Driving Markets Monday?",The U.S. stock market struggled to gain momentum on Monday as investors remained cautious ahead of Election Day on Tuesday. 
41752185,XOM,2024-11-05T17:11:10Z,"5 Stocks To Watch On Election Day: Trump Media, Exxon, First Solar, RTX, Lennar",Election Day is here. A win for Republican Donald Trump or Democrat Kamala Harris could move different market sectors.
41755700,XOM,2024-11-05T19:31:58Z,"Tropical Storm Rafael Could Make US Landfall: 11 Stocks, ETFs To Watch","2024 hurricane season continues with deadly storms, threatening the Gulf Coast and potentially impacting companies such as Exxon Mobil, Chevron and Generac."
41768151,XOM,2024-11-06T10:43:52Z,Stunning Trump Victory Could Provide 'Yuge' Showcase For Direxion's GUSH And DRIP ETFs, 
41883635,XOM,2024-11-11T16:46:54Z,Trump Looks To Undo Biden Climate Progress With Burgum As 'Energy Czar': Report,Trump is reportedly considering North Dakota Governor Doug Burgum as the frontrunner for the energy czar position. 
41893598,XOM,2024-11-12T08:50:05Z,Exxon CEO Urges Trump To Reconsider Paris Agreement Exit: 'Stops And Starts Aren't Right For Business',Exxon Mobil CEO Darren Woods has urged President-elect Donald Trump to reconsider withdrawing from the Paris climate agreement.
41906766,XOM,2024-11-12T15:16:25Z,"Exxon Mobil Agrees To Sale Of Conventional Permian Assets, Expects To Close Deal By Q1 2025; Privately Owned Hilcorp Is Buyer Of Exxon Conventional Assets, Will Pay Around $1B",
41914956,XOM,2024-11-12T18:44:18Z,Exxon Mobil Sells $1 Billion in Permian Basin Assets to Focus on Shale: Report,"Exxon Mobil to sell $1 billion Permian Basin assets to focus on shale production, aligning with strategy to invest in high-value assets."
41946383,XOM,2024-11-13T16:37:09Z,What's Going On With Exxon Mobil (XOM) Stock?,Exxon Mobil shares have remained flat over the past week since Donald Trump&#39;s presidential election win. Investor may be cautious about how Trump&#39;s energy policies may impact the oil and gas giant.
41948486,XOM,2024-11-13T17:40:43Z,Biden Pledges 'Smooth' Transition To Trump In White House Meeting,"Biden and Trump met in Oval Office, pledging a smooth transition of power. Trump shaping agenda, considering energy czar Burgum as frontrunner."
41952823,XOM,2024-11-13T20:24:32Z,"Republicans Set To Hold Slim House Majority: What It Means For Energy, Financial, Defense Sectors","Trump&#39;s win secures Republican control of the House and Senate, allowing for swift implementation of policy changes, potentially reshaping economic and energy sectors."
41966992,XOM,2024-11-14T11:36:51Z,Obama-Era State Secretary Warns Trump's Plans To Withdraw From Paris Agreement Would 'Cede Leadership To China',"Earlier this year, he resigned from his role as President Joe Biden&#39;s top climate envoy."
41974985,XOM,2024-11-14T14:41:04Z,"Reported Nov 13, 2024, 'Exxon Mobil To Lay Off Nearly 400 Texas Employees As A Result Of Pioneer Acquisition' - Houston Business Journal",
41978949,XOM,2024-11-14T16:17:34Z,What's Going On With Exxon Mobil (XOM) Stock?,Exxon Mobil shares are trading higher by roughly 5% in November. Trump&#39;s administration is expected to prioritize fossil fuel production.
41997142,XOM,2024-11-15T00:13:26Z,"Viking Fund Management Sells Big Oil Stocks In Q3, Cuts Tesla Position In Half, Adds To Largest Position Broadcom","A look at the moves made by Viking Fund management in the third quarter, including the exits and new stakes and fund&#39;s largest positions at the end of Q3."
42006624,XOM,2024-11-15T13:00:23Z,Price Over Earnings Overview: Exxon Mobil, 
42011906,XOM,2024-11-15T15:43:44Z,Exxon Mobil To Cut 400 Texas Jobs In Stages Through 2026,Exxon Mobil plans to lay off 400 employees in Texas due to acquisition of Pioneer Natural Resources. It aims to cut $15B in costs by 2027.
42039258,XOM,2024-11-18T15:03:13Z,What's Going On With Exxon Mobil (XOM) Stock?,Exxon Mobil shares are trading higher by around 4% in November. The stock has seen an uptick following Donald Trump&#39;s presidential election win.
42068513,XOM,2024-11-19T16:53:57Z,"TD Cowen Maintains Buy on Exxon Mobil, Raises Price Target to $132",
42083549,XOM,2024-11-20T11:03:25Z,"Exxon Mobil Corporation And LG Chem Have Signed A Non-binding Memorandum Of Understanding For A Multiyear Offtake Agreement For Up To 100,000 Metric Tons Of Lithium Carbonate",
42087743,XOM,2024-11-20T13:35:54Z,"Exxon Mobil's Lithium Leap: 100,000 Metric Tons To Fuel LG Chem's US Plant","Exxon Mobil inked a MOU with LG Chem for supplying up to 100,000 metric tons of lithium carbonate to its cathode plant in Tennessee. This aims to strengthen LG Chem&#39;s supply chain and reduce environmental impact."
42110044,XOM,2024-11-21T13:06:46Z,"ExxonMobil Announces $200M Investment To Expand Advanced Recycling Operations In Texas, Targeting 1 Billion Pounds Annual Capacity By 2027 With Additional Units Planned Globally",
42117222,XOM,2024-11-21T16:26:07Z,ExxonMobil Plans $200 Million Expansion To Tackle Plastic Waste: Details,"ExxonMobil to invest $200 million to expand recycling operations in Baytown and Beaumont, targeting 1 billion pounds of global capacity by 2027."
42174225,XOM,2024-11-25T20:46:02Z,"Exxonmobil Says Adding New Units In Texas, Increasing Advanced Recycling Capacity To 500M Pounds Per Year; $200M+ Investment Will Add Two New Units In Baytown And Two In Beaumont",
42194369,XOM,2024-11-26T16:20:32Z,"RBC Capital Maintains Sector Perform on Exxon Mobil, Lowers Price Target to $115",
42195274,XOM,2024-11-26T17:01:34Z,Exxon Mobil Unusual Options Activity For November 26, 
42204881,XOM,2024-11-27T00:07:53Z,"Thanksgiving Travel Preview: AAA Expects Record Numbers, TSA Braces For Busiest Day Ever, Arctic Weather Blast","AAA expects record-setting travel numbers for Thanksgiving 2024 with an estimated 79.9 million travelers, up 2% from the previous record set last year."
42212364,XOM,2024-11-27T13:01:17Z,"Trump's Tariff Threat To Canada May Disrupt Oil Markets, Inflate Prices: 'Would Likely Raise The Price Of Fuels,' Says Analyst","President-elect Donald Trump&#39;s move to impose 25% tariffs on Canada can thwart the growth of the stock markets and affect corporate profits, inflation, transportation and oil marketing companies."
42219290,XOM,2024-11-27T17:01:15Z,"Reuters Reports FBI Has Been Investigating Exxon Mobil Consultant Over Alleged Role In Hack-And-Leak Operation, Cyber Spying Operation Targeting Hundreds Of Exxon Mobil Critics",
42224850,XOM,2024-11-27T21:21:17Z,"2025 Stock Playbook: Tap Into AI's $1 Trillion Potential, US Growth Opportunities","JPMorgan predicts U.S. as global growth leader by 2025 due to AI-driven spending and robust capital market activity. Stock picks include Amazon, Microsoft and more."
42235640,XOM,2024-11-28T18:15:19Z,Trump's Energy Policies Poised To Reshape Oil & Gas Market: Winners And Losers Revealed,"Trump&#39;s energy plans could reshape US markets with potential tariffs, increased production, and LNG exports. Goldman Sachs breaks down winners and losers."
42280136,XOM,2024-12-02T23:24:32Z,"Gas Prices Fall For 7th Straight Week To $3 Per Gallon, Reaching 2021 Levels","The national average price of gas has fallen for the seventh straight week to $3 per gallon, the lowest level since May 2021. The price of gas has fallen slightly, 0.6 cents from last week, and is 23.2 cents lower than a year ago."
42292218,XOM,2024-12-03T14:29:04Z,"Performance Shipping Secures Time Charter Contract With Oil Major At $33,500 Per Day For LR2 Aframax Tanker, M/T P. Aliki; Charter Will Generate ~$6.6M Of Gross Revenue For The Minimum Duration Of The Charter",
42323392,XOM,2024-12-04T18:45:56Z,Market Whales and Their Recent Bets on XOM Options, 
42340255,XOM,2024-12-05T14:19:02Z,OPEC+ Extends Oil Output Cuts To Late 2026: What It Means For Markets,"The OPEC+ group extends production cuts until 2026, with gradual increases and extended compensation period. Analysts view this as cautious market management."
42392942,XOM,2024-12-09T15:40:40Z,"Jim Cramer: Exxon Is 'Overvalued' Versus Rival Oil Giant, Avoid Lumen Technologies","On CNBC&#39;s &#34;Mad Money Lightning Round,&#34; Jim Cramer said Exxon Mobil Corporation is &#34;overvalued&#34; versus Chevron."
42433429,XOM,2024-12-11T12:10:13Z,ExxonMobil Expects To Deliver Growth Potential Of $20B In Earnings And $30B In Cash Flow Over The Next Six Years,
42433436,XOM,2024-12-11T12:10:59Z,ExxonMobil Expects To Invest $27B-$29B Of Cash Capex In 2025 And $28B-$33B Annually In 2026-2030,
42433867,XOM,2024-12-11T12:24:50Z,"Lithium Producers Brace For Prolonged Oversupply, Stalled Prices","Max 155 characters: Lithium market remains oversupplied, prices low, but could help EV transition. Chinese dominance and US policy shifts also play a role."
42444546,XOM,2024-12-11T18:09:23Z,"Exxon Mobil's 2030 Plan: $20 Billion Earnings Boost, Cash Surge, Emissions Goals & More","Exxon Mobil unveils 2030 plan to increase earnings and cash flow, aiming for 10% CAGR in earnings and 8% in cash flow growth, while reducing reinvestment rate."
42446068,XOM,2024-12-11T19:30:33Z,P/E Ratio Insights for Exxon Mobil, 
42465467,XOM,2024-12-12T16:11:58Z,"RBC Capital Reiterates Sector Perform on Exxon Mobil, Maintains $115 Price Target",
42465837,XOM,2024-12-12T16:27:09Z,"UBS Maintains Buy on Exxon Mobil, Lowers Price Target to $147",
42467682,XOM,2024-12-12T17:37:52Z,Exxon Has A Differentiated Permian Position Post-Pioneer Deal: Goldman Sachs Analyst,"Neutral rating and $125 price target by Goldman Sachs analyst, Exxon Mobil plans to increase earnings and cash flow by $20 billion and $30 billion respectively by 2030."
42468758,XOM,2024-12-12T18:17:10Z,Exxon Mobil Options Trading: A Deep Dive into Market Sentiment, 
42505461,XOM,2024-12-16T12:26:45Z,"Mizuho Maintains Neutral on Exxon Mobil, Lowers Price Target to $134",
42507587,XOM,2024-12-16T13:37:29Z,Tesla To Rally Around 18%? Here Are 10 Top Analyst Forecasts For Monday, 
42508433,XOM,2024-12-16T14:08:31Z,Top 3 Energy Stocks That May Rocket Higher In Q4, 
42512237,XOM,2024-12-16T16:32:08Z,"JP Morgan Maintains Overweight on Exxon Mobil, Lowers Price Target to $125",
42533390,XOM,2024-12-17T15:32:24Z,What's Going On With Exxon Mobil (XOM) Stock?,Exxon Mobil shares are trading lower by 3.3% since Monday&#39;s open. The stock is facing headwinds this week over China&#39;s weakening economic growth.
42533795,XOM,2024-12-17T15:45:40Z,Exxon Mobil's Options Frenzy: What You Need to Know, 
42599281,XOM,2024-12-19T17:48:23Z,"Piper Sandler Maintains Overweight on Exxon Mobil, Lowers Price Target to $127",
42623487,XOM,2024-12-20T16:59:40Z,Defensive Oil Stocks To Watch In 2025 Amid $70 Brent Forecast: JP Morgan,"JP Morgan analyst updates ratings, price targets, and forecasts for major North American oil companies. Brent crude expected to average ~$70/bbl in 2025, with focus on defensive positioning and unique re-rating opportunities."
42650684,XOM,2024-12-23T15:30:29Z,Smart Money Is Betting Big In XOM Options, 
42678014,XOM,2024-12-25T14:00:48Z,Top 7 Blue-Chip Stocks With The Best Return Potential Going Into 2025,"The year 2024 saw the U.S. stock market make new records, with major indices breaching key milestones. While many stocks witnessed a stellar rally this year, analysts still expect some blue-chip equities to rise further as they forecast a better return potential.



Dow’s Performance In 2024"
42707484,XOM,2024-12-27T17:41:41Z,ExxonMobil Stock Navigates Death Cross: Market Signals Turn Bearish For The Oil Giant,"ExxonMobil stock is forming a Death Cross, signaling a bearish trend. Despite investments in clean energy, regulatory hurdles and oil prices pose challenges for the company."
42772556,XOM,2025-01-02T18:30:34Z,Exxon Mobil Unusual Options Activity, 
42777105,XOM,2025-01-02T21:32:26Z,Russian Natural Gas Delivery To Europe Halted: US-Listed LNG Stocks Gain As Exports Set To Increase In 2025,"Russian gas exports stopped running through Soviet-era Ukrainian pipelines on Wednesday, according to a Reuters report, after Ukraine refused to renew a transit agreement."
42792900,XOM,2025-01-03T18:01:22Z,"CNBC Halftime Report Final Trades; Uber, Robinhood, Exxon Mobil, iShares Bitcoin Trust",
42824728,XOM,2025-01-06T18:00:28Z,Check Out What Whales Are Doing With XOM, 
42862810,XOM,2025-01-07T21:55:30Z,Exxon Mobil Anticipates Changes In Liquids Prices To Impact Q4 Upstream Earnings Q/Q By $(0.9)B - $(0.5)B - Filing,
42867453,XOM,2025-01-08T08:39:35Z,"Exxon Mobil Sues California AG Over Defamation Of Recycling Efforts, Citing Ties To Competitors",Exxon Mobil filed a federal lawsuit Monday against California Attorney General Rob Bonta and environmental groups.
42869332,XOM,2025-01-08T11:32:26Z,Chart Industries Announce Its Signing Of A Global Master Goods And Services Agreement With ExxonMobil,
42875502,XOM,2025-01-08T14:34:59Z,Oil Price Drop To Cut Exxon Mobil's Q4 Upstream Earnings By Up To $0.9 Billion: Details,"Exxon Mobil anticipates changes in oil and gas prices to impact Q4 earnings, signs agreement with Chart Industries and sues CA AG for defamation."
42883117,XOM,2025-01-08T18:39:10Z,In an Unpredictable Market Here Are Some Potential Winners and Losers for the First Quarter,"Every year, analysts discuss the stocks and sectors they favor for the coming year, often providing price targets for where major indexes might land by year-end. I believe both of these practices are futile. The market is dynamic and ever-changing; the environment can shift on a dime, so don’t get attached to a one-year playbook. Focusing on quarterly trends is a better approach."
42883747,XOM,2025-01-08T19:11:18Z,Goldman Sachs Flags Weak Q4 Guidance For Exxon Amid Weak Upstream And Chemical Results,Goldman Sachs analyst expresses views on Exxon Mobil&#39;s Q4 earnings expectations. The company projected impact on upstream earnings due to changes in oil and gas prices.
42913622,XOM,2025-01-10T14:18:29Z,"Dollar Soars To 27-Month Highs, 30-Year Yields Hit 5%, Stocks Tumble As Jobs Report, Oil Spike Darken Fed's Interest Rate Cut Hopes","Strong jobs report fuels Fed hawkishness, spurs market fears. Unemployment drops, wages rise, rates may not be cut until 2025. Dollar and yields jump."
42922934,XOM,2025-01-10T18:19:32Z,Oil Stocks Rally On Anticipation Of Stricter Russian Sanctions: Here's How ETFs Are Reacting,Oil stocks and prices are rising due to strict U.S. sanctions on Russian oil. Watch these ETFs tracking oil futures and energy stocks.
42947072,XOM,2025-01-13T14:45:05Z,"Truist Securities Maintains Hold on Exxon Mobil, Raises Price Target to $119",
42992007,XOM,2025-01-14T23:24:57Z,"Trump Cabinet Confirmation Hearings On Wednesday: Departments Of Transportation, Energy, State; Attorney General, CIA Director",Here&#39;s a look at who will be appearing before Senate committees on Wednesday as the nominations process begins. 
43010401,XOM,2025-01-15T17:08:27Z,"Maximize Growth, Minimize Risk With New, Dynamic Allocation ETF","Teucrium adds new ETF, RSMV, to its lineup with a focus on long-term capital appreciation and risk management in volatile markets."
43013634,XOM,2025-01-15T19:47:30Z,OPEC's Optimism Clashes With IEA's Conservative 2025 Oil Growth Projections,"IEA revises 2025 global oil demand outlook to 1.05 million barrels per day, citing economic recovery and lower fuel prices. OPEC projects higher growth."
43030219,XOM,2025-01-16T14:49:42Z,"Trump Cabinet Picks Scott Bessent, Doug Burgum To Appear For Senate Confirmation Hearings Thursday","President-elect Donald Trump&#39;s picks for Secretary of the Interior, Housing and Urban Development, Environmental Protection Agency and the Treasury Department are set to begin the confirmation process on Thursday."
43036184,XOM,2025-01-16T17:31:33Z,"US Energy Sector Enjoys Strong Start To 2025, Analysts Eye 'Constructive Setup' For Chevron (CORRECTED)","The U.S. energy sector kicked off 2025 with a strong rally, outperforming all other sectors as crude prices soared."
43087966,XOM,2025-01-21T01:15:47Z,"Trump Signs Orders To Take US Out Of Paris Climate Agreement, Calls The Deal 'One-Sided' And Unfair","Trump withdraws U.S. from Paris Agreement on inauguration day, mirroring his 2017 move later reversed by Biden."
43105017,XOM,2025-01-21T16:45:36Z,Looking At Exxon Mobil's Recent Unusual Options Activity, 
43200965,XOM,2025-01-24T19:38:38Z,Goldman Sachs Stays On The Sidelines On Exxon Mobil - Here's Why,"Goldman Sachs analyst cuts ExxonMobil price forecast due to mark-to-market commodity prices, but maintains Neutral rating. Q4 earnings expected on Jan 31, 2025."
43280066,XOM,2025-01-28T17:32:31Z,On CNBC: Stephanie Link Sells Freeport-McMoRan And Exxon Mobil,
43349490,XOM,2025-01-30T19:07:59Z,Exxon Mobil Stock Faces Resistance: Can Q4 Earnings Spark A Reversal?,"Exxon Mobil (XOM) reports Q4 earnings on Friday, with EPS of $1.56 and revenues of $86.63 billion expected. Stock is down YTD but analysts see 13.5% upside."
43378014,XOM,2025-01-31T08:32:10Z,"Earnings Scheduled For January 31, 2025", 
43379072,XOM,2025-01-31T10:12:33Z,"Dow Jumps Over 150 Points As Investors Monitor Earnings Reports; Investor Sentiment Improves, Fear & Greed Index Remains In 'Neutral' Zone", 
43379598,XOM,2025-01-31T10:57:09Z,"Apple, Exxon Mobil And 3 Stocks To Watch Heading Into Friday", 
43380335,XOM,2025-01-31T11:30:57Z,"Exxon Mobil Q4 2024 Adj. EPS $1.67 Beats $1.56 Estimate, Sales $83.426B Miss $86.634B Estimate",
43380449,XOM,2025-01-31T11:36:40Z,US Stock Futures Climb After Apple Beats Q1 Expectations: Expert Says Tech Stocks Hold Above Key Level Despite DeepSeek Impact,"US stock futures climbed on Friday, pointing to a third straight week of gains fueled by strong corporate earnings."
43389620,XOM,2025-01-31T13:39:30Z,"Exxon Mobil Q4 Earnings: Mixed Results, But CEO Promises 'Profitable Growth Well Into the Future'","Exxon Mobil reported Q4 results with revenues of $83.4B, missing expectations. Adjusted EPS beat at $1.67 &amp; company plans to expand share repurchases."
43392378,XOM,2025-01-31T14:51:48Z,Exxon Mobil CEO Darren Woods Says Yellowtail Project In Guyana Could Start By Q3 2025; Says Major Planned Projects For 2025 Could Begin Ahead Of Schedule,
43398821,XOM,2025-01-31T17:19:40Z,Dow Edges Lower; Exxon Mobil Earnings Top Views, 
43400100,XOM,2025-01-31T17:57:21Z,"Tech Stocks Rally, S&P 500 Flirts With Records, Gold Extends All-Time Highs: What's Driving Markets Friday?","Major stock indices have completed their recovery following Monday&#39;s sharp drop, buoyed by tech stocks rallying on the back of solid earnings and positive macroeconomic data.



The S&amp;P 500 index stands at 6,118 points at midday trading in New York, not far from the all-time high of 6,128 points reached last Friday."
43420044,XOM,2025-02-01T15:30:22Z,"Benzinga Bulls And Bears: Nvidia, Palantir, Rigetti Computing And Shiba Inu Hints At Major Partnership","Benzinga examined the prospects for many investors’ favorite stocks over the last week — here’s a look at some of our top stories.



The Nasdaq ended the week down 1.6%, with the S&amp;P 500 losing 1% and the Dow gaining 0.3%, as markets attempted to recover from earlier losses. "
43427872,XOM,2025-02-03T09:09:52Z,"Dow Dips Over 300 Points As Trump Imposes Tariffs On Canada, Mexico, And China: Fear & Greed Index Remains In 'Neutral' Zone", 
