ID,Ticker,Date,Headline,Summary
28444206,XOM,2022-08-10T20:48:00Z,Exxon Mobil Whale Trades Spotted," 

A whale with a lot of money to spend has taken a noticeably bullish stance on Exxon Mobil.

Looking at options history for Exxon Mobil (NYSE:XOM) we detected 63 strange trades."
28443469,XOM,2022-08-11T15:02:32Z,The Inflation Trade 'Isn't Dead Yet': This Analyst Sees 23% Upside On This Energy Play,"The Energy Select Sector SPDR Fund (NYSE: XLE) is up 31.09% year-to-date, alongside major energy names like Exxon Mobil Corp (NYSE: XOM) and Chevron Corporation (NYSE: "
28455969,XOM,2022-08-11T15:07:47Z,Where Exxon Mobil Stands With Analysts," 

Over the past 3 months, 15 analysts have published their opinion on Exxon Mobil (NYSE:XOM) stock. These analysts are typically employed by large Wall Street banks and tasked with understanding a company&#39;s business to predict how a stock will trade over the upcoming year."
28460502,XOM,2022-08-11T17:49:42Z,10 Energy Stocks With Whale Alerts In Today's Session," 

This whale alert can help traders discover the next big trading opportunities.

Whales are entities with large sums of money and we track their transactions here at Benzinga on our options activity scanner."
28495452,XOM,2022-08-15T14:05:51Z,Here's Why Exxon Mobil Stock Is Falling,"Exxon Mobil Corp (NYSE: XOM) shares are trading lower by 4.04% to $90.17. Shares of energy companies at large are trading lower Monday morning as oil prices drop following soft China factory data, which has pressured demand outlook.

What Happened?"
28502311,XOM,2022-08-15T20:20:51Z,"'The Bigger The Base, The Higher The Space': Analyst Sees 45% Upside Potential On This Mining Play","The Energy Select Sector SPDR Fund (NYSE: XLE) was up 34.45% year-to-date, alongside major energy names such as Exxon Mobil Corp (NYSE: XOM) and Chevron Corporation (NYSE: "
28536883,XOM,2022-08-17T15:16:41Z,Check Out What Whales Are Doing With XOM," 

Someone with a lot of money to spend has taken a bullish stance on Exxon Mobil (NYSE:XOM).

And retail traders should know.

We noticed this today when the big position showed up on publicly available options history that we track here at Benzinga."
28538780,XOM,2022-08-17T17:00:12Z,"CNBC Halftime Report Final Trades: Amgen, Exxon Mobil, Easterly Government Properties, Illinois Tool Works",
28538856,XOM,2022-08-17T17:37:01Z,"Apple, IBM Get CNBC 'Fast Money' Mentions, While This Stock Popped Nearly 1% In Seconds",CNBC’s &#34;Fast Money: Halftime Report&#34; delivers market-moving news to investors.
28546280,XOM,2022-08-18T12:10:43Z,"CNBC's Final Trades: Easterly Government Properties, ExxonMobil, Illinois Tool Works And This Health Care Company","On CNBC’s “Halftime Report Final Trades,” Jenny Harrington of Gilman Hill Asset Management said Easterly Government Properties Inc (NYSE: DEA) offers a 5.6% yield."
28552842,XOM,2022-08-18T14:21:13Z,Watching Exxon Mobil; Hearing Investors Business Daily's SwingTrader Names Stock As Buy,
28555852,XOM,2022-08-18T17:00:04Z,"CNBC Halftime Report Final Trades: Exxon Mobile, Devon Energy, Enterprise Products",
28562408,XOM,2022-08-19T12:01:01Z,CNBC's Final Trades: 4 Energy Plays With The Biggest Upside,"On CNBC’s “Halftime Report Final Trades,” Jim Lebenthal of Cerity Partners said that Exxon Mobil Corp (NYSE: XOM) is a recent addition to his portfolio."
28565355,XOM,2022-08-19T14:37:59Z,Camber Energy Is Headed Higher After 'Massive Rally': Here Are The Signs,"On Thursday evening, Benzinga asked its followers on Twitter what stock they’re most focused on to end the week. From the replies, Benzinga selected one ticker for technical analysis."
28569138,XOM,2022-08-19T21:03:16Z,'Are Gas Stations Price Gouging?' Politicians Say Yes. But This Is How Much They Really Make,"Amazon.com, Inc. (NASDAQ: AMZN) founder Jeff Bezos slammed U.S. President Joe Biden and the White House in early July when the billionaire criticized the commander in chief for calling on companies running or supplying gasoline stations to lower their prices."
28585462,XOM,2022-08-22T14:07:13Z,Watching Exxon Mobil; Hearing Investors Business Daily's SwingTrader Removes Full Position In Stock,
28586956,XOM,2022-08-22T15:53:46Z,"Warren Buffett Is Betting Big On Occidental Petroleum, But Analyst Sees 'Better Options Elsewhere'",Shares of Occidental Petroleum Corporation (NYSE: OXY) jumped on Friday on news Berkshire Hathaway Inc (NYSE: BRK-A) (NYSE: BRK-B) and billionaire CEO &lt;
28590667,XOM,2022-08-22T20:35:31Z,This Is What Whales Are Betting On Exxon Mobil,"Someone with a lot of money to spend has taken a bearish stance on Exxon Mobil (NYSE:XOM).

And retail traders should know.

We noticed this today when the big position showed up on publicly available options history that we track here at Benzinga."
28618175,XOM,2022-08-24T16:40:38Z,Here's Why Exxon Mobil Could Be Headed Back To All-Time Highs,Exxon Mobil Corporation (NYSE: XOM) was trading flat on Wednesday after a big bullish day on Tuesday saw the stock gap up 1.53% and rally an additional 2.56% intraday.
28620796,XOM,2022-08-24T17:45:49Z,8 Energy Stocks With Whale Alerts In Today's Session,"This whale alert can help traders discover the next big trading opportunities.
Whales are entities with large sums of money and we track their transactions here at Benzinga on our options activity scanner."
28653265,XOM,2022-08-26T17:00:14Z,"CNBC Halftime Report Final Trades: Google, Exxon Mobil, Chevron",
28653391,XOM,2022-08-26T18:09:40Z,"Alphabet, Exxon Are CNBC 'Fast Money' Mentions, And A Stock Loser Is Named Call Of The Day",CNBC’s &#34;Fast Money: Halftime Report&#34; delivers market-moving news to investors.
28665410,XOM,2022-08-29T12:30:51Z,Alphabet And These 3 Energy Plays Are CNBC's Final Trades,"On CNBC’s “Halftime Report Final Trades,” Brenda Vingiello of Sand Hill Global Advisors chose Alphabet Inc (NASDAQ: GOOGL), saying the digital ads market will remain attracti"
28667743,XOM,2022-08-29T13:09:04Z,"Morgan Stanley Maintains Overweight on Exxon Mobil, Raises Price Target to $107",
28671641,XOM,2022-08-29T16:24:18Z,What 14 Analyst Ratings Have To Say About Exxon Mobil,Analysts have provided the following ratings for Exxon Mobil (NYSE:XOM) within the last quarter:
28672718,XOM,2022-08-29T17:01:36Z,"CNBC Halftime Report Final Trades: Cleveland-Cliffs, Dollar General, Exxon Mobil, FactSet Research Systems",
28672713,XOM,2022-08-29T17:12:43Z,14 Analysts Have This to Say About Exxon Mobil,"Over the past 3 months, 14 analysts have published their opinion on Exxon Mobil (NYSE:XOM) stock. These analysts are typically employed by large Wall Street banks and tasked with understanding a company&#39;s business to predict how a stock will trade over the upcoming year."
28673737,XOM,2022-08-29T18:10:00Z,Expert Ratings for Exxon Mobil,Analysts have provided the following ratings for Exxon Mobil (NYSE:XOM) within the last quarter:
28673068,XOM,2022-08-29T18:17:44Z,"Apple, Dollar General Are CNBC 'Fast Money' Mentions, With This Stock Popping 1% After Being Named",CNBC’s &#34;Fast Money: Halftime Report&#34; delivers market-moving news to investors.
28676136,XOM,2022-08-29T20:52:05Z,Looking To Trade The Energy Bull Cycle? This Direxion 2X ETF Offers Trading Exposure,Direxion Energy Bull 2X Shares (NYSE: ERX) closed up more than 3% higher on Monday as the ETF continued to trend within its uptrend.
28682090,XOM,2022-08-30T11:55:47Z,Exxon Mulls Suing Russia Government Over Barred Exit From Energy Project: Report,"
"
28683732,XOM,2022-08-30T12:32:25Z,"Benzinga Before The Bell: Tesla Sues Louisiana Automobile Dealers Association, Will iPhone 14 Feature Satellite Connectivity?, Netflix Denies $7 To $9 Ad-Supported Plan And Other Top Financial Stories Tuesday, August 30","Reuters

Taiwan’s China Airlines Orders 16 Boeing 787s"
28681747,XOM,2022-08-30T12:36:02Z,"CNBC's Final Trades: Cleveland-Cliffs, Dollar General And This Energy Giant With ""At Least Another 10-15% Upside'","On CNBC’s “Halftime Report Final Trades,” Jim Lebenthal of Cerity Partners chose Cleveland-Cliffs Inc (NYSE: CLF), saying that “economic activity with hard c"
28688632,XOM,2022-08-30T16:46:22Z,Why Lose Money In A Bear Market? These Stocks Are Bucking The Trend In 2022,"Contrary to 2021, when equity markets were in a bull run, 2022 has served as a not-so-gentle reminder that the stock market does not give free gifts. The macro attitude that is pushing the markets lower has been influenced by worries about a recession, geopolitical tensions, the energy crisis, and record inflation."
28690313,XOM,2022-08-30T17:42:39Z,10 Energy Stocks Whale Activity In Today's Session,"This whale alert can help traders discover the next big trading opportunities.
Whales are entities with large sums of money and we track their transactions here at Benzinga on our options activity scanner."
28709734,XOM,2022-08-31T21:19:11Z,"Exxon, Shell Close To Selling California Oil And Gas Venture Aera",
28713294,XOM,2022-09-01T11:08:27Z,"Exxon, Shell Seek To Offload California Oil & Gas Joint Venture: Report","
"
28715823,XOM,2022-09-01T12:22:11Z,"Top Financial Stories Thursday, September 1: Netflix Weighs Charging High Sum For Ads, Self Harm posts Grow On Twitter, California Fast-Food Bill Faces Industry Backlash…",Wall Street Journal
28719567,XOM,2022-09-01T14:45:12Z,Looking At Exxon Mobil's Recent Whale Trades,"Someone with a lot of money to spend has taken a bearish stance on Exxon Mobil (NYSE:XOM).
And retail traders should know.
We noticed this today when the big position showed up on publicly available options history that we track here at Benzinga."
28725647,XOM,2022-09-01T20:21:11Z,ExxonMobil To Sell Its Share Of Aera Energy Joint Venture,
28753977,XOM,2022-09-06T11:47:52Z,"Morgan Stanley Maintains Overweight on Exxon Mobil, Raises Price Target to $113",
28754528,XOM,2022-09-06T12:57:48Z,What 10 Analyst Ratings Have To Say About Exxon Mobil,"Within the last quarter, Exxon Mobil (NYSE:XOM) has observed the following analyst ratings: "
28760611,XOM,2022-09-06T15:36:07Z,Check Out What Whales Are Doing With XOM,"Someone with a lot of money to spend has taken a bearish stance on Exxon Mobil (NYSE:XOM).
And retail traders should know.
We noticed this today when the big position showed up on publicly available options history that we track here at Benzinga."
28812887,XOM,2022-09-09T16:05:07Z,What Are Whales Doing With Exxon Mobil,"A whale with a lot of money to spend has taken a noticeably bullish stance on Exxon Mobil.
Looking at options history for Exxon Mobil (NYSE:XOM) we detected 10 strange trades."
28827109,XOM,2022-09-12T11:51:58Z,"Piper Sandler Maintains Overweight on Exxon Mobil, Lowers Price Target to $108",
28847921,XOM,2022-09-13T13:44:35Z,Colombia's Ecopetrol Asks Oil Regulator To Suspend Fracking Pilot Projects For 90 Days - Sources,
28884168,XOM,2022-09-15T15:26:40Z,Check Out What Whales Are Doing With XOM,"A whale with a lot of money to spend has taken a noticeably bullish stance on Exxon Mobil.
Looking at options history for Exxon Mobil (NYSE:XOM) we detected 16 strange trades."
28916604,XOM,2022-09-19T15:14:21Z,Check Out What Whales Are Doing With XOM,"Someone with a lot of money to spend has taken a bearish stance on Exxon Mobil (NYSE:XOM).
And retail traders should know.
We noticed this today when the big position showed up on publicly available options history that we track here at Benzinga."
28926171,XOM,2022-09-20T09:01:37Z,Exxon Ramps Up Oil Production in Guyana Faster than Expected; Uncertain if it Will Bid for New Blocks,
28927240,XOM,2022-09-20T11:33:19Z,Exxon Undecided On Auction Bidding For Guyana Oil Assets Despite Boosting Production: Report,"
	Exxon Mobil Corp (NYSE: XOM) has not decided whether it will bid for new offshore areas in Guyana as the company ramps up production faster than expected.
	Exxon has told the government it will wait for the economic terms before deciding if it wants to expand its acreage.
"
28927627,XOM,2022-09-20T11:35:34Z,Chevron Mulls Divesting Minority Stakes In Three Alaska-Based Oilfields: Report,"
	Chevron Corporation (NYSE: CVX) is looking to offload its interest in over 2,000 oil and gas wells in Alaska, marking its second exit from oil production in the state in 30 years.
	Bids are due this month, and the sale could fetch around $450-$550 million.
"
28929135,XOM,2022-09-20T12:21:53Z,"Top Financial Media Stories Tuesday, September 20: Apple Feels The Forex Pinch, Pepsi Ends Russian Production, Beyond Meat's COO Arrested And More..","Reuters

What Recession? AmEx Shares Ambitious Hiring Plans As Peers Let Go Staff"
28934458,XOM,2022-09-20T15:17:26Z,"Exxonmobil, Qatarenergy To Expand LNG Production With North Field East Agreement; Exxonmobil Awarded 25% Interest In North Field East Joint Venture",
28945810,XOM,2022-09-21T11:48:21Z,'Strike action hits Exxon Mobil's oil and petrochemical plants in France' -Reuters,
28950198,XOM,2022-09-21T15:23:06Z,Is Putin Bluffing? How Stocks Are Reacting On Heels Of Thinly-Veiled Nuke Threats,The SPDR S&amp;P 500 (NYSE: SPY) traded higher by 0.6% as U.S. investors mostly shrugged off the latest aggressive military actions by Russian President Vladimir Putin.
28964791,XOM,2022-09-22T13:23:27Z,"Exxon Mobil Spokesperson Says Gradually Shuts 235,000 BPD Fos-sur-Mer Oil Refinery In France On Strike Action",
28986529,XOM,2022-09-23T15:15:12Z,"Why Exxon Mobil, BP And Shell Shares Are All Getting Hammered","Exxon Mobil Corp (NYSE: XOM), BP plc (NYSE: BP) and Shell PLC (NYSE: SHEL) shares are trading lower by 5.96% to $85.15, 8.49"
28999333,XOM,2022-09-24T21:08:43Z,"Weekend Stock Spotlight: Uber, Microsoft, Ford, Exxon Mobile And The Impact Of Paul Singer's Stake In Paypal","Benzinga reviews this weekend&#39;s top stories covered by leading media outlets, here are the articles investors need to read."
29034610,XOM,2022-09-27T15:18:15Z,"Shell, Exxon Launch Joint Sale Of UK, Dutch North Sea Natural Gas Assets; Cos Hire Jefferies To Run North Sea Sales Process Which Could Raise Over $2B",
29041191,XOM,2022-09-27T19:24:59Z,Exxon Mobil Whale Trades For September 27," Someone with a lot of money to spend has taken a bearish stance on Exxon Mobil (NYSE:XOM).
And retail traders should know.
We noticed this today when the big position showed up on publicly available options history that we track here at Benzinga."
29062621,XOM,2022-09-28T19:40:25Z,"Why BP, Exxon Mobil And Shell Shares Are All Rising Today","BP plc (NYSE: BP), Exxon Mobil Corp (NYSE: XOM) and Shell PLC (NYSE: SHEL) shares are all trading higher going into the close of "
29061517,XOM,2022-09-29T12:16:39Z,"If You Invested $1,000 In Exxon Mobil Stock At Its COVID-19 Pandemic Low, Here's How Much You'd Have Now",Investors who bought stocks during the COVID-19 market crash in 2020 have generally experienced some big gains in the last two years. But there is no question some big-name stocks performed better than others since the pandemic bottom.
29090385,XOM,2022-09-30T10:31:15Z,Mark Zuckerberg's Meta No Longer Among Top 10 Most-Valuable Companies: Who Overtook The Tech Giant?,Meta Platforms Inc. (NASDAQ: META) is no longer among the top 10 most valuable companies in the world as its market cap fell to $366.61 billion with shares of the company closing 3.67% lower on Thursday.
29102906,XOM,2022-09-30T21:17:23Z,"Bearish On Exxon, Chevron? This Inverse ETF Tracks The Energy Sector",Direxion Energy Bear 2X Shares (NYSE: ERY) was trading flat on Friday after a four-day decline saw the ETF retrace 11% off the Sept. 26 high of $51.45.
29117251,XOM,2022-10-03T12:49:52Z,Why Exxon Mobil Stock Is Shooting Higher,Exxon Mobil Corp (NYSE: XOM) shares are trading higher by 3.48% to $90.35 during Monday&#39;s pre-market session. Shares of several oil stocks are trading higher amid an increase in the price of oil as OPEC+ is rumored to be considering a ~1M barrel per day oil production cut.
29113007,XOM,2022-10-03T12:50:33Z,ExxonMobil And Biotech: How To Play A Declining Market,"On CNBC’s “The Final Call,” Carter Worth said he liked biotech. He named SPDR S&amp;P Biotech ETF (ARCA: XBI) hit a low on May 11 but “the S&amp;P hasn’t bottomed yet.” “It’s up 32% since then,” he added."
29119861,XOM,2022-10-03T14:35:55Z,Exxon Mobil Whale Trades Spotted," Someone with a lot of money to spend has taken a bullish stance on Exxon Mobil (NYSE:XOM).
And retail traders should know.
We noticed this today when the big position showed up on publicly available options history that we track here at Benzinga."
29120954,XOM,2022-10-03T15:25:24Z,U.S. Labor Board Says Exxon Texas Refinery Worker Lockout Unlawful Attempt To Remove Union,
29140558,XOM,2022-10-04T16:26:38Z,Exxon Head Of Upstream Says Production At Sakhalin-1 Oilfield In Russia Largely Shut In,
29157867,XOM,2022-10-05T17:45:01Z,"Top 15 Trending Stocks On WallStreetBets As Of Wednesday, October 5, 2022 (Via Swaggy Stocks)",
29157698,XOM,2022-10-05T17:55:51Z,10 Energy Stocks With Whale Alerts In Today's Session,"This whale alert can help traders discover the next big trading opportunities.

Whales are entities with large sums of money and we track their transactions here at Benzinga on our options activity scanner."
29157868,XOM,2022-10-05T18:25:59Z,What's Going On With Exxon Stock?,"Exxon Mobil Corp (NYSE: XOM) shares are trading higher by 4.80% to $99.82 during Wednesday&#39;s session amid an increase in the price of oil following reports suggesting OPEC+ has agreed to a 2 million barrel per day output cut.

Why It Matters"
29157466,XOM,2022-10-05T18:38:39Z,"Exxon Mobil Is A Buy With Signs Of Strong Third-Quarter Earnings, Says Bank Of America","Exxon Mobil Corp (NYSE: XOM) shares are trading 4.6% higher to $99.63 on Wednesday following a new 8-K filing that indicates strong third-quarter earnings that will likely be above consensus estimates and puts management on track to achieve its cash target of $20-$30 billion within the third quarter, according"
29173781,XOM,2022-10-06T17:39:09Z,10 Energy Stocks Whale Activity In Today's Session," This whale alert can help traders discover the next big trading opportunities.
Whales are entities with large sums of money and we track their transactions here at Benzinga on our options activity scanner."
29174039,XOM,2022-10-06T17:54:52Z,"EXCLUSIVE: Tortoise Portfolio Manager & Managing Director, Rob Thummel Tells Benzinga 'Exxon Pays Dividend 3.5% Probably Will Raise Dividend In November As They Historically Do, They Have Low Debt Levels'",
29175589,XOM,2022-10-06T19:35:12Z,"Top 15 Trending Stocks On WallStreetBets As Of Thursday, October 6, 2022 (Via Swaggy Stocks)",
29182515,XOM,2022-10-07T11:36:56Z,"Wells Fargo Maintains Overweight on Exxon Mobil, Raises Price Target to $116",
29184001,XOM,2022-10-07T13:27:42Z,What 11 Analyst Ratings Have To Say About Exxon Mobil," Over the past 3 months, 11 analysts have published their opinion on Exxon Mobil (NYSE:XOM) stock. These analysts are typically employed by large Wall Street banks and tasked with understanding a company&#39;s business to predict how a stock will trade over the upcoming year."
29188335,XOM,2022-10-07T17:37:28Z,10 Energy Stocks Whale Activity In Today's Session," This whale alert can help traders discover the next big trading opportunities.
Whales are entities with large sums of money and we track their transactions here at Benzinga on our options activity scanner."
29194720,XOM,2022-10-08T17:52:51Z,"Weekend Stock Spotlight: Tesla, Credit Suisse, Polestar, And The Danger Of The Fed Going Too Far","Benzinga reviews this weekend&#39;s top stories covered by leading media outlets, here are the articles investors need to read."
29203332,XOM,2022-10-10T15:02:29Z,Check Out What Whales Are Doing With XOM," A whale with a lot of money to spend has taken a noticeably bearish stance on Exxon Mobil.
Looking at options history for Exxon Mobil (NYSE:XOM) we detected 17 strange trades."
29205169,XOM,2022-10-10T17:15:50Z,Exxon Is Said To Weigh Takeover Of Denbury,
29205410,XOM,2022-10-10T17:36:51Z,10 Energy Stocks Whale Activity In Today's Session," This whale alert can help traders discover the next big trading opportunities.
Whales are entities with large sums of money and we track their transactions here at Benzinga on our options activity scanner."
29205289,XOM,2022-10-10T19:17:44Z,French Petrol Stations Strike Continues As Union Rejects Wage Talk 'Blackmail',"
"
29211535,XOM,2022-10-11T11:33:42Z,Exxon Mobil Shows Initial Interest In Denbury Takeover,"
	Exxon Mobil Corp (NYSE: XOM) has expressed preliminary interest in Denbury Inc (NYSE: DEN). No final decision has been made, and Exxon could opt against proceeding with a potential deal.
"
29239433,XOM,2022-10-12T16:07:38Z,Analyzing Exxon Mobil's Short Interest,"Exxon Mobil&#39;s (NYSE:XOM) short percent of float has fallen 9.57% since its last report. The company recently reported that it has 35.25 million shares sold short, which is 0.85% of all regular shares that are available for trading."
29242677,XOM,2022-10-12T19:37:02Z,EnLink Midstream Signs Transportation Service Agreement With ExxonMobil; Financial Terms Not Disclosed,
29242726,XOM,2022-10-12T19:39:40Z,"Landmark Emissions-Reduction Project In Louisiana Announced; CF Industries, ExxonMobil, EnLink Midstream To Collaborate; CF Industries Is Investing $200M To Build A CO2 Dehydration And Compression Unit",
29259238,XOM,2022-10-13T19:09:31Z,Looking At Exxon Mobil's Recent Whale Trades," Someone with a lot of money to spend has taken a bullish stance on Exxon Mobil (NYSE:XOM).
And retail traders should know.
We noticed this today when the big position showed up on publicly available options history that we track here at Benzinga."
29278797,XOM,2022-10-15T16:24:22Z,"ExxonMobil Ordered To Reinstate, Pay $800K To 2 Employees Who Were Illegally Fired For This Reason", 
29293171,XOM,2022-10-17T17:05:27Z,Exxon Mobil Says Russia 'Unilaterally Terminated' Exxon's Interests In Sakhalin-1 Oil Project; Says 'Safely Exited Russia Following Expropriation' Of Sakhalin-1,
29299921,XOM,2022-10-18T07:45:26Z,Exxon Exits Russia Completely After Putin Seizes Company's Properties: Report,Exxon Mobil Corp (NYSE: XOM) reportedly said on Monday it has made a complete exit from Russia after President Vladimir
29300453,XOM,2022-10-18T10:06:23Z,Indian Oil Giant Reportedly Eyes Stake In New Russian Entity That Manages Sakhalin 1 Project,India&#39;s Oil and Natural Gas Corporation is reportedly eyeing a stake in the new Russian entity that will manage the Sakhalin 1 project as it looks to maintain a 20% share in the asset.
29300484,XOM,2022-10-18T10:16:56Z,Biden Administration Mulls Releasing Oil From Strategic Reserve Again To Keep Prices In Check Ahead Of Nov. 8 Polls: Report,"U.S. President Joe Biden  will likely release additional oil from the Strategic Petroleum Reserve, or SPR, this week, less than three weeks from the midterm polls scheduled for Nov. 8."
29304379,XOM,2022-10-18T12:30:22Z,"Complete Exit For Exxon From Russia, Microsoft's Layoffs, Another Setback For Boeing's Potential 737 MAX 7 Approval, Visa & Mastercard Under FTC Probe: Top Stories Tuesday, Oct. 18","Reuters

Exxon Exits Russia Completely After Putin Seizes Company&#39;s Properties"
29304980,XOM,2022-10-18T12:44:04Z,"JP Morgan Maintains Overweight on Exxon Mobil, Raises Price Target to $103",
29311184,XOM,2022-10-18T16:36:22Z,"'Lawsuit Filed By Attorney General Matthew Platkin, New Jersey Division Of Consumer Affairs Accuses Five Oil And Gas Companies Of Misleading The Public About Their Products And Climate Change' - State Of New Jersey | Department Of Law & Public Safety",
29324785,XOM,2022-10-19T13:59:24Z,"Morgan Stanley Maintains Overweight on Exxon Mobil, Raises Price Target to $114",
29312286,XOM,2022-10-19T20:54:28Z,An Energy Caucus Lawmaker Is Buying Up Energy Stocks With Big Yields: Here Are Three You Should Know About,Kevin Hern is a member of the Republican party and a member of the U.S. House of Representatives for Oklahoma&#39;s 1st Congressional District. Rep.
29343897,XOM,2022-10-20T14:42:02Z,Looking At Exxon Mobil's Recent Whale Trades," A whale with a lot of money to spend has taken a noticeably bullish stance on Exxon Mobil.
Looking at options history for Exxon Mobil (NYSE:XOM) we detected 15 strange trades."
29346169,XOM,2022-10-20T16:04:21Z,Par Pacific Announces Acquisition Of ExxonMobil Billings Refinery And Associated Marketing And Logistics Assets,
29361549,XOM,2022-10-21T20:15:48Z,Biden's Plan To Help Taxpayers At The Gas Pump Comes As Strategic Reserves Fall To 1984 Levels,President Joe Biden announced on Oct. 19 the release of 15 million barrels of oil from the strategic petroleum reserve (SPR) due to recent production cuts announced by the OPEC + coalition.
29368495,XOM,2022-10-22T17:26:42Z,"Barron's Top Weekend Stock Picks: Why Tesla Stock Can Bounce Back In 3 Months, Exxon Mobil, Twitter, Oracle And More","Benzinga reviews this weekend&#39;s top stories covered by Barron&#39;s and other leading media outlets, here are the articles investors need to read."
29399819,XOM,2022-10-25T14:47:38Z,Check Out What Whales Are Doing With XOM," A whale with a lot of money to spend has taken a noticeably bullish stance on Exxon Mobil.
Looking at options history for Exxon Mobil (NYSE:XOM) we detected 19 strange trades."
29404101,XOM,2022-10-25T19:50:33Z,Want To Play The Energy Sector Bullish Into Exxon Earnings? This ETF Offers 2X Returns,"Direxion Energy Bull 2X Shares (NYSE: ERX) was trading slightly lower in consolidation on Tuesday, after momentum within an uptrend caused the ETF to rally over 14% between Oct. 19 and Monday."
29436385,XOM,2022-10-27T13:02:40Z,"Benzinga Pro's Top 5 Stocks To Watch For Thursday, October 27, 2022: F, SPOT, XOM, HOG, MQ",
